"Áo choàng tắm Kimono dệt 100% cotton, áo choàng tắm khách sạn, Spa, Homestay"
Áo Choàng Tắm Khách Sạn Cao Cấp
Áo Choàng Tắm Tổ Ong Viền Nâu Hantexco
Khăn Choàng Tắm Đa Năng 2 Trong 1
Áo Choàng Ngủ Phòng Tắm Dễ Thương
Áo choàng tắm Nam thun lạnh
Áo Choàng Khăn Tắm 2 Dây 2 in 1 Siêu Nhanh Khô
Áo choàng tắm Nam/ Nữ Kimono dệt sợi bông tự nhiên
Áo choàng tắm cho nữ chất bông tuyết ấm mềm  CDACT01 xám
Áo choàng tắm tổ ong khách sạn cao cấp 5 sao
Áo choàng tắm khách sạn
Áo Choàng Tắm Tổ Ong Viền Kem Hantexco
Khăn tắm kiểu áo choàng dành cho nữ có nón tai thỏ CDCT01 trắng 
Áo choàng tắm khách sạn Spa dành cho Nam và Nữ
Áo choàng tắm HomenHouse chất liệu cotton
Áo choàng tắm nữ nón tai thỏ dễ thương CDCT01 hồng phấn
Áo choàng tắm cao cấp Narsis L8016
Áo choàng khăn tắm 2 dây 2 trong 1 cao cấp (vàng) tặng kèm Máy rửa mặt Foreo Luna Mini 2 (Hồng)
Áo choàng tắm kiểu dáng Kimono dệt 100% sợi bông tự nhiên
"Áo choàng tắm JYSK Larv polyester xám,S/M"
Áo choàng tắm nam Poêmy cao cấp
Áo choàng tắm HANVICO
Khăn tắm biển đa năng
Áo Choàng Tắm JYSK Cotton Timmerdala - Xám Đậm (SM)
Áo Choàng Tắm Cotton Tibro Gold JYSK - Size S/M
Áo choàng tắm HomenHouse Waffle chất liệu cotton
Áo choàng tắm nữ Poêmy cao cấp
Áo choàng tắm HANVICO
Áo Choàng Tắm JYSK Cotton Terry Tibro Kronborg Màu Tự Nhiên (SM)
Áo hoác bông tắm thời trang nam nữ cao cấp
Áo Choàng Tắm The Bamboo Kam
Áo choàng tắm khách sạn DADA 
Áo choàng khăn tắm 2 dây 2 trong 1 cao cấp- Tặng Kèm Gương Đa Năng Mini Cao Cấp
Áo choàng tắm đi biển Narsis A8014 màu trắng
Áo choàng tắm Hotel Series Miyoung Home
Khăn Choàng Ếch Thiện Phú KCE01 - Xanh Lá
Áo choàng tắm bông
ÁO CHOÀNG TẮM CHO BÉ - GIAO MÀU NGẪU NHIÊN
Áo choàng có nón hình con gấu cho bé Mollis N28- 79 cm
Áo choàng tắm Linen Tales mã Waffle chất liệu linen
Áo Choàng Tắm Cotton Mỏng LENCIER
