"Bếp cồn mini cho cắm trại, dã ngoại NatureHike NH18L001-T"
Bếp gas mini gấp gọn cắm trại dã ngoại leo núi tiện dụng - dùng được cho bình gas mini
Bếp Ga Du Lịch Dã Ngoại Mini Siêu Nhỏ Gọn An Toàn KH14
Lò nướng than inox du lịch tiện dụng loại lớn
"Bộ Nồi Treo 4 chiếc cho Cắm Trại, Dã Ngoại, Phượt, Picnic Xếp Gọn Siêu nhẹ NatureHike NH18T018-G"
Bếp cồn mini gấp gọn
 Nồi Treo Dã Ngoại Naturehike 4L NH17D021-G
Than nướng không khói Binchotan (Binchotan Charcoal for BBQ) Hộp 1kg
Bộ Nồi Cắm Trại Dã Ngoại 2-3 Người xếp gọn
Bộ Nồi nấu nướng dã ngoại cắm trại 1-2 người xếp gọn
"Bếp ga du lịch dã ngoại xếp gọn, đã bao gồm đầu chuyển ga, tiết kiệm ga"
Bếp Ga Dã Ngoại Cắm trại Xếp Gọn Naturehike NH15L399-T
Bộ Nồi Nấu Ăn Cắm Trại – Du Lịch Dã Ngoại 2-3 người
"Bếp Dầu 8 Bấc Dã Ngoại,Làm Phép Vào Nhà Mới Sung Túc,Phát Lộc Tiện Dụng"
Bộ nồi dã ngoại cao cấp gập gọn tiện lợi ngoài trời TM7101
Bộ nồi nấu ăn dã ngoại từ 2-3 người
Bộ Nồi Nấu Nướng Cắm Trại Dã Ngoại 2-3 Người DS301
Bộ Nồi Cắm Trại Dã Ngoại xếp gọn dành cho 5-6 người
 Bộ Nồi Cắm Trại 4 Chiếc Chống Gỉ Naturehike NH15T401-G Siêu Tiện Lợi
Ấm Đun Nước Cắm Trại Dã Ngoại 0.8L và 1.2L
Nồi Treo 4.2 Lít Cắm Trại Cho 6- 8 Người
Bếp ga dã ngoại gấp gọn NH17L040T
Bộ Nồi + Bếp Củi Du Lịch Dã Ngoại Cắm Trại Xếp Gọn
"Bộ dụng cụ nấu ăn cắm trại, dã ngoại, du lịch - Alayna"
BẾP NƯỚNG THAN HOA CAO CẤP 4 NGƯỜI CAMPINGMOON MT-025fly
Bộ Nồi Dã Ngoại 1-2 Người Xếp Gọn Inox 304
Bếp gas mini dã ngoại gấp gọn NH17L035-T
Bộ Nồi Cắm Trại Dã Ngoại 4-5 Người gọn nhẹ DS500
Bộ Nồi Nấu Nướng Cắm Trại Dã Ngoại 4 mảnh xếp gọn
Bếp Nướng Than Hoa Dã Ngoại Gấp Gọn Cao Cấp X-TWO
Bếp ga dã ngoại cắm trại chống gió xếp gọn siêu nhẹ (Đã bao gồm đầu chuyển ga)
Bộ nồi nấu ăn dã ngoại NH15T401-G 4in1 sử dụng cho 2-3 người
Chảo Dã Ngoại Huýt Sáo Đa Năng Có Nắp Đậy Silicon Naturehike NH19CJ006 Dung Tích 1.6L
Bếp Củi Dã Ngoại Gấp Gọn Siêu Gọn Nhẹ Titanium và Stainless Steel 304
Vỉ nướng bằng thép chống gỉ an toàn cho gia đình BB2413
Bộ nồi nấu ăn dã ngoại đi rừng gồm 8 món bằng inox cao cấp gập gọn tiện lợi (tặng kèm túi đựng có dây rút)
