Máy Khuếch Tán Tinh Dầu 500ml Tặng 3 Chai Sả Chanh + Bạc Hà + Oải Hương 10ml Nhập Khẩu Ấn Độ | Xông Phòng 30m2 | Kèm Remote Điều Khiển | MKT18 Quả Bí Ngô Đen
Máy khuếch tán tinh dầu bí ngô + Tinh dầu Sả Chanh thiên nhiên 10ml. máy xông tinh dầu
"MÁY XÔNG TINH DẦU Chuyên Dụng Cho Phòng Lớn Tích Hợp Điều Khiển Vân Gỗ Cao Cấp - Máy Phun Sương Công Nghệ Siêu Âm, Đèn LED 7 Màu Tùy Chọn"
Máy Khuếch Tán Tinh Dầu 500ml Tặng 3 Chai Sả Chanh + Bạc Hà + Oải Hương 10ml Nhập Khẩu Ấn Độ | Xông Phòng 30m2 | Kèm Remote Điều Khiển | MKT17 Lục Bình Đen
Máy xông tinh dầu siêu âm dung tích lớn 500ml
Máy Khuếch Tán Tinh Dầu 500ml Tặng 3 Chai Sả Chanh + Bạc Hà + Oải Hương 10ml Nhập Khẩu Ấn Độ | Xông Phòng 30m2 | Kèm Remote Điều Khiển | MKT20 Búp Sen Đen
Máy Xông Tinh Dầu Vân Gỗ Cao Cấp Dung Tích 500ML Chuyên Dụng Cho Phòng Lớn
Máy xông tinh dầu vân gỗ MK105 - Giao màu ngẫu nhiên
Combo máy khuếch tán/ máy xông tinh dầu Lorganic quả đào FX2059 + tinh dầu sả chanh Lorganic (10ml) LGN0367/ Thích hợp xông phòng diện tích 15-40m2.
Combo máy khuếch tán/ máy xông tinh dầu Lorganic bình hoa FX2057 + tinh dầu bạch đàn chanh Lorganic (10ml) LGN0366
"MÁY XÔNG TINH DẦU CHUYÊN DỤNG DUNG TÍCH 550ML, VÂN GỖ CAO CẤP, TÍCH HỢP ĐIỀU KHIỂN TỪ XA"
Máy khuếch tán tinh dầu SENSELAB S400ML + Tặng 1 Tinh dầu Sả Chanh SENSELAB 10ml + Remote ĐKTX - Máy xông tinh dầu siêu âm
"Máy khuếch tán tinh dầu chuyên dụng cho phòng lớn, tích hợp điều khiển từ xa"
Máy Khuếch Tán Tinh Dầu 500ml Tặng 3 Chai Sả Chanh + Bạc Hà + Oải Hương 10ml Nhập Khẩu Ấn Độ | Xông Phòng 30m2 | Kèm Remote Điều Khiển | MKT19
"máy khuếch tán tinh dầu lọ hoa lớn + Tặng tinh dầu thiên nhiên sả chanh Thacosa 10ml. máy xông tinh dầu. máy phun sương, máy tạo ẩm, lọc không khí + LED đổi 7 màu"
Máy xông tinh dầu cao cấp Bầu Tiên. Dung tích 550ml Có Remote. Tặng kèm lọ tinh dầu Cam ngọt Vemoda cao cấp (Đức) 10ml
"Máy xông tinh dầu Bình Minh giúp khuếch tán, tỏa hương tinh dầu, tạo độ ẩm, xông phòng, tặng kèm điều khiển từ xa và tinh dầu sả chanh Kobi"
"MÁY KHUẾCH TÁN TINH DẦU Chuyên Dụng cho phòng lớn 550ML, Vân gỗ cao cấp, Tích hợp điều khiển, Sóng Siêu Âm, Đèn LED 7 Màu, Công Suất Cao"
Máy Xông Tinh Dầu Chuyên Dụng Vân Gỗ Cao Cấp Tích Hợp Remote Và Đèn LED 7 Màu Biến Đổi Cực Đẹp
"Máy xông tinh dầu gỗ tròn, Máy khuếch tán tinh dầu nhỏ gọn, Máy khuếch tán tinh dầu"
"Máy Xông Tinh Dầu Chuyên Dụng Cao Cấp Cho Gia Đình và Văn Phòng - Công Nghệ Phun Sương Siêu Âm, Đèn LED 7 Màu trang trí"
"Máy Khuếch Tán Tinh Dầu Chuyên dụng 300ml Cho Gia Đình Văn Phòng, Công suất cao, Công Nghệ Sóng Siêu Âm, Đèn LED 7 Màu Tùy Chọn"
"Máy xông tinh dầu, phun sương Quả Cầu Hoa LED 7 màu cao cấp 2019 + tặng 1 lọ tinh dầu 10ml"
"Máy Xông Tinh Dầu Siêu Âm Nagomi Kết Hợp Đèn LED 7 Màu, 3 Chế Độ Hẹn Giờ, Dung Tích Lớn, Hoạt Động Liên Tục Đến 16 giờ, Có Thể Điều Chỉnh Mức Phun"
Máy khuếch tán tinh dầu siêu âm trụ trắng 
Đèn Xông Tinh Dầu Gốm Bát Tràng Gốm Sứ Thấu Quang Size Trung
Máy khuếch tán tinh dầu SENSELAB LS 500SL + Tặng 2 Tinh dầu Sả Chanh 10ml + Tinh dầu Oải hương 10ml. Thương hiệu SENSELAB Nhập khẩu Ấn Độ + Kèm Remote Điều khiển - Đèn ngủ nhiều màu
Máy Xông Tinh Dầu Vân Gỗ 550ML Chuyên Dụng Cho Phòng Lớn Có Remote Điều Khiển Từ Xa Kèm Đèn LED Thay Đổi Màu Cực Đẹp
Combo máy khuếch tán/ máy xông tinh dầu Lorganic Bí Ngô FX2055 + tinh dầu bạch đàn chanh Lorganic (10ml) LGN0364/ Thích hợp xông phòng 15-40m2.
Máy xông tinh dầu siêu âm dung tích 350ml dùng pin sạc tặng kèm lọ tinh dầu sả chanh KBAYBO 10ml
Máy khuếch tán tinh dầu trụ tròn 7 màu 500ml
Đèn xông tinh dầu gốm sứ bát tràng họa tiết hoa lá size M - Mẫu ngẫu nhiên
"Máy Khuếch Tán Tinh Dầu có REMOTE Cao Cấp Dành Cho Gia Đình - Máy PHUN SƯƠNG Công nghệ siêu âm, Công Suất Cao"
Máy xông tinh dầu hoa Lục Bình cao cấp 550ml kèm remote  1 tinh dầu 30ml và 2 viên xí ngầu
Máy Khuếch Tán Tinh Dầu 100ml Tặng 3 Chai Sả Chanh + Bạc Hà + Oải Hương 10ml Nhập Khẩu Ấn Độ | Xông Phòng 30m2 | MKT23 Cẩm Tú Cầu Hồng
 Máy khuếch tán xông tinh dầu phun sương tạo ẩm làm đèn ngủ công suất mạnh búp sen - Tặng kèm set 6 tinh dầu thiên nhiên nhập khẩu
"Máy Khuếch Tán Tinh Dầu Chuyên Dụng 500ml Tích hợp điều khiển từ xa, Phun sương siêu âm, Đèn LED 7 màu biến đổi rất đẹp"
Máy Khuếch Tán Tinh Dầu SIêu Âm Trụ 1000ml Tích Hợp Loa Bluetooth | Tặng Remote kèm 1 tinh dầu sả chanh đuổi muỗi
"Máy xông tinh dầu cao cấp Thiên Ý giúp khuếch tán, tỏa hương tinh dầu, tạo độ ẩm, xông phòng, tặng kèm điều khiển từ xa và tinh dầu sả chanh Kobi"
Máy xông tinh dầu vân gỗ Hình lọ hoa
"Máy Khuếch Tán Tinh Dầu Chuyên dụng Cho Phòng Lớn, Vân gỗ cao cấp, Tích hợp Remote 550ml - Phun Sương Bằng sóng Siêu Âm, Đèn LED 7 Màu Biến Đổi"
Đèn Xông Tinh Dầu Mini
"Máy Xông Tinh Dầu Thủy Tinh Cao Cấp, Họa Tiết Sang Trọng, Máy Khuếch Tán Tinh Dầu Chuyên Dụng, Đèn LED Trang Trí (Họa Tiết Ngẫu Nhiên)"
Đèn Xông Tinh Dầu Gốm Bát Tràng Tặng 2 Tinh Dầu Sả Chanh Kobi 10ml Và 1 Bóng Đèn Dự Phòng Chạy Bằng Điện Giúp Chống Muỗi Hiệu Quả
"Máy xông tinh dầu cao cấp Tulip 550ml Có Remote. Tặng kèm lọ tinh dầu cam ngọt cao cấp (Đức 10ml). Giúp khuếch tán, tỏa hương tinh dầu, tạo độ ẩm, xông phòng. "
Đèn Xông Tinh Dầu Gốm Bát Tràng Size Trung
Máy Xông Tinh Dầu Cao Cấp Chuyên Dụng Khuếch Tán Tinh Dầu Và Tạo Độ Ẩm Cho Gia Đình Và Văn Phòng
Máy xông tinh dầu khuếch tán MKT10 130ml
Máy khuếch tán tinh dầu bí ngô đen 500ml
Máy khuếch tán tinh dầu SENSELAB S500Pro + Tinh dầu Sả Chanh thiên nhiên SENSELAB 10ml. Máy xông tinh dầu xông phòng cao cấp
"Máy phun sương, xông tinh dầu, tạo độ ẩm hình tròn, tích hợp chức năng đèn ngủ bầu trời sao- màu giao ngẫu nhiên "
Máy Xông Tinh Dầu Đuổi Muỗi Kèm Lọ Tinh Dầu ( tặng 1 găng tay y tế )
" Máy Phun Tinh Dầu Mini Tú Cầu | Giúp Đuổi Muỗi, Xông Phòng Ngủ, Phòng Khách | Tặng Tinh Dầu Sả Chanh Kobi Nhập Khẩu Ấn Độ"
Máy Khuếch Tán Tinh Dầu Hồ Điệp 1500ml Tặng 3 Chai Sả Chanh + Bạc Hà + Oải Hương 10ml Nhập Khẩu Ấn Độ | Xông Phòng 50m2 | MKT14
Máy khuếch tán tinh dầu trụ đứng nhỏ 7 màu 150ml
Bộ đèn xông tinh dầu đuổi muỗi và côn trùng Hương Thảo Mộc
"Máy khuếch tán tinh dầu cao cấp Tulip giúp khuếch tán, tỏa hương tinh dầu, tạo độ ẩm, xông phòng, tặng kèm điều khiển từ xa và tinh dầu Sả chanh Kobi"
Đèn Xông Tinh Dầu Gốm Bát Tràng
Đèn Xông Tinh Dầu Nến Hình Trụ Milaganics
Combo Đèn xông tinh dầu tam giác TG01 và 2 chai tinh dầu sả chanh Eco oil 10ml và 1 bóng đèn
"Máy xông tinh dầu, phun sương cao cấp hình trụ vuông (200 ml) + 1 lọ tinh dầu"
"Combo máy khuếch tán nụ hoa FX2053 + tinh dầu bưởi chùm Lorganic (10ml), Thanh lọc không khí, Thích hợp diện tích 25-40m2."
Máy Xông Tinh Dầu Mini Humidifier Có đèn
Combo Đèn xông tinh dầu điện MNB38 và 1 bóng đèn
"Máy Khuếch Tán Tinh Dầu Siêu Cao Cấp - Dòng máy chuyên dụng, Công suất cao, Phù hợp không gian sang trọng"
"Máy xông tinh dầu Đế Xoay cao cấp, tặng 1 tinh dầu trầm hương và 2 vên xí ngầu uống bia"
 Máy khuếch tán xông tinh dầu phun sương tạo ẩm làm đèn ngủ công suất mạnh kiêm đèn ngủ bình hoa - Tặng kèm set 6 tinh dầu thiên nhiên nhập khẩu
Máy Xông Tinh Dầu Cao Cấp Thể Tích 150ML - Bền – Khử Mùi – Tạo Ẩm
Máy khuếch tán tinh dầu SENSELAB RX500Pro + Tinh dầu Sả Chanh thiên nhiên SENSELAB 10ml. Máy xông tinh dầu xông phòng cao cấp
"Máy Xông Tinh Dầu Có Loa Bluetooth Kết Nối Với Điện Thoại Nghe Nhạc Cực Hay, Máy Khuếch Tán Tinh Dầu Cho Phòng Lớn Thể Tích 1000ML, Có Remote Điều Khiển Từ Xa và Đèn LED Biến Đổi Màu Cực Đẹp"
"Máy Xông Hơi Mặt, Khuếch Tán Tinh Dầu Nano BinB0 Phun Sương Hơi Nước Tạo Ẩm - Có Đèn Led Ngủ Tiện Lợi- MP13"
Máy khuếch tán tinh dầu Lanaform Fidji
"MÁY XÔNG TINH DẦU CAO CẤP CHUYÊN DỤNG CHO PHÒNG LỚN, CÓ ĐIỀU KHIỂN TỪ XA, ĐÈN LED TRANG TRÍ RẤT ĐẸP"
Máy Khuếch Tán Tinh Dầu Siêu Âm Loại Lớn có Đèn LED đổi màu Và Remote Điều Khiển Cao Cấp
Đèn xông tinh dầu kiêm đèn ngủ Emie tặng kèm cóc sạc 2.4A
Combo Đèn xông tinh dầu điện MNB36 và 1 bóng đèn
Đèn xông tinh dầu đuổi muỗi Hacker
Máy Xông Tinh Dầu MiPow (USA) Vaso 2.0 Aroma Diffuser- CHÍNH HÃNG
"Máy khuếch tán tinh dầu Chuyên dụng Vân gỗ cao cấp, Dung tích 500ml, Tích hợp điều khiển từ xa, Tùy chọn màu đèn rất đẹp"
Combo máy khuếch tán/ máy xông tinh dầu Lorganic dung tích lớn 1000ml FX2048 - có tích hợp loa bluetooth+ tinh dầu bưởi chùm Lorganic (10ml) LGN0363/ Thích hợp xông phòng 15-40m2.
Máy khuếch tán tinh dầu
Đèn xông tinh dầu nến hình lá Lasante DN-03 - Giao màu ngẫu nhiên
Đèn Ngủ Xông Tinh Dầu Bằng Sứ
Máy Xông Tinh Dầu Mèo Lucky Kèm Đèn Led và Quạt
Máy xong tinh dầu phun sương giả vân gỗ cao cấp hình búp sen 400ml +1 lọ tinh dầu (Vân gổ vàng)
Máy Xông Tinh Dầu Siêu Âm Nagomi - Dung Tích 300ml - Tặng 1 chai tinh dầu (Hương thơm ngẫu nhiên) - Hàng nhập khẩu 
Máy xông tinh dầu nắp rạn nhiều mẫu Có remote kèm 3 tinh dầu 10ml
"Máy phun sương mini Tú Cầu khuếch tán tinh dầu siêu âm tạo ẩm hoa khô, có đèn LED 7 màu, tặng kèm tinh dầu sả chanh Kobi"
MÁY XÔNG TINH DẦU TAI THỎ
Máy khuếch tán tinh dầu siêu âm tạo ẩm hồ điệp 2400ml - máy xông tinh dầu phun sương Aramacs
Máy Khuếch Tán Tinh Dầu 500ml Tặng 3 Chai Sả Chanh + Bạc Hà + Oải Hương 10ml Nhập Khẩu Ấn Độ | Xông Phòng 40m2 | Kèm Remote Điều Khiển | MKT21 Cánh Hoa Đen
Máy khuếch tán tinh dầu siêu âm tạo ẩm bình hoa tulip - máy xông tinh dầu phun sương Aramacs
Máy khuếch tán tinh dầu SENSELAB RX400SL + Tặng Tinh dầu Sả Chanh 10ml + Oải Hương 10ml. Tinh dầu thiên nhiên Nhập khẩu Ấn Độ + Kèm Remote Điều khiển
 Đèn xông tinh dầu size trung tặng 01 bóng đèn dự phòng
Đèn Nến Đốt Tinh Dầu Chiếc Lá Lorganic DX0003  
Combo Đèn xông tinh dầu điện MNB37 và 1 bóng đèn
Bộ đèn xông tinh dầu đuổi muỗi tinh chất Hoa Ngải Hương
Máy Xông Tinh Dầu  phun xương tạo ẩm  khuếch tán tinh dầu   bằng công nghệ nano LỒNG ĐÈN LỚN khuếch tán tinh dầu dùng cho  phòng ngủ phòng khách
MÁY ĐUỔI MUỖI XÔNG TINH DẦU THÔNG MINH
Máy Xông Tinh Dầu Vân Gỗ - Tặng Kèm Đèn Led Hình Trai Màu Ngẫu Nhiên
Đèn Xông Tinh Dầu Đuổi Muỗi Cao Cấp
Máy khuếch tán xông tinh dầu phun sương tạo ẩm làm đèn ngủ 7 chế độ màu công suất mạnh kiêm đèn ngủ bí ngô - Tặng kèm set 6 tinh dầu thiên nhiên nhập khẩu
MÁY KHUẾCH TÁN TINH DẦU HÌNH BĂNG TUYẾT 500ML CÓ ĐIỀU KHIỂN TỪ XA CÔNG NGHỆ SIÊU ÂM
"Máy Khuếch Tán Tinh Dầu Chuyên dụng, Vân Gỗ, Tích hợp Remote, Công suất cao cho phòng rộng"
Máy khuếch tán tinh dầu cho ô tô 
Đèn Xông Tinh Dầu Mẫu Mới Mini
MÁY MÁY XÔNG TINH DẦU KHẾCH TÁN PHI THUYỀN CÚN - HỒNG
Bếp đất nung xông bồ kết thảo dược - Tặng cột tóc quả bơ
Máy Khuếch Tán Tinh Dầu 100ml Tặng 3 Chai Sả Chanh + Bạc Hà + Oải Hương 10ml Nhập Khẩu Ấn Độ | Xông Phòng 30m2 | MKT25 Cẩm Tú Cầu Xanh Lá
"Máy phun sương Búp Sen tạo ẩm không khí, kèm điều khiển từ xa và tinh dầu sả chanh Kobi"
"Máy Khuếch Tán Tinh Dầu Chuyên Dụng Cho Gia Đình Và Văn Phòng, Máy Phun Sương Siêu Âm Khuếch Tán Tinh Dầu Tích Hợp Đèn Led 7 Màu Trang Trí Phòng Cực Đẹp"
Đèn xông tinh dầu nến ấm trà Lasante DN-02
"Máy Khuếch Tán Tinh Dầu Phun Sương Hải Đăng | Giúp Đuổi Muỗi, Xông Phòng | Tặng Tinh Dầu Sả Chanh Kobi | Nhập Khẩu Ấn Độ"
Máy Khuếch Tán Tinh Dầu 100ml Tặng 3 Chai Sả Chanh + Bạc Hà + Oải Hương 10ml Nhập Khẩu Ấn Độ | Xông Phòng 40m2 | MKT33 Gốm Sứ Dáng Ngọc Đen
Máy Khuếch Tán Tinh Dầu 100ml Tặng 3 Chai Sả Chanh + Bạc Hà + Oải Hương 10ml Nhập Khẩu Ấn Độ | Xông Phòng 30m2 | MKT24 Cẩm Tú Cầu Xanh Dương
"Máy xông tinh dầu sóng siêu âm cao cấp Hoa Tulip - Có Remote. Máy khuếch tán tinh dầu giúp tỏa hương, tạo độ ẩm, làm thơm phòng."
Đèn Xông Tinh Dầu Bát Tràng Gốm Sứ Thấu Quang Cỡ Trung - Đèn Đốt Tinh Dầu Sứ Thấu Quang Bóng Halogen 33w
"Máy Khuếch Tán Xông Tinh Dầu 3D Trái Tim, DC-8374"
Máy phun sương khuếch tán tinh dầu DDL20 (màu ngẫu nhiên)
"Đèn xông tinh dầu MD024 Kepha. Gốm bát tràng cao cấp. Hoạ tiết hoa sen màu xanh. Đế gỗ chắc chắn, an toàn"
Máy khuếch tán tinh dầu búp sen vàng 500ml
"Máy khuếch tán tinh dầu phun sương Hải Đăng có đèn LED 7 màu, có hẹn giờ, tự đông ngắt khi hết nước, tặng kèm tinh dầu sả chanh Kobi"
"Máy Khuếch Tán Tinh Dầu Hồ Điệp Trắng | Giúp Xông Phòng, Đuổi Muỗi | Tặng 3 Chai Tinh Dầu Kobi Sả Chanh + Bạc Hà + Oải Hương Nhập Khẩu Ấn Độ"
Máy Khuếch Tán Xông Tinh Dầu DC-8335
"Máy Xông Tinh Dầu Hiệu Ứng Ánh Sáng 3D Cực đẹp, Máy Khuếch Tán Tinh Dầu Chuyên Dụng Xông Tinh Dầu Và Đèn LED 3D Trang Trí Phòng"
Máy Xông Tinh Dầu Siêu Âm Nagomi - Dung Tích 500ml - Tặng 1 chai tinh dầu (Hương thơm ngẫu nhiên) - Hàng nhập khẩu
Máy xông tinh dầu đuổi muỗi 60 ngày
Đèn Xông Tinh Dầu Miệng Hoa
Đèn Nến Đốt Tinh Dầu Hình Vuông Lorganic DX0004
"Máy khuếch tán tinh dầu Ban Mai Siêu Âm có đèn LED 7 màu, chạy êm, có hẹn giờ, tự ngắt khi hết nước, tặng kèm điều khiển từ xa và tinh dầu sả chanh Kobi"
Máy khuếch tán tinh dầu cây thông bốn mùa màu xanh nhỏ nhắn-dung tích 230ml dành cho không gian nhỏ
Máy khuếch tán tinh dầu
" Máy Xông Tinh Dầu Mini Phú Quý | Giúp Phun Sương, Đuổi Muỗi | Tặng Tinh Dầu Sả Chanh Kobi Nhập Khẩu Ấn Độ"
Đèn xông tinh dầu BT-N13
Đèn xông tinh dầu cao cấp
Đèn xông tinh dầu đuổi muỗi Hàn Quốc-Tặng kèm 2 lọ tinh dầu
Đèn xông tinh dầu đuổi muỗi Hacker
"Máy xông tinh dầu cao cấp có Remote dung tích 500ml. Máy khuếch tán tinh dầu. Tặng kèm lọ tinh dầu Sả chanh cao cấp (Ấn Độ 10ml). Giúp khuếch tán, tỏa hương tinh dầu, khử mùi, thanh lọc không khí, không gian sống trong lành, thoải mái."
Máy khuếch tán tinh dầu siêu âm kiêm đèn ngủ HL EOD01 nhiều màu sắc Hàng Chính Hãng
"Máy khuếch tán tinh dầu siêu âm tạo ẩm Cát Tường có đèn LED 7 màu, chế độ hẹn giờ, tự đông ngắt khi hết nước, tặng kèm tinh dầu sả chanh Kobi"
Máy xông tinh dầu
MÁY XÔNG TINH DẦU MÈO THẦN TÀI
Đèn xông tinh dầu gốm kiếng bông  
"Máy xông tinh dầu đuổi muỗi, đuổi côn trùng  kèm lọ tinh dầu ( Tặng 01 khuôn ép cơm )"
Máy khuếch tán tinh dầu wifi trụ trong thông minh kết nối app phun sương tạo ẩm lọc khí tạo hương xông hương
Máy khuếch tán cánh hoa vàng + tặng tinh dầu bạc hà 10ml JULYHOUSE
ĐÈN XÔNG TINH DẦU MD028 KEPHA
5 Bóng đèn thay thế cho đèn xông tinh dầu (loại 35w-220v)
Máy khuếch tán tinh dầu hồ điệp trắng
"Máy xông tinh dầu cao cấp dung tích 550ml Có Remote. Máy khuếch tán tinh dầu. Tặng kèm lọ tinh dầu Sả chanh cao cấp (Ấn Độ 10ml). Giúp khuếch tán, tỏa hương tinh dầu, khử mùi, thanh lọc không khí, không gian sống trong lành, thoải mái."
"Bộ đèn xông và lọ tinh dầu đuổi muỗi tinh chất sả, không mùi"
"Máy Khuếch Tán Xông Tinh Dầu Quả Trứng 400ml, DC-8403"
Máy xong tinh dầu phun sương giả vân gỗ cao cấp hình búp sen 400ml +1 lọ tinh dầu
ĐÈN XÔNG TINH DẦU MD009 KEPHA
Máy xông tinh dầu cao cấp kiêm đèn ngủ Lemon Humidifer sẽ giúp bạn có một giấc ngủ ngon hơn
Máy xông tinh dầu có nhạc thiền MIPOW VASO - Hàng chính hãng
Máy khuếch tán tinh dầu Lanaform Borneo
Máy phun sương tạo ẩm khuếch tán tinh dầu YW-025
Máy Xông Tinh Dầu Phi Thuyền - Xanh lá 
Đèn Xông Tinh Dầu Khắc cá 3D
Đèn xông tinh dầu nến tròn bông mai DN-05
"Máy Tạo Ẩm Phun Sương Bạch Tuyết Kobi làm sạch không khí, tặng kèm điều khiển từ xa và tinh dầu sả chanh"
Đèn Xông Tinh Dầu Nến Trái Tim Milaganics
Đèn nến xông tinh dầu kèm 3 viên nến và 1 tinh dầu ( tặng cột tóc quả bơ )
MÁY XÔNG ĐUỔI MUỖI CHỨA TINH DẦU AN TOÀN CHO NGƯỜI DÙNG 
Máy Khuếch Tán Tinh Dầu Siêu Âm Dung Tích 500ml Tặng Kèm 03 Chai Tinh Dầu Thiên Nhiên Nguyên Chất 10ml
Đèn xông tinh dầu gốm đen
Đèn xông tinh dầu Cúc trắng MNB48 Song An tặng 1 bóng đèn
Máy Khuếch Tán Tinh Dầu Cẩm Tú Cầu Màu  Xanh Dương 100ml
"Máy Xông Tinh Dầu Siêu Âm Phun Sương Quả Trứng Vân Gỗ Cao Cấp Led 7 Màu, Dùng Được Điều Khiển Từ Xa"
Đèn Xông Tinh Dầu - Sứ Thấu Quang
"Máy khuếch tán tinh dầu sóng siêu âm KE2050 Kepha - Hàng chính hãng 100% | Vẹn nguyên hương tinh dầu | Làm sạch không khí, khử mùi hiệu quả | Quà tân gia độc đáo"
Đèn Xông Tinh Dầu Gốm Sứ Bát Tràng Cỡ Trung Size 12x12cm Đa Màu Sắc + TẶNG KÈM 1 Lọ Tinh Dầu 100% Nguyên Chất Từ Thiên Nhiên + 1 Bóng Đèn Dự Phòng (Giao Mẫu Ngẫu Nhiên)
Combo Đèn xông tinh dầu điện MNB34 và 1 bóng đèn
Đèn Xông Tinh Dầu Bát Tràng - Sứ Thấu Quang
Máy Đuổi Muỗi Xông Tinh Dầu-Tặng Chai Tinh Dầu Đuổi Muỗi-Giao Màu Ngẫu Nhiên
Máy Khuếch Tán Tinh Dầu Caroline TM-300A
Máy khuếch tán tinh dầu (máy hút trực tiếp tinh dầu không cần nước) chuyên dành cho phòng 50m2 trở lên Ngọc Tuyết
Máy khuếch tán tinh dầu Mipow Vaso KE2055 Kepha. Máy xông tinh dầu cao cấp nhập khẩu Mỹ
Combo Đèn xông tinh dầu điện MNB35 và 1 bóng đèn
"Máy khuếch tán Tinh Dầu Hồ Điệp Đáy Tròn Dung tích lớn 2400ml, làm đèn ngủ, quà tặng"
" Máy Phun Tinh Dầu Phòng Ngủ Cát Tường | Giúp Phun Sương Tự Động, Đuổi Muỗi | Tặng Tinh Dầu Sả Chanh Kobi Nhập Khẩu Ấn Độ"
Máy xông tinh dầu có nhạc MIPOW VASO - Hàng chính hãng
Đèn xông tinh dầu nến điêu khắc Lasante DN-06
Máy khuếch tán tinh dầu  231 3D
Đèn xông tinh dầu nến dáng cao điêu khắc Lasante DN-08
Máy Xông Tinh Dầu Kiểu Mẫu Cho Nội Thất Tích Hợp Remote Điều Khiển Từ Xa | Máy Phun Sương Công Nghệ Siêu Âm | Đèn Led 7 Màu Tùy Chọn Cực Đẹp | ĐXTD11 Lục Bình
Máy khuếch tán tinh dầu Bạch Tuyết HaEva 
Máy khuếch tán tinh dầu FX2018 cổ cao màu vàng
"Đèn xông đuổi muỗi, côn trùng"
Máy Khuếch Tán Tinh Dầu Cho ô tô và Gia Đình 230ml
Combo Máy khuếch tán tinh dầu MKT08 + 1 chai tinh dầu quế Eco oil 10ml
Máy Khuếch Tán Tinh Dầu 500ml Tặng 3 Chai Sả Chanh + Bạc Hà + Oải Hương 10ml Nhập Khẩu Ấn Độ | Xông Phòng 30m2 | Kèm Remote Điều Khiển | MKT18 Quả Bí Ngô Đen
Máy khuếch tán tinh dầu bí ngô + Tinh dầu Sả Chanh thiên nhiên 10ml. máy xông tinh dầu
"MÁY XÔNG TINH DẦU Chuyên Dụng Cho Phòng Lớn Tích Hợp Điều Khiển Vân Gỗ Cao Cấp - Máy Phun Sương Công Nghệ Siêu Âm, Đèn LED 7 Màu Tùy Chọn"
Máy Khuếch Tán Tinh Dầu 500ml Tặng 3 Chai Sả Chanh + Bạc Hà + Oải Hương 10ml Nhập Khẩu Ấn Độ | Xông Phòng 30m2 | Kèm Remote Điều Khiển | MKT17 Lục Bình Đen
Máy xông tinh dầu siêu âm dung tích lớn 500ml
Máy Khuếch Tán Tinh Dầu 500ml Tặng 3 Chai Sả Chanh + Bạc Hà + Oải Hương 10ml Nhập Khẩu Ấn Độ | Xông Phòng 30m2 | Kèm Remote Điều Khiển | MKT20 Búp Sen Đen
Máy Xông Tinh Dầu Vân Gỗ Cao Cấp Dung Tích 500ML Chuyên Dụng Cho Phòng Lớn
Máy xông tinh dầu vân gỗ MK105 - Giao màu ngẫu nhiên
Combo máy khuếch tán/ máy xông tinh dầu Lorganic quả đào FX2059 + tinh dầu sả chanh Lorganic (10ml) LGN0367/ Thích hợp xông phòng diện tích 15-40m2.
Combo máy khuếch tán/ máy xông tinh dầu Lorganic bình hoa FX2057 + tinh dầu bạch đàn chanh Lorganic (10ml) LGN0366
"MÁY XÔNG TINH DẦU CHUYÊN DỤNG DUNG TÍCH 550ML, VÂN GỖ CAO CẤP, TÍCH HỢP ĐIỀU KHIỂN TỪ XA"
Máy khuếch tán tinh dầu SENSELAB S400ML + Tặng 1 Tinh dầu Sả Chanh SENSELAB 10ml + Remote ĐKTX - Máy xông tinh dầu siêu âm
"Máy khuếch tán tinh dầu chuyên dụng cho phòng lớn, tích hợp điều khiển từ xa"
Máy Khuếch Tán Tinh Dầu 500ml Tặng 3 Chai Sả Chanh + Bạc Hà + Oải Hương 10ml Nhập Khẩu Ấn Độ | Xông Phòng 30m2 | Kèm Remote Điều Khiển | MKT19
"máy khuếch tán tinh dầu lọ hoa lớn + Tặng tinh dầu thiên nhiên sả chanh Thacosa 10ml. máy xông tinh dầu. máy phun sương, máy tạo ẩm, lọc không khí + LED đổi 7 màu"
Máy xông tinh dầu cao cấp Bầu Tiên. Dung tích 550ml Có Remote. Tặng kèm lọ tinh dầu Cam ngọt Vemoda cao cấp (Đức) 10ml
"Máy xông tinh dầu Bình Minh giúp khuếch tán, tỏa hương tinh dầu, tạo độ ẩm, xông phòng, tặng kèm điều khiển từ xa và tinh dầu sả chanh Kobi"
"MÁY KHUẾCH TÁN TINH DẦU Chuyên Dụng cho phòng lớn 550ML, Vân gỗ cao cấp, Tích hợp điều khiển, Sóng Siêu Âm, Đèn LED 7 Màu, Công Suất Cao"
Máy Xông Tinh Dầu Chuyên Dụng Vân Gỗ Cao Cấp Tích Hợp Remote Và Đèn LED 7 Màu Biến Đổi Cực Đẹp
"Máy xông tinh dầu gỗ tròn, Máy khuếch tán tinh dầu nhỏ gọn, Máy khuếch tán tinh dầu"
"Máy Xông Tinh Dầu Chuyên Dụng Cao Cấp Cho Gia Đình và Văn Phòng - Công Nghệ Phun Sương Siêu Âm, Đèn LED 7 Màu trang trí"
"Máy Khuếch Tán Tinh Dầu Chuyên dụng 300ml Cho Gia Đình Văn Phòng, Công suất cao, Công Nghệ Sóng Siêu Âm, Đèn LED 7 Màu Tùy Chọn"
"Máy xông tinh dầu, phun sương Quả Cầu Hoa LED 7 màu cao cấp 2019 + tặng 1 lọ tinh dầu 10ml"
"Máy Xông Tinh Dầu Siêu Âm Nagomi Kết Hợp Đèn LED 7 Màu, 3 Chế Độ Hẹn Giờ, Dung Tích Lớn, Hoạt Động Liên Tục Đến 16 giờ, Có Thể Điều Chỉnh Mức Phun"
Máy khuếch tán tinh dầu siêu âm trụ trắng 
Đèn Xông Tinh Dầu Gốm Bát Tràng Gốm Sứ Thấu Quang Size Trung
Máy khuếch tán tinh dầu SENSELAB LS 500SL + Tặng 2 Tinh dầu Sả Chanh 10ml + Tinh dầu Oải hương 10ml. Thương hiệu SENSELAB Nhập khẩu Ấn Độ + Kèm Remote Điều khiển - Đèn ngủ nhiều màu
Máy Xông Tinh Dầu Vân Gỗ 550ML Chuyên Dụng Cho Phòng Lớn Có Remote Điều Khiển Từ Xa Kèm Đèn LED Thay Đổi Màu Cực Đẹp
Combo máy khuếch tán/ máy xông tinh dầu Lorganic Bí Ngô FX2055 + tinh dầu bạch đàn chanh Lorganic (10ml) LGN0364/ Thích hợp xông phòng 15-40m2.
Máy xông tinh dầu siêu âm dung tích 350ml dùng pin sạc tặng kèm lọ tinh dầu sả chanh KBAYBO 10ml
Máy khuếch tán tinh dầu trụ tròn 7 màu 500ml
Đèn xông tinh dầu gốm sứ bát tràng họa tiết hoa lá size M - Mẫu ngẫu nhiên
"Máy Khuếch Tán Tinh Dầu có REMOTE Cao Cấp Dành Cho Gia Đình - Máy PHUN SƯƠNG Công nghệ siêu âm, Công Suất Cao"
Máy xông tinh dầu hoa Lục Bình cao cấp 550ml kèm remote  1 tinh dầu 30ml và 2 viên xí ngầu
Máy Khuếch Tán Tinh Dầu 100ml Tặng 3 Chai Sả Chanh + Bạc Hà + Oải Hương 10ml Nhập Khẩu Ấn Độ | Xông Phòng 30m2 | MKT23 Cẩm Tú Cầu Hồng
 Máy khuếch tán xông tinh dầu phun sương tạo ẩm làm đèn ngủ công suất mạnh búp sen - Tặng kèm set 6 tinh dầu thiên nhiên nhập khẩu
