"Máy Khuếch Tán Tinh Dầu Chuyên Dụng 500ml Tích hợp điều khiển từ xa, Phun sương siêu âm, Đèn LED 7 màu biến đổi rất đẹp"
Máy Khuếch Tán Tinh Dầu SIêu Âm Trụ 1000ml Tích Hợp Loa Bluetooth | Tặng Remote kèm 1 tinh dầu sả chanh đuổi muỗi
"Máy xông tinh dầu cao cấp Thiên Ý giúp khuếch tán, tỏa hương tinh dầu, tạo độ ẩm, xông phòng, tặng kèm điều khiển từ xa và tinh dầu sả chanh Kobi"
Máy xông tinh dầu vân gỗ Hình lọ hoa
"Máy Khuếch Tán Tinh Dầu Chuyên dụng Cho Phòng Lớn, Vân gỗ cao cấp, Tích hợp Remote 550ml - Phun Sương Bằng sóng Siêu Âm, Đèn LED 7 Màu Biến Đổi"
Đèn Xông Tinh Dầu Mini
"Máy Xông Tinh Dầu Thủy Tinh Cao Cấp, Họa Tiết Sang Trọng, Máy Khuếch Tán Tinh Dầu Chuyên Dụng, Đèn LED Trang Trí (Họa Tiết Ngẫu Nhiên)"
Đèn Xông Tinh Dầu Gốm Bát Tràng Tặng 2 Tinh Dầu Sả Chanh Kobi 10ml Và 1 Bóng Đèn Dự Phòng Chạy Bằng Điện Giúp Chống Muỗi Hiệu Quả
"Máy xông tinh dầu cao cấp Tulip 550ml Có Remote. Tặng kèm lọ tinh dầu cam ngọt cao cấp (Đức 10ml). Giúp khuếch tán, tỏa hương tinh dầu, tạo độ ẩm, xông phòng. "
Đèn Xông Tinh Dầu Gốm Bát Tràng Size Trung
Máy Xông Tinh Dầu Cao Cấp Chuyên Dụng Khuếch Tán Tinh Dầu Và Tạo Độ Ẩm Cho Gia Đình Và Văn Phòng
Máy xông tinh dầu khuếch tán MKT10 130ml
Combo Đèn xông tinh dầu tam giác TG3 và 2 chai tinh dầu sả chanh Eco oil 10ml và 1 bóng đèn
Máy khuếch tán vân gỗ vàng + tặng tinh dầu sả chanh 10ml JULYHOUSE
"Máy xông tinh dầu SẮC XUÂN cao cấp dung tích 500ml. Máy khuếch tán tinh dầu. Tặng kèm lọ tinh dầu Cam tươi VEMODA (Đức 10ml). Giúp khuếch tán, tỏa hương tinh dầu, khử mùi, thanh lọc không khí."
Máy khuếch tán kiêm đèn ngủ phun sương tạo ẩm xông tinh dầu làm đèn ngủ công suất mạnh model  lồng đèn - Tặng kèm hộp bộ 6 tinh dầu thiên nhiên nhập khẩu
Máy phun sương khuếch tán tinh dầu USA công nghệ siêu âm điều khiển từ xa HoMedics Ellia ARM-910WTA nhập khẩu USA
Combo máy khuếch tán/ máy xông tinh dầu Lorganic hình tổ chim FX2045 + tinh dầu sả chanh Lorganic (10ml) LGN0360/ Thích hợp xông phòng diện tích 15-40m2.
Máy phun sương tạo ẩm khuếch tán tinh dầu kết nối Wifi YX-088
Máy Khuếch Tán Tinh Dầu 500ml Tặng 3 Chai Sả Chanh + Bạc Hà + Oải Hương 10ml Nhập Khẩu Ấn Độ | Xông Phòng 30m2 | Kèm Remote Điều Khiển | MKT27 Bầu Đen
Máy khuếch tán tinh dầu cây thông bốn mùa màu trắng-dung tích 230ml-nhỏ nhắn xinh xắn
Đèn máy xông khuếch tán tinh dầu bằng điện cho phòng URPOWER 700ML ED11
ĐÈN XÔNG TINH DẦU NẾN - ẤM TRÀ
"Máy xông tinh dầu siêu âm cao cấp dung tích 500 ML, kiểu dáng hiện đại có remote điều khiển từ xa + Chai tinh dầu 10 ml + tặng kèm quạt cầm tay 3 cấp độ gió siêu cute - Vân gỗ sáng"
Combo Đèn xông tinh dầu điện MNB33 và 1 bóng đèn
Máy khuếch tán tinh dầu siêu âm phun sương tạo ẩm hoa khô vĩnh cửu Aramacs 100ml 
Máy khuếch tán tinh dầu cây thông bốn mùa màu hồng xinh xắn-dung tích 230ml cho không gian nhỏ
Đèn nến đốt tinh dầu trái tim Lorganic DX0007 (Nhiều màu)
"MÁY XÔNG TINH DẦU CHUYÊN DỤNG CÓ REMOTE ĐIỀU KHIỂN TỪ XA, VÂN GỖ, ĐÈN LED CAO CẤP. KHUẾCH TÁN TINH DẦU LAN TỎA HƯƠNG THƠM"
Combo Đèn xông tinh dầu điện tam giác TG07 và 1 bóng đèn
"Máy phun sương tạo ẩm, khuếch tán tinh dầu, đuổi muỗi"
Máy khuếch tán tinh dầu và làm ẩm không khí MKT02 và tinh dầu quế eco oil 10ml 
"Máy tạo ẩm Phú Quý Kobi phun sương khuếch tán tinh dầu mạnh mẽ thanh lọc không khí, không gây ồn, có chế độ hẹn giờ, tặng kèm tinh dầu sả chanh Kobi"
Máy khuếch tán xông tinh dầu phun sương tạo ẩm làm đèn ngủ công suất mạnh kiêm đèn ngủ trụ trắng - Tặng kèm chai tinh dầu thiên nhiên 10ml nhập khẩu - 10 móc dán trong suốt chịu lực siêu dính
Đèn xông tinh dầu gốm đen nhỏ
Máy phun sương tạo ẩm và khuếch tán tinh dầu vân gỗ cổ cao sang trọng (Màu ngẫu nhiên)
Bộ đèn xông tinh dầu đuổi muỗi và côn trùng Green Spearmint
ĐÈN XÔNG TINH DẦU MD001 KEPHA
 Máy khuếch tán xông tinh dầu phun sương tạo ẩm làm đèn ngủ công suất mạnh kiêm đèn ngủ trụ trong - Tặng kèm set 6 tinh dầu thiên nhiên nhập khẩu
"Đèn nến xông tinh MD010 Kepha. Đèn nến hình tròn, đĩa đựng tinh dầu hình chiếc lá. Gốm sứ bát tràng cao cấp"
Máy khuếch tán tinh dầu lập phương 200ml
Máy xông tinh dầu Healthy Life hình búp sen
Đèn xông tinh dầu phun sương hình bóng đèn
Đèn Xông Tinh Dầu Họa Tiết Hoa_001
"Máy khuếch tán tinh dầu xe hơi GX02 thiết kế sang trọng, đẳng cấp, tặng kèm tinh dầu sả chanh Kobi"
"Máy Xông Khuếch Tán Tinh Dầu Hương Thơm, hình RADIO, Phun Sương Tạo Ẩm Phòng Ngủ - 1.3L "
Đèn Xông Tinh Dầu Bình Hoa Trang Trí 500ML | Tặng Kèm 3 Chai Tinh Dầu HaNa Nguyên Chất | Kèm Remote
Đèn Xông Tinh Dầu Kết Hợp Đèn Ngủ Bát Tràng Sứ Thấu Quang Chất Liệu Sáng Bóng Tráng Men Bền Đẹp Nhiều Hình Lựa Chọn
Combo đèn xông tinh dầu nến ấm trà + nến Lasante DN-12
Máy Khuếch Tán Xông Tinh Dầu Siêu Âm Ngọn Đồi Trắng PR-106 250ml
Máy Khuếch Tán Xông Tinh Dầu Leviter DC-8110
Máy Khuếch Tán Xông Leviter Tinh Dầu DC-8307
Đèn nến xông tinh dầu sứ trắng NH
Máy Khuếch Tán Tinh Dầu KD80 
"Máy Khuếch Tán Tinh Dầu Qủa Chanh Tiện Dụng Cho Gia Đình Và Xe Hơi - Phun Sương Sóng Siêu Âm, Đèn LED 7 Màu Trang Trí"
Máy xông tinh dầu có nhạc thiền MIPOW VASO - Hàng chính hãng (đen)
Đèn xông tinh dầu giao họa tiết ngẫu nhiên
Đèn xông tinh dầu vuông VGOM01 và 1 chai tinh dầu sả chanh Eco oil 10ml cùng 1 bóng đèn
Đèn xông tinh dầu gốm trang trí họa tiết
Máy Khuếch tán tinh dầu có đèn Led nhiều màu - Tặng lọ tinh dầu Quế 10ml
"Máy xông tinh dầu cao cấp Tulip 500ml Có Remote. Tặng kèm lọ tinh dầu thiên nhiên nhập khẩu 10ml  - Tặng kèm 10 móc dán trong suốt chịu lực. Giúp khuếch tán, tỏa hương tinh dầu, tạo độ ẩm, xông phòng - Tuylip Vàng"
Máy xông tinh dầu - khuếch tán tinh dầu hình trụ họa tiết hươu 3D siêu lung linh xoay tròn
"Máy xông Tinh dầu Caroline M1 giúp khuếch tán tinh dầu, tạo cảm giác thư thái, tạo độ ẩm cho không khí dung tích 240 ml Màu Trắng Xanh"
Đèn xông tinh dầu Gốm Sứ Bát Tràng Cỡ Lớn (giao mẫu ngẫu nhiên)
Máy khuếch tán phun sương tạo ẩm xông tinh dầu trứng rồng Aramacs
" Đèn xông tinh dầu MD026 Kepha + Tặng 1 lọ tinh dầu Cam Ngọt 10ml. Đèn xông tinh dầu gốm sứ bát tràng. Họa tiết lá sen, đài sen màu xanh dịu"
Đèn xông tinh dầu Cúc trắng MNB48 Song An tặng 1 chai tinh dầu sả chanh Viện nông nghiệp và 1 bóng đèn
Máy Khuếch Tán Tinh Dầu Caroline S100ST 200ml (Màu Trắng)
Combo Máy khuếch tán tinh dầu và làm ẩm không khí MKT05 + 1 chai tinh dầu bạc hà eco oil 10ml 
"Đèn xông tinh dầu loại to - thơm nhà, đuổi muỗi - Giao màu ngẫu nhiên"
Máy khuếch tán tinh dầu Caroline Hồng
Tinh Dầu Bưởi - Tinh Dầu Tự Nhiên Nguyên Chất 10ml - Hapaku
Đèn xông tinh dầu gỗ hương
Máy Khuếch Tán Tinh Dầu Lemon Caroline (180ml)
Máy Khuếch Tán Tinh Dầu Caroline - AM50 Pro
Combo đèn xông tinh dầu hình lá + 10 viên nến Lasante DN-13
Máy khuếch tán tinh dầu công nghệ siêu âm Lanaform MOYA nhập khẩu Vương Quốc Bỉ
Đèn Xông Tinh Dầu - Máy Khuếch Tán Tinh Dầu Hình Đen Lá Đẳng Cấp Thời Thượng
Đèn Xông Tinh Dầu Đuổi Muỗi Công Nghệ Mới An Toàn Cho Sức Khỏe + TẶNG KÈM Lọ Tinh Dầu Hương Tự Nhiên Sử Dụng Trong 480 Giờ Liên Tục
Máy tạo đổ ẩm và xông tinh dầu Lotus
MÁY KHUẾCH TÁN TINH DẦU VNSPECIAL AI (BLUETOOTH + ĐIỀU KHIỂN TỪ XA) - TẶNG 1 CHAI TINH DẦU BẤT KÌ
Máy khuếch tán tinh dầu ấm vàng dung tích 300ml 
Đèn xông tinh dầu nến tròn tim  DN-07
Đá thơm khuếch tán sả chanh Lá 
Đèn Xông Tinh Dầu Họa Tiết Hoa_002
Đèn xông tinh dầu thuỷ tinh cao cấp - Tinh dầu hữu cơ Oresoi
Combo đèn xông tinh dầu tròn điêu khắc + nến Lasante DN-15
"Máy Khuếch Tán Tinh Dầu Cao Cấp Cho Gia Đình Và Xe Hơi, Công Nghệ Sóng Siêu Âm, Đèn LED 7 Màu Tùy Chọn"
Máy khuếch tán tinh dầu cao cấp hình Lập Phương
Máy khuếch tán tròn trắng 500ml có nhiều chế độ hẹn giờ
Đèn xông tinh dầu - Đèn gốm vẽ mini
"Máy khuếch tán tinh dầu, tạo ẩm bình tulip màu vân gỗ tối mini 130ml"
"Máy tạo hương thơm tự động, khuếch tán tinh dầu nguyên chất, loại 3 đế S200"
	 Máy khuếch tán V-R150 - Phun Sương Tinh dầu Viet Oils
Đèn xông tinh dầu gốm trắng hoa văn mini
Combo đèn xông tinh dầu + nến ly coffee Lasante DN-11
Máy Khuếch Tán Tinh Dầu Cẩm Tú Cầu Màu  Xanh Lá 100ml
"Đèn xông tinh dầu Tặng 1 lọ tinh dầu | Đèn xông MD026 Kepha + Tặng 1 lọ tinh dầu Sả Chanh 10ml | Đèn xông tinh dầu gốm sứ cao cấp. Họa tiết lá sen, đài sen màu xanh dịu"
MÁY KHUẾCH TÁN TINH DẦU VNSPECIAL KIM CƯƠNG VÀNG - TẶNG 1 CHAI TINH DẦU BẤT KÌ
Máy khuếch tán tinh dầu hoa cỏ khô tích hợp led đổi màu ( giao mẫu ngẫu nhiên)
Đèn xông tinh dầu gỗ Hình vuông Chữ Phúc -gỗ hương- Tặng kèm 1 bóng đèn
Máy khuếch tán tinh dầu cánh hoa vàng 500ml
Máy khuếch tán tinh dầu Caroline 180ml - Cam
Đèn xông tinh dầu hình trái nho + Tặng kèm 5 bóng thay thế
Combo Đèn xông tinh dầu điện tam giác TG09 và 1 bóng đèn
Máy Khuếch Tán Tinh Dầu Caroline S100SĐ 200ml (Màu Đen)
Combo Bếp đốt tinh dầu hình phật màu trắng và 1 chai tinh dầu quế Eco oil 10ml
"Máy Khuếch Tán  XôngTinh Dầu 3D Hình Trụ, DC-8116"
Máy Khuếch Tán Tinh Dầu 500ml Tặng 3 Chai Sả Chanh + Bạc Hà + Oải Hương 10ml Nhập Khẩu Ấn Độ | Xông Phòng 30m2 | Kèm Remote Điều Khiển | MKT18 Quả Bí Ngô Đen
Máy khuếch tán tinh dầu bí ngô + Tinh dầu Sả Chanh thiên nhiên 10ml. máy xông tinh dầu
"MÁY XÔNG TINH DẦU Chuyên Dụng Cho Phòng Lớn Tích Hợp Điều Khiển Vân Gỗ Cao Cấp - Máy Phun Sương Công Nghệ Siêu Âm, Đèn LED 7 Màu Tùy Chọn"
Máy Khuếch Tán Tinh Dầu 500ml Tặng 3 Chai Sả Chanh + Bạc Hà + Oải Hương 10ml Nhập Khẩu Ấn Độ | Xông Phòng 30m2 | Kèm Remote Điều Khiển | MKT17 Lục Bình Đen
Máy xông tinh dầu siêu âm dung tích lớn 500ml
Máy Khuếch Tán Tinh Dầu 500ml Tặng 3 Chai Sả Chanh + Bạc Hà + Oải Hương 10ml Nhập Khẩu Ấn Độ | Xông Phòng 30m2 | Kèm Remote Điều Khiển | MKT20 Búp Sen Đen
Máy Xông Tinh Dầu Vân Gỗ Cao Cấp Dung Tích 500ML Chuyên Dụng Cho Phòng Lớn
Máy xông tinh dầu vân gỗ MK105 - Giao màu ngẫu nhiên
Combo máy khuếch tán/ máy xông tinh dầu Lorganic quả đào FX2059 + tinh dầu sả chanh Lorganic (10ml) LGN0367/ Thích hợp xông phòng diện tích 15-40m2.
Combo máy khuếch tán/ máy xông tinh dầu Lorganic bình hoa FX2057 + tinh dầu bạch đàn chanh Lorganic (10ml) LGN0366
"MÁY XÔNG TINH DẦU CHUYÊN DỤNG DUNG TÍCH 550ML, VÂN GỖ CAO CẤP, TÍCH HỢP ĐIỀU KHIỂN TỪ XA"
Máy khuếch tán tinh dầu SENSELAB S400ML + Tặng 1 Tinh dầu Sả Chanh SENSELAB 10ml + Remote ĐKTX - Máy xông tinh dầu siêu âm
"Máy khuếch tán tinh dầu chuyên dụng cho phòng lớn, tích hợp điều khiển từ xa"
Máy Khuếch Tán Tinh Dầu 500ml Tặng 3 Chai Sả Chanh + Bạc Hà + Oải Hương 10ml Nhập Khẩu Ấn Độ | Xông Phòng 30m2 | Kèm Remote Điều Khiển | MKT19
"máy khuếch tán tinh dầu lọ hoa lớn + Tặng tinh dầu thiên nhiên sả chanh Thacosa 10ml. máy xông tinh dầu. máy phun sương, máy tạo ẩm, lọc không khí + LED đổi 7 màu"
Máy xông tinh dầu cao cấp Bầu Tiên. Dung tích 550ml Có Remote. Tặng kèm lọ tinh dầu Cam ngọt Vemoda cao cấp (Đức) 10ml
"Máy xông tinh dầu Bình Minh giúp khuếch tán, tỏa hương tinh dầu, tạo độ ẩm, xông phòng, tặng kèm điều khiển từ xa và tinh dầu sả chanh Kobi"
"MÁY KHUẾCH TÁN TINH DẦU Chuyên Dụng cho phòng lớn 550ML, Vân gỗ cao cấp, Tích hợp điều khiển, Sóng Siêu Âm, Đèn LED 7 Màu, Công Suất Cao"
Máy Xông Tinh Dầu Chuyên Dụng Vân Gỗ Cao Cấp Tích Hợp Remote Và Đèn LED 7 Màu Biến Đổi Cực Đẹp
"Máy xông tinh dầu gỗ tròn, Máy khuếch tán tinh dầu nhỏ gọn, Máy khuếch tán tinh dầu"
"Máy Xông Tinh Dầu Chuyên Dụng Cao Cấp Cho Gia Đình và Văn Phòng - Công Nghệ Phun Sương Siêu Âm, Đèn LED 7 Màu trang trí"
"Máy Khuếch Tán Tinh Dầu Chuyên dụng 300ml Cho Gia Đình Văn Phòng, Công suất cao, Công Nghệ Sóng Siêu Âm, Đèn LED 7 Màu Tùy Chọn"
"Máy xông tinh dầu, phun sương Quả Cầu Hoa LED 7 màu cao cấp 2019 + tặng 1 lọ tinh dầu 10ml"
"Máy Xông Tinh Dầu Siêu Âm Nagomi Kết Hợp Đèn LED 7 Màu, 3 Chế Độ Hẹn Giờ, Dung Tích Lớn, Hoạt Động Liên Tục Đến 16 giờ, Có Thể Điều Chỉnh Mức Phun"
Máy khuếch tán tinh dầu siêu âm trụ trắng 
Đèn Xông Tinh Dầu Gốm Bát Tràng Gốm Sứ Thấu Quang Size Trung
Máy khuếch tán tinh dầu SENSELAB LS 500SL + Tặng 2 Tinh dầu Sả Chanh 10ml + Tinh dầu Oải hương 10ml. Thương hiệu SENSELAB Nhập khẩu Ấn Độ + Kèm Remote Điều khiển - Đèn ngủ nhiều màu
Máy Xông Tinh Dầu Vân Gỗ 550ML Chuyên Dụng Cho Phòng Lớn Có Remote Điều Khiển Từ Xa Kèm Đèn LED Thay Đổi Màu Cực Đẹp
Combo máy khuếch tán/ máy xông tinh dầu Lorganic Bí Ngô FX2055 + tinh dầu bạch đàn chanh Lorganic (10ml) LGN0364/ Thích hợp xông phòng 15-40m2.
Máy xông tinh dầu siêu âm dung tích 350ml dùng pin sạc tặng kèm lọ tinh dầu sả chanh KBAYBO 10ml
Máy khuếch tán tinh dầu trụ tròn 7 màu 500ml
Đèn xông tinh dầu gốm sứ bát tràng họa tiết hoa lá size M - Mẫu ngẫu nhiên
"Máy Khuếch Tán Tinh Dầu có REMOTE Cao Cấp Dành Cho Gia Đình - Máy PHUN SƯƠNG Công nghệ siêu âm, Công Suất Cao"
Máy xông tinh dầu hoa Lục Bình cao cấp 550ml kèm remote  1 tinh dầu 30ml và 2 viên xí ngầu
Máy Khuếch Tán Tinh Dầu 100ml Tặng 3 Chai Sả Chanh + Bạc Hà + Oải Hương 10ml Nhập Khẩu Ấn Độ | Xông Phòng 30m2 | MKT23 Cẩm Tú Cầu Hồng
 Máy khuếch tán xông tinh dầu phun sương tạo ẩm làm đèn ngủ công suất mạnh búp sen - Tặng kèm set 6 tinh dầu thiên nhiên nhập khẩu
"Máy Khuếch Tán Tinh Dầu Chuyên Dụng 500ml Tích hợp điều khiển từ xa, Phun sương siêu âm, Đèn LED 7 màu biến đổi rất đẹp"
Máy Khuếch Tán Tinh Dầu SIêu Âm Trụ 1000ml Tích Hợp Loa Bluetooth | Tặng Remote kèm 1 tinh dầu sả chanh đuổi muỗi
"Máy xông tinh dầu cao cấp Thiên Ý giúp khuếch tán, tỏa hương tinh dầu, tạo độ ẩm, xông phòng, tặng kèm điều khiển từ xa và tinh dầu sả chanh Kobi"
Máy xông tinh dầu vân gỗ Hình lọ hoa
"Máy Khuếch Tán Tinh Dầu Chuyên dụng Cho Phòng Lớn, Vân gỗ cao cấp, Tích hợp Remote 550ml - Phun Sương Bằng sóng Siêu Âm, Đèn LED 7 Màu Biến Đổi"
Đèn Xông Tinh Dầu Mini
"Máy Xông Tinh Dầu Thủy Tinh Cao Cấp, Họa Tiết Sang Trọng, Máy Khuếch Tán Tinh Dầu Chuyên Dụng, Đèn LED Trang Trí (Họa Tiết Ngẫu Nhiên)"
Đèn Xông Tinh Dầu Gốm Bát Tràng Tặng 2 Tinh Dầu Sả Chanh Kobi 10ml Và 1 Bóng Đèn Dự Phòng Chạy Bằng Điện Giúp Chống Muỗi Hiệu Quả
"Máy xông tinh dầu cao cấp Tulip 550ml Có Remote. Tặng kèm lọ tinh dầu cam ngọt cao cấp (Đức 10ml). Giúp khuếch tán, tỏa hương tinh dầu, tạo độ ẩm, xông phòng. "
Đèn Xông Tinh Dầu Gốm Bát Tràng Size Trung
Máy Xông Tinh Dầu Cao Cấp Chuyên Dụng Khuếch Tán Tinh Dầu Và Tạo Độ Ẩm Cho Gia Đình Và Văn Phòng
Máy xông tinh dầu khuếch tán MKT10 130ml
Combo máy khuếch tán tinh dầu cao cấp MKT03 và 1 chai tinh dầu bạc hà eco oil 10ml
Máy Khuếch Tán  Tinh Dầu Cho Xe Ôtô Leviter DN 834 Cáp Sạc USB - Đen
Đèn Nến - Gốm Sứ Cao Cấp Nhập Khẩu - Đèn Xông Tinh Dầu Viet Oils
Đèn xông tinh dầu gốm chữ phúc
Máy phun sương tạo ẩm khuếch tán tinh dầu kết nối Wifi cao cấp - 150WIFI
Máy xông tinh dầu mini khuếch tán hương thơm vân gỗ Tulip Kazu-05 tặng kèm tinh dầu bạc hà 10ml
"Đèn xông tinh dầu hoạ tiết con công Kepha, tặng tinh dầu Cam Ngọt Tây ban nha 10ml và 1 bóng đèn xông tinh dầu dự phòng | Đèn xông tinh dầu gốm sứ cao cấp"
Đèn Xông Tinh Dầu Gốm Hoa Mai TN35 + Tặng kèm 5 bóng thay thế  
Máy khuếch tán tinh dầu 126 màu ngẫu nhiên
Máy Khuếch Tán Tinh Dầu Cẩm Tú Cầu Màu  Hồng 100ml
Combo đèn xông tinh dầu hình vuông + nến Lasante DN-16
Máy khuếch tán tinh dầu Lucky xanh lá 3 lít cho không gian rộng
Mua Đèn xông tinh dầu thuỷ tinh cao cấp - Tinh dầu hữu cơ Oresoi Tặng Tinh dầu hữu cơ nguyên chất 100% thiên nhiên (10ml)
Máy khuếch tán tinh dầu ấm đen dung tích 300ml
Máy Khuếch Tán Tinh Dầu Hình Nấm Sứ 200ml
Máy khuếch tán tinh dầu 127 màu ngẫu nhiên
Combo đèn xông tinh dầu hình tim + nến Lasante DN-14
Máy khuếch tán tinh dầu kết hợp đèn ngủ RIO DHAY - nhập khẩu chính hãng ( UK )
"Máy Xông Tinh Dầu cao cấp cho khách VIP - Máy chuyên dụng, thiết kế sang trọng, bảo hành 12 tháng"
Máy Xông Tinh Dầu Dáng Hoa Trang Trí | Tích Hợp Remote Điều Khiển Từ Xa | Máy Phun Sương Công Nghệ Siêu Âm | Đèn Led 7 Màu Tùy Chọn Cực Đẹp | ĐXTD12 Lục Bình Đen
Máy phun tinh dầu Vaso cao cấp 
Đèn Khuếch Tán Tinh Dầu Dáng Trứng Nhiều Hình Vẽ Cảnh Đồng Quê Chất Liệu Sứ Tráng Men
"Máy khuếch tán tinh dầu chóp núi có nhiều lỗ phun, có remote điều khiển từ xa -  Hãng chính hãng GX03K "
Máy Khuếch Tán Tinh Dầu Gốm Sứ Bông Hoa 200ml
Đá thơm khuếch tán sả chanh Thánh Giá ( Tròn ) 
"Đèn xông tinh dầu , phun ẩm kết hợp đèn ngủ  BodiTek - DNHL - Hàng nhập khẩu"
Đèn xông tinh dầu gốm bát tràng size Nhỏ - Giao mẫu ngẫu nhiên
"Đèn xông tinh dầu MD026 Kepha + Tặng 1 lọ tinh dầu quế 10ml. Đèn xông tinh dầu gốm sứ bát tràng. Họa tiết lá sen, đài sen màu xanh dịu"
MÁY KHUẾCH TÁN TINH DẦU VNSPECIAL VŨ TRỤ TRONG- TẶNG 1 CHAI TINH DẦU VNSPECIAL
Máy khuếch tán tinh dầu thông minh 300ml điều khiển từ xa qua WIFI (voi trắng)
Máy khuếch tán tinh dầu kim cương đen 550ml
Máy khuếch tán tinh dầu Bình Minh Haeva
Máy khuếch tán tinh dầu hộp vuông vỏ ngoài bằng tre
Máy khuếch tán tinh dầu Lucky tím 3 lít cho không gian rộng
Máy khuếch tán/ máy xông tinh dầu Lorganic Giọt Nước FX2056/ Thích hợp xông phòng 15-40m2.
Combo Đèn xông tinh dầu tam giác TG6 và 2 chai sả chanh Eco oil 10ml và 1 bóng đèn
Chén đốt trầm bằng gốm mã 05K (Giao mầu ngẫu nhiên)
Máy Xông + Đèn + Quạt Hình Hộp Thư - Essential Oils Diffuser Mail Box S20
Combo Đèn xông tinh dầu điện tam giác TG13 và 1 bóng đèn
Máy khuếch tán tinh dầu hiệu ứng 3D pháo hoa DP-DGD23-1
"Đèn xông tinh dầu MD026 Kepha + Tặng 1 lọ tinh dầu bưởi 10ml Nguyên chất 100%, nhập khẩu trực tiếp Tây Ban Nha - Giúp làm đẹp, kích thích tóc mọc, giảm tóc rụng - Khử mùi, thư giãn, giảm stress, giúp sạch không khí"
Đèn xông tinh dầu họa tiết cánh đồng quê. Gốm sứ bát tràng cao cấp
Máy Khuếch Tán Tinh Dầu TH-15 Vân Gỗ 350ml
"Máy Khuếch tán tinh dầu, Phun sương, Chế độ báo thức, Chế độ đêm, Làm Sạch Không Khí, Tạo Ẩm, Phát Sáng - Màu Đen - Tặng chai tinh dầu Qasto - Màu đen"
Máy khuếch tán cánh hoa nâu đậm + tặng tinh dầu ngủ Ngon 10ml JULYHOUSE
Máy khuếch tán tinh dầu hình trụ tròn đế gỗ siêu âm + Tặng tinh dầu sả chanh 10ml JULYHOUSE
Combo Máy khuếch tán tinh dầu và làm ẩm không khí MKT05 kèm 1 chai tinh dầu quế eco oil 10ml (Giao màu ngẫu nhiên)
Đèn Xông Tinh Dầu Cảm Ứng Sứ Kiểu + Tặng kèm 5 bóng đèn thay thế
Máy khuếch tán búp sen đen 500ml
[ Nguyên chất ] Tinh Dầu Quế Nucare - 5ML
MÁY KHUẾCH TÁN TINH DẦU HỒ LÔ VÀNG
Đèn xông tinh dầu cảnh phố nổi  Bát Tràng - Giao màu ngẫu nhiêu
Combo Đèn xông tinh dầu tam giác TG2 và 2 chai tinh dầu sả chanh Eco oil 10ml và 1 bóng đèn
"Máy Xông Tinh Dầu Đuổi Muỗi, Côn Trùng Bảo Vệ Bé Yêu Và Gia Đình - Tặng kèm 1 lọ tinh dầu đuổi muỗi 45ml cùng loại"
Combo Đèn xông tinh dầu điện tam giác TG09 và 1 bóng đèn
Combo Đèn xông tinh dầu điện tam giác TG10 và 1 bóng đèn
ĐÈN SỨ TRẮNG L1 HOA HỒNG
Máy khuếch tán phòng V-R07
Máy Xông + Đèn + Quạt Hình Hộp Thư - Essential Oils Diffuser Mail Box S20
Đèn Điện - Gốm Sứ Cao Cấp Nhập Khẩu - Đèn Xông Tinh Dầu Viet Oils
Máy Khuếch Tán Xông Tinh Dầu Cây Thông Dung Tích 230ml
Bóng đèn xông tinh dầu
Máy Khuếch Tán Tinh Dầu KD30 - Sang trọng - Gọn nhẹ - Tinh tế - Hàng chính hãng
Đèn Khuếch Tán Tinh Dầu Dáng Tròn 3 In 1 Chất Liệu Sứ Tráng Men Nhiều Hình Vẽ Lựa Chọn
Đèn Xông Tinh Dầu Gốm Bát Tràng  Size Trung- Giao mẫu ngẫu nhiên
Máy Khuếch Tán Tinh Dầu KD80s - Sang trọng - Gọn Nhẹ - Tinh tế - Hàng Chính Hãng
Máy Khuếch Tán Tinh Dầu Kodo 10S - Sang trọng - Gọn Nhẹ - Tinh tế - Hàng Chính Hãng
Máy Khuếch Tán Tinh Dầu 300ML Tặng 12 Chai Tinh Dầu (10ML) Bạc Hà + Sả Chanh + Lavender + Cam Ngọt + Quế + Trà Xanh Cao Cấp Nguyên Chất 100% Từ Thiên Nhiên
