"Sữa bột Aptamil Profutura ÚC số 3 cho trẻ từ 1 tuổi trở lên, 900g"
Australia Bio Island DHA for Kids 60CAPSULES
Máy Hút Vệ Sinh Mũi Cho Bé BF02
Máy Tạo Tiếng Ồn Trắng Ru Trẻ Ngủ
Blackmores Superkids Immune 60 Chewables
Nature's Way Kids Smart Vita Gummies Vitamin C + Zinc Sugar Free 70 Gummies
Brauer Baby & Child Immunity Support 100ml
Bioglan Kids Vitamin C + Zinc 70 Gummies
Key Sun All Natural Kids Honey and Eucalyptus Plus Vitamin C 12 Lozenges
Carusos Natural Health Probiotic Infant & Baby 60 grams
