"Địu Ngồi Nhiều Tư Thế Chống Gù , Có Mũ Che Nắng Aimama "
Đai Xe Máy Phản Quang Dạng Lưới Thoáng Khí Cho Bé
Địu Em Bé - Địu Chống Gù Đa Năng AIMAMA ( Hàng chính hãng )
Xe tập đi cao cấp
Địu Em Bé Comfybaby Trợ Lực 4 Tư Thế + Tặng 2 Khẩu Trang Xuất Nhật
XE TẬP ĐI
Xe gà cho bé tập đi bằng gỗ siêu bền
"Xe đẩy em bé 2 chiều, trọng lượng xe 5.4 kg, cho bé từ  0-3 tuổi, gấp gọn dễ dàng bằng 1 tay"
Đai Đi Xe Máy Cho Bé Autoru
Dây Dây Dắt Trẻ Em Đi Dạo Lõi Thép Phản Quang Có Khóa BabyPlay
Ghế Ngồi Ô Tô Trẻ Em Joie Steadi Dark Pewter
Xe gỗ tập đi cho bé SRV8800
"Xe đẩy cho bé HUAYING ,Xe đẩy em bé 2 chiều 3 tư thế màu đỏ,màu xanh,màu kaki,màu hồng"
Xe Đẩy Cho Bé Zaracos Lola 2386
xe tròn tập đi AA1 cho bé- Song Long
"Địu Em Bé, Địu Nhiều Tư Thế Có Mũ Che Nắng - Hàng chính hãng (giao màu ngẫu nhiên)"
Xe đẩy dạo chơi 2 chiều gấp gọn cao cấp V5B
"Xe đẩy, xe đẩy cho bé 2 chiều gấp gọn"
Địu Trẻ Em Aprica Pitta
XE 3 BÁNH CẦN ĐẨY CAO CẤP 618 CÓ ĐÈN VÀ NHẠC CHO BÉ
Địu bốn tư thế cho bé - Giao màu ngẫu nhiên
XE ĐẨY CHO BÉ 2 CHIỀU
XE TẬP ĐI CHO BÉ
Xe đẩy du lịch siêu nhẹ COSCO SHELLEY 
"Xe đẩy cho bé, xe đẩy du lịch cho bé 2 chiều 3 tư thế"
Đai Xe Máy An Toàn 2 Trong 1 Cho Bé
Địu ngồi cao cấp 4 tư thế 2 trong 1 Comfybaby CF818
Xe Đẩy Trẻ Em Gấp Gọn Baobaohao QZ1 - Xám
"Xe tập đi kiểu mới, điều chỉnh độ cao, có phanh bánh xe điều chỉnh tốc độ, có đàn nhạc"
Địu Trẻ Em 4 Tư Thế Panda D4X (Xanh)
Xe đẩy dạo chơi gấp gọn 2 chiều V3 (thanh bảo vệ bé tuyệt đối)
Xe đẩy du lịch gấp gọn cho bé - xe đẩy ngồi cho bé mẫu mới 2020
VÒNG DÂY ĐAI ĐEO TAY DẮT TRẺ EM CHỐNG ĐI LẠC - DÂY LÕI THÉP SIÊU NHẸ - PHÁT SÁNG BUỔI TỐI – DÂY CUỘN LÒ XO GỌN GÀNG - DH2011
Đai An Toàn Xe Máy Cho Bé
Ghế cho bé ngồi xe Ga và xe đạp điện 
Đai Địu Em Bé Chuyên Dụng USA Store – US2026
Đai xe máy phản quang cho bé
Xe đẩy gấp gọn 2 chiều V3 có đệm lót + mái che
Địu lưới siêu thoáng Royalcare màu xanh 906LG
Ba lô Kết Hợp Dây Dắt Trẻ Em Chống Lạc Dài 2.5 Mét
Xe Đẩy Hai Chiều 109 Cho Bé 3 Tư Thế
Xe Gỗ Tập Đi 3 Con Chim Cho Bé TOMCITY Màu Ngẫu Nhiên
Xe Tập Đi Cho Bé Zaracos Mura 777
Xe Đẩy Cho Bé Zaracos Oral 2706 - Dark Blue
Xe Tập Đi Con Gà (Giao Mẫu Ngẫu Nhiên)
"Xe đẩy cho bé, xe đẩy em bé, Xe đẩy trẻ em 2 chiều 3 tư thế, xe đẩy du lịch, xe đẩy gấp gọn TẶNG NGAY BỘ ĐỒ CHƠI NÚM GỖ CHO BÉ CHỦ ĐỀ NGẪU NHIÊN"
Đai giữ cho bé ngồi xe máy có đỡ cổ 2 trong 1 Cho Bé 1-5 tuổi
Đai Xe Máy An Toàn 2 Trong 1 Cho Bé (Đỏ)
"Xe đẩy Vovo 1 chiều 3 tư thế, tải trọng 50kg,  dễ dàng gấp gọn, trọng lượng chỉ 5.8 kg, gấp nhanh 1 tay chỉ với 1 nút bấm"
Xe tập đi con vịt  (Có nhạc + để chân + tay đẩy)- màu cho bé trai- mẫu ngẫu nhiên 
"Dây Dắt Trẻ Đi Dạo Chống Lạc Cho Bé - Loại Có Khóa Bấm, Dài 2.5m"
Xe Đẩy Em Bé Gấp Gọn Cao Cấp - XD10 (Giao màu  ngẫu nhiên)
XE TẬP ĐI CHO BÉ BLK631
Địu Em Bé 4 Tư Thế Đa Năng An Toàn
"Xe tập đi Nhựa Chợ Lớn L3 Con Tôm (Không nhạc) - M1390A-XTĐ, Sườn xe bằng sắt chịu lực, Nhựa chính phẩm an toàn, Sản xuất tại Việt Nam - Hàng chính hãng"
Xe Đẩy Trẻ Em Gấp Gọn Tiện Lợi V1 
Xe Đẩy Trẻ Em Baobaohao 722C gọn nhẹ đa tư thế - xd722c (mầu bé trai)
Xe đẩy du lịch thông minh - xe đẩy gấp gọn du lịch siêu nhẹ cao cấp cho bé
Xe tập đi bằng gỗ con gà cho bé
Ghế Ngồi Xe Ga Beesmart - Xanh Dương
XE TẬP ĐI CAO CẤP CHO BÉ (CÓ NHẠC) AUTORU AUBW03
"XE ĐẨY EM BÉ mã 6083 ( 3 tư thế nằm, ngồi, ngả . gấp gọn tiện lợi) -Màu đỏ"
Ghế Ngồi Sau Xe Máy Beesmart X2 - Xanh Lót Xanh Trơn
Xe Đẩy Trẻ Em Joie Pact W/ RC&ADPT&TB Gray Flannel
Xe đẩy du lịch cho bé 
Xe đẩy dạo chơi gấp gọn xoay chiểu 360 độ cao cấp V5
Xe Đẩy Cho Bé Zaracos Nano RS
Xe 3 bánh có cần đẩy 306.
Xe Đẩy Cho Bé V1
Xe tập đi Nhựa Chợ Lớn L3 Con Vịt (Không nhạc) - M1441A-XTĐ - Giao màu ngẫu nhiên
Ghế Ngồi Ô Tô Trẻ Em Joie Stages Gray Flannel
Xe đẩy trẻ em đa năng gọn nhẹ Thời trang cho bé Màu xanh mint
Xe đẩy du lịch cho bé
Nôi xách GLUCK BABY ZY07 Kiêm gắn ghế ngồi ô tô
Địu em bé có ghế ngồi trợ lực (Màu ngẫu nhiên)
"Xe Đẩy Cho Bé, Xe đẩy em bé 2 Chiều 3 Tư Thế XĐHY1299"
"Xe tập đi cho bé ALPINIA phiên bản 2020. Biến đổi 2 chức năng. Có đồ chơi, nhạc và đèn"
Địu bé Gluck Baby GP708 4 trong 1
ĐAI ĐỊU ĐA NĂNG CHO BÉ YÊU HÀNG CAO CẤP
Ghế Ô Tô Zaracos William 5086 Be
Địu Em Bé - Địu Đa Năng - MÀU GHI ( Hàng chính hãng )
Xe đẩy 4 bánh cho em bé 
"	Xe đẩy du lịch Mastela A2 - Khung Aluminum cao cấp siêu nhẹ, dễ dàng gấp gọn"
XE TẬP ĐI HÌNH VỊT CHO BÉ 
Địu Ngồi Trợ Lực Có Ghế Chống Gù Babylab - Hàng Chính Hãng
Địu ngồi cao cấp siêu mềm 4 tư thế Comfybaby HC003
"Xe đẩy đi dạo cao cấp gấp gọn nhẹ, ghế ngồi đệm V2"
Xe Đẩy Trẻ Em Aprica Karoon Air RD TW
Combo Bộ Xích đu Nhún nhảy Tập đi Jumper Kids KG101+ Ghế Xích đu Đa năng tích hợp Bàn Ăn dặm (Chính hãng)
Ghế Ngồi Xe Ga Beesmart - Hồng 
Địu Trẻ Em Aprica Pitta - Beige
Xích Đu Nhún Nhảy Tập Đi Jumper Kids - JPKG101
XE TẬP ĐI ĐA NĂNG WDH-BABYPARK 3in1 - XE TẬP ĐI - XE CHÒI CHÂN - XE SCOOTERS
Xe Đẩy Em Bé Cao Cấp Gấp Gọn Tiện Lợi - XD14 (màu ngẫu nhiên)
Xe 2 Nhún Ăn Bột Autoru
Xe đẩy trẻ em Myrica ALB1VN
XE ĐẠP ĐA NĂNG 3 BÁNH CÓ CẦN ĐẨY- CHÍNH HÃNG ( Giao Hàng Ngẫu Nhiên Mẫu)
Địu Em Bé Comfybaby Cao cấp Trợ Lực 4 Tư Thế + Tặng Khăn ướt cao cấp và 2 Khẩu Trang Xuất Nhật
Xe Đẩy Trẻ Em Baobaohao 722C gọn nhẹ đa tư thế - xd722c (màu bé gái)
"Xe 3 In 1: Tập Ngồi, Tập Đứng, Tập Đi Winfun 0859NL"
Xe gỗ tập đi tặng kèm túi vải - cho bé yêu những bước đi vững chắc đầu đời
Xe tập đi 3in1 cao cấp cho bé mẫu 2020 có mái che cần đẩy
Địu ngồi cao cấp 4 tư thế  2 trong 1 Comfybaby CF818
Xe đẩy gập gọn và đảo chiều tiện lợi cho bé
Xe Gà Tập Đi Cho Bé - Xe gỗ tập đi(Tặng Vịt Thả Bể Bơi)
Địu cao cấp Infantino 4 tư thế 005204
Xe đẩy 5 bánh cho bé - màu ngẫu nhiên
Xe tập đi đèn nhạc Winfun CHÍNH HÃNG
"Xe đẩy du lịch đảo chiều gấp gọn siêu nhẹ Playkids có mái che nắng, trọng lượng chỉ 3,7kg, để được đằng trước xe máy, gấp gọn đựng được trong vali xách tay - TẶNG KÈM BẢNG NÚM GỖ CHO BÉ CHỦ ĐỀ NGẪU NHIÊN, Xe đẩy trẻ em, xe đẩy gấp gọn"
Xe Tập Đi Có Nhạc Và Đồ Chơi Cho Bé
"Dây đeo tay chống thất lạc trẻ em, vòng đeo tay bảo vệ bé khi đi dạo ( giao màu ngẫu nhiên )"
"Xe đẩy gấp gọn 5 bánh cho bé (màu ngẫu nhiên) - Tặng kèm 01 khuôn ép cơm, làm bánh hình con vật siêu ngộ nghĩnh"
Xe Đẩy Trẻ Em 2 Chiều Có Nhạc Baobaohao 709N - Xanh
Địu Trẻ Em 4 Tư Thế Panda D4D - Đỏ
XE ĐẨY EM BÉ mã 6083- Màu Xanh Dương
Ghế ngồi ô tô giữ bé trên xe hơi - Màu hồng phấn
XE TẬP ĐI CHO BÉ (CÓ CÂY ĐẨY - TẤM LÓT CHÂN) AUTORU AUBW04
"Xe đẩy trẻ em, Xe đẩy du lịch đảo chiều gấp gọn siêu nhẹ Playkids có mái che nắng, trọng lượng chỉ 3,7kg, để được đằng trước xe máy, gấp gọn đựng được trong vali xách tay ( TẶNG KÈM BỘ THẺ HỌC THÔNG MINH 16 CHỦ ĐỀ 416 THẺ CHO BÉ )"
Ghế Ngồi Sau Xe Máy Beesmart X2 - Hồng Lót Họa Tiết Chữ
Xe Đẩy Trẻ Em Bập Bênh 2 Chiều Baobaohao C3 - Hồng Tím
Xe đẩy trẻ em Joie Litetrax 4 Flex W/ RC SIG. Noir
"Dây Chống Lạc Khóa Nam Châm, Dây Lõi Thép Phản Quang Baby Coupe 2,5 Mét"
"Xe đẩy đảo chiều, 2 chiều cho bé gấp gọn dụ lịch siêu nhẹ 3.7kg có thể mang lên máy bay mẫu mới nhất"
Xe đẩy du lịch Vovo Travel gấp gọn 2018 mới nhất
Xe tập đi Nhựa Chợ Lớn L3 Con Nhím (Không nhạc) - M1486A-XTĐ - Giao màu ngẫu nhiên
Xe đẩy trẻ em gấp gọn nhiều tư thế có đệm rời và lưới nằm cho mùa hè BLB 769 mẫu mới 2020
"Xe đẩy trẻ em, xe đẩy du lịch gấp gọn "
Đai Bảo Hiểm Xe Máy Supeguardo Túi Lưới (Size XL) - Giao Mẫu Ngẫu Nhiên
Xe Tập Đi Bằng Gỗ Cho Bé (tập đi 3 con chim) 
Xe Tập Đi Hình Thỏ Autoru (Có Nhạc)
Ghế Ô Tô Zaracos William 5086 Pink
Xe Tập Đi Tròn Xuất Nhật - Có Nâng Hạ Độ Cao
Xe Đẩy Trẻ Em Hai Chiều Gluck Baby C8M - Kem
Xe đẩy gấp gọn và đảo chiều cho bé
Xe Tập Đi Liền Ghế Cao Cấp Farlin - BF-880
"Xe đẩy em bé Vovo 2 chiều 2019, chât liệu hợp kim platinum, tải trọng 50 kg, đệm nằm thiết kế chống cong vẹo cột sống của bé"
Xe Đẩy Trẻ Em Siêu Nhẹ Gấp Gọn A2 Mastela (Xanh Lam)
Ghế Ngồi Xe Ga Beesmart - Xanh Lá
Ghế Ngồi Sau Xe Máy Beesmart X2 - Không Tựa Đầu (Xanh)
Xe tập đi Nhựa Chợ Lớn L4 Xe đua F1 (Có nhạc) - M1631B-XTĐ - Giao màu ngẫu nhiên
Xe tập đi cao cấp điều chỉnh 6 mức độ cao 
Xe đẩy 5 bánh gấp gọn có giỏ tiện lợi  cho bé yêu màu đen
Xe Đẩy Trẻ Em Joie Pact W/ RC&ADPT&TB Laurel
Xe Tập Đi Đa Năng Có Bàn Nhạc Winfun 0804
GHẾ ĐÔN ĐA NĂNG ĐI XE CHO BÉ
Đai Đi Xe Máy Đỡ Cổ Cho Bé Panda DXM
"Xe đẩy trẻ em cao cấp 2 chiều 3 tư thế gấp gọn khi du lịch, kiểu dáng sang trọng (Xe đẩy mới 2019)"
Xích Đu Nhún Nhảy Tập Đi Jumper Kids (Hệ Có Chân Giằng Dưới) - JPKG102
XE ĐẨY CHO BÉ 2 CHIỀU BONBÉBÉ BB-24 GẤP GỌN CHẮC CHẮN
Địu ngồi cho bé siêu tiện lợi_đỏ đô
Dây Dắt Trẻ Đi Dạo Chống Lạc An Toàn Cao Cấp AZONE
Dây Dắt Trẻ Đi Dạo Chống Lạc
"Xe đẩy cho bé, Xe đẩy gấp gọn"
Xe đẩy em bé gấp gọn
"Xe đẩy du lịch cho bé, xe 5 bánh gấp gọn"
Xe đẩy trẻ em QQ3.
Dây dắt trẻ em chống lạc
Xe Đẩy Trẻ Em Aprica Karoon Air NV TW
Địu bé 8 trong 1 Glück Baby
Xe đẩy trẻ em Joie Pact Flex W/RC&ADPT&TB SIG. Noir
Ghế Ngồi Sau Xe Máy Beesmart X2 - Có Tựa Đầu (Xanh)
Xe đẩy hai chiều V3 Pro Summer New 
Xe tập đi Con vịt  (Có nhạc + để chân + tay đẩy)- màu cho bé gái - màu ngẫu nhiên 
Xe Đẩy Combi Mechacal Handy S - Xanh Navy
Xe đẩy du lịch gấp gọn siêu nhẹ 3 tư thế mẫu 2019 mới nhất (xanh xám)
Xe đẩy gấp gọn 5 bánh
Địu em bé J-Style tư thế nằm hoặc ngồi cho bé Supeguardo (giao màu ngẫu nhiên)
GHẾ SỐ XẾP ĐI XE CHO BÉ  ( GIAO MÀU NGẪU NHIÊN ) 
Xe đẩy đôi 703R
GHẾ GA XẾP CHO BÉ ( GIAO MÀU NGẪU NHIÊN ) DÀNH  CHO CÁC LOẠI XE TAY GA 
Ghế Ngồi Xe Ga Beesmart X2 BEEX2-0 - Xanh
Xe Tập Đi Có Nhạc Và Đồ Chơi Cho Bé
Xe tập đi Nhựa Chợ Lớn L3 Bọ Xít (Không nhạc) - M1497A-XTĐ - Giao màu ngẫu nhiên
"Xe tập đi Nhựa Chợ Lớn L4 Chú Heo Con (Có nhạc) - M1771B-XTĐ, Sườn xe bằng sắt chịu lực, Nhựa chính phẩm an toàn, Sản xuất tại Việt Nam - Hàng chính hãng"
Xe đẩy gấp gọn cho bé
Xe Đẩy Cho Bé 1 Chiều Gấp Gọn 
Xe Đẩy Trẻ Em Aprica Karoon Air BK TW
"Xe đẩy cho bé 2 chiều, Xe đẩy trẻ em gấp gọn HT 105 - 2 chiều 3 tư thế đa năng, kiểu dáng sang trọng, dễ dàng mang theo ( TẶNG KÈM BỘ THẺ HỌC THÔNG MINH 16 CHỦ ĐỀ 416 THẺ CHO BÉ ) - xe đẩy du lịch, xe đẩy gấp gọn, xe đẩy cho bé, xe đẩy em bé"
Đai xe máy loại đỡ cổ cho bé - An toàn khi đi xe máy thương hiệu kachoo nhiều màu sắc
Xe đẩy có ô ghế da cho bé -màu tím
Ghế Ngồi Ô Tô Trẻ Em Joie Stages Coal
Ghế Ngồi Ô Tô Trẻ Em Joie Stages Cherry
Xe đẩy đôi cho bé 703A
Xe đẩy 2 chiều có bập bênh cho bé Baobaohao 720W
"Xe đẩy trẻ em  2 chiều 3 tư thế A6 gấp gọn, chỉ 5,6 kg xách tay gấp lại dễ dàng mang theo - TẶNG KÈM BỘ THẺ HỌC THÔNG MINH 16 CHỦ ĐỀ 416 THẺ CHO BÉ"
Xe đẩy 2 chiều cho bé tặng kèm đèn ngủ đáng yêu
XE ĐẨY TRẺ EM CÓ MÁI CHE QQ12
"Xe Đẩy em bé 2 Chiều Gấp Gọn,Thiết Kế Châu Âu, Năng Động, Hợp Kim, Trọng tải 80kg"
Xe đẩy em bé GB QBIT + All Terrain (Đen)
Ghế Ngồi Ô Tô Trẻ Em Joie Elevate Cherry
Đai 2 Lớp An Toàn Cho Bé Ngồi Xe Máy - Xanh
Xe đẩy du lịch Glück Baby US300
Dây chống lạc
Ghế Ngồi Xe Số Beesmart - Xanh Dương
Xe đầy em bé BLY A118 màu ngẫu nhiên
Xe đẩy trẻ em đa năng gọn nhẹ Thời trang cho bé
Địu Trẻ Em Aprica Pitta - Tím
Ghế ngồi ô tô Gluck ZY-02
Địu ngồi trẻ em siêu thoáng khí ROYALCARE tặng xe trượt đà cho bé VBC-123-6 ( ngẫu nhiên)
Xe đẩy trẻ em gấp gọn
Xe tập đi cho bé
Địu ngồi cao cấp 4 tư thế chống vòng kiềng Comfy Baby
Xe Đẩy Cho Bé - Xe Đẩy Gấp Gọn - Xe Đẩy Đa Năng Cao Cấp Dành Cho Bé Yêu
Xe Đẩy Cho Bé 709N
Xe đẩy em bé GB Swan Basic - Đỏ
Xe Đẩy Cho Bé Zaracos CRUZ 3206
Ghế ngồi ô tô cho bé từ 9 tháng đến 12 tuổi
"Xe đẩy trẻ em 2 chiều 3 tư thế đa năng, kiểu dáng sang trọng ( TẶNG KÈM BỘ ĐỒ CHƠI NÚM GỖ CHO BÉ CHỦ ĐỀ NGẪU NHIÊN )"
Địu Infantino cao cấp sơ sinh tới 3 tuổi - 4 tư thế 005204
Xe Đẩy Đa Năng Cao Cấp Dành Cho Bé Yêu (Giao Mẫu Ngẫu Nhiên)
"Địu em bé 4 chức năng an toàn tiện lợi khi đi ra ngoài cùng bé, thương hiệu KACHOO được cấp chứng nhận hợp quy"
"Địu Em Bé, Địu ngồi 4 Tư Thế Có Túi Để Đồ Tiện Dụng Comfybaby + Tặng 2 Khẩu Trang Xuất Nhật"
Xe đẩy em bé gấp gọn- ghế ngồi đi chơi trẻ em nhỏ gọn
Combo Bộ Xích đu Nhún nhảy Tập đi Jumper Kids KG102 (có Khung giằng dưới) + Ghế Xích đu Đa năng tích hợp Bàn Ăn dặm (Chính hãng)
Xe tập đi Nhựa Chợ Lớn L4 Con Mèo ĐK (Có nhạc) - M1622B-XTĐ - Giao màu ngẫu nhiên
Địu bệ ngồi tiện dụng Supeguardo (Giao màu ngẫu nhiên)
Ghế ngồi xe đạp và xe đạp điện KIBA cao cấp cho bé
Xe Đẩy Tiện Lợi Dành Cho Trẻ Em - XE10 (Giao mẫu ngẫu nhiên)
XE ĐẨY THÔNG MINH GẤP GỌN 613 CHO BÉ ( GIAO MÀU NGẪU NHIÊN )
Ghế ngồi xe gấp gọn cho bé
Xe Đẩy Seebaby Qq3 - Đỏ
Xe tập đi chống vọng kiềng chân cho trẻ có nhạc từ 6 tháng đến 24 tháng
Xe tập đi Nhựa Chợ Lớn L3 Con Cua (Không nhạc)-M1393A-XTĐ- Giao màu ngẫu nhiên
Xe đẩy đôi ghế trước ghế sau 705 
Xe Đẩy Cho Bé 722C
Xe Đẩy Trẻ Em Baobaohao 722C - B289 - Xanh
Xe tập đi Nhựa Chợ Lớn L3 Con Cá (Có nhạc) - M1396B-XTĐ - Giao màu ngẫu nhiên 
Địu cho bé Ergobaby 360 Cool Air Mesh – Carbon Grey
Ghế Ngồi Xe Số Beesmart - Xanh Dương + Tặng Kèm Khăn Voan Chống Bụi Cho Bé (80 x 80 cm)
Xe Đẩy Cho Bé Zaracos Oral 2706 - Red
Xe 3 bánh cán đẩy (giao mầu bé gái)
Xe đẩy 5 bánh cho bé
ĐAI THƯỜNG ĐI XE CHO BÉ ( GAIO MÀU NGẪU NHIÊN ) 
Xe đẩy du lịch gọn nhẹ cho bé 2019- màu cho bé trai
"Địu Ngồi Em Bé - Đa Chức Năng, Địu Nhiều Tư Thế, Chống Cong Chân và Đau Bẹn Bé"
Ghế ngồi ô tô giữ bé trên xe hơi - Xanh dương đậm 
Ghế Ô Tô Zaracos Aroma 7196 Grey
Xe đẩy cho bé
" XE ĐẨY EM BÉ MẮT CƯỜI CÓ MÁI CHE, GIỎ ĐỒ, PHANH CHÂN- màu bé trai"
Ghế ngồi xe tay ga - xe tay côn ( hình ngẫu nhiên)
"Dây Đai Chống Lạc 2 Đầu, Dây Dắt Trẻ Em Lõi Thép, Phản Quang, Có Khóa - Dài 2.5 Mét (Tặng 1 Khóa Cổ Tay)"
Xe tập đi Nhựa Chợ Lớn L4 Con Chó (Không nhạc) - M1638A-XTĐ - Giao màu ngẫu nhiên
"Dây Dắt Trẻ Em Chống Lạc Dạng Yếm Quấn Bụng, Lõi Thép Phản Quang Dài 2.5 Mét"
xe đẩy cho bé gấp gọn siêu nhẹ 
"Xe đẩy mây gấp (có tay đẩy, để chân, vịt kêu)"
Xe đẩy du lịch siêu gọn nhẹ  QQ1-2
Xe Đẩy Gluck Baby B6 (Xanh Dương)
Địu Em Bé i-Angel Fleur IA-117
Ghế Ngồi Ô Tô Trẻ Em Joie Steadi Coal
Xe tập đi Nhựa Chợ Lớn L4 Con Hổ (Có nhạc) - M1637B-XTĐ
Xe tập đi Nhựa Chợ Lớn L3 Con Nhím (Có nhạc) - M1486B -XTĐ - Giao màu ngẫu nhiên
Xe đẩy du lịch hai chiều siêu nhẹ Joovy  tặng xe trượt đà cho bé VBC-123-6 ( ngẫu nhiên)
Xe đẩy ba bánh có ô ghế da cho bé -màu xanh 
Xe đẩy trẻ em Màu xám ghi tiện lợi gấp gọn cho trẻ 
Ghế Ngồi Xe Số Beesmart X2 BEEX2-1 - Xanh
"Xe đẩy 2 chiều gấp gọn du lịch kiêm nôi xách tay, ghế ô tô an toàn cho bé 3in1 (đen)"
Xe tập đi Nhựa Chợ Lớn L4 Con Vịt ĐK (Không nhạc) - M1629A-XTĐ - Giao màu ngẫu nhiên
Xe tập đi Nhựa Chợ Lớn L4 Chim Cánh Cụt (Có nhạc) - M1462B-XTĐ - Giao màu ngẫu nhiên
Địu Em Bé Đa Chức Năng I-Angel Miracle (0 - 36 Tháng)
"Xe Đẩy Cho Bé, Xe Đẩy Gấp Gọn, Xe Đẩy Du Lịch"
Xe Tập Đi Zaracos Cooper 555 Pink
Xe đẩy 2 chiều gấp gọn có mái che S113
Xe đẩy du lịch siêu nhẹ COSCO OCEAN BLUE
Địu ngồi an toàn - hàng cao cấp (giao màu ngẫu nhiên)
Đai Bảo Hiểm Xe Máy Supeguardo (Size XL) + Tặng Kèm Khẩu Trang - Giao Mẫu Ngẫu Nhiên
"Xe đẩy 2 chiều gấp gọn, xe đẩy giá rẻ, xe đẩy cho bé HT 105 - 2 chiều 3 tư thế đa năng kiểu dáng sang trọng, dễ dàng mang theo ( TẶNG KÈM BỘ ĐỒ CHƠI XÚC XẮC ĐÁNG YÊU CHO BÉ ) - xe đẩy du lịch, xe đẩy gấp gọn, xe đẩy cho bé, xe đẩy em bé"
Xe đẩy gấp gọn 2 chiều V3 có đệm lót
"Xe đẩy gấp gọn, Xe đẩy du lịch đảo chiều gấp gọn siêu nhẹ Playkids có mái che nắng, trọng lượng chỉ 3,7kg, để được đằng trước xe máy, gấp gọn đựng được trong vali xách tay (TẶNG KÈM BỘ ĐỒ CHƠI XÚC XẮC ĐÁNG YÊU CHO BÉ)"
Ghế Ngồi Ô Tô Trẻ Em Joie i-Gemm 2 Pavement
Vòng Tay Chống Lạc Cho Bé - Giao Ngẫu Nhiên
"Xe tập đi Nhựa Chợ Lớn L4 Xe đua F1 (Không nhạc) - M1631A-XTĐ, Sườn xe bằng sắt chịu lực, Nhựa chính phẩm an toàn, Sản xuất tại Việt Nam - Hàng chính hãng"
Địu Sunbaby 4 chức năng (4 in1 mới)
"Xe Đẩy Du Lịch, Xe Đẩy Cho Bé, Xe Đẩy Gấp Gọn"
Địu ngồi cao cấp siêu mềm 4 tư thế Comfybaby HC003 - Xanh
Dây Đeo Tay Chống Lạc - Khóa Cảm Ứng - 2M
Xe đẩy cho bé TOPBI A09 (008)
Xe 3 bánh tập đi cho bé có cần đẩy và mái che hàng cao cấp_XE51 (Giao màu ngẫu nhiên)
"Xe đẩy đôi gấp gọn mẫu mới 2019 (mái che, phanh chân, giỏ đồ)- màu cho bé gái"
Xe đẩy 2 chiều gấp gọn du lịch 3 tư thế siêu nhẹ nhỏ gọn có thể mang lên máy bay Bair Travel D298 mẫu mới nhất
"Xe tập đi đa năng cho bé 3IN1 Xe Tập Đi,  Xe Chòi Chân, Xe Scooters có nhạc và đèn cho bé từ 6 tháng đến 4 tuổi"
"Xe đẩy trẻ em 2 chiều 3 tư thế gấp gọn, xe đẩy du lịch, xe đẩy nôi cho bé siêu nhẹ xanh, nặng 7KG"
Xe tập đi Nhựa Chợ Lớn L3 Con Cá (Không nhạc) - M1396A-XTĐ - Giao màu ngẫu nhiên
Xe tập đi Nhựa Chợ Lớn L4 Con Hổ (Không nhạc) - M1637A-XTĐ
Xe Đẩy Gấp Gọn Trọng Lượng Nhẹ 509 
Xe đẩy 2 chiều - Hàng nhập khẩu
Xe Đẩy Trẻ Em Joie Litetrax 4 W/ RC Deep Sea
Xe đẩy 3 bánh  cán đẩy (giao mầu bé trai)
Xe tập đi đa năng kiểu dáng xe đua F1
Ghế Ngồi Ô Tô Cho Bé Brevi Smart Silverline BRE545
"Xe đẩy, xe nôi cho bé. Xe 3 tư thế có giảm xóc."
Địu Em Bé 3 Trong 1 Kuku KU2152
Xe đẩy em bé gấp gọn 
Xe Đẩy Gọn Nhẹ Orrbic toys CODY V2
Xe Tập Đi Con Ngựa Cho Bé
Xe đẩy QQ2 du lịch siêu nhẹ
Xe Đẩy Coozy Ariel 126 - Pink
Ghế cho bé ngồi xe đạp
ĐAI ĐI XE MÁY CHO BÉ AUCSB01
Xe Tập Đi Hình Thỏ Autoru (Có Nhạc + Cây Đẩy + Tấm Lót Chân)
XE ĐẨY GẤP GỌN MẪU MỚI
"Xe đẩy hai chiều gập gọn cao cấp, siêu nhẹ và mái che chống tia UV Mastela Premium T05S"
"Xe Đẩy Trẻ Em E51 - Gấp Gọn Bằng 1 Tay, Ngồi Nhiều Tư Thế, Kèm Màn, Áo Mưa, Mền Giữ Ấm, Hốc Đựng Bình Sữa, Gối"
"Xe đẩy trẻ em 2 chiều 3 tư thế, xe đẩy du lịch, xe đẩy gấp gọn (đen)"
Dây đai dắt trẻ chống lạc an toàn cho trẻ em 
Xe tập đi chống vọng kiềng chân cho trẻ có nhạc từ 6 tháng đến 24 tháng (hồng)
" Xe Đẩy Cho Bé, Xe Đẩy Gấp Gọn, Xe Đẩy Du Lịch Siêu Nhẹ, Xe Đẩy Trẻ Em, Xe Đẩy Giá Rẻ ( TẶNG KÈM BẢNG GHÉP HÌNH NÚM GỖ CHO BÉ CHỦ ĐỀ NGẪU NHIÊN ) "
Địu Em Bé i-Angel Irene IA-108
"XE ĐẨY CHO BÉ 2 CHIỀU , XE ĐẨY DU LỊCH , GẤP GỌN"
Xe đẩy du lịch cho bé
Ghế Ngồi Ô Tô Trẻ Em Joie Elevate Two Tone Black
Xe Đẩy Em Bé Cao Cấp Gấp Gọn Tiện Lợi - XD12 (màu ngẫu nhiên)
Xe Tập Đi Tiện Lợi Cho Bé - XE13 (Giao mẫu ngẫu nhiên)
Xe Tập Đi Hình Voi Autoru (Có Nhạc)
"Xe đẩy, xe đẩy trẻ em, Xe đẩy cho bé, xe đẩy du lịch 1 chiều 3 tư thế siêu nhẹ, siêu êm, siêu gọn – TẶNG KÈM BẢNG NÚM GỖ CHO BÉ CHỦ ĐỀ NGẪU NHIÊN"
Địu cao cấp 4 tư thế Aprica Pitta / TẶNG KHẨU TRANG CHO BÉ
Đai an toàn đi xe máy KACHOO - Loại thêu nhỏ (Giao màu ngẫu nhiên)
Xe đẩy cho bé
Xe Đẩy Trẻ Em Aprica Karoon
Quạt Gắn Xe Đẩy Cho Bé Kuku Có Đèn KU5379
Xe Đẩy Trẻ Em 2 Chiều Có Nhạc Baobaohao 709N - Đỏ
Ghế Ôtô Cho Bé Zaracos Morel 2636 - Brown
Xe tập đi Nhựa Chợ Lớn L4 Gấu Pooh (Có nhạc) - M1531B-XTĐ - Màu ngẫu nhiên
Ghế ô tô Joie Elevate Cherry CHÍNH HÃNG 
" Xe đạp 3 bánh cần đẩy có bàn đạp, mái che, bảo hiểm, để chân- màu cho bé trai "
"Địu Ngồi Em Bé - KUB - Đa Chức Năng, Địu Nhiều Tư Thế, Chống Cong Chân và Đau Bẹn Bé"
" Xe đạp 3 bánh cần đẩy có bàn đạp, mái che, bảo hiểm, để chân- màu cho bé gái"
Xe tập đi Nhựa Chợ Lớn L4 Con Ong (Không nhạc) - M1554A-XTĐ - Giao màu ngẫu nhiên
Ghế Ngồi Beesmart X2 - Màu Vàng
ĐAI THÊU ĐI XE CHO BÉ ( GIAO MÀU NGẪU NHIÊN ) 
XE ĐẨY CHO BÉ 711B
Đai Mini Cooper (Giao màu ngẫu nhiên)
XE ĐẨY 3 BÁNH CAO CẤP CHO BÉ 1-5 tuổi CÓ BÀN ĐẠP- màu cho bé trai
XE TẬP ĐI 315B CÓ PIN CHO BÉ MỚI MÀU NGẪU NHIÊN
Xe Đẩy Seebaby Qq3 - Xanh
Đai giữ an toàn tiện lợi cho trẻ ngồi xe máy với nhiều hình thù ngộ nghĩnh
Xe tập đi Nhựa Chợ Lớn L3 Bọ Xít (Có nhạc) - M1497B-XTĐ - Giao màu ngẫu nhiên
"Địu Ngồi Nhiều Tư Thế Chống Gù , Có Mũ Che Nắng Aimama "
Đai Xe Máy Phản Quang Dạng Lưới Thoáng Khí Cho Bé
Địu Em Bé - Địu Chống Gù Đa Năng AIMAMA ( Hàng chính hãng )
Xe tập đi cao cấp
Địu Em Bé Comfybaby Trợ Lực 4 Tư Thế + Tặng 2 Khẩu Trang Xuất Nhật
XE TẬP ĐI
Xe gà cho bé tập đi bằng gỗ siêu bền
"Xe đẩy em bé 2 chiều, trọng lượng xe 5.4 kg, cho bé từ  0-3 tuổi, gấp gọn dễ dàng bằng 1 tay"
Đai Đi Xe Máy Cho Bé Autoru
Dây Dây Dắt Trẻ Em Đi Dạo Lõi Thép Phản Quang Có Khóa BabyPlay
Ghế Ngồi Ô Tô Trẻ Em Joie Steadi Dark Pewter
Xe gỗ tập đi cho bé SRV8800
"Xe đẩy cho bé HUAYING ,Xe đẩy em bé 2 chiều 3 tư thế màu đỏ,màu xanh,màu kaki,màu hồng"
Xe Đẩy Cho Bé Zaracos Lola 2386
xe tròn tập đi AA1 cho bé- Song Long
"Địu Em Bé, Địu Nhiều Tư Thế Có Mũ Che Nắng - Hàng chính hãng (giao màu ngẫu nhiên)"
Xe đẩy dạo chơi 2 chiều gấp gọn cao cấp V5B
"Xe đẩy, xe đẩy cho bé 2 chiều gấp gọn"
Địu Trẻ Em Aprica Pitta
XE 3 BÁNH CẦN ĐẨY CAO CẤP 618 CÓ ĐÈN VÀ NHẠC CHO BÉ
Địu bốn tư thế cho bé - Giao màu ngẫu nhiên
XE ĐẨY CHO BÉ 2 CHIỀU
XE TẬP ĐI CHO BÉ
Xe đẩy du lịch siêu nhẹ COSCO SHELLEY 
"Xe đẩy cho bé, xe đẩy du lịch cho bé 2 chiều 3 tư thế"
Đai Xe Máy An Toàn 2 Trong 1 Cho Bé
Địu ngồi cao cấp 4 tư thế 2 trong 1 Comfybaby CF818
Xe Đẩy Trẻ Em Gấp Gọn Baobaohao QZ1 - Xám
"Xe tập đi kiểu mới, điều chỉnh độ cao, có phanh bánh xe điều chỉnh tốc độ, có đàn nhạc"
Địu Trẻ Em 4 Tư Thế Panda D4X (Xanh)
Xe đẩy dạo chơi gấp gọn 2 chiều V3 (thanh bảo vệ bé tuyệt đối)
Xe đẩy du lịch gấp gọn cho bé - xe đẩy ngồi cho bé mẫu mới 2020
VÒNG DÂY ĐAI ĐEO TAY DẮT TRẺ EM CHỐNG ĐI LẠC - DÂY LÕI THÉP SIÊU NHẸ - PHÁT SÁNG BUỔI TỐI – DÂY CUỘN LÒ XO GỌN GÀNG - DH2011
Đai An Toàn Xe Máy Cho Bé
