"Thanh chắn giường Umoo, khung chắc chắn cho bé ngủ và chơi an toàn (Giá 1 thanh)"
Thanh chặn giường cao cấp Umoo
"Combo 10 miếng silicon bọc cạnh bàn, góc bàn"
Thanh chắn giường Baby Gift an toàn cho bé giá 1 thanh
Thanh chắn giường cho bé an toàn cao cấp trượt lên trượt xuống nút bấm hiện đại cao khoá an toàn 82 cm Aachmann giá bán 1 thanh 
Thanh chắn cầu thang và cửa giúp Bé an toàn- KHÔNG KHOAN ĐỤC TƯỜNG- LẮP ĐẶT ĐƠN GIẢN
Bộ 8 nút bịt góc bàn an toàn cho bé
Bộ 10 nút bịt ổ điện bảo vệ an toàn cho bé yêu
"Thanh chặn, chắn cửa, cầu thang, bằng thép sơn tĩnh điện, không cần khoan đục, có chốt khóa đảm bảo an toàn cho bé"
Thanh chắn giường Umoo cao cấp  (1 thanh)
Dây Bọc Cạnh Bàn Chống Va Chạm Cho Bé
Nón Bảo Hiểm Tập Đi Cho Bé Lưỡi Trai 7 Tháng Đến 4 Tuổi.
Combo 12 bịt góc cạnh bàn silicon Bảo vệ an toàn cho bé 12B600
Combo Bộ 16 Miếng Dụng Cụ Silicone Chặn Và Bịt Góc Bàn Tủ Cửa Bảo Vệ Bé Legaxi
"Set 12 miếng silicon bọc cạnh, góc bàn bảo vệ bé không bị thương khi va đập"
"Thanh chặn giường, chắn giường cao cấp Umoo lắp đặt gọn nhẹ, không khoan đục, vải lưới giúp bố mẹ quan sát hoạt độn, đảm bảo an toàn cho bé (1 thanh)"
Đai Xe Máy Phản Quang Cho Bé Trai/Bé Gái
THANH CHẮN GIƯỚNG CHO BÉ - CAO 90cm- LOẠI 1
Dây Bọt Biển Bọc Cạnh Bàn Bảo Vệ Bé - Giao màu ngẫu nhiên
4 Lưới bọc quạt bảo vệ an toàn cho bé ( 4 cái)
Combo 08 Miếng Bọt Biển Bọc Cạnh Góc Bàn
Bộ 10 Dây Khóa Tủ Chén Ngăn Kéo Cánh Cửa Tủ Lạnh An Toàn Cho Trẻ Sơ Sinh Trẻ Em
"Đai An Toàn Cho Bé Ngồi Xe Máy, Đai Xe Máy Tư Thế Ngồi Sau - Tặng Khẩu Trang (Màu Ngẫu Nhiên)"
Bộ 8 Miếng Bọt Biển Bịt Góc Bàn Bảo Vệ Trẻ
Combo 10 Cái bịt góc bàn
Thanh chắn giường Cao Cấp bảo vệ Bé- Số lượng 01 thanh- Màu GHI  (Tặng 01 tranh ghép hình bằng gỗ kích thích sự phát triển trí não của Bé)
"Thanh chặn cửa, cầu thang- Bảo vệ an toàn cho Bé và thú cưng"
"Combo 01 Thanh chặn cầu thang và cửa- Không cần khoan đục- (Rộng 72-85cm, cao 76cm) và thanh nối 30cm giúp Bé an toàn"
Combo 8 bịt góc cạnh bàn silicon Bảo vệ an toàn cho bé 8JV600
Bộ 2 Khóa Cửa Tủ An Toàn Cho Bé - Nhiều Loại
"Bộ Đồ Bảo Hộ Tay Chân Cho Bé 6 Món Yesure , sản phẩm có thiết kế ôm sát phần khuỷu tay, đầu gối, bàn tay bé, hạn chế tác động của những va đập khi bé vui chơi, tham gia các hoạt động thể thao"
"Bộ 4 Khoá Chặn Cửa Tủ , Tủ Lạnh Bảo Vệ An Toàn Cho Bé Milliken NL-3021 - Màu Ngẫu Nhiên"
Bộ 10 Nút Che Ổ Điện Dài 2.5 CM Thiết Kế Vừa Khít Ổ Cắm Điện An Toàn Cho Bé Và Gia Đình
Miếng Dán Cao Su Bọc Cạnh Bàn Bảo Vệ Bé 8cmx2m Cao Cấp
"Lưới bọc quạt cỡ lớn bọc cả trước sau, có dây buộc và chốt chống tuột bảo vệ bé khi đang sử dụng (màu đen)"
Bộ 10 Nút Bịt Ổ Điện Loại 2 Chạc An Toàn Cho Bé
"Lưới Chắn Cầu Thang, Ban Công /Lưới An Toàn"
4 Mét Dây Ron Silicone Bọc Cạnh Góc Bàn Chống Va Đập Bảo Vệ An Toàn Cho Bé Kèm keo Acrylic Cao Cấp
Combo 8 miếng mút chặn góc bàn chống va chạm bảo vệ bé
Bịt ổ điện an toàn cho bé (8 cái) - nội địa Nhật Bản
"Gối bảo vệ đầu, gáy cho bé tập ngồi, tập đứng, tập đi, tập bò Loại Tốt Vãi Nhung"
Cuộn Xốp 2m Bọc Cạnh Bàn An Toàn Cho Bé (Màu Ngẫu Nhiên)
Combo 5 đôi tất bảo vệ đầu gối cho bé tập bò (Màu ngẫu nhiên)
Cuộn Bịt Cạnh Góc Bàn 2m
Nút Bịt Ổ Điện An Toàn
"Nón bảo hiểm đầu cho bé tập bò, tập đi"
Mũ bảo hiểm cho bé  - Xanh 
Bộ 10 nút bịt ổ điện Panda bảo vệ an toàn cho bé yêu
Combo 8 miếng bọc góc bàn 
Thanh chắn giường an toàn cho em bé nút bấm hiện đại cao 82cm trượt lên trượt xuống giá bán 1 thanh 
Đai Ngồi An Toàn Cho Bé
Dây bọt biển bọc cạnh bàn bảo vệ bé - Giao màu ngẫu nhiên
"Thanh nối dài cho thanh chặn cửa, cầu thang Babysafe"
Tấm Lưới Bọc Quạt Điện Chống Bụi Và Bảo Vệ An Toàn Cho Bé Cao Cấp
"Mũ Bảo Hiểm Em Bé Có Kính Chông Bụi, Chắn Gió_ Hình Thú Có Tai Nghộ Nghĩnh, Đáng Yêu Cho Trẻ 5 - 8 tuổi"
"XỊT DA CHỐNG MUỖI PLASMAKARE 100ml xua đuổi Muỗl, xẹp vết đốt, Viện Sốt rét - KST -Côn trùng TƯ đã chứng nhận hiệu quả"
khoá tủ lạnh kiểu mới tiện lợi và an toàn đa năng cho mẹ và bé
"Bộ 2 Cái Khoá Ngăn Kéo, Cửa Tủ Lạnh, Của Tủ Quần Áo - Khóa Dạng Dây"
"Thanh Chặn Cửa, Cầu Thang Babysafe - Khóa Doublelocking, Đóng Tự Động - Dùng Cho Cửa Kích Thước Từ 75 - 85 cm "
Thanh Chắn Giường Babysafe Bảo Vệ An Toàn Cho Bé - Hàng nhập khẩu
"Thanh chắn cửa, cầu thang không cần khoan đục"
Hộp bọc ổ điện bảo vệ bé an toàn - Hàng nội địa Nhật
Đai An Toàn Cho Bé Trên Ô tô
Mũ Bảo Vệ Đầu Cho Bé Mumguard Hình Bọ Cánh Cam - Xanh
"Thanh Chặn Cửa, Cầu Thang Không Cần Khoan Tường Babysafe Bằng Gỗ, Cửa Đóng Tự Động - Hàng nhập khẩu"
Hàng Nhật - Bộ 12 bịt ổ điện an toàn cho bé
"Thanh chắn giường cho bé an toàn cao cấp chống kẹt, cao tới 105cm, hạ được 1 góc, 24 nắc điều chỉnh mẫu mới nhất trượt lên xuống (Giá 1 thanh) "
Mũ Bảo Hiểm Hình Thú Đáng Yêu Cho Bé 0-6 Tuổi
Combo 04 Miếng Bọt Biển Bọc Cạnh Bàn
Dây Bọc Cạnh Bàn Bọt biển Chống Va Chạm Cho Bé (Tuỳ chọn màu)
Bộ 10 cái Nắp che ổ cắm an toàn điện dành cho bé (Việt Nam)
Combo 16 miếng bộ bịt ổ điện kèm dụng cụ tháo lắp an toàn cho bé + tặng 5 zipper 11x16cm
Thanh chắn giường cao cấp mẫu mới nhất  Babyqiner trượt lên xuống nút bấm hiện đại giá 1 thanh
"Thanh chắn giường cao cấp bảo vệ bé ( màu ghi - 01 thanh ) - Tặng 01 mũ tắm cho bé, 1 nút bịt ổ điện"
Bộ 8 bọc góc cạnh bàn bằng mút an toàn cho trẻ nhỏ có sẵn miếng dán (Tuỳ chọn màu)
Mũ bảo vệ đầu cho bé - Màu hồng
"Combo 1 Thanh Chặn Cửa, Cầu Thang Không Cần Khoan Tường Babysafe XY009 Cửa Đóng Tự Động & 1 Thanh Nối Dài 10 cm - Hàng nhập khẩu"
Mũ bảo hiểm cho bé  - HỒNG
Thanh chắn giường màu kem - mẫu trượt cao 90cm
"Chắn cửa, chắn cầu thang antoanf cho bé và thú cưng"
Bộ 8 Miếng Bọt Biển Bọc Góc Bàn Chống Va Đập cho Bé (Màu Ngẫu Nhiên)
Combo 02 thanh chặn giường cao cấp- 01 thanh 1m8 và 01 thanh 2m- tặng thìa ăn cho Bé
Mũ Bảo Hiểm Doremon
Nón Bảo Hiểm Cho Bé Tập Đi Lưỡi Trai Trơn 7 Tháng Đến 4 Tuổi
Bộ 10 nút bịt ổ điện 2 chạc an toàn cho bé - Họa tiết bông hoa
Combo 20 Nút Bịt Ổ Điện An Toàn Có Móc Kéo 
"Mũ nón bảo hiểm bảo vệ đầu cho bé tập đi chống va đập cho bé tùy ý chỉnh to nhỏ, vải bọc thoáng khí"
"Mũ Bảo Hiểm Trẻ Em Mumguard Có Vành Trước (Nón An Toàn Cho Bé Tập Bò, Tập Đi) "
Bộ 8 Bọc Góc Bàn Babyhop
Mũ nón bảo hiểm cho bé trẻ nhỏ kiểu dáng Khủng Long có kính bảo vệ mắt - NHK-NBHKL-XALA
"Khoá Chặn Cửa Tủ , Tủ Lạnh Bảo Vệ An Toàn Cho Bé"
BỊT CẠNH VÀ GÓC BÀN VUÔNG GÓC SET 4 CÁI
Bộ 12 Nút Che Ổ điện Có Khóa Chốt An Toàn
"Máy báo khóc  không dây, loa to, tiếng rõ, giao tiếp 2 chiều giữa mẹ và bé yêu 00"
Dây Bọc Cạnh Bàn Chống Va Chạm Cho Bé
Cuộn xốp 2m bọc cạnh bàn an toàn cho bé (màu ngẫu nhiên)
Mũ Bảo Vệ Đầu Cho Bé Mumguard Hình Bọ Cánh Cam - Cam
"Cuộn Xốp Bọc Cạnh Bàn Hình Chữ W Dài 2M An Toàn Cho Bé - Dây Cao Su Nẹp Bịt Góc Bàn, Ghế, Tường, Tủ, Giường,.-Giao Màu Ngẫu Nhiên"
Thanh Chắn Giường Màu Hồng - Mẫu Trượt Cao 90cm
"Thanh Nối Dài Cho Thanh Chặn Cửa, Cầu Thang Babysafe"
Bộ 4 bọc góc bàn bằng mút an toàn cho trẻ nhỏ có sẵn miếng dán (Màu ngẫu nhiên)
Đai ( Địu) Ghế Ngồi Ô Tô An Toàn Cho Bé Yêu
Thanh chắn giường
"Combo 3 Khóa dây tủ lạnh , Khóa gài tủ , gài cửa - Khóa an toàn"
Combo 2 dụng cụ gài khóa tủ an toàn cho bé
"Đai Tập Đi Đỡ Mông Cho Bé - An Toàn, Tiện Lợi, Bé Nhanh Biết Đi"
"Combo 1 Thanh Chặn Cửa, Cầu Thang Không Cần Khoan Tường Babysafe XY006A Cửa Đóng Tự Động & 1 Thanh Nối Dài 28 cm - Hàng nhập khẩu"
" Set 4 miếng Xốp bịt góc bàn, góc giường"
Mũ Bảo Hiểm Em Bé Tem Doremon_ Kính chắn gió chống bụi cho trẻ từ 5 - 8 tuổi
Combo 15 Nút bịt ổ điện
Dây bọt biển bọc cạnh bàn chống va đập cho bé dài 2m có kèm băng keo hai mặt
"Thanh chắn giường an toàn cho bé chính hãng Mastela BR002 1.8m, loại 1 thanh chắn độc lập chắc chắn, vải lưới thoáng khí"
Vớ Lót Đầu Gối Cho Bé Tập Bò Kuku KU2811
"Thanh chắn cửa, chắn cầu thang có chốt khóa an toàn cho bé"
"Bịt Cạnh Bàn, Góc Bàn Bằng Silicon (4 Cái) - Nội Địa Nhật Bản"
Mũ bảo vệ đầu cho bé - Màu ghi
GHẾ TẮM CHO BÉ SƠ SINH
Combo 2 lưới bọc quạt bảo vệ an toàn cho trẻ nhỏ
NÓN / MŨ BẢO HIỂM MẪU MỚI MÀU NGẪU NHIÊN CHO BÉ 8 THÁNG - 5 TUỔI
"Khóa ngăn kéo, tủ lạnh, gài cửa an toàn "
Đệm Bảo Vệ Đầu Gối | Khuỷu Tay Trẻ Em (Tập Đi Hoặc Vận Động) - 04
"Giá Đỡ Chống Cận Thị, Vẹo Cột Sống Cho Bé"
"COMBO 4 DÂY KHÓA CHẶN CỬA TỦ, TỦ LẠNH, NGĂN KÉO AN TOÀN CHO BÉ - Màu ngẫu nhiên"
"Thanh chắn cầu thang và chắn cửa cao cấp M2 phòng chống té ngã cho trẻ em thông số rộng 75-84cm, cao 76cm"
Hộp bọc ổ điện an toàn cho bé - Nội địa Nhật Bản
  Đai Đi Xe Máy An Toàn Cho Bé Chất Đẹp
Mũ bảo hiểm cho bé
"THANH CHẮN GIƯỜNG CAO CẤP, TẶNG 04 BỊT CẠNH BÀN VÀ 02 BỊT Ổ ĐIỆN"
Khăn voan đại che bụi bẩn cho bé - màu ngẫu nhiên
"Combo 01 Thanh chặn cầu thang và cửa- Không cần khoan đục- (Rộng 72-85cm, cao 76cm) và 01 thanh nối 45cm giúp Bé an toàn"
"Cuộn bọc cạnh bàn ghế, cạnh tủ cao su non bảo vệ an toàn cho bé vui chơi trong nhà (2 mét) tặng kèm băng dính -giao màu ngẫu nhiên"
"Chắn cầu thang thiết kế thông minh không khoan đục, tặng thìa ăn cho Bé"
Bộ 4 Lưới Bọc Quạt Bảo Vệ Bé
Bộ 10 Nút Che Ổ Điện Và 4 Bịt Góc Cạnh Bàn Bảo Vệ An Toàn Cho Bé
MŨ / NÓN BẢO HIỂM CHO BÉ - giao màu ngẫu nhiên 
ĐỒ BẢO HỘ THỂ THAO
"Khẩu Trang Xô Sữa trẻ em, Xuất Nhật,  An Toàn Cho Bé Yêu"
Combo 2 Dụng Cụ Khóa Tủ Có Dây Chỉnh Kích Thước (giao màu ngẫu nhiên)
Combo 10 Nút Bịt Ổ Điện Tròn Lớn Đường Kính 3CM Bảo Vệ An Toàn Cho Bé (Giao Màu Ngẫu Nhiên)
Nón Bảo Hiểm Có Bảo Hộ Cho Bé Tập Đi Lưỡi Trai Trơn 7 Tháng Đến 4 Tuổi
"Bộ 2 Khoá Chặn Cửa Tủ , Tủ Lạnh Bảo Vệ An Toàn Cho Bé Miliken Tampe NL-3050 - Màu Ngẫu Nhiên"
"Combo 2 đôi vớ chống trượt, bảo vệ đầu gối bé khi tập bò (giao màu ngẫu nhiên) - 12x7cm"
Tấm Kính Che Mặt Y Tế (Direct Splash Face Shield) - Điều Chỉnh Theo Kích Cỡ Đầu (Cho Trẻ Em Và Người Lớn)
"Chốt khoá cửa an toàn trẻ em - Khoá cửa tủ, cửa sổ an toàn cho bé - Một bộ 2 chiếc"
"Thanh chắn giường Umoo, khung chắc chắn cho bé ngủ và chơi an toàn (Giá 1 thanh)"
Thanh chặn giường cao cấp Umoo
"Combo 10 miếng silicon bọc cạnh bàn, góc bàn"
Thanh chắn giường Baby Gift an toàn cho bé giá 1 thanh
Thanh chắn giường cho bé an toàn cao cấp trượt lên trượt xuống nút bấm hiện đại cao khoá an toàn 82 cm Aachmann giá bán 1 thanh 
Thanh chắn cầu thang và cửa giúp Bé an toàn- KHÔNG KHOAN ĐỤC TƯỜNG- LẮP ĐẶT ĐƠN GIẢN
Bộ 8 nút bịt góc bàn an toàn cho bé
Bộ 10 nút bịt ổ điện bảo vệ an toàn cho bé yêu
"Thanh chặn, chắn cửa, cầu thang, bằng thép sơn tĩnh điện, không cần khoan đục, có chốt khóa đảm bảo an toàn cho bé"
Thanh chắn giường Umoo cao cấp  (1 thanh)
Dây Bọc Cạnh Bàn Chống Va Chạm Cho Bé
Nón Bảo Hiểm Tập Đi Cho Bé Lưỡi Trai 7 Tháng Đến 4 Tuổi.
Combo 12 bịt góc cạnh bàn silicon Bảo vệ an toàn cho bé 12B600
Combo Bộ 16 Miếng Dụng Cụ Silicone Chặn Và Bịt Góc Bàn Tủ Cửa Bảo Vệ Bé Legaxi
"Set 12 miếng silicon bọc cạnh, góc bàn bảo vệ bé không bị thương khi va đập"
"Thanh chặn giường, chắn giường cao cấp Umoo lắp đặt gọn nhẹ, không khoan đục, vải lưới giúp bố mẹ quan sát hoạt độn, đảm bảo an toàn cho bé (1 thanh)"
Đai Xe Máy Phản Quang Cho Bé Trai/Bé Gái
THANH CHẮN GIƯỚNG CHO BÉ - CAO 90cm- LOẠI 1
Dây Bọt Biển Bọc Cạnh Bàn Bảo Vệ Bé - Giao màu ngẫu nhiên
4 Lưới bọc quạt bảo vệ an toàn cho bé ( 4 cái)
Combo 08 Miếng Bọt Biển Bọc Cạnh Góc Bàn
Bộ 10 Dây Khóa Tủ Chén Ngăn Kéo Cánh Cửa Tủ Lạnh An Toàn Cho Trẻ Sơ Sinh Trẻ Em
"Đai An Toàn Cho Bé Ngồi Xe Máy, Đai Xe Máy Tư Thế Ngồi Sau - Tặng Khẩu Trang (Màu Ngẫu Nhiên)"
Bộ 8 Miếng Bọt Biển Bịt Góc Bàn Bảo Vệ Trẻ
Combo 10 Cái bịt góc bàn
Thanh chắn giường Cao Cấp bảo vệ Bé- Số lượng 01 thanh- Màu GHI  (Tặng 01 tranh ghép hình bằng gỗ kích thích sự phát triển trí não của Bé)
"Thanh chặn cửa, cầu thang- Bảo vệ an toàn cho Bé và thú cưng"
"Combo 01 Thanh chặn cầu thang và cửa- Không cần khoan đục- (Rộng 72-85cm, cao 76cm) và thanh nối 30cm giúp Bé an toàn"
Combo 8 bịt góc cạnh bàn silicon Bảo vệ an toàn cho bé 8JV600
Bộ 2 Khóa Cửa Tủ An Toàn Cho Bé - Nhiều Loại
"Bộ Đồ Bảo Hộ Tay Chân Cho Bé 6 Món Yesure , sản phẩm có thiết kế ôm sát phần khuỷu tay, đầu gối, bàn tay bé, hạn chế tác động của những va đập khi bé vui chơi, tham gia các hoạt động thể thao"
"Bộ 4 Khoá Chặn Cửa Tủ , Tủ Lạnh Bảo Vệ An Toàn Cho Bé Milliken NL-3021 - Màu Ngẫu Nhiên"
Bộ 10 Nút Che Ổ Điện Dài 2.5 CM Thiết Kế Vừa Khít Ổ Cắm Điện An Toàn Cho Bé Và Gia Đình
Miếng Dán Cao Su Bọc Cạnh Bàn Bảo Vệ Bé 8cmx2m Cao Cấp
"Lưới bọc quạt cỡ lớn bọc cả trước sau, có dây buộc và chốt chống tuột bảo vệ bé khi đang sử dụng (màu đen)"
Bộ 10 Nút Bịt Ổ Điện Loại 2 Chạc An Toàn Cho Bé
"Lưới Chắn Cầu Thang, Ban Công /Lưới An Toàn"
4 Mét Dây Ron Silicone Bọc Cạnh Góc Bàn Chống Va Đập Bảo Vệ An Toàn Cho Bé Kèm keo Acrylic Cao Cấp
Combo 8 miếng mút chặn góc bàn chống va chạm bảo vệ bé
Bịt ổ điện an toàn cho bé (8 cái) - nội địa Nhật Bản
"Gối bảo vệ đầu, gáy cho bé tập ngồi, tập đứng, tập đi, tập bò Loại Tốt Vãi Nhung"
Cuộn Xốp 2m Bọc Cạnh Bàn An Toàn Cho Bé (Màu Ngẫu Nhiên)
Combo 5 đôi tất bảo vệ đầu gối cho bé tập bò (Màu ngẫu nhiên)
Cuộn Bịt Cạnh Góc Bàn 2m
Nút Bịt Ổ Điện An Toàn
"Nón bảo hiểm đầu cho bé tập bò, tập đi"
Mũ bảo hiểm cho bé  - Xanh 
Bộ 10 nút bịt ổ điện Panda bảo vệ an toàn cho bé yêu
 Mũ Bảo Hiểm Trẻ Em cao cấp - dành cho trẻ từ 5 - 10 Tuổi
Thanh chắn giường điều chỉnh độ cao an toàn cho bé Mastela C09: size 200cm
"Bộ 4 Cái Khoá Ngăn Kéo, Cửa Tủ Lạnh, Của Tủ Quần Áo - 4 Khóa Dạng Dây"
Bộ 05 nút bịt ổ điện bảo vệ an toàn cho bé yêu
Mũ lưỡi trai siêu nhân cho bé trai bé gái màu đen
Thanh chắn giường cho Bé- Mẫu mới nhất
"Dây Bọt Biển Bọc Cạnh Bàn, Cạnh Sắt, Dài 2M Chữ U Kèm Băng Dán ( Giao Màu Ngẫu Nhiên )"
Combo Thanh chắn giường dạng trượt không khoan đục- Mẫu mới nhất- 1 thanh 1m8 và 1 thanh 2m- Màu Kem
"Combo 2 Phụ Kiện Cố Định Cho Thanh Chặn Cửa, Cầu Thang (Bằng kim loại) XY024 Babysafe - Hàng nhập khẩu"
 COMBO 2 CHIẾC LƯỚI CHE QUẠT 
Thanh chắn giường cho Bé- Mẫu mới nhất- 1m8- Màu Xanh
Nút bịt ổ điện an toàn - Bộ 10 nút - Hàng nhập khẩu
"Bộ chắn ba mặt giường ngủ cho Bé, 02 thanh 2m và 01 thanh 1m8, tặng thìa báo nóng cao cấp cho Bé"
Gối Bảo Vệ Đầu Cho Bé Khi Té Ngã - KUB - Hình Con Hưu
Thanh chắn giường dạng trượt không khoan đục- Mẫu mới nhất- 2.2m- Màu Xanh
Bộ 20 Nút Bịt Ổ Điện Loại 2 Chạc An Toàn Cho Bé
Nón Tập Đi Cho Bé SongZhiLong
Lưới che khe hở cầu thang ban công an toàn cho bé
Combo 8 bọc góc bàn bằng xốp mềm mại bảo vệ bé - giao màu ngẫu nhiên
Nút chặn ổ điện cho bé 10 cái
"Thanh chắn giường thế hệ mới năm 2020, giá 1 thanh, tặng thìa ăn cao cấp cho Bé"
[COMBO 4 Chiếc] Miếng bọc góc bàn hình chữ L bằng nhựa mềm bảo vệ an toàn cho trẻ nhỏ - Có sẵn keo dán 3M 4 góc
Combo Thanh chắn giường dạng trượt không khoan đục- Mẫu mới nhất- 1 thanh 1m6 và 1 thanh 2m- Màu Kem
Nón Bảo Vệ Đầu Chống Va Đập An Toàn Cho Bé Khi Chơi Cao Cấp
"Tấm Lưới Chắn An Toàn, Che Kẽ Hở Ban Công, Cầu Thang Cho Bé Babysafe - Giao màu ngẫu nhiên - Hàng nhập khẩu "
"Combo Thanh chặn cầu thang và cửa- Không cần khoan đục- (Rộng 72-85cm, cao 76cm) và thanh nối 10cm (cao 76 cm) giúp Bé an toàn"
Khẩu Trang Vải Sợi Hoạt Tính Hương Tràm Cung Đình Size: Em Bé (2C/HỘP)
Lưới bọc quạt an toàn cho bé nội địa Nhật Bản
Bộ 12 bọc góc bàn ghế silicon tránh va đập bảo vệ bé yêu ( 12 cái)
Bộ 4 Cái Bịt Góc Bàn Bằng Mút Cao Cấp - KUB - Giao Màu Ngẫu Nhiên
Combo 4 Dụng Cụ Khóa Tủ An Toàn Cho Bé (giao màu ngẫu nhiên)
Khóa Tủ Lạnh Kuku KU5351
"Combo 4 Vít Chữ U - Phụ Kiện Thanh Chắn Cửa, Cầu Thang Babysafe - Hàng nhập khẩu"
Combo 2 Mũ Che Thóp Cotton Mềm Cho Trẻ Sơ Sinh 0-6 Tháng - Họa Tiết Bé Trai
"Bộ 4 Khóa Ngăn Kéo, Cửa Tủ An Toàn Cho Bé"
Bộ 10 đôi tất hoạt hình chống trơn cho bé tập đi (3-4 tuổi)
Set 20 Nút Bịt Ổ Điện Bảo Vệ An Toàn Cho Bé Loại 3 Chân (Trắng)
Thanh Chắn Giường Kuku KU6035
"Bộ 2 dụng cụ gài khóa tủ, cửa đa năng (giao màu ngẫu nhiên)"
Giá Đỡ - Dụng Cụ Chống Cận Thị Cho Bé Tiện Dụng Khi Ngồi Học
Bộ 2 miếng chặn cửa an toàn
Nút bịt ổ điện 3 chạc an toàn cho bé - Bộ 10 nút
Combo 2 lót bảo vệ đầu gối cute cho bé (mẫu ngẫu nhiên)
Set 3 Mũ Che Thóp Cho Trẻ Sơ Sinh 0-6 Tháng (Hàng Loại Tốt)- Họa Tiết Bé Trai
Mũ Bảo Vệ Đầu Cho Bé Mumguard Hình Ong Vàng (40 - 52 cm)  - Vàng Đen
Tất Đệm Đầu Gối Cho Bé Tập Bò Bảo Vệ Đầu Gối Cho Bé Yêu Siêu An Toàn
Bộ 2 Khóa An Toàn Đa Năng Dreambaby
"Vớ Lót Đầu Gối Cho Bé Tập Bò Siêu Êm Và Bảo Vệ Đầu Gối Bé, Chống Trượt "
Nón bảo hiểm cao cấp KinderKraft trẻ em
"Combo 1 Thanh Chặn Cửa, Cầu Thang Không Cần Khoan Tường Babysafe XY007 & 1 Thanh Nối Dài 10 cm - Hàng nhập khẩu"
Mũ Bảo Vệ Đầu Cho Bé HeadGuard - Xanh Da Trời
"Sét 3 dụng cụ khóa tủ tạnh, ngăn kéo màu trắng 20x5cm "
Nón Bảo Hiểm Cho Bé Supeguardo Có Lưỡi Trai - Xanh Biển
Nón Chống Bụi Chống Nắng – Bảo Vệ Sức Khỏe An Toàn Cho Bé
"Thanh Chắn Giường Mastela, Chặn Giường Cho Bé (1.5m)- Xanh Dương - Tặng Thước Đo Chiều Cao Và Thị Lực"
Đai bảo vệ đầu gối trẻ em AOLIKES TC-7117
"Khóa Gài Cửa, Tủ Lạnh ngộ nghĩnh dễ thương giao ngẫu nhiên"
Thanh chắn giường cho bé an toàn mẫu 2019 Seedling BQ-03 cao 88cm nhé trượt lên trượt xuống giá 1 thanh 
"Combo 2 Khóa ngăn kéo, tủ lạnh bảo vệ trẻ em nội địa Nhật Bản"
Mũ Bảo Vệ Đầu Cho Bé HeadGuard - Hồng
"Combo 1 Thanh Chặn Cửa, Cầu Thang Không Cần Khoan Tường Babysafe XY007 & 1 Thanh Nối Dài 45 cm  - Hàng nhập khẩu"
Gối Lót Xe Đẩy Và Ghế ÔTo  Cho Bé
Mũ lưỡi trai gấu cho bé trai và bé gái màu Ghi
Bộ 3 hộp bọc ổ điện bảo vệ bé an toàn - Hàng nội địa Nhật
Nón Bảo Hiểm Cho Bé Supeguardo Có Lưỡi Trai - Tím
"Thanh chắn giường cao cấp 2019 Babyqiner trượt lên xuống, không khoan đục- Số lượng: 01 thanh"
Nút Nhựa Chặn Góc Bàn Kuku KU5356
Thanh chắn giường điều chỉnh độ cao an toàn cho bé Mastela C09: size 180cm
Combo 03 Bọc quạt tránh bụi cất đi - Giao mầu ngẫu nhiên
Bộ 10 Nút Bịt Ổ Điện Bảo Vệ An Toàn Cho Bé  Miliken Tampe NL-3057
Đai giữ bé an toàn khi ngồi trên ghế - Hàng xuất nhật
Nón Bảo Hiểm Cho Bé Supeguardo Có Lưỡi Trai - Cam
"Thanh chắn giường an toàn cho bé chính hãng Mastela BR002 1.5m, loại 1 thanh chắn độc lập chắc chắn, vải lưới thoáng khí"
Đai ghế ngồi ô tô cho bé 
Cửa chặn Yanis không cần khoan tường
Vớ giày cô vừa cho bé
"Dụng Cụ Gài Khóa Tủ, Cửa, Ngăn Kéo Đa Năng"
Nón Bảo Hiểm Trẻ Em Giro Scamp
Mũ bảo vệ đầu cho bé BabyGuard (Người nhện)
Tấm Bọc Quạt Chống Bám Bụi In Hình Họa Tiết Xinh Xắn Cao Cấp
Thanh chắn giường cho Bé- Mẫu mới nhất- 2m- Màu Kem
"Khóa Ngăn Kéo Tủ Bếp, Tủ Lạnh Bảo Vệ An Toàn Cho Bé Babysafe XY031 - Khóa Dạng Dây - Hàng nhập khẩu"
Vĩ 4 miếng xốp che góc bàn an toàn Safety spongy corner cushions Lucky Baby
Thanh chắn giường khung chắc chắn cho bé ngủ và chơi an toàn không cần khoan đục (Giá 1 thanh) - Tặng kèm miếng dán chuyên dụng
Thanh Chắn Giường An Toàn Mastela MT0517-01 (1.8m) - Màu ngẫu nhiên
"Bộ 4 Dụng Cụ Chặn Cửa,Chống Sập Cửa Kẹt Tay Bảo Vệ An Toàn Cho Bé Yêu Họa Tiết Ngẫu Nhiên"
"Combo 01 Thanh chắn cầu thang và cửa- Không cần KHOAN ĐỤC- (Rộng 72-85cm, cao 76cm) và thanh nối 20cm giúp Bé an toàn"
Khóa chặn tủ máy lạnh kiểu thú cưng hàng Nhật- giao ngẫu nhiên
Nón Bảo Hiểm Cho Bé Có Vành - Sunbaby
Bộ 3 Cái Bịt Ổ Điện 3 Chân Hình Tròn
Combo 12 Bọc Góc Bàn Bảo Vệ Bé Babyprints
Nút bịt ổ điện 20 cái
Combo thanh chặn không khoan tường và thanh nối mở rộng dùng cho cửa/ cầu thang có kích thước từ 90 - 98.5 cm
Combo 03 chiếc lưới bọc quat bảo vê an toàn cho bé
Vỉ gồm 02 chiếc khóa chặn cửa tủ lạnh bảo vệ an toàn cho bé
Thanh chắn giường cho Bé- 1m6- Màu Kem
"Thanh chắn giường Umoo, khung chắc chắn cho bé ngủ và chơi an toàn (Giá 1 thanh)"
Thanh chặn giường cao cấp Umoo
"Combo 10 miếng silicon bọc cạnh bàn, góc bàn"
Thanh chắn giường Baby Gift an toàn cho bé giá 1 thanh
Thanh chắn giường cho bé an toàn cao cấp trượt lên trượt xuống nút bấm hiện đại cao khoá an toàn 82 cm Aachmann giá bán 1 thanh 
Thanh chắn cầu thang và cửa giúp Bé an toàn- KHÔNG KHOAN ĐỤC TƯỜNG- LẮP ĐẶT ĐƠN GIẢN
Bộ 8 nút bịt góc bàn an toàn cho bé
Bộ 10 nút bịt ổ điện bảo vệ an toàn cho bé yêu
"Thanh chặn, chắn cửa, cầu thang, bằng thép sơn tĩnh điện, không cần khoan đục, có chốt khóa đảm bảo an toàn cho bé"
Thanh chắn giường Umoo cao cấp  (1 thanh)
Dây Bọc Cạnh Bàn Chống Va Chạm Cho Bé
Nón Bảo Hiểm Tập Đi Cho Bé Lưỡi Trai 7 Tháng Đến 4 Tuổi.
Combo 12 bịt góc cạnh bàn silicon Bảo vệ an toàn cho bé 12B600
Combo Bộ 16 Miếng Dụng Cụ Silicone Chặn Và Bịt Góc Bàn Tủ Cửa Bảo Vệ Bé Legaxi
"Set 12 miếng silicon bọc cạnh, góc bàn bảo vệ bé không bị thương khi va đập"
"Thanh chặn giường, chắn giường cao cấp Umoo lắp đặt gọn nhẹ, không khoan đục, vải lưới giúp bố mẹ quan sát hoạt độn, đảm bảo an toàn cho bé (1 thanh)"
Đai Xe Máy Phản Quang Cho Bé Trai/Bé Gái
THANH CHẮN GIƯỚNG CHO BÉ - CAO 90cm- LOẠI 1
Dây Bọt Biển Bọc Cạnh Bàn Bảo Vệ Bé - Giao màu ngẫu nhiên
4 Lưới bọc quạt bảo vệ an toàn cho bé ( 4 cái)
Combo 08 Miếng Bọt Biển Bọc Cạnh Góc Bàn
Bộ 10 Dây Khóa Tủ Chén Ngăn Kéo Cánh Cửa Tủ Lạnh An Toàn Cho Trẻ Sơ Sinh Trẻ Em
"Đai An Toàn Cho Bé Ngồi Xe Máy, Đai Xe Máy Tư Thế Ngồi Sau - Tặng Khẩu Trang (Màu Ngẫu Nhiên)"
Bộ 8 Miếng Bọt Biển Bịt Góc Bàn Bảo Vệ Trẻ
