"Ghế kê chân vệ sinh SQUATPRO Model 20120 sản xuất độc quyền bới Babyhop Loại Lớn cao 21cm, giúp đi vệ sinh đúng chuẩn, kích thích cho đường tiêu hóa - Hàng chính hãng"
Ghế Kê Chân Toilet Chống Táo Bón Ngăn Ngừa Các Bệnh Tiêu Hóa Khi Đi Vệ Sinh
"Bục kê chân toilet Eltory (Dạng Treo) - hỗ trợ tư thế vệ sinh, thiết kế hiện đại, giúp phòng chống táo bón, trĩ, bục kê chân toilet cho người cao tuổi và trẻ em. Hàng chính hãng, nhựa cao cấp chịu lực tốt - TS001"
Ghế kê chân Toilet ngăn ngừa ung thư đại tràng chất liệu nhựa ABS 
GHẾ CHỐNG TÁO BÓN 2019
Ghế Kê Chân Toilet Squatpro EUKO
"Ghế Nhựa Lùn Gấp Gọn Tiện Lợi, Màu Sắc Tươi Sáng, Thiết Kế Nhỏ Gọn (Dùng Ngồi Hoặc Kê Chân) Qui Phúc - Giao Màu Ngẫu Nhiên - Kích thước 20 x 27 x 21.5 cm"
GHẾ KÊ CHÂN TOILET NGỒI ĐÚNG CÁCH VÀ TRÁNH NHIỀU BỆNH ( tặng khăn sau tay )
Ghế kê chân toilet Inochi hàng cao cấp nhựa an toàn và chắc chắn - giao màu ngẫu nhiên
Ghế Kê Chân Khi Đi Vệ Sinh Chefman GCM
Ghế tắm an toàn dành cho người già
"Ghế  Kê Chân Khi Đi Vệ Sinh, Chống Táo Bón Và Các Bệnh Về Đường Tiêu Hóa, Giúp Trẻ Nhỏ Và Người Già Ngồi Vững Hơn Tặng Kèm 1 Cọ Nhà Vệ Sinh 2 Đầu"
Ghế ngồi bồn cầu có thang vịn an toàn cho bé (màu ngẫu nhiên) (Chiếc)
"Ghế  Kê Chân Khi Đi Vệ Sinh, Chống Táo Bón Và Các Bệnh Về Đường Tiêu Hóa, Giúp Trẻ Nhỏ Và Người Già Ngồi Vững Hơn Tặng Kèm Cọ Rửa Bồn Cầu 2 Đầu"
Ghế kê chân đi vệ sinh Chefman - Hồng
"Ghế Nhựa Chắc Chắn, An Toàn Cho Mẹ Và Bé - Nội Địa Nhật Bản"
Bộ 2 Ghế Kê Chân Toilet Chống Táo Bón pt19
Ghế kê chân chống trơn trượt (xanh) - Hàng nội địa Nhật
Bộ 2 ghế kê chân chống trơn trượt (xanh) - Hàng nội địa Nhật
"COMBO Ghế Kê Chân Toilet, Chống Táo Bón + Bệ Thu Nhỏ Bồn Vệ Sinh - TẶNG 1 BẤM MÓNG TAY"
Combo 5 Ghế Mini Duy Tân No.610 - 26 x 17 x 15 Cm Cùng Màu Giao Ngẫu Nhiên
Ghế Kê Chân Toilet Chống Táo Bón
Ghế để chân đi vệ sinh Chefman Cao Cấp
Ghế tắm an toàn dành cho người già
Ghế bệt phòng tắm
Combo Ghế kê chân bồn cầu + Chai tẩy quần áo màu1000ml - Nội địa Nhật Bản
Bộ ghế kê chân chắc chắn + tặng đôi dép đi trong nhà cao cấp - Hàng nội địa Nhật
