"Hạt Nêm Knorr Từ Thịt Thăn, Xương Ống Và Tủy Bổ Sung Vitamin A (1200g) - 32010222"
Bột cần tây mật ong sấy lạnh Jan's túi 50 g
Muối Hồng Himalaya DK Harvest
 Bột Ngọt Vedan 400g 
Bột Ngọt Vedan 1kg
Bột Phô Mai Tornado Vị Truyền Thống (100g / Gói)
Đường Mía Thượng Hạng Biên Hòa 1kg
"Hạt Nêm Knorr Từ Thịt Thăn, Xương Ống Và Tủy Bổ Sung Vitamin A (900g) - 32010220"
Đường Mía Vàng Thiên Nhiên Biên Hòa 1KG
Bột Ngọt Vedan 454g
Bột Ngọt Ajinomoto Gói 454g
1 gói muối sấy tinh IOD Thành Phát loại 1Kg
Bột Phô Mai Cheese Gói 250g
Đường Mía Thượng Hạng Biên Hòa 500g
"Hạt Nêm Knorr Từ Thịt Thăn, Xương Ống Và Tủy Bổ Sung Vitamin A (400g) - 32010212"
Đường trắng Bến Thành - 100% đường mía tinh khiết
"Hạt nêm Knorr Thịt Thăn, Xương Ống Và Tuỷ 1800g"
500G Ớt Bột Vảy Làm Kim Chi Hàn Quốc CHACKHAN - Thương Hiệu Hàn Quốc NONG WOO
Hạt Nêm Youki Nhật Bản 500g
500g Bột Phô Mai Cheese
Hạt nêm rong biển Ajinomoto 112g
Muối Hồng Himalaya Nhập Khẩu Pakistan Loại Mịn (Túi 1kg)
"Đường cỏ ngọt - Đường ăn kiêng nấu ăn, làm bánh - iLite Cook&Bake Singapore"
Muối hạt loại 1kg/ 1 gói
Bột nêm Ngưu Báng 200 g
Bột nêm Gà Knorr Chicken Flavor Bouillon 1.14 Kg - Nhập khẩu Mỹ
"Ớt Bột Hàn Quốc Làm Kim Chi, Tokbokki Gói 200g + Tặng Hồng Trà Sữa (Cafe) Maccaca 20g"
Đường Nâu Vàng Samyang Hàn Quốc 1kg
GIA VỊ LÀM KIM CHI HÀN QUỐC - FIVE SEC KIMCHI 
Tiêu đen nguyên hạt Đăk Lăk GUfoods (túi 200g)
Muối biển tinh khiết 500g
Combo 5 Gói Gia Vị Nấu Phở Vipep  - Gia Vị Nấu Phở Bò
Viên nấu cà ri S&B Foods Golden Curry 198g Nhật Bản
Bột Phô Mai Tornado Vị Truyền Thống (1kg / Gói)
Ớt Bột Hàn Quốc (Loại Thượng Hạng)(1kg)
Muối Hồng Himalaya Dạng Nhuyễn (1kg) – Theo Tiêu Chuẩn Muối Ăn Bộ Y Tế
Men Dinh Dưỡng Bragg 127g
Muối Tắm Vitamin C A Bonne' APM.00007 (350g)
Ớt Bột Mịn Hàn Quốc Nong Woo Chackhan Gói 1KG - Chuyên Làm Kim Chi
Đường Ăn Kiêng Tropicana Slim Stevia 125gr - Chiết Xuất Từ Lá Cỏ Ngọt Stevia 125g (50 x 2.5g)
Muối Hồng Himalaya Mịn Nguyên Chất (500g)
1kg Bột Phô Mai Cheese
Muối Tắm Trắng Yogurt A Bonne' APM.00006 (350g)
Bột Nêm Ngưu Báng 1000g
Ớt Bột Hàn Quốc (Loại Thượng Hạng) 500G 
Hạt nêm Massel hương vị Gà Australia 100% không chứa bột ngọt - Nhập khẩu Australia
Viên nấu Cà ri kiểu Nhật Kobe Bussan 200g - các vị
Bơ Thực Vật Meizan 800g
Hạt nêm thịt heo Vedan  gói 400g 
Muối Hồng Himalaya Naturgreen Dạng Nhuyễn (500g)
Muối Hồng Himalaya Dạng Nhuyễn (500g) – Theo Tiêu Chuẩn Muối Ăn Bộ Y Tế
Bột Nêm Ngưu Báng 450g
Gia vị rắc cơm 6 vị 30 gói Nhật Bản
Combo 2 Knorr Natural Bột Nêm Tự Nhiên Vị Gà 330g / Gói
Đường Ăn Kiêng Tropicana Slim Stevia Sweetener (50 x 2.5g)
"Phụ gia tạo giòn dai cho giò chả, xúc xích"
Muối tôm Tây Ninh 60g Dh Foods
Bột xí muội Volcano 100g
Muối Hồng Himalaya Dạng Hạt (500g) – Theo Tiêu Chuẩn Muối Ăn Bộ Y Tế
Combo 2 Hạt Nêm Nấm Hương Organic Mới 380g/ gói
Bột nêm rau củ Dưỡng Sinh
Đường cỏ ngọt tự nhiên - Đường ăn kiêng iLite từ Singapore
Bột Phô Mai Tornado Vị Cay Gói (100g / Gói) 
Bột nước dùng Pigeon Dashi vị Cá bào rong biển (50g) - Nhập khẩu Nhật Bản
Bột Ngọt Vedan 2kg 
Đường ăn kiêng cỏ ngọt 70 gói - Sweetleaf stevia sweetener tự nhiên
Bột Ớt Nongwo Hàn Quốc 500g
Hạt nêm rau củ Cao San
Hạt Nêm Rong Biển Ajinomoto (56G)
Quế Thanh Cạo Vỏ Vipep
Bột trứng muối Gumi Egg 100g
500G Ớt Bột Mịn (Nhuyễn) Hàn Quốc CHACKHAN - NONG WOO
Bột Tương Đen JAJANG Hàn Quốc Deasang Gói 250Gr
Đường TSU Special Organic Dark Brown 500gr
Muối Hồng Himalaya Vipep Hạt 1.1kg Tặng Cối Xay Ceramic 
Muối ăn (Pink Salt) Himalaya Love Stone 
Bột gia vị Cajun seasoning Louisana 227gram
Combo 3 Gói Bột Phô Mai Tornado Vị Truyền Thống (100g / Gói)
Muối Ớt Tôm Tây Ninh Mọi Nhà (50g)
Hạt thì là Ông Chà Và 110g
 Bột Ngọt Ajinomoto Plus 1kg (Bao Bì Mới)
Muối nấu sấy khô loại 1kg/ 1 gói
Đường Bắp Ăn Kiêng Diabetics Tropicana Slim (100g)
Muối Hồng Himalaya Vipep Dạng Hạt
Hạt Nêm SHIMAYA Vị Tảo Bẹ 56g Nội Địa Nhật Bản
Bột Ngọt Ajinomoto 1kg - hàng nội địa Nhật Bản
Hạt nêm Massel hương vị Bò Australia 100% không chứa bột ngọt - Nhập khẩu Australia
Muối Sữa Spa A Bonne' APM.00013 (300g)
Muối Hồng Himalaya Nguyên Chất Hạt Túi 500G
Mì Chính Ajinomoto Nội Địa
Gói 1kg Ớt Bột Mịn Hàn Quốc Hanaro Hae Cham
Đường Bắp Ăn Kiêng Sucralose Tropicana Slim (100g)
Muối Hồng Himalaya Vipep Xay Nhuyễn
Bột Chanh Gia Vị 400g (Chavi - Bao bì mới)
Bơ thực vật Tường An hộp 800g
Combo 2 Gói Bột Phô Mai Tornado Vị Truyền Thống (100g / Gói)
Nước Cốt Gà Hầm Xương Cô Đặc WEIPER Nhật Bản (Tặng 1 Gói Hạt Nêm Vị Thịt Bò 9g)
Combo 2 gói Hạt Nêm Nấm Hương Maggi (200gr)
"Hạt Nêm ngon ngọt tự nhiên, an toàn cho bé và gia đình Youki Nhật Bản 500g"
Đường Nâu Dark Brown Sugar Toàn Phát - 1Kg
Hạt Nêm Aji-ngon Heo 900g
Bột Ớt Cánh Vảy Hàn Quốc Noong Woo Chakhan 1 Kg
Gia vị rắc cơm Hello Kitty Nhật Bản 48g (20 gói x 5 vị) siêu ngon 
Combo 5 Gói Bột Tương Đen JAJANG Hàn Quốc Deasang (250G/Gói)
Gia vị thịt xá xíu Kanokwan 50g
Phụ gia làm ngọt cho nước dùng
"Muối Hồng Himalaya Mịn 0,6mm Nguyên Chất (1000g)"
Combo Đường Bắp Ăn Kiêng Diabetics Tropicana Slim (100g) + Đường Bắp Ăn Kiêng  Sucralose Tropicana Slim (100g)
Bột lẩu thái ( Tom Yum Paste) Kanokwan 500g
Hành bột Vipep 500gr
Tỏi Bột Vipep 600gr
"Combo 3 hộp Hạt nêm Massel Classic Powder Gà, Bò, Rau 100% (168g x 3) - Nhập khẩu Australia"
Bộ  3 gói Gia vị thịt xá xíu Kanokwan 50g
Quế Bột Vipep 
Bột quế Ông Chà Và 300g
Knorr Hương Vị gà Knorr Chicken Flavor Bouillon (1kg)
Muối Hồng Himalaya Hạt 3-5mm Nguyên Chất (500g)
Bột Ngọt Miwon 1kg
Combo 2KG Đường thốt nốt Ngọc Trang (2 hủ keo đường mềm) - Đặc sản An Giang
Bột Phô Mai Tornado Vị Cay Gói (1kg / Gói)
Mè Rang Ăn Liền Hũ 100g
Combo 2 gói Đường tinh luyện Bến Thành (mỗi gói 1kg)
Hạt nêm xương hầm Vedan gói 3kg
Muối hồng Himalaya Nhập Khẩu Pakistan dạng mịn 500g
Muối tôm Tây Ninh Tanisa (L1) -  Bịch 500g
Ớt bột Dea Joo gói 200g cao cấp Hàn Quốc
Combo 5 Bột Phô Mai Tornado Vị Truyền Thống (30g / Gói)
Đường tinh luyện Biên Hòa Pure gói 500g (Bao Bì Mới)
Combo 2 gói đường tinh luyện Biên Hòa Pure ( 1kg / gói )
Muối Tiêu Sọ Thành Phát 100g
Hoa Hồi Vipep 
1KG Đường thốt nốt Ngọc Trang (Keo mềm) - Đặc sản An Giang
Muối tôm Tây Ninh hộp 250g (L1)
Thùng 12 Gói Bột Canh Vifon (900g / Gói)
Gừng Bột Vipep  500gr - Gừng bột nguyên chất
Muối Tôm Đặc Biệt Tanisa 250g
Muối hồng mịn Himalaya  Sottolestelle  Himalayan Pink Salt
Bột Nêm Từ Thiên Nhiên Ngưu Báng (450g)
Đường Phèn TSU Cao Cấp Diamond 450gr
Đường tinh luyện Bến Thành
Mì chính Ajinomoto Nhật Bản 1kg
Muối Ớt Tôm Bạc Liêu (150g)
Bột gia vị luộc - sốt hải sản crab & shrimp boil 454gr
100G Ớt Bột Vảy Hàn Quốc Cheng Jeong - NONG WOO (túi zipper)
COMBO SIÊU TIẾT KIỆM - 1 Tiêu Đen DK Harvest 85g (kèm Xoay Tiêu) + 1 Muối Hồng Himalayan DK Harvest 100g (kèm máy xoay muối)
Bột xí muội Volcano (1Kg / Gói)
Lá Húng Quế Basil Leaves hiệu Essential Everyday - Nhập khẩu Mỹ 17g
Combo 2 gói bột ngọt Vedan 1kg
Tiêu đen hạt Ông Chà Và 350g
Đinh hương Ông Chà Và 200g
Muối Sấy Khô IOD Thành Phát (Hủ 800g)
Bột Gừng Natas (40g)
VIÊN CARI KIỂU NHẬT KHÔNG CAY 200GR - hàng nội địa Nhật Bản
Hạt Nêm Maggi 3 Ngọt Vị Gà (900g) - 12249416
Bột Ngọt Ajinomoto Gói 1Kg
Bột tỏi Toàn Gia 500g/gói
Muối Ớt Tôm Bạc Liêu (200g)
Bột Ớt (Hàn Quốc) Ông Chà Và (40g)
Hạt nêm nấm Scook 1kg
Bột Gừng Hữu Cơ 30g Lumlum Organic Ginger Powder
Combo 5 Túi Tiêu hạt Đăk Lăk GUfoods [mỗi túi 200g]
Hạt nêm xương hầm Vedan gói 400g
Muối Hồng Himalaya Dạng Thô 1kg
"Quế Bột cao cấp cạo vỏ, sấy lạnh nguyên chất giúp giảm cân, giúp lưu thông máu, ổn định đường huyết, Quế Rừng Xanh- Quế rừng Trà Bồng Quảng Ngãi"
Hạt Nêm Vị Sò Ajinomoto 50G - Nội Địa Nhật Bản
Muối Tôm Chay An An (100g)
Thảo quả Ông Chà Và 120g
Hạt Nêm CHIN-SU Ngọt Tôm Thơm  Thịt (Gói 800g)
Cà ri xanh 500 g Kanokwan
Combo 2 hộp bơ thực vật Tường An ( 800g / hộp )
Gói 1Kg Bột Ớt Cánh Vảy Hàn Quốc HANARO Hae Cham
Muối Hồng Himalaya Rmsalt Nhập Khẩu Pakistan Dang Thô 500gr
Combo 3 gói Hạt nêm Nấm Vicook's 1KG/gói
Muối Ớt Rang Hũ 150g
Lá Mùi Tây Ông Chà Và (15g)
Hạt Nêm Ajinomoto Vị Gà 50g Nội Địa Nhật Bản
Bột Tỏi Lý Sơn Dori - Hủ 70g - Tỏi trồng và sản xuất trực tiếp tại đảo Lý Sơn - Bột tỏi Lý Sơn nguyên chất - Mùi rất thơm đặc trưng của tỏi Lý Sơn - Dùng ướp thực phẩm làm nước chấm nước sốt
Bột nêm rau củ Super Nutri
Combo 2 gói đường vàng TTC Trading ( 1kg / gói )
Bột trứng muối Gumi Egg  (1kg / gói)
Đường giảm Calo (đường ăn kiêng) - hàng nội địa Nhật Bản
Muối Hồng Himalaya Vipep Cối Xay 120gr
Muối tôm ớt kiểu Tây Ninh 120gr Dh Foods
Hạt Nêm Ajinomoto Chiết Xuất Từ Rong Biển 56g Nội Địa Nhật Bản
Combo 2 Gói Bột Ngọt Vedan (1Kg/Gói)
Gia vị Mì thái xào 500g Kanokwan (Pad Thai 500 g)
Đường ăn kiêng Tropicana Slim Classic 100g
Hạt Nêm Maggi 3 Ngọt Vị Heo (900gr) -12249417
"Đường Resoni 150g- Thực phẩm chức năng dành cho người tiểu đường, ăn kiêng"
Combo 2 Gói Bột Phô Mai Tornado Vị Truyền Thống & Vị Cay (100g / Gói)
Muối Tiêu Lá Chanh 50gr Dh Foods 
Bột Quế McCormick (32g)
Bột gừng Ông Chà Và 200g
Bột nước cốt gà hầm xương Kagome Nhật Bản
Hạt nêm vị Nấm Cao San
Hạt Nêm Neptune Vị Heo (380g)
Bột phô mai Lak Lak Vị truyền thống 500g
Bột nêm rau củ hữu cơ cho bé Sottolestelle 100g Organic Vegetable Powder
Hỗn hợp tăng vị bột ngọt 700g
Hạt Muối hồng Himalaya  Sottolestelle Himalayan Pink Salt ( Coarse Grain )
Combo 2 hũ Ớt Bột Hàn Quốc 45gr Dh Foods
1 hộp tinh bột nghệ vàng Curcumin 500gr
"Hạt nêm Massel  hương vị Rau củ 100% không chứa bột ngọt (2,5 Kg - Ăn chay được) "
Đường Mía Vàng Khoáng Chất Biên Hòa 1KG
Gói 500 Gram Bột Ớt Cánh Vảy Hàn Quốc HANARO Hae Cham
Combo 10 gia vị cơm chiên hải sản 25g
Hạt Nêm Topvalu Vị Rau Củ Và Nước Hầm Xương Heo 110g Nội Địa Nhật Bản
Combo 3 Hộp Đường Bắp Ăn Kiêng Sucralose Tropicana Slim (100g / Hộp)
Lốc 6 Hũ Hạt Điều Màu Ông Chà Và (70g/Hũ)
Hạt nêm Youki Nhật Bản 500g - hàng nội địa Nhật Bản
Muối Hồng Himalaya Hạt Mịn Nguyên Chất Túi 500gr
Muối Ớt Natas (90g)
Tiêu sọ hạt Ông Chà Và 350g
Gia Vị Nấu Phở Minh Hà 100g
Muối Tôm Tanisa Bịch 500gr (Loại Đặc Biệt)
Combo 2 Gói Gia Vị Gà Rang Muối Thành Lộc 500g (490g)/10
1 gói hạt nêm Nấm Vicook's 1kg/gói
Combo 3 Lốc Gia Vị Cơm Chiên Hải Sản Vedan (25g x 10 Gói/Lốc X 3 Lốc)
DASHI DẠNG BỘT KATSUO - hàng nội địa Nhật Bản
Mì chính KOBE BUSSAN 1kg - Nội địa Nhật Bản
Hộp 6 Viên Gia Vị Hủ Tiếu Nam Vang Ông Chà Và  (96g)
Hạt Nêm Miwon 900g
Combo 2 Hộp Đường Ăn Kiêng Tropicana Slim Stevia Sweetener (50 x 2.5g)
Đường Ăn Kiêng Tropicana Slim No Calorie Diabetics 100g
"Đường Ăn Kiêng Splenda Hộp 2000 Gói Nhỏ Của Mỹ Cho Nhà hàng, Khách sạn, Resort...."
Bột nêm Dashi tảo bẹ Kombu Shimaya 140g .
Combo 2 hộp Men Dinh Dưỡng Bragg Nutritional Yeast 127g
Ớt Bột Hàn Quốc 500gr 
Bột Ớt Cay Ông Chà Và (40g)
1KG Đường thốt nốt Ngọc Trang (9 viên đường lón) - Đặc sản An Giang
Muối Mè Đậu Phộng Hũ 150g
Bột nấm Đông Cô 100% Prince7
Muối Tắm Cà Phê A Bonne' APM.00011 (350g)
"Set 500g Ớt Bột  Hàn Quốc kèm 200g sốt tương ớt  Osajang làm kim chi, mì cay,..."
Gia vị rắc cơm 12 loại rau củ Ohmoriya 23g
Đinh hương Ông Chà Và 110g
Hạt Nêm Neptune 4 Trong 1 Vị Heo (850g)
Gia vị thịt nướng Toàn Gia 500g/gói
"Bột ớt Cayenne Pepper Viet Healthy 100g, bột ớt Viet Healthy nguyên chất giúp giảm đau, cải thiện tuần hoàn máu, nâng cao miễn dịch"
Muối ăn Himalaya loại mịn
Bột nước dùng Pigeon Dashi vị Gà Phô Mai (56g) - Nhập khẩu Nhật Bản
Bột Nghệ Natas (40g)
Hộp 10 gói gia vị thịt xá xíu 50g Kanokwan
Gia vị rắc cơm vị trứng gà Tanaka 42g
Súp hầm xương vị thịt heo KOBE BUSSAN 1kg - Nội địa Nhật Bản
Tiểu hồi Ông Chà Và 110g
Hạt Ngò Vipep 300gr
Muối Hồng Himalaya Dạng Hạt (1kg) – Theo Tiêu Chuẩn Muối Ăn Bộ Y Tế
Quế hồi thảo quả khô 20 Gram Kèm vị Mã 127.
Bột húng lìu Toàn Gia 500g/gói
Bột Ớt Siêu Cay Ông Chà Và (40g)
Gia vị rắc cơm trứng Marumiya 100g
Nhục đậu khấu Ông Chà Và 300g
Bột mác khén 35 Gram Kèm vị Mã 103.
Muối hồng Himalaya Nhập Khẩu Pakistan dạng hạt 1 Kg
Tiêu Hồng Sấy Lạnh - Có Cối Xay K-Pepper 60g
Muối Tiêu Chín 125g
Gia vị rắc cơm tôm sakura gói 25g( sakuraebi furikake isokoma)
Cà Ri Ướp Ông Chà Và 70g
Bột Nêm Vị Heo Krua Hom (500g)
Natural Hạt Ngò 25gr Dh Foods
Bột chiên giòn 200g
Combo 4 gói hạt nêm Hải sản 250gr/gói
Men Dinh Dưỡng  Nutritional Yeast  Bragg 127g (combo 3 hộp)
Muối Tôm Ớt Xanh Tây Ninh 120g Dh Foods
Muối Tiêu Natas (100g)
Combo 20 Gói Gia Vị Nấu Phở Vipep 
Hạt Nêm Oishi Kankoku Vị Thịt Bò 96g Hàn Quốc
Muối Ớt Tôm Tây Ninh Mọi Nhà - 105g
Bột Ngọt Miwon 350g
Tiêu Đen Xay 45gr Dh Foods
Natural Hạt điều đỏ 50g Dh Foods - Nguyên chất 100%
Bột hành Toàn Gia 500g/gói
Muối Tắm Sữa A Bonne' Hokkaido Milk Glutathione APM.00022 (350g)
Hạt Nêm Ajinomoto Vị Tôm Rau Củ 50g Nội Địa Nhật Bản
500g Muối tôm Tanisa loại 2
Bột nghệ Ấn Độ Ông Chà Và 300g
Combo 3 Lốc Gia Vị Cơm Chiên Dương Châu Vedan (25g x 10 Gói/Lốc X 3 Lốc)
Muối Tinh Nguyên Chất Daesang Hàn Quốc Gói 500 Gram
Combo 3 Gói Bột Chiên Xù Thành Lộc G200G
Natural Muối Tiêu Sả 55g Dh Foods
Thảo Quả Vipep 350gr
Combo 2 Gói Hỗn Hợp Tăng Vị Vedan (700g/Gói)
Sốt gà hầm xương Hirokishoko Nhật Bản
Muối Hồng Himalaya Nguyên Chất Mịn Túi 250G
Lá kinh giới Ông Chà Và 70g
Bột Chanh Gia Vị Chavi 400g
Muối Tiêu Chanh Ớt 50gr Dh Foods 
Lốc 6 Hũ Bột Quế Ông Chà Và (35g/Hũ)
Combo 3 Túi 30 gói gia vị rắc cơm (6 vị - 75gr)
Muối Ớt Tây Ninh Tinh Nguyên (90g)
Lá hương thảo Ông Chà Và 50g
Bột gừng hữu cơ DACE 45g
Gia vị rắc cơm vị rong biển tẳm vừng(Gomanori Furikake isokoma )
Muối hồng Himalaya Nhập Khẩu Pakistan dạng mịn 1 Kg
Bột nêm Ngưu Báng 60g
Muối Hồng Himalaya loại mịn túi 250gr
Bột ớt cay Ông Chà Và 145g
Bột nêm Dashi cá ngừ Marutomo hạt nhỏ 150g
Cốt súp cô đặc - Món Bò Kho Hoàn Chỉnh - 35gr - Số 1 tại Mỹ - Tiêu chuẩn FDA - Tiện lợi cho bữa ăn gia đình
Muối ăn Himalaya - Muối hồng (500gr)
Bột gia vị luộc - sốt hải sản crab & shrimp boil 142gram
Muối Sả Ớt An An (100g)
Gia vị rắc cơm thịt bò Sukiyaki Marumiya 40g
Bột Ớt Hữu Cơ 30g Lumlum Organic Chilli Powder
1 KG Bột Nêm Gia Vị Bò Hàn Quốc NONG WOO - Thương Hiệu Hàn Quốc
Tiêu Sọ Hạt Natas (60g)
"Muối Hồng Himalaya Nhập Khẩu Pakistan 500g (Loại Mịn 0,6mm)"
Lá nguyệt quế Ông Chà Và 70g
"Cốt súp cô đặc - Từ thịt gà - 200gr - Số 1 tại Mỹ - Tiêu chuẩn FDA, không bột ngọt, không chất bảo quản, tốt cho sức khỏe, sản phẩm bán chạy số 1 tại Mỹ"
Hạt Nêm Vị Cá Mòi 56G - Nội Địa Nhật Bản
Combo 6 Hộp Đường Ăn Kiêng Tropicana Slim No Calorie Sweetener Diabetics (50 x 2g)
Combo 5 gói Bột chiên xù G150g (140g)/10
Hộp 6 Viên Gia Vị Ông Chà Và Cà Ri (96g)
Cốt súp cô đặc - Từ Thịt Heo - 35gr - Số 1 tại Mỹ - Tiêu chuẩn FDA - Tiện lợi cho bữa ăn gia đình
Bộ 6 Sốt Kho Cá / Thịt Dasavi (50g / Gói)
Gia Vị Gà Chiên HXC (1kg)
Ngũ vị hương Đức Giang 3gam- loại 100 gói 1 hộp
Tiêu sọ hạt Phú Quốc 50gr Dh Foods
Combo 3 hũ Bột Tỏi Việt Ấn (80gr/hũ)
Muối Tôm Tây Ninh Tinh Nguyên (90g)
Bột ớt Nhập Khẩu Hàn Quốc Nongwoo (500g)
Muối hồng Himalaya Vipep hạt mịn 500g
100G Ớt Bột Mịn Hàn Quốc Cheng Jeong -  NONG WOO  ( Túi Zipper)
Muối Hồng Himalaya Nguyên Chất Hạt Túi 250G
Combo 5 Gói Bột Thính Gạo Thành Lộc 150g/gói
Bột Ớt Nongsan (454g)
GIA VỊ CƠM CHIÊN THỊT HEO NƯỚNG 3T - hàng nội địa Nhật Bản
Muối Tắm Vitamin C A Bonne' APM.00012 (350g)
Combo 5 Gói Gia Vị Gà Rang Muối Thành Lộc (100g/Gói)
Lá nguyệt quế khô Kèm vị Mã 041.
Combo 5 Gói Bột Gia Vị Thịt Nướng Thành Lộc (20g/Gói)
Hoa Hồi Bột Vipep 400gr
Bột chiên giòn xù Karaage 500gr
Tiêu Sọ Xay Natas (55g)
Gói 500G Bột Ớt Cánh Vảy Bidan Daesang Hàn Quốc
"Hạt Nêm Knorr Từ Thịt Thăn, Xương Ống Và Tủy Bổ Sung Vitamin A (1200g) - 32010222"
Bột cần tây mật ong sấy lạnh Jan's túi 50 g
Muối Hồng Himalaya DK Harvest
 Bột Ngọt Vedan 400g 
Bột Ngọt Vedan 1kg
Bột Phô Mai Tornado Vị Truyền Thống (100g / Gói)
Đường Mía Thượng Hạng Biên Hòa 1kg
"Hạt Nêm Knorr Từ Thịt Thăn, Xương Ống Và Tủy Bổ Sung Vitamin A (900g) - 32010220"
Đường Mía Vàng Thiên Nhiên Biên Hòa 1KG
Bột Ngọt Vedan 454g
Bột Ngọt Ajinomoto Gói 454g
1 gói muối sấy tinh IOD Thành Phát loại 1Kg
Bột Phô Mai Cheese Gói 250g
Đường Mía Thượng Hạng Biên Hòa 500g
"Hạt Nêm Knorr Từ Thịt Thăn, Xương Ống Và Tủy Bổ Sung Vitamin A (400g) - 32010212"
Đường trắng Bến Thành - 100% đường mía tinh khiết
"Hạt nêm Knorr Thịt Thăn, Xương Ống Và Tuỷ 1800g"
500G Ớt Bột Vảy Làm Kim Chi Hàn Quốc CHACKHAN - Thương Hiệu Hàn Quốc NONG WOO
Hạt Nêm Youki Nhật Bản 500g
500g Bột Phô Mai Cheese
Hạt nêm rong biển Ajinomoto 112g
Muối Hồng Himalaya Nhập Khẩu Pakistan Loại Mịn (Túi 1kg)
"Đường cỏ ngọt - Đường ăn kiêng nấu ăn, làm bánh - iLite Cook&Bake Singapore"
Muối hạt loại 1kg/ 1 gói
Bột nêm Ngưu Báng 200 g
Bột nêm Gà Knorr Chicken Flavor Bouillon 1.14 Kg - Nhập khẩu Mỹ
"Ớt Bột Hàn Quốc Làm Kim Chi, Tokbokki Gói 200g + Tặng Hồng Trà Sữa (Cafe) Maccaca 20g"
Đường Nâu Vàng Samyang Hàn Quốc 1kg
GIA VỊ LÀM KIM CHI HÀN QUỐC - FIVE SEC KIMCHI 
Tiêu đen nguyên hạt Đăk Lăk GUfoods (túi 200g)
Muối biển tinh khiết 500g
Combo 5 Gói Gia Vị Nấu Phở Vipep  - Gia Vị Nấu Phở Bò
Viên nấu cà ri S&B Foods Golden Curry 198g Nhật Bản
Bột Phô Mai Tornado Vị Truyền Thống (1kg / Gói)
Ớt Bột Hàn Quốc (Loại Thượng Hạng)(1kg)
Muối Hồng Himalaya Dạng Nhuyễn (1kg) – Theo Tiêu Chuẩn Muối Ăn Bộ Y Tế
Men Dinh Dưỡng Bragg 127g
Muối Tắm Vitamin C A Bonne' APM.00007 (350g)
Ớt Bột Mịn Hàn Quốc Nong Woo Chackhan Gói 1KG - Chuyên Làm Kim Chi
Đường Ăn Kiêng Tropicana Slim Stevia 125gr - Chiết Xuất Từ Lá Cỏ Ngọt Stevia 125g (50 x 2.5g)
Muối Hồng Himalaya Mịn Nguyên Chất (500g)
1kg Bột Phô Mai Cheese
Muối Tắm Trắng Yogurt A Bonne' APM.00006 (350g)
Bột Nêm Ngưu Báng 1000g
Ớt Bột Hàn Quốc (Loại Thượng Hạng) 500G 
Hạt nêm Massel hương vị Gà Australia 100% không chứa bột ngọt - Nhập khẩu Australia
Viên nấu Cà ri kiểu Nhật Kobe Bussan 200g - các vị
Bơ Thực Vật Meizan 800g
"Hạt Nêm Knorr Từ Thịt Thăn, Xương Ống Và Tủy Bổ Sung Vitamin A (1200g) - 32010222"
Bột cần tây mật ong sấy lạnh Jan's túi 50 g
Muối Hồng Himalaya DK Harvest
 Bột Ngọt Vedan 400g 
Bột Ngọt Vedan 1kg
Bột Phô Mai Tornado Vị Truyền Thống (100g / Gói)
Đường Mía Thượng Hạng Biên Hòa 1kg
"Hạt Nêm Knorr Từ Thịt Thăn, Xương Ống Và Tủy Bổ Sung Vitamin A (900g) - 32010220"
Đường Mía Vàng Thiên Nhiên Biên Hòa 1KG
Bột Ngọt Vedan 454g
Bột Ngọt Ajinomoto Gói 454g
1 gói muối sấy tinh IOD Thành Phát loại 1Kg
Bột Phô Mai Cheese Gói 250g
Đường Mía Thượng Hạng Biên Hòa 500g
"Hạt Nêm Knorr Từ Thịt Thăn, Xương Ống Và Tủy Bổ Sung Vitamin A (400g) - 32010212"
Đường trắng Bến Thành - 100% đường mía tinh khiết
"Hạt nêm Knorr Thịt Thăn, Xương Ống Và Tuỷ 1800g"
500G Ớt Bột Vảy Làm Kim Chi Hàn Quốc CHACKHAN - Thương Hiệu Hàn Quốc NONG WOO
Hạt Nêm Youki Nhật Bản 500g
500g Bột Phô Mai Cheese
Hạt nêm rong biển Ajinomoto 112g
Muối Hồng Himalaya Nhập Khẩu Pakistan Loại Mịn (Túi 1kg)
"Đường cỏ ngọt - Đường ăn kiêng nấu ăn, làm bánh - iLite Cook&Bake Singapore"
Muối hạt loại 1kg/ 1 gói
Bột nêm Ngưu Báng 200 g
Bột nêm Gà Knorr Chicken Flavor Bouillon 1.14 Kg - Nhập khẩu Mỹ
"Ớt Bột Hàn Quốc Làm Kim Chi, Tokbokki Gói 200g + Tặng Hồng Trà Sữa (Cafe) Maccaca 20g"
Đường Nâu Vàng Samyang Hàn Quốc 1kg
GIA VỊ LÀM KIM CHI HÀN QUỐC - FIVE SEC KIMCHI 
Tiêu đen nguyên hạt Đăk Lăk GUfoods (túi 200g)
Muối biển tinh khiết 500g
Combo 5 Gói Gia Vị Nấu Phở Vipep  - Gia Vị Nấu Phở Bò
Viên nấu cà ri S&B Foods Golden Curry 198g Nhật Bản
Bột Phô Mai Tornado Vị Truyền Thống (1kg / Gói)
Ớt Bột Hàn Quốc (Loại Thượng Hạng)(1kg)
Muối Hồng Himalaya Dạng Nhuyễn (1kg) – Theo Tiêu Chuẩn Muối Ăn Bộ Y Tế
Men Dinh Dưỡng Bragg 127g
Muối Tắm Vitamin C A Bonne' APM.00007 (350g)
Ớt Bột Mịn Hàn Quốc Nong Woo Chackhan Gói 1KG - Chuyên Làm Kim Chi
Đường Ăn Kiêng Tropicana Slim Stevia 125gr - Chiết Xuất Từ Lá Cỏ Ngọt Stevia 125g (50 x 2.5g)
Muối Hồng Himalaya Mịn Nguyên Chất (500g)
1kg Bột Phô Mai Cheese
Muối Tắm Trắng Yogurt A Bonne' APM.00006 (350g)
Bột Nêm Ngưu Báng 1000g
Ớt Bột Hàn Quốc (Loại Thượng Hạng) 500G 
Hạt nêm Massel hương vị Gà Australia 100% không chứa bột ngọt - Nhập khẩu Australia
Viên nấu Cà ri kiểu Nhật Kobe Bussan 200g - các vị
Bơ Thực Vật Meizan 800g
Bột Canh Tôm Nấm Lý Tưởng 150g (2 gói)
Bột Mật Ong Tự Nhiên OneLife (Hộp 50gr)
Combo 2 Gói Gia Vị Gà Rang Muối Thành Lộc G250G
Cà ri vàng 500g Kanokwan 
Natural Hạt Dổi 30gr Dh Foods
Thùng 10 Gói Ớt Bột Vảy (Cánh) Hàn Quốc CHENG JEONG - Ớt Bột Làm Kim Chi
Combo 3 gói Bột Ngọt Ajinomoto loai 454g
Bột  Nghệ Hữu Cơ 30g Lumlum Organic Turmeric Powder
Combo 5 Gói Bột Điều Thành Lộc (20g/Gói)
Combo 2 Gói Gia Vị Lẩu Thái Vipep 85gr
Bột ớt cay Ông Chà Và 300g
Bột Ngọt Miwon 454g
Bột quế hữu cơ 30g Lumlum Organic Cinnamon Powder
Bột đinh hương Ông Chà Và 300g
Nghệ Bột Vipep
Combo 12 Hộp Đường Ăn Kiêng Tropicana Slim Stevia Sweetener (50 x 2.5g)
Lá húng quế Ông Chà Và 50g
Muối Tôm Ớt Xanh Tây Ninh 60g Dh Foods
Combo 10 Gói Gia Vị Thảo Mộc Thành Lộc (Gà Tần) G25g (20g)/20
Combo 4 Muối Tôm Tây Ninh Tinh Nguyên (90g)
Combo 2 Gói Gia Vị Nấu Lẩu Dê - Bò
Lốc 20 Hộp 6 Viên Gia Vị Lẩu Thái Ông Chà Và  (96g)
Hạt Nêm Vị Cá Ngừ Marutomo 120G - Nội Địa Nhật Bản
Muối Sữa Spa A Bonne' Formula APM.00010 (350g)
Gia vị quay nướng Vịt 45 Gram Kèm vị Mã 143.
Bột nêm chiết xuất thịt gà Ajinomoto hạt nhỏ 200g
Combo 2 Gói Gia Vị Nấu TomYum 75gr
Tiêu đen hạt ATC 250gr
Combo lốc 5 gói bột chiên giòn tẩm khô Vedan 60g/gói
Bột tỏi hữu cơ DACE 65g
Muối hồng Himalaya Vipep hạt thô 500g
Súp hầm xương vị thịt heo KOBE BUSSAN 200gr - Nội địa Nhật Bản
Tiêu Đen Rang Xay Agrinet (100g/gói) (Gia vị) 
Miso Dạng Bột Vị Rau Củ Hữu Cơ
Cốt súp cô đặc - Món Hủ Tiếu Hoàn Chỉnh - 200gr - Số 1 tại Mỹ - Tiêu chuẩn FDA
Tiêu Đen Xay 80g Dh Foods - Tiêu Đen nguyên chất 100%
Tiêu Đen - Có Cối Xay K-Pepper 90g
VIÊN CARI KIỂU NHẬT VỊ CAY 200GR -  hàng nội địa Nhật Bản
Bột cà ri ướp Ông Chà Và 350g
Cà ri Massaman 500g Kanokwan
Bột thảo quả Ông Chà Và 300g
VIÊN CARI KIỂU NHẬT VỊ CAY VỪA 200GR - hàng nội địa Nhật Bản
