"Khăn Trùm Mặt Che Nắng Đi Phượt Đa Năng Cao Cấp Vải Thoáng Khí, Mau Khô, Dễ Mặc Cho Nam Và Nữ Dành Cho Phượt Thủ - Mai Lee"
Bộ 2 Khăn Bịt Mặt Trơn Đen Đa Chức Năng
Khăn trùm đầu Ninja Fullface (Màu đen)
Combo 5 Khăn Đa Năng Đi Phượt Sành Điệu - Màu Ngẫu Nhiên
Combo 5 Khăn Đa Năng Sportslink Đi Phượt Sành Điệu 
"Khăn Rimix Đa Năng Trùm Đầu Ninja Fullface Chống Nắng, Chống Tia UV Thích Hợp Đi Xe , Chạy Bộ , Leo Núi  Dành Cho Cả Nam Và Nữ Rimix - Hàng Chính Hãng"
"Combo chống nắng dành riêng cho phượt thủ - 3 món (Khăn đa năng, ống tay, khăn trùm mặt nạ njnja)"
"Khăn Đa Năng Ninja Trùm Kín  Đầu CLEACCO Dành cho Nam Nữ Chất Vải Đặc Biệt  Thoáng Khí  Tự Làm Mát Thích Hợp Chạy Bộ , Đi Xe , Leo Núi , Đi Phượt - Hàng Chính Hãng"
Combo 3 Khăn Đa Năng Đi Phượt Cao Cấp Kiêm Khẩu Trang Sành Điệu
Khăn Trùm Mặt Nạ NINJA
 Combo 2 khăn phượt đa năng - giao màu ngẫu nhiên
Khăn Trùm Mặt Đi Phượt Chống Nắng Chống Bụi CS
"Combo 3 Khăn Đa Năng Che Mặt Che Cổ Màu Đen Chất Đẹp Co Dãn Thấm Mồ Hôi Tốt Đi Phượt, Du Lịch"
Khăn Bịt Mặt Đầu Lâu Đa Chức Năng Winwinshop88 KNMDL - Đen
Khẩu Trang Đi Phượt
Khăn trùm mặt thể thao
Khẩu Trang Ninja Đi Phượt Đa Năng
Khăn rằn vải tốt - Alayna
Nón và khẩu trang đi phượt 2 trong 1 - mẫu ngẫu nhiên
Khăn rằn thời trang Cambodia Caro BlacknWhite 60x180cm (Trắng đen)
Combo 10 khăn đa năng khăn ống
Khẩu Trang Phượt Đa Năng Dành Cho Nam
Bộ 2 Khăn Bịt Mặt Đa Chức Năng (Mẫu Ngẫu Nhiên)
Khăn trùm ninja đi phượt- Khăn đa năng đi phượt- khăn đi phượt
Khẩu Trang Phượt Nhiều Họa Tiết
"Khăn lau tập thể dục đa năng với chất liệu vải bông thấm hút tốt, kèm chức năng túi đựng RIMIX - Hàng chính hãng"
Combo 3 Khẩu trang phượt đa năng họa tiết (ngẫu nhiên)
"Khăn trùm đầu thể thao nam nữ, chống nắng chống bụi Magic Tube - Alayna"
"Khăn lau mồ hôi dành cho Yoga, Gym "
"Combo 2 khăn Cotton dùng tập thể thao: Gym, Yoga, tennis….. hàng siêu mịn KT: 40cm x 80cm"
Combo bộ 10 khăn phượt đa năng - Giao màu ngẫu nhiên
Khăn Đa Năng Thể Thao Làm Mát Nhanh Chóng
Khăn Lạnh Thể Thao Đa Năng Siêu Mát - 2 Cái - Màu Ngẫu Nhiên
Khăn bịt mặt đa năng Hàn Quốc (giao màu ngẫu nhiên)
Khăn đa năng trơn
Khăn lạnh thể thao siêu mát
Bộ 20 Khăn đa năng nhiều màu Đi phượt đi nắng Tặng giá đỡ đa năng Popsocket
SET 2 khăn phượt đa nặng Halloween
Combo Set 5 khăn phượt đa năng
Combo 6 Khăn Đa Năng Đi Phượt
Khăn Che Mặt Hình Đầu Lâu Đa Năng Cho Phượt Thủ Chuyên Nghiệp AZONE
Khẩu Trang Đa Năng Kunosport I Đi Xe Máy Đi Phượt Chống Nắng Bụi
Nón và khẩu trang đi phượt 2 trong 1 CS-00-CS-12 Sportslink
"Khẩu trang băng lụa Rexchi 11 chống nắng, khăn thể thao đa năng cao cấp"
Combo 3 khăn phượt - giao màu ngẫu nhiên
"Khăn thể thao , dã ngoại bỏ túi chất liệu vải nhanh khô kèm túi móc đựng Silicon dẻo cao cấp Cleacco"
Khăn Tắm Thể Thao KHÔ Nhanh Trong 3 Giây Chống Nắng Thấm Mồ Hôi Làm Mát Tập GYM Yoga NatureHike NH19Y002-J
combo 3 khăn ống đa năng cho nam
Combo 3 khăn lạnh thể thao siêu mát
Khăn lạnh thể thao Uncle Bills AG2082
Khăn phượt đa năng Hunter Scarf - Alayna
Khăn rằn thời trang Green Scarf 40x150cm (Xanh lá)
Combo 3 Khăn làm lạnh thể thao mát lạnh - GD126CB
"Khăn tập gym, thể thao nhanh khô, kháng mùi hôi MDBuddy MDG004"
Khăn Đa Năng Đen Trơn
Khăn Lạnh Đa Năng
Khăn yoga và đi biển
Khăn lạnh thể thao cao cấp dùng cho mùa hè (XTM-KL01)
Khăn rằn thời trang Yellow Caro Scarf 40x150cm (Vàng)
Khẩu Trang Đi Phượt
Khăn phượt đa năng đi phượt dã ngoại leo núi dùng để chống nắng - giao màu ngẫu nhiên
Bộ 2 Khăn Bịt Mặt Đầu Lâu Đa Chức Năng (Màu Đen)
"Khăn Lạnh Thể Thao Làm Mát,Thấm Hút Mồ Hôi Đa Năng Szone"
Khăn tập
Bộ 2 Khẩu Trang Kiểu Dáng Ninja Dành Cho Dân Phượt (màu ngẫu nhiên)
Khăn rằn sọc HN Mekong 40x150cm (Đen trắng)
Khẩu trang khăn đa năng chống độc hại tiện dụng kiểu dáng đơn giản phù hợp cho cả nam và nữ - Mẫu ngẫu nhiên
Khăn ống đa năng in hình đầu lâu
"Khăn lạnh gymer THOL CT001 với độ thấm hút mồ hôi tuyệt đối, mát lạnh, nâng cao tinh thần và hiệu quả khi tập luyện - Hàng chính hãng - Màu ngẫu nhiên"
Khăn Lạnh Thể Thao Hạ Nhiệt Thấm Hút Mồ Hôi Hàng Cao Cấp
Khăn đa năng - Alayna
Khăn lạnh mùa hè Đa Năng (giao màu ngẫu nhiên)
Khăn lạnh thể thao cao cấp REMAX RT-TW01 - Hàng chính hãng
1 Khăn Đa Năng
Combo 2 khăn rằn vải tốt (màu ngẫu nhiên) - Alayna
Khăn thể thao nhanh khô loại cao cấp Aonijie E4091 (128.5cm x 60cm)
Khăn choàng thổ cẩm đi phươt đi biển
"Khăn thể thao đa năng, thấm hút mồ hôi tốt MDBuddy MDG004"
Khăn Lạnh Thể Thao Làm Mát Đa Năng - 05 Chiếc - Nhiều Màu
Combo 5 Khăn Đa Năng Chống Nắng Có Thể Làm Khẩu Trang Nhiều Màu Sắc Dài 47CM
Bộ 2 Khẩu Trang Kiểu Dáng Ninja Dành Cho Dân Phượt  ( tặng ví đựng thẻ card )
Khăn siêu hút nước bơi lội TYR Large Dry-Off Sport Towel
"Khăn thể thao cao cấp 100% tơ tằm, kích thước 30 x 100 cm, hàng thủ công Việt Nam"
Combo 5 gói khăn Sakurai 20 
Combo 2 khăn phượt đa năng màu trắng cờ nước anh
Khăn Làm Lạnh Thể Thao 30x120 RH20 - Giao ngẫu nhiên
Combo 2 khăn lạnh đa năng
