"Sữa Rửa Mặt Cetaphil Gentle Skin Cleaner (500ml) - 8394107341305,9318637069637"
Nước Tẩy Trang L'Oreal 3 In 1 Micellar Làm Sạch Sâu (400ml)
Nước tẩy trang Loreal Micellar Water 3-in-1 Refreshing Even For Sensitive Skin
Sữa rửa mặt trị mụn Senka Perfect Whip Acne Care 100g
Bao Cao Su Invisible Durex 10S (10 Cái / Hộp) - 100930571
Sữa Rửa Mặt Cetaphil Gentle Skin Cleanser (125ml)
Nước tẩy trang SENKA A.L.L. CLEAR WATER Micellar Formula White 230ml
Sữa Rửa Mặt Tạo Bọt Chiết Xuất Tơ Tằm Trắng Senka Perfect Whip 120g - 14839
Nước Tẩy Trang Làm Sạch Sâu Cho Da Nhạy Cảm La Roche-Posay Micellar Water Ultra Sensitive Skin 400ml
Nước tẩy trang L'Oreal Paris 3-in-1 Micellar Water 400ml
Sữa Dưỡng Thể Trắng Da Chống Nắng Và Ô Nhiễm Môi Trường Vaseline SPF 24 PA ++ (400ml)
Nước tẩy trang sạch thoáng Senka A.L.L.Clear Water Fresh 230ml
Dung Dịch Tẩy Tế Bào Chết Paula's Choice Skin Perfecting 2% BHA Liquid (30ml)
Sữa rửa mặt dạng bùn Trà tràm – Naruko Tea Tree Purifying Clay Mask and Cleanser in 1 (120g)
Sáp Dưỡng Môi Hồng Xinh Vaseline Lip Therapy Rosy Lip (7g) - 305210231597
Sữa rửa mặt làm sạch từ trà xanh đảo Jeju Innisfree Green Tea Foam Cleanser 150ml - NEW
Tẩy Tế Bào Chết Mặt Huxley Secret Of Sahara Scrub Mask Sweet Therapy 30ml
Sữa Rửa Mặt Nam Ngăn Ngừa Mụn Sạch Nhờn Trắng Da Hàn Quốc Cao Cấp Dabo Black Force (120ml) – Hàng Chính Hãng
Nước Rửa Chén Sunlight Thiên Nhiên Mới (750g / Túi)
Kem Rửa Mặt Dưỡng Trắng Hada Labo Perfect White Cleanser 80g
Bộ Gel rửa mặt làm sạch & giảm nhờn La Roche-Posay 200ml & nước tẩy trang 50ml 
Sữa Rửa Mặt Ẩm Mịn Và Săn Chắc Da Senka Perfect Whip Collagen In 14839 (120g)
Cetaphil Sữa Rửa Mặt Dịu Nhẹ Cho Mọi Loại Da Gentle Skin Cleanser 500ml Và Cetaphil Sữa Dưỡng Ẩm Baby Lotion 50ml
Máy rửa mặt mini massage tích hợp sóng âm BR-1020
Máy Rửa Mặt Và Mát Xa Da Mặt Halio Facial Cleansing & Massaging Device
Bộ sản phẩm làm sạch và bảo vệ da dầu nhạy cảm La Roche-Posay Effaclar Gel
Bộ sản phẩm nước tẩy trang làm sạch sâu giàu khoáng dành cho da nhạy cảm La Roche Posay Micellar Water Ultra Sensitive Skin
Sữa Rửa Mặt Tạo Bọt Chiết Xuất Đất Sét Trắng Senka Perfect White Clay New 14840 (120g)
Tấm Đệm Lót Siêu Thấm Caryn (20 Miếng)
Kem tẩy tế bào chết mặt Organic Shop Organic Coffee & Powder 75ml
Bao Cao Su Durex Invisible Extra Lubricant (10 Cái / Hộp) - 100958977
Máy rửa mặt Foreo LUNA MINI 3 - Loại bỏ bụi bẩn và cặn trang điểm chỉ trong 30s
Sữa rửa mặt dịu nhẹ Cosrx Low Ph Good Morning Gel Cleanser
Gel rửa mặt tạo bọt làm sạch & giảm nhờn cho da dầu nhạy cảm La Roche-Posay Effaclar Purifying Foaming Gel (400ml)
Máy Sấy Tóc Philips BHC010/00 - Hàng Chính Hãng
Sữa Rửa Mặt Dạng Gel Dành Cho Da Nhạy Cảm Effaclar Gel Moussant Purifiant La Roche Posay 50ml
Nước Tẩy Trang Làm Sạch Sâu & Kiểm Soát Bã Nhờn Cho Da Dầu Nhạy Cảm La Roche-Posay Micellar Water Ultra Oily Skin 400ml
Mặt Nạ Ngủ Dưỡng Ẩm Và Thanh Lọc Da Laneige Miniature Water Sleeping Mask (25ml)
Tẩy Tế Bào Chết Rosette Gommage (120g)
Bánh Oreo Mini Chocolate 204gr
Sữa Rửa Mặt Làm Sáng Da Pond's White Beauty (100g)
Sữa Rửa Mặt Dành Cho Da Mụn Innisfree Bija Trouble Facial Foam 150ml - 131171093
Bộ dưỡng chất giúp cải thiện và làm sáng da La Roche Posay Pure Vitamin C10 Serum
Máy Sấy Tóc Philips BHD029/00
Dung Dịch Làm Sạch Và Tẩy Trang Công Nghệ Micella Bioderma Sensibio H2O - 500ml
Sữa Rửa Mặt Tạo Bọt Ngăn Ngừa Mụn Và Se Lỗ Chân Lông - Normaderm Anti-perfection Deep Cleansing Foaming Cream Vichy 125ml - 100873890
Gel rửa mặt tạo bọt làm sạch & giảm nhờn cho da dầu nhạy cảm La Roche-Posay Effaclar Purifying Foaming Gel (50ml)
Sữa Rửa Mặt Ngăn Ngừa Lão Hóa Pond's Age Miracle (100g)
Kem Sữa Rửa Mặt Dưỡng Trắng Nâng Tông Pond'S White Beauty Tone Up 100G
Sữa rửa mặt chiết xuất tơ tằm trắng Senka Perfect Whip 50g
Gel rửa mặt tạo bọt làm sạch & giảm nhờn cho da dầu nhạy cảm La Roche-Posay Effaclar Purifying Foaming Gel (200ml)
Sữa rửa mặt Some By Mi AHA-BHA-PHA 30 Days Miracle Acne Clear Foam
Sữa Rửa Mặt Pond's Đất Sét Khoáng Detox Dạng Hạt (90g)
Dung Dịch Loại Bỏ Tế Bào Chết 2% BHA Paula's Choice Skin Perfecting 2% BHA Liquid Exfoliant (118ml)
Bọt rửa mặt tẩy trang Senka All Clear Doublew Foam 150ml
 TẨY TẾ BÀO CHẾT CHIẾT XUẤT QUẾ HỒI & CAFE 
Combo Nước tẩy trang dưỡng trắng Senka All Clear Water Micellar Formula White 230ml + Sữa rửa mặt dành cho da mụn Senka Perfect Whip Acne Care 50g
Dầu Tẩy Trang Sạch Sâu Senka All Clear Oil 14847 (230ml)
Sữa rửa mặt se khít lỗ chân lông innisfree Super Volcanic Pore Micellar Cleansing Foam 2X 150ml - 131172704
Sữa Rửa Mặt Trắng Da L'Oreal White Perfect 50ml 
Thùng 48 Hộp Sữa Chua Lên Men Tự Nhiên Yomost Vị Cam (170ml/Hộp)
Combo Sữa rửa mặt dành cho da mụn Senka Perfect Whip Acne Care 100g + Nước tẩy trang Senka All Clear White 70ml
Nước Tẩy Trang Vitamin Và Tinh Than Tre Sạch Sâu  Pond's Micellar Water
Nước tẩy trang dành cho da nhạy cảm La Roche Posay 50ml
Gel Tẩy Tế Bào Chết Naruko Trà Tràm Tea Tree Shine Control And Blemish Clear Peeling Gel (120g)
Tẩy Tế Bào Da Chết Chiết Xuất Từ Than Hoạt Tính ARRAHAN CHARCOAL PEELING GEL (180ml)
Bọt rửa mặt dưỡng ẩm Hada Labo Gokujyun Moisturizing Foaming Wash 160ml
Nước Rửa Chén Sunlight Thiên Nhiên Mới (750g / Chai)
Thùng 48 Hộp Sữa Tươi Tiệt Trùng Dutch Lady Cô Gái Hà Lan Có Đường (48X180ml)
Dung Dịch Làm Sạch Và Tẩy Trang Công Nghệ Micella Bioderma Sebium H2O - 500ml
Tã Quần Mỏng Nhẹ Caryn Gói Siêu Lớn L14 (14 Miếng)
Nước Tẩy Trang Vitamin Và Hoa Hồng Sáng Da  Pond's Micellar Water
Sữa rửa mặt làm giảm và ngăn ngừa mụn đầu đen Some By Mi Bye bye blackhead 30 days miracle greentea tox bubble cleanser
Sữa Rữa Mặt Skin1004 Madagascar Centella Ampoule Foam 125ml
Nước Tẩy Trang L'Oreal 3 In 1 Micellar Làm Sạch Sâu (95ml)
Máy rửa mặt silicon cao cấp FOREVER ( Khách chọn màu)
Bánh Quy Mặn Nhân Phô Mai Ritz (160g) - Nhập khẩu Nhật Bản
Tã Dán Siêu Thấm Caryn Gói Siêu Lớn M20 (20 Miếng)
Sữa Rửa Mặt NIVEA MEN DEEP Than Đen Hoạt Tính Hút Nhờn Sáng Da (100G) - 84415
Sữa rửa mặt thải độc rau củ Byvibes Wonder Bath Super Vegitoks Cleanser 300ml (Màu xanh)
Sữa Rửa Mặt Sạch Mụn Đầu Đen ST.IVES Trà Xanh 170g - 077043358023
Tẩy Tế Bào Chết Dành Cho Da Khô Rosette Gommage Moist (120g)
Tã Quần Mỏng Nhẹ Caryn Gói Siêu Lớn M16 (16 Miếng)
Nước Tẩy Trang NIVEA Acne Care Ngừa Mụn Micellar Water (125ml) - 89270
Nước Tấy Trang Hoa Hồng Cocoon 300ml
Nước Hoa Hồng NIVEA Extra White Dưỡng Trắng Da & Se Khít Lỗ Chân Lông (200ml) - 86720
Sữa Rửa Mặt Trắng Da L'Oreal White Perfect (100ml)
Máy rửa mặt Foreo LUNA 3 Loại bỏ bụi bẩn và cặn trang điểm chỉ trong 30s - Hàng Nhập Khẩu
Thùng 48 Hộp Sữa Chua Lên Men Tự Nhiên Yomost Vị Dâu (170ml/Hộp)
"Bộ Gel rửa mặt và tắm giúp làm sạch bã nhờn,giảm mụn & thâm sẹo La Roche-Posay Effaclar Micro-Peeling Purifying Gel"
"Nước tẩy trang dành cho da dầu, da mụn BIODERMA Sébium H2O 500ml"
Tẩy Da Chết Sủi Bọt Thải Độc Môi Unpa Bubi Bubi Lip 12ml
Combo sữa rửa mặt kiểm soát bã nhờn và làm sáng da chiết xuất từ than hoạt tính  3W CLINIC CHARCOAL và chiết xuất từ lúa mạch 3W CLINIC BROWN RICE (100ml) - Hàn Quốc Chính Hãng
Sữa rửa mặt dưỡng chuyên biệt chống lão hóa Hada Labo Pro Anti Aging α Lifting Cleanser (80g)
Sữa Rửa Mặt Dạng Bọt Dove Tinh Chất - Serum Se Khít Lỗ Chân Lông Và Kiềm Dầu 160Ml
Thức Ăn Khô Cho Chó Con Hương Vị Thịt Bò Và Sữa SmartHeart (1.5kg)
Tẩy Da Chết ORGANIC BODY SCRUB Làm Sáng Da Toàn Thân RUSIA
Máy Rửa Mặt Và Mát Xa Da Mặt Cho Da Nhạy Cảm  Halio Sensitive
Combo 6 Băng Vệ Sinh Diana 4Teen Siêu Mỏng Cánh (Gói 8 Miếng)
Gel Bôi Trơn Durex K-Y Jelly (50g) - 100876353
"Combo sữa rửa mặt kiểm soát bã nhờn chiết xuất từ than hoạt tính , sửa rữa mặt ngăn ngừa mụn, phục hồi da chiết xuất từ trà xanh, sửa rữa mặt làm sáng mịn da chiết xuất từ lúa mạch 3W CLINIC "
Sữa Rửa Mặt Sáng Da Nivea Men 88836 (100g)
Gel Bí Đao Rửa Mặt Cocoon (140ml)
"Natureine AQUA PEEL Moisture Peeling Gel - Gel tẩy tế bào da chết, cấp ẩm Nhật Bản - Chính Hãng"
Bộ sản phẩm dành cho da nhạy cảm La Roche-Posay
Mặt Nạ Đất Sét Dưỡng Ẩm Và Se Khít Lỗ Chân Lông Laneige Mini Pore Waterclay Mask Miniature (25ml)
Máy rửa mặt nhiều chế độ
Nước Tẩy Trang Vitamin Và Hoa Hồng Sáng Da Pond's Micellar Water 400ml Tặng Kèm Nước Tẩy Trang Vitamin Và Nha Đam Khóa Ẩm Pond's Micellar Water 100ml
Sữa Rửa Mặt Neutrogena Làm Sạch Sâu 150ml
Sữa Rửa Mặt Ngăn Ngừa Lão Hóa Da Innisfree Jeju Pomegranate Revitalizing Foam Cleanser (150ml)
Sữa Rửa Mặt NIVEA MEN Giảm Nhờn Mụn (100G) - 82378
EUCERIN GEL RỬA MẶT DÀNH CHO DA NHỜN MỤN EUCERIN PROACNE CLEASING 200ML
Sửa Rửa Mặt Ý Dĩ Hatomugi Naturie Nhật Bản
Bao Cao Su Durex Real Feel (3 Cái / Hộp)
Nước Tẩy Trang Byphasse Dành Cho Mọi Loại Da (500ml)
Gel Rửa Mặt Kiểm Soát Nhờn Ngăn Ngừa Mụn Acnes Oil Control Cleanser (100g)
Dung Dịch Làm Sạch Và Tẩy Trang Công Nghệ Micella Bioderma Sensibio H2O
Sữa Rửa Mặt Dạng Bọt Dove Tinh Chất - Serum Cấp Ẩm & Cho Da Mềm Mượt 160Ml
Sữa Rửa Mặt Than Dành Cho Nam Dabo Black Force (120ml)
Nước Tẩy Trang Tươi Mát L'Oreal Paris Micellar Water (400ml)
Bộ Đôi Sữa Rửa Mặt Tạo Bọt Chiết Xuất Tơ Tằm Trắng Senka Perfect Whip 120g Tặng Lưới Tạo Bọt
Kem chống nắng dưỡng trắng Anessa Whitening UV Sunscreen Gel Spf 50+ Pa++++ (90g)
Sữa Rửa Mặt Dove Tinh Chất - Serum Cấp Ẩm 130g Tặng Kem Xả Dove Phục Hồi Hư Tổn 1 Phút Dạng Gel Sữa Dưỡng 150ml
Nước Tẩy Trang Dưỡng Ẩm L'Oreal Paris Micellar Water (400ml)  
Dung Dịch Tẩy Tế Bào Chết Hoá Học COSRX BHA Blackhead Power Liquid Exfoliator 100ml
Nước Tẩy Trang NIVEA White Oil Clear Kiểm Soát Nhờn Micellar Water (200ml) - 86609
Sữa Rửa Mặt Tạo Bọt Làm Sạch Giúp Làm Sạch Sâu Và Se Khít Lỗ Chân Lông Không Gây Khô Da La Roche-Posay Effaclar Deep Cleansing Foaming Cream (125ml)
Nước Tẩy Trang Simple Micellar (200ml) - 8712561669825
Bọt Tắm Gội Thảo Mộc Arau Baby Túi 400ml 
Máy rửa mặt sóng âm Xiaomi inFace
Sữa Rửa Mặt Tạo Bọt Dưỡng Trắng Và Trẻ Hoa Da Beauty Buffet Scentio Milk Plus 100ml
Sữa Rửa Mặt Hạt Nghệ Ngừa Mụn Thorakao Curcuma Cleansing Milk 100g 
Kem Đánh Răng Trẻ Em P/S - Dâu Trái Cây (45g)
Tẩy tế bào chết da mặt từ gừng và hoa đào Organic shop Face Scrub Ginger & Sakura 75ml
Máy Sấy Tóc Philips HP8232/00 - Hàng chính hãng
Nước Tẩy Trang Mắt Và Môi Chuyên Dụng 2 lớp Maybelline New York Eye & Lip Makeup Remover 150ml
Bánh Oreo Mini Vani 204gr
[MẪU MỚI] Sữa Rửa Mặt Dạng Gel Simple Refreshing (150ml) -
"Nước Tẩy Trang Làm Sạch Da, Kháng Khuẩn, Dịu Nhẹ Derladie Cleansing Water Witch Hazel 500ml"
"Sữa Rửa Mặt Dưỡng Ẩm, Làm Sạch Sâu Chiết Xuất Hoa Cúc - Oribe Facial Cleanser 100g"
Nước gạo WOONGJIN 1.5L x1 Chai
"Sửa Rửa Mặt Ý Dĩ Hatomugi Naturie nội địa Nhật Bản 130g làm sạch nhờn, làm sáng da, mờ thâm mụn [ Được Mask 3W Clinic ]"
Combo 2 sữa rửa mặt dạng bọt Dove Tinh chất serum cho da nhạy cảm 160ml
Sữa Dưỡng Thể Trắng Da Chống Nắng Và Ô Nhiễm Môi Trường Vaseline SPF 24 PA ++ (200ml)
Gel rửa mặt tạo bọt làm sạch & giảm nhờn cho da dầu nhạy cảm La Roche-Posay Effaclar Purifying Foaming Gel (200ml)
Sữa Rửa Mặt ST.IVES Tẩy Da Chết Chiết Xuất Yến Mạch 170g USA
Lăn Khử Mùi Giúp Khô Thoáng Vùng Da Dưới Cánh Tay 72h Vichy Detransprirant Intensif 72h Transpiration Excessive (50ml)
Sữa Rửa Mặt NIVEA MEN Tạo Bọt Giúp Sáng Da Vượt Trội (100ml) - 83956
"Sữa rửa mặt giảm dầu, ngăn ngừa mụn Vichy Normaderm Phytosolution (50ml)"
Simple Kind To Skin Refreshing Facial Wash - Sữa Rửa Mặt Dịu Nhẹ Cho Da Nhạy Cảm
"Serum Tẩy tế bào chết, cải thiện mụn, vết thâm tái tạo da The Ordinary AHA 30% BHA 2% Peeling Solution (30ml)"
Thùng 48 Hộp Sữa Tươi Tiệt Trùng Dutch Lady Cô Gái Hà Lan Không Đường (48X180ml)
"Kem Dưỡng Trắng Da, Giảm Thâm Nám Pond’s Flawless White Ban Đêm (50g)"
Máy Rửa Mặt Và Mát Xa Da Mặt Cao Cấp - Hàng Nhập Khẩu - Màu Ngẫu Nhiên
"Máy rửa mặt làm sạch bụi bẩn, bã nhờn và lớp trang điểm thừa có khả năng massage kích thích tuần hoàn máu - Giao màu ngẫu nhiên"
Dung dịch dịu da kháng khuẩn Acnes Soothing Lotion (90ml)
Sữa Rửa Mặt Dove Tinh Chất - Serum Cấp Ẩm Và Cho Da Mềm Mịn 130ml
Gel rửa mặt ngừa mụn Decumar Clean (100g)
Sữa Rửa Mặt Khoáng Chất Bùn Nam Kiểm Soát Chất Nhờn Nivea 50g - 83941
Sữa Rửa Rặt Thải Độc Rau Củ Byvibes Wonder Bath Super Vegitoks Cleanser 300ml Tặng Kèm Máy Massage Mặt Ion
Miếng Lót Thấm Sữa Pigeon 2018 (60 Miếng)
Bộ Nước Tẩy Trang Chuyên Sâu Dành Cho Da Nhạy Cảm Vichy Mineral Micellar Water 400Ml
"Sữa Rửa Mặt Dưỡng Ẩm, Làm Sạch Sâu Chiết Xuất Hoa Cúc - Oribe Facial Cleanser 50g"
Gói 12 Miếng Bông Mút Bọt Biển Rửa Mặt
Dầu Tẩy Trang Naive (170ml)
Nước tẩy trang từ trà xanh đảo Jeju Innisfree Green Tea Cleansing Water 300ml - NEW
Sữa Rửa Mặt BeGreen House - Fresh Facial Cleanser (100ml)
Sữa Rửa Mặt Neutrogena Làm Sạch Sâu Và Kiểm Soát Nhờn
Combo Sữa rửa mặt ẩm mịn và săn chắc da Senka Perfect Whip Collagen In 120g + Nước tẩy trang Senka All Clear White 70ml
Combo 2 Sữa Rửa Mặt Chiết Xuất Từ Trà Xanh 3W Clinic Green Tea Foam Cleansing (100ml)
Combo Kem Sữa Rửa Mặt Dưỡng Trắng Nâng Tông Pond'S White Beauty 100G Và Kem Sữa Dưỡng Trắng Nâng Tông Pond'S White Beauty Tone Up 50G
Sữa Rửa Mặt Dưỡng Ẩm Ohui Miracle Moisture Cleansing Foam 80ml
Combo 2 Nước Tẩy Trang NIVEA Chiết Xuất Hoa Hồng Hokkaido (125ml) - 84998 (TẶNG GỐI BỌT BÔNG SIÊU MỀM MỊN)
Gel rửa mặt dịu nhẹ Senka Perfect Gel Gentle Wash
Kem Rửa Mặt Sạch Khuẩn Mụn Kiểm Soát Nhờn Oxy Total Anti Acne (100g)
Sữa Rửa Mặt Dưỡng Ẩm Từ Olive Innisfree Olive Real Cleansing Foam 150ml - 131170248
Cọ Rửa Mặt Bạch Tuộc Tạo Bọt Xốp Rửa Sạch Massage Lỗ Chân Lông Tẩy Tế Bào Chết Từ Sillicone
Kem loại bỏ tế bào chết Paula’s Choice Skin Perfecting 2% BHA Gel Exfoliant 100ml
Combo 3 Nước Tẩy Trang Vitamin & Hoa Hồng Sáng Mịn Pond’S Micellar Water 100ml + Nước Tẩy Trang Vitamin & Tinh Than Tre Sạch Sâu Pond’S Micellar Water 100ml + Nước Tẩy Trang Vitamin & Nha Đam Khóa Ẩm Sáng Mịn Pond’S Micellar Water 100ml
Sữa Rửa Mặt Tẩy Trang 2 Tác Dụng Senka All Clear Double Wash 14851 (120g)
Tinh Chất Tẩy Da Chết Và Làm Sáng Da The Ordinary Lactic Acid 5% + HA 30ml
Cà phê hòa tan NESCAFÉ 3in1 Cà phê sữa đá - Hộp 10 gói x 20 g
Gel rửa mặt dịu nhẹ dành cho da nhạy cảm Huxley Cleansing Gel; Be Clean Be Moist 200ml
Sữa Rửa Mặt Ngừa Mụn Pond's Acne Clear (100g)
Sữa rửa mặt trị mụn và se khít lỗ chân lông Paula’s Choice Clear Pore Normalizing Cleanser 177 ml
Sữa Bột Nguyên Kem Dutch Lady Cô Gái Hà Lan Hộp Giấy (400g)
Sữa Rửa Mặt NIVEA MEN Chứa Hạt Mát-Xa Kiểm Soát Nhờn (100G) - 84428
Sữa Rửa Mặt Cetaphil Gentle Skin Cleanser (125ml) + Tặng Kèm 2 Mũ Trùm Đầu Khi Tắm Hoặc Ủ Tóc Trong Suốt
Gel tẩy tế bào chết cho da mặt Hàn Quốc Dabo (180ml) – Hàng Chính Hãng
Sữa Rửa Mặt Từ Blueberry Innisfree Blueberry Rebalancing 5.5 Cleanser 100ml - 131171581
Tã Quần Cao Cấp Moony Nhật Bản M58 (58 Miếng)
Dung dịch tạo bọt ngăn ngừa mụn Acnes Foaming Wash (150ml)
"Sữa Rửa Mặt Cetaphil Gentle Skin Cleaner (500ml) - 8394107341305,9318637069637"
Nước Tẩy Trang L'Oreal 3 In 1 Micellar Làm Sạch Sâu (400ml)
Nước tẩy trang Loreal Micellar Water 3-in-1 Refreshing Even For Sensitive Skin
Sữa rửa mặt trị mụn Senka Perfect Whip Acne Care 100g
Bao Cao Su Invisible Durex 10S (10 Cái / Hộp) - 100930571
Sữa Rửa Mặt Cetaphil Gentle Skin Cleanser (125ml)
Nước tẩy trang SENKA A.L.L. CLEAR WATER Micellar Formula White 230ml
Sữa Rửa Mặt Tạo Bọt Chiết Xuất Tơ Tằm Trắng Senka Perfect Whip 120g - 14839
Nước Tẩy Trang Làm Sạch Sâu Cho Da Nhạy Cảm La Roche-Posay Micellar Water Ultra Sensitive Skin 400ml
Nước tẩy trang L'Oreal Paris 3-in-1 Micellar Water 400ml
Sữa Dưỡng Thể Trắng Da Chống Nắng Và Ô Nhiễm Môi Trường Vaseline SPF 24 PA ++ (400ml)
Nước tẩy trang sạch thoáng Senka A.L.L.Clear Water Fresh 230ml
Dung Dịch Tẩy Tế Bào Chết Paula's Choice Skin Perfecting 2% BHA Liquid (30ml)
Sữa rửa mặt dạng bùn Trà tràm – Naruko Tea Tree Purifying Clay Mask and Cleanser in 1 (120g)
Sáp Dưỡng Môi Hồng Xinh Vaseline Lip Therapy Rosy Lip (7g) - 305210231597
Sữa rửa mặt làm sạch từ trà xanh đảo Jeju Innisfree Green Tea Foam Cleanser 150ml - NEW
Tẩy Tế Bào Chết Mặt Huxley Secret Of Sahara Scrub Mask Sweet Therapy 30ml
Sữa Rửa Mặt Nam Ngăn Ngừa Mụn Sạch Nhờn Trắng Da Hàn Quốc Cao Cấp Dabo Black Force (120ml) – Hàng Chính Hãng
Nước Rửa Chén Sunlight Thiên Nhiên Mới (750g / Túi)
Kem Rửa Mặt Dưỡng Trắng Hada Labo Perfect White Cleanser 80g
Bộ Gel rửa mặt làm sạch & giảm nhờn La Roche-Posay 200ml & nước tẩy trang 50ml 
Sữa Rửa Mặt Ẩm Mịn Và Săn Chắc Da Senka Perfect Whip Collagen In 14839 (120g)
Cetaphil Sữa Rửa Mặt Dịu Nhẹ Cho Mọi Loại Da Gentle Skin Cleanser 500ml Và Cetaphil Sữa Dưỡng Ẩm Baby Lotion 50ml
Máy rửa mặt mini massage tích hợp sóng âm BR-1020
Máy Rửa Mặt Và Mát Xa Da Mặt Halio Facial Cleansing & Massaging Device
Bộ sản phẩm làm sạch và bảo vệ da dầu nhạy cảm La Roche-Posay Effaclar Gel
Bộ sản phẩm nước tẩy trang làm sạch sâu giàu khoáng dành cho da nhạy cảm La Roche Posay Micellar Water Ultra Sensitive Skin
Sữa Rửa Mặt Tạo Bọt Chiết Xuất Đất Sét Trắng Senka Perfect White Clay New 14840 (120g)
Tấm Đệm Lót Siêu Thấm Caryn (20 Miếng)
Kem tẩy tế bào chết mặt Organic Shop Organic Coffee & Powder 75ml
Bao Cao Su Durex Invisible Extra Lubricant (10 Cái / Hộp) - 100958977
Máy rửa mặt Foreo LUNA MINI 3 - Loại bỏ bụi bẩn và cặn trang điểm chỉ trong 30s
Sữa rửa mặt dịu nhẹ Cosrx Low Ph Good Morning Gel Cleanser
Gel rửa mặt tạo bọt làm sạch & giảm nhờn cho da dầu nhạy cảm La Roche-Posay Effaclar Purifying Foaming Gel (400ml)
Máy Sấy Tóc Philips BHC010/00 - Hàng Chính Hãng
Sữa Rửa Mặt Dạng Gel Dành Cho Da Nhạy Cảm Effaclar Gel Moussant Purifiant La Roche Posay 50ml
Nước Tẩy Trang Làm Sạch Sâu & Kiểm Soát Bã Nhờn Cho Da Dầu Nhạy Cảm La Roche-Posay Micellar Water Ultra Oily Skin 400ml
Mặt Nạ Ngủ Dưỡng Ẩm Và Thanh Lọc Da Laneige Miniature Water Sleeping Mask (25ml)
Tẩy Tế Bào Chết Rosette Gommage (120g)
Bánh Oreo Mini Chocolate 204gr
Sữa Rửa Mặt Làm Sáng Da Pond's White Beauty (100g)
Sữa Rửa Mặt Dành Cho Da Mụn Innisfree Bija Trouble Facial Foam 150ml - 131171093
Bộ dưỡng chất giúp cải thiện và làm sáng da La Roche Posay Pure Vitamin C10 Serum
Máy Sấy Tóc Philips BHD029/00
Dung Dịch Làm Sạch Và Tẩy Trang Công Nghệ Micella Bioderma Sensibio H2O - 500ml
Sữa Rửa Mặt Tạo Bọt Ngăn Ngừa Mụn Và Se Lỗ Chân Lông - Normaderm Anti-perfection Deep Cleansing Foaming Cream Vichy 125ml - 100873890
Gel rửa mặt tạo bọt làm sạch & giảm nhờn cho da dầu nhạy cảm La Roche-Posay Effaclar Purifying Foaming Gel (50ml)
Sữa Rửa Mặt Ngăn Ngừa Lão Hóa Pond's Age Miracle (100g)
Dầu tẩy trang Innisfree Apple Seed Cleansing Oil 131171060 (150ml)
Sửa rửa mặt làm sạch sâu Innisfree Apple Seed Deep Cleansing Foam 131171066 (150ml)
Dung Dịch Làm Sạch Và Tẩy Trang Công Nghệ Micella Bioderma Sebium H2O
Senka Perfect Whip Acne Care - Sửa rửa mặt dành cho da mụn
Sữa Rửa Mặt Dành Cho Da Quá Nhạy Cảm La Roche-Posay (200ml)
Thùng 48 Hộp Sữa Chua Lên Men Tự Nhiên Yomost Trái Lựu (170ml/Hộp)
Sữa Rửa Mặt Than Hoạt Tính 3W Clinic (100ml)
     GSK ACNE-AID LIQUID CLEANSER 100ML SỮA RỬA MẶT LÀM SẠCH VÀ NGỪA MỤN
Combo Nước Tẩy Trang Vitamin Và Hoa Hồng Sáng Da  Pond's Micellar Water 100ml + Kem Sữa Rửa Mặt Dưỡng Trắng Nâng Tông  Pond's White Beauty 100ml
Gel rửa mặt làm sạch từ trà xanh đảo Jeju Innisfree Green Tea Morning Cleanser 150ml - NEW
Tã Quần Mỏng Nhẹ Caryn Gói Lớn L7 (7 Miếng)
Nước tẩy trang tinh dầu Hoắc Hương 38ml JULYHOUSE
Bánh Quế Lu Sôcôla (234g)
Nước tẩy trang hoa hồng cocoon 300ml (rose micellar water)
Xà Phòng Rửa Mặt Loại Bỏ Mụn Đầu Đen Cocolarme Mild Soap (85g)
Nước tẩy trang Caryophy Smart Cleansing Water
Sữa Rửa Nam Ngăn Ngừa Mụn Trắng Da Dabo Black Force (120ml)
Nước tẩy trang sạch thoáng Senka A.L.L.Clear Water Fresh 230ml Tặng Lưới Tạo Bọt
Nước Tẩy Trang Làm Sạch Sâu & Kiểm Soát Bã Nhờn Cho Da Dầu Nhạy Cảm La Roche-Posay Micellar Water Ultra Oily Skin 200ml
Kiehl's Calendula Deep Cleansing Foaming Face Wash – Gel Rửa Mặt Chiết Xuất Hoa Cúc
Kem Rửa Mặt Tút Sáng Từ Đất Sét Trắng Oxy White Complete (100g)
Máy Sấy Tóc Philips BHD002/00 - Hàng Chính Hãng
Sữa rửa mặt Some By Mi Snail Truecica Miracle Repair Low PH Gel Cleanser
Kem Tẩy Tế Bào Chết Thorakao 45g
Bộ sữa rửa mặt Cetaphil Gentle Skin Cleanser (2 chai 591ml và 1 chai 118ml) - Nhập khẩu Mỹ
Sữa rửa mặt Caryophy Portulaca Cleansing Foam 3 In 1
LAROCHE-POSAY NƯỚC TẨY TRANG SẠCH SÂU CHO DA DẦU NHẬY CẢM EFFACLAR MICELLAR WATER 50ML
Cây - Dụng Cụ Massage Và Rửa Mặt 2 Đầu Cao Cấp Đa Năng - Hàng Nhập Khẩu - Giao Màu Ngẫu Nhiên 
Máy Rửa Mặt Cao Cấp LumiSpa - Nuskin
Sữa rửa mặt NIVEA White Oil Clear giúp trắng da sạch nhờn (100g) - 84951
Sữa tắm trẻ em Arau Baby 450ml
Sữa Rửa Mặt Nivea Men Bùn Khoáng Sáng Da Và Mờ Vết Thâm Mụn (100g)
Combo Kem Dưỡng Da POND'S Age Miracle Đêm 50g + Sữa Rửa Mặt Pond's Chống Lão Hóa Age Miracle 100g
Tã Dán Siêu Mềm Bobby Extra Soft Dry Gói Lớn L30 (30 Miếng)
Máy Rửa Mặt Và Mát Xa Da Mặt Top Cho Da Nhạy Cảm - Clean & Massage Sensitive Facial Brush  
Combo 2 Nước Tẩy Trang Vitamin & Hoa Hồng Sáng Da Pond’S Micellar Water 100Ml
Nước tẩy trang Senka Micellar Formula White 70ml
Sữa Rửa Mặt Pond's Đất Sét Khoáng Sạch Sâu Sáng Mịn (90g)
Nước Tẩy Trang Byphasse Micellar Make-up Remover Solution
"Sữa Rửa Mặt Sáng Da, Ngừa Mụn Tràm Trà Vedette 100ml"
Sữa Rửa Mặt ST.IVES Tươi Mát Da Hương Mơ (170g) - 077043103609
Sữa Rửa Mặt Dạng Bọt Dove Tinh Chất - Serum Cho Da Nhạy Cảm 160Ml
Nước Tẩy Trang NIVEA Chiết Xuất Hoa Hồng Hokkaido (400ml) - 86550
Hộp 16 Gói Trà Lipton Ice Tea Vị Xoài (14g / Gói)
Sữa rửa mặt trắng da Hatomugi 170g - hàng nội địa Nhật
Hoạt chất Tẩy tế bào chết da mặt Cherry Zoley (80ml)
Máy rửa mặt facial  xoay 360 độ AOBERST
Sữa Rửa Mặt Collagen 3W Clinic (100ml)
"Sữa Rửa Mặt Cetaphil Gentle Skin Cleaner (500ml) - 8394107341305,9318637069637"
Nước Tẩy Trang L'Oreal 3 In 1 Micellar Làm Sạch Sâu (400ml)
Nước tẩy trang Loreal Micellar Water 3-in-1 Refreshing Even For Sensitive Skin
Sữa rửa mặt trị mụn Senka Perfect Whip Acne Care 100g
Bao Cao Su Invisible Durex 10S (10 Cái / Hộp) - 100930571
Sữa Rửa Mặt Cetaphil Gentle Skin Cleanser (125ml)
Nước tẩy trang SENKA A.L.L. CLEAR WATER Micellar Formula White 230ml
Sữa Rửa Mặt Tạo Bọt Chiết Xuất Tơ Tằm Trắng Senka Perfect Whip 120g - 14839
Nước Tẩy Trang Làm Sạch Sâu Cho Da Nhạy Cảm La Roche-Posay Micellar Water Ultra Sensitive Skin 400ml
Nước tẩy trang L'Oreal Paris 3-in-1 Micellar Water 400ml
Sữa Dưỡng Thể Trắng Da Chống Nắng Và Ô Nhiễm Môi Trường Vaseline SPF 24 PA ++ (400ml)
