"Máy Nghe Nhạc MP3 Mini Vỏ Nhôm, Kẹp Áo  Hỗ Trợ Thè Nhớ TF - Hàng nhập khẩu (Giao Màu Ngẫu Nhiên)"
"Ruizu D20 - Máy nghe nhạc MP4, màn hình cảm ứng - Hàng Chính Hãng"
Máy Nghe Nhạc Mp3 Ruizu X02 (Trắng) - Hàng Chính Hãng
Máy Nghe Nhạc MP3 Ruizu X02 8GB - Hàng Nhập Khẩu
Máy nghe nhạc Mp3 Mini
"Máy Nghe Nhạc Thẻ Nhớ, Usb, Nghe Kinh Phật, Đài Fm BK51"
Máy nghe nhạc MP3 Pro - Màn hình LCD tiện lợi ( MP3- PROB )
Máy ghi âm chuyên nghiệp RV01 15h ghi âm
Máy ghi âm Sony ICD-PX470 - Hàng Nhập Khẩu
"Máy nghe giảng Pháp, kinh phật, loa nghe tụng kinh, niệm phật dành cho người cao tuổi tặng thẻ nhớ 8Gb có sẵn các bài giảng Pháp"
"Máy Ghi Âm, Thiết Bị Ghi Âm siêu nhỏ chuyên dụng DVR 818 pin trên 35H - Hàng Chính Hãng"
Máy nghe nhạc xem phim hỗ trợ bluetooth đa ngôn ngữ tra từ điển cảm ứng dung lượng 8GB thế hệ mới nhất Ruizu M7 - Hàng Chính Hãng
Máy ghi âm Sony ICD-UX570F (Hàng nhập khẩu)
Máy ghi âm chuyên nghiệp SK-012 8G
Máy Ghi Âm Chuyên Nghiệp T60 Tích Hợp Micro Âm Thanh Kỹ Thuật Số Màn Hình LCD Công Nghệ VAR/VOR Hỗ Trợ Nghe Nhạc Mp3 AnZ - Thời Gian Ghi Âm Lên Tới 720 Phút
Máy Nghe Nhạc MP3 Ruizu X02 Bộ Nhớ Trong 8GB AZONE - Hàng Nhập Khẩu
Máy Nghe Nhạc Smart Watch MP3 Màn Hình Cảm Ứng Bluetooth Ruizu M8 Bộ Nhớ Trong 8GB Cao Cấp AZONE - Hàng Chính Hãng
"Máy phát hiện điện thoại, camera thiết bị nghe lén phát sóng,các thiết bị định vị GPS"
Máy nghe nhạc MP3 Bluetooth Ruizu D29 PD - Hàng Chính Hãng
Máy Phát Hiện Camera quay trộm Và Máy Ghi Âm nghe lén CC308
Máy nghe nhạc Hi-res Sony Walkman NW-A105 - Hàng phân phối chính hãng
"Máy Ghi Âm, Thiết Bị Ghi Âm Cao cấp GH700 Pin trên 300h - Hàng Chính hãng"
Máy ghi âm Sony ICD-TX650 (Hàng nhập khẩu)
"Radio mini nghe đài, nghe nhạc thẻ nhớ, USB, nghe kinh phật Craven CR-65 - có đèn pin (hàng nhập khẩu)"
"Đài kinh phật, máy tụng kinh, nghe pháp, Kèm nhiều bài pháp ý nghĩa đã ghi vào thẻ nhớ 8G"
Máy Nghe Nhạc MP3 F8 Bộ Nhớ Trong Sẵn 8G Cao Cấp AZONE - Hàng Nhập Khẩu
Máy Nghe Nhạc Kết Hợp Đài Phát Thanh Xe Hơi Mp3 20189 Điện Áp 12VDC
Máy ghi âm SK6 chất lượng cao
Máy ghi âm Sony ICD-PX240 (Hàng nhập khẩu)
"Máy nghe nhạc MP3, MP4 màn hình HD 2.4 inches Ruizu D08 Bộ Nhớ Trong 8GB AZONE - Hàng Nhập Khẩu"
"Máy Ghi âm, Định vị, Nghe từ xa qua điện thoại GF09"
Máy Ghi Âm - Thiết Bị Ghi Âm chuyên nghiệp 609 - Hàng Chính Hãng
Máy Nghe Nhạc MP3 Bluetooth Ruizu X16 Bộ Nhớ Trong 8GB AZONE - Hàng Nhập Khẩu
"K68 thiết bị dò tìm phát hiện camera, GPS, điện thoại, nghe trộm, nghe lén phát sóng không dây"
Máy nghe nhạc mp3 hình kitty dễ thương tặng tai nghe và dây sạc
Máy Ghi Âm Mini Chuyên Nghiệp GA805 Bộ Nhớ Trong 8GB Cao Cấp AZONE
Máy Ghi Âm Chuyên Nghiệp V90 Bộ Nhớ Trong 8Gb Công Nghệ Khử Tiếng Ồn Tự Động Khoảng Cách Ghi Âm Lên Tới 60m AnZ
Máy ghi âm chất lượng cao bộ nhớ trong 8GB 299 IPS
Máy nghe nhạc Mp4 verision 6 âm thanh HIFI Chất lượng cao - Hàng nhập khẩu (MP4.02)
Máy DJ Controller DDJ-SB3 (Pioneer DJ) sử dụng Serato DJ - Hàng Chính Hãng
Máy Ghi Âm kiêm Máy Nghe Nhạc Mini GH538 - Hàng Chính Hãng
"Máy nghe Pháp - Combo(danh sách Pháp, sách hướng dẫn, đài giọt nước, củ sạc Iphone, thẻ nhớ ) - Máy niệm phật "
Máy ghi âm Zoom H1N- Hàng nhập khẩu
Máy nghe nhạc Ruizu X52 Bluetooth Lossless 8GB - Hàng Nhập Khẩu
Máy Nghe Nhạc COWON U7 Black - Hàng Chính Hãng
"Máy dò thiết bị định vị, camera, ghi âm CC308+ - Tặng kèm đèn pin bóp tay mini"
Máy nghe nhạc Mp3 Mini - Máy Mp3 kẹp áo [Mp3mini] Hàng chính hãng
Máy nghe nhạc Hi-res màn hình full cảm ứng FiiO M3 Pro - Hàng Chính Hãng
Máy nghe nhạc mp3 tuyệt vời kẹp gắn quần áo
"Máy nghe nhạc MP4, màn hình lớn 2.4 inch Ruizu D08 - 8G Hàng Chính Hãng"
Máy Nghe Nhạc MP3 Lossless Bluetooth 4.1 Ruizu D16 Cao Cấp AZONE - Hàng Nhập Khẩu
Máy nghe nhạc mp3 Lossless thể thao bluetooth 4.0 RUIZU X50 8GB Hàng Nhập Khẩu
Máy ghi âm mini chuyên nghiệp Ruizu K60 Hàng nhập khẩu
Máy ghi âm chuyên nghiệp E80
Máy nghe nhạc Mp4 verision 6 âm thanh chuẩn thiết kế độc đáo - Hàng nhập khẩu (MP4.02)
Loa nghe nhạc mp3 B851
Máy Ghi Âm Chuyên Nghiệp A618 ROM 8GB Âm Thanh 360 Giảm Tiếng Ồn Hỗ Trợ Ghi Âm Chất Lượng Cao 3072KBPS
Máy Ghi Âm Yescool A7
Máy nghe nhạc mini Aigo MP3-206 (Tặng kèm thẻ nhớ 8Gb)-Hàng chính hãng
Máy ghi âm chất lượng cao T95 8GB
Bút Ghi Âm Micro Lọc Tiếng Ồn NewmanShinco RV-15 16G
Máy Nghe Nhạc ASTELL & KERN Activo CT10 - Hàng Chính Hãng
Máy Ghi Âm Chuyên Nghiệp A618 Bộ Nhớ Trong 8GB
Máy Nghe Nhạc MP3 Màn Hình Cảm Ứng Bluetooth Ruizu D66 Bộ Nhớ Trong 16GB - Hàng Chính Hãng
Máy Ghi Âm Cầm tay Remax RP1 - Hàng Chính Hãng +  Tặng Kèm 1 Ghế Đỡ  Điện Thoại Đa Năng T2
Máy Nghe Nhạc MP3 Màn Hình Cảm Ứng Bluetooth Ruizu M7 Bộ Nhớ Trong 8GB Cao Cấp AZONE - Hàng Chính Hãng
Máy Ghi Âm Sony ICD-TX650/BCE - Hàng Chính Hãng
MÁY GHI ÂM CẦM TAY ZOOM H1N hàng chính hãng
Máy Nghe Nhạc MP3 Bluetooth Ruizu D15 Bộ Nhớ Trong 8GB - Hàng Chính Hãng
"Máy Nghe Nhạc Ruizu D22 Lossless Bluetooth 4.1, Ghi Âm 3m, Loa Ngoài - Hàng chính hãng "
Máy Nghe Nhạc Cho Ô Tô MP3 Bluetooth Tích Hợp Radio 3077 Điện Áp 12VDC
Máy Ghi Âm RV05 8GB - Pin khủng 12 ngày ghi liên tục
Máy ghi âm Digital Voice Recorder GH-A500 8G
Máy Nghe Nhạc Lossless Bluetooth RUIZU D02 (8G)
"Máy Nghe Nhạc MP3, Lossless, FM, Ruizu D28 (4GB) - Hàng Chính Hãng"
Máy Nghe Nhạc Mini S61 NS 5593
Máy Nghe Nhạc MP3 Màn Hình Cảm Ứng 2.8 inch Bluetooth 5.0 Ruizu D66 Bộ Nhớ 16GB - Hàng Chính Hãng
Máy Ghi Âm Siêu Nhỏ Goldseee 609 8GB Chuyên Dụng
MÁY GHI ÂM SUNTECH V91 - 16G - Hàng Chính Hãng
Máy Phát Hiện Camera quay trộm Và máy Ghi Âm nghe lén Cx007
Máy Ghi Âm Nhỏ Gọn Lên Tới 48h Chuyên Nghiệp Hoàng Long STĐA RV01  ( 8G ) - Hàng Nhập Khẩu Cao Cấp 
Máy Nghe Nhạc MP3 Bluetooth Kèm Radio Cho Ô Tô 1012 Điện Áp 12VDC
"Máy Nghe Nhạc Ruizu M6 - Màn Hình Cảm Ứng 2.8 Inches, Bluetooth 5.0, Loa Ngoài, Pin 50h - Hàng Chính Hãng"
Máy Ghi Âm - Thiết Bị Ghi Âm chuyên dụng T60 cao cấp - Hàng Chính Hãng
Máy ghi âm kỹ thuật số 3072KBPS Giảm tiếng ồn thông minh Máy ghi âm chất lượng cao MP3 - Màn hình màu gương gương 5D AnZ
Máy Nghe Pháp MP3 Loại Nhỏ Có Màn Hình + Nút Chọn Bài
Máy nghe nhạc MP3 S6 (8G)
Máy Ghi Âm Chuyên Nghiệp Ruizu K05 Bộ Nhớ Trong 8GB Cao Cấp AZONE  - Hàng Chính Hãng
"Máy nghe nhạc thẻ nhớ, đài FM B-851"
Máy ghi âm mini chuyên nghiệp TC01
Máy ghi âm SK 111 ghi âm liên tục 7 ngày
Máy Nghe Nhạc COWON Plenue J - Hàng Chính Hãng
Máy Nghe Nhạc MP3 Lossless Ruizu A50 Cao Cấp AZONE - Hàng Nhập Khẩu
Máy ghi âm RV11 Pro - 8GB bộ nhớ trong
Máy nghe nhạc Blackpink icream how you like that tặng tai nghe chống rối
(Tecsun) DR920C radio full band elderly portable radio semiconductor college entrance examination English four six campus radio digital display (silver gray)
Máy DJ Controller DDJ-WeGO (Pioneer DJ) - Hàng Chính Hãng
Máy Nghe nhạc Mp3 ruizu x02  + Tặng thẻ nhớ 8Gb Class 10 - Hàng Nhập Khẩu
Máy nghe nhạc hoạt hình NS 5215 (Giao màu ngẫu nhiên)
Máy Ghi Âm Kỹ Thuật Số Có Điều Khiển Từ Xa Sony Chính Hãng ICD-TX800 
Máy nghe nhạc RUIZU 01 Bluetooth 8G  Hàng Nhập Khẩu
Máy nghe nhạc Lossless Ruizu D29 - Hàng Chính Hãng 
Máy nghe nhạc MP3 EXO tặng tai nghe khóa kéo chống rối
Máy Nghe Nhạc MP3 Bluetooth Kèm Radio 5009 Có 2 Cổng USB Dành Cho Ô Tô Điện Áp 12VDC
"MÁY PHÁT NHẠC LOA KÈN ĐỒNG ( MÁY SIÊU ĐẸP ) NGHE NHẠC QUA BLTOOTH, USB, ĐÀI FM, "
Usb Ghi Âm Q2 8Gb
Máy Nghe Nhạc Mp3 RUIZU X02 8G
Máy nghe nhạc BTS dynamite tặng tai nghe dây kéo chống rối BTS
Máy ghi âm mini tiện dụng DVR 818
Máy Nghe Nhạc Cảm Ứng Ruizu M9 Có Bluetooth (Bộ nhớ 16GB) - Hàng Chính Hãng
"Máy ghi âm cao cấp SK999 Tự động ghi âm khi có âm thanh, khả năng ghi âm 360 với 2 mic thu âm, dung lượng 8GB lưu trữ cực lâu lên đến 10 ngày"
Máy ghi âm pin siêu lâu 15 ngày liên tục GA15
Máy nghe nhạc Tiêu Chiến Xiao Zhan tặng tai nghe
Máy Ghi Âm Remax RP1  - Hàng Chính Hãng
"Máy Nghe Nhạc MP3 Màn Hình Cảm Ứng 1,8 inch Bluetooth Ruizu M4 16GB - Hàng Nhập Khẩu"
Máy Nghe Nhạc MP3 Bluetooth Ruizu M4 Bộ Nhớ Trong 16GB - Hàng Chính Hãng
Máy nghe nhạc Lossless Bluetooth FiiO M7 (Tặng kèm thẻ nhớ 16GB) - Hàng chính hãng
Máy ghi âm RV03 - Ghi âm 24h
Máy Nghe Nhạc Bluetooth Lossless RUIZU D02 Bộ Nhớ Trong 8GB - Hàng Nhập Khẩu - Màu Ngẫu Nhiên
Máy nghe nhạc Lossless thể thao HiFi Ruizu D01 8GB - Hàng Nhập Khẩu
Máy Ghi Âm Vandlion V16-8G
Máy Nghe Nhạc Astell&Kern AK70 64GB - Hàng Chính Hãng
Thiết bị DJ Controller DDJ-ERGO-V (Pioneer DJ) - Hàng Chính Hãng
Đài Học Ngoại Ngữ DVD Bearmax KVR - 1209 (Ghi Xám) - Hàng Chính Hãng
Máy DJ All In One System XDJ–RX2 (Pioneer DJ) - Hàng Chính Hãng
Bàn DJ Controller DDJ – RZ (Pioneer DJ) - Hàng Chính Hãng
Máy Ghi Âm Chuyên Nghiệp GA806 Bộ Nhớ Trong 8GB Cao Cấp AZONE
Máy ghi âm thanh chất lượng cao tiện dụng 805
Máy ghi âm chuyên nghiệp siêu lọc âm K7 8GB
Máy Ghi Âm Mini Chuyên Nghiệp Ruizu K60 Bộ Nhớ Trong 8GB - Hàng Chính hãng PD
Máy Nghe Nhạc MP3 Lossless Ruizu X02 Bộ Nhớ Trong 8GB AZONE - Hàng Nhập Khẩu
"Máy Nghe Nhạc Hifi, Bluetooth, Cảm Ứng, Loa Ngoài Ruizu A2 [Tặng Thẻ Nhớ 16GB] - Hàng Chính Hãng"
Máy Ghi Âm Newman (Newsmy) V19 8G
Máy Nghe Nhạc COWON Plenue V - Hàng Chính Hãng
Máy ghi âm ADG - Voice Recorder
 Máy Ghi Âm Cầm Tay ZOOM H5 - Hàng Chính Hãng
Máy Nghe Nhạc MP3 Ruizu M4 Bộ Nhớ Trong 16Gb - Màn Hình Cảm Ứng 1.8 Inch - Kết Nối Bluetooth 4.0 - Hàng Chính Hãng
Máy nghe nhạc MP3 thể thao lossless mini Hifi Ruizu A50 Màn hình 2.5inch Hàng Nhập Khẩu
Máy nghe nhạc loa ngoài X3 (8G) (Tặng 01 tai  nghe)
Máy ghi âm Sony PCM-A10 (Hàng nhập khẩu)
MÁY GHI ÂM SUNTECH ST600 - 16G - Hàng Chính Hãng
Máy ghi âm chuyên nghiệp DV-400 8GB
Máy Nghe Nhạc Màn Hình Cảm Ứng Bluetooth Ruizu M7 Bộ Nhớ Trong 8GB - Hàng Chính Hãng
Máy Nghe Nhạc Astell&Kern AK240 256GB - Hàng Chính Hãng
Máy Nghe Nhạc Panda (PANDA) F-381
Máy Nghe Nhạc Mp3 RUIZU X02 8G AZONE Hàng Nhập Khẩu - Trắng
Máy ghi âm giọng nói T90 8GB chất lượng cao
Máy nghe nhạc Mp3 lossless Ruizu D16 bluetooth 8G màn hình 2.4inch Hàng Nhập Khẩu
"Máy phát nhạc loa kèn đồng ( nghe NHẠC , BLUTOOTH, THẺ NHỚ - FM ) MẪU TO - MÀU ĐỒNG"
Máy Nghe Nhạc MP3 HiFi Thể Thao Bluetooth Ruizu X16 Bộ Nhớ Trong 8GB AZONE - Hàng Nhập Khẩu
Máy Ghi Âm Chuyên Nghiệp Shinco V-19 Xanh (16G)
Máy Ghi Âm Chuyên Nghiệp Cao Cấp A700 8GB - Digital Voice Recorder
Máy ghi âm RV04 - Bộ nhớ trong 8GB
MÁY GHI ÂM SUNTECH V32-8G - Hàng Chính Hãng 
CỦ LOA TOA TU-651
Máy Nghe Nhạc Astell&Kern AK120 II 128GB - Hàng Chính Hãng
Máy Ghi Âm Cao Cấp Goldseee A700 Tích Hợp Loa Ngoài Thời Lượng Pin Trên 300H
Máy Ghi Âm Chuyên Nghiệp 818 Bộ Nhớ Trong 8GB
Máy Nghe Nhạc Astell&Kern AK380 256GB - Hàng Chính Hãng
"MÁY NGHE NHẠC MP3 BTS,BIGBANG,IKON,WINNER,BLACKPINK"
Máy nghe nhạc mp3 Rubik Style cá tính 10h phát nhạc
Máy Nghe Nhạc Astell&Kern AK500N - Hàng Chính Hãng
Máy Ghi Âm Nhỏ Gọn SK6
Bàn DJ Controller DDJ-SX3 (Pioneer DJ) sử dụng Serato DJ - Hàng Chính Hãng
Máy Ghi Âm Kèm Nghe Nhạc Mini Aigo R5511 (8G)
Thiết bị DJ Controller DDJ-RZX (Pioneer DJ) - Hàng Chính Hãng
Máy nghe nhạc Mp4 iMEga Hifi - Hàng nhập khẩu
MÁY NGHE NHẠC HIFI BLUETOOTH REMAX RP2 - CHÍNH HÃNG 
Máy Nghe Nhạc MP3 Màn Hình Cảm Ứng Bluetooth Ruizu D25 Bộ Nhớ Trong 16GB - Hàng Chính Hãng
"Máy phát nhạc loa kèn đồng ( nghe đài FM, BLUTOOTH, THẺ NHỚ) "
Máy ghi âm Ruizu K60 PD Pin Lithium 8GB - Hàng Chính Hãng
Máy ghi âm thanh chất lượng cao 806
Máy Ghi Âm Chuyên Nghiệp Zoom H6 Black - Hàng Chính Hãng Tại  Việt Nam ( New Product )
Loa nghe nhạc cao cấp
Máy ghi âm Tích Hợp Quay Phim Kiêm Móc Khóa MC01
MÁY GHI ÂM SUNTECH ST600 - 8G - Hàng Chính Hãng 
Máy Nghe Nhạc Astell&Kern AK100 II 64GB - Hàng Chính Hãng
Usb Ghi Âm Lọc Âm G3 8GB - Lưu Trữ Liên Tục 100 Giờ
Máy nghe nhạc Mp4 iMEga Hifi (Tặng joystick chơi game) - Hàng nhập khẩu
Máy ghi âm TS600- 8GB
Máy  DJ Controller DDJ-1000SRT (Pioneer DJ) Hàng Chính Hãng
Máy Nghe Nhạc Astell&Kern AK300 64GB - Hàng Chính Hãng
Máy Ghi Âm Mini Chuyên Nghiệp Ruizu K60 Bộ Nhớ Trong 8GB Cao Cấp AZONE - Hàng Chính Hãng 
MÁY THU ÂM ZOOM H4N PRO CAO CẤP hàng chính hãng
MáyDJ Controller DDJ-1000 (Pioneer DJ) - Hàng Chính Hãng
Máy Ghi Âm Cầm Tay Remax RP–1 - Hàng Chính Hãng 
Máy Nghe Nhạc Ô Tô Chạy Hệ Điều Hành Androi Màn Hình Lớn 7 Inch Tích Hợp MP4 Bluetooth Wifi
Máy Nghe Nhạc Astell&Kern AK380 256GB Copper - Hàng Chính Hãng
Máy Ghi Âm Chuyên Nghiệp T68 Bộ Nhớ Trong 8GB - Digital Voice Recorder
MÁY GHI ÂM SUNTECH V91-8G - Hàng Chính Hãng
Máy nghe nhạc Vương Nhất Bác Wang Yibo tặng tai nghe khóa kéo 
Máy Ghi Âm Digital Voice Recorder Bộ Nhớ 8GB
Máy ghi âm Digitalvoice Stereo chuyên dụng AK-012 8GB
MÁY GHI ÂM SUNTECH V16-8G - Hàng Chính Hãng
Máy Ghi Âm Chuyên Nghiệp T60 Cao Cấp AZONE
Máy Ghi Âm Chuyên Nghiệp SK6 Cao Cấp AZONE
Máy Dịch Ngôn Ngữ Jinghua (JWD) HQ-68
Máy Ghi Âm Chuyên Nghiệp 299IPS Bộ Nhớ Trong 8GB Cao Cấp AZONE
Máy Ghi Âm Chống Ồn PCM Jinghua DVR-618 (32GB)
Máy Ghi Âm Kỹ Thuật Số Học Ngoại Ngữ Panda F-362 
Máy nghe nhạc Lossless Bluetooth Aigo MP3-209 (Tặng thẻ nhớ 8Gb và tai nghe)-Hàng chính hãng
Máy Ghi Âm Lọc Âm RV08 - Bộ nhớ trong 8GB
Máy Ghi Âm Chuyên Nghiệp GH-805  Bộ Nhớ Trong 8G Màn Hình LCD Tích Hợp Loa Ngoài - Thời Gian Ghi Lên Tới 560 Giờ AnZ
MÁY GHI ÂM SUNTECH V16-16G - Hàng Chính Hãng
"Máy Ghi Âm Chuyên Dụng Cao Cấp Goldseee 8I8 Tích Hợp Loa Ngoài, Pin Khỏe - Hàng Nhập Khẩu"
MP3 Bluetooth Lossless Màn Hình HD 2.4 inch - Hàng Chính Hãng
"Máy Nghe Nhạc Cầm Tay RUIZU D25 Bluetooth Bộ Nhớ 8GB Tặng Kèm Tai Nghe,Cáp Sạc - Hàng Chính Hãng"
Máy Ghi Âm Chuyên Nghiệp GH-Q6 8G Màn Hình LCD Tích Hợp Loa Ngoài - Có Hỗ Trợ Nghe Nhạc MP3 AnZ
Máy Nghe Nhạc Astell&Kern AK320 128GB Xám - Hàng Chính Hãng
Máy Nghe Nhạc Lossless Ruizu X02 Bộ Nhớ Trong 8GB AZONE - Hàng Nhập Khẩu
Máy Ghi Âm Newsmy V03 Bộ Nhớ 8G - Vàng
"Máy ghi âm JVJ J130 16GB (Ghi âm chất lượng cao, sách hướng dẫn tiếng Việt, thời lượng pin 30 tiếng liên tục) - Hàng Chính Hãng"
Máy nghe nhạc Mp3 Lossless Ruizu X16 Bluetooth 8G Hàng Nhập Khẩu
"Đài di động FM phát sóng , khe cắm thẻ nhớ,cắm USB SW-571 có đèn pin"
Máy Ghi Âm Chuyên Nghiệp GA818 Bộ Nhớ Trong 8GB Cao Cấp AZONE
"Máy Nghe Nhạc Kiêm Ghi Âm Chuyên Dụng Goldseee 538 Kích Thước Nhỏ, Bộ nhớ 8Gb Có Khe Cắm Thẻ Nhớ Mở Rộng"
MÁY GHI ÂM CẦM TAY REMAX RP1 - Hàng Chính Hãng 
Máy Nghe Nhạc Cảm Ứng Ruizu X05 Bộ Nhớ 8GB- Hàng Chính Hãng
MÁY GHI ÂM SUNTECH V25-8G - Hàng Chính Hãng
Máy ghi âm Vandlion V32-8G
Thẻ VIP Newsmy Tải Phần Mềm Chuyển Đổi Âm Thanh Sang Văn Bản (Phiên Bản Trung Quốc)
Máy Ghi Âm Và Học Tiếng Anh Panda F376
Robot Ghi Âm Không Dây iFLYTEK
Máy ghi âm Ic Recorder NS 2683
Máy Nghe nhạc Minecraft Like A Boss
MÁY GHI ÂM SUNTECH V25-16G - Hàng Chính Hãng
Máy Ghi Âm Chuyên Dụng Goldseee T60 Cao Cấp 8Gb Màn Hình Lớn Kèm Loa Ngoài - Hàng Nhập Khẩu
Máy Ghi Am 299IPS Tặng 1 Thẻ Nhớ 8GB
Máy nghe nhạc Lossless Ruizu X05 Bộ Nhớ Trong 8GB AZONE - Hàng Nhập Khẩu
"Máy Dò Cầm Tay K68 thiết bị chuyên dụng dò tìm camera , GPS, Máy Nghe Lén , Máy Ghi Âm"
"Máy dò định vị điện thoại, camera nhanh chóng, chính xác, cường độ sóng mạnh K18 (Tặng 3 nút kẹp cao su giữ dây điện -màu ngẫu nhiên)"
