"Micro Thu Âm Đa Năng dành cho điện thoại, máy ảnh live stream Boya MM1  - Hàng Chính Hãng"
Micro Gài Áo Cho Máy Quay Boya BY-M1 - Hàng Chính Hãng
Phông giấy mỹ chụp ảnh studio màu đen mã: 44
Micro thu âm Shotgun YC-VM200 Yichuang hàng chính hãng.
Micro Camera Rode NTG2 - Hàng Chính Hãng
Mic thu âm định hướng YC-CFM360 hàng chính hãng
Micro thu âm Wireless Go
Mic thu âm định hướng YC-CFM280 hàng chính hãng
"Micro không dây cho máy ảnh, máy quay Comica CVM-WM200 (A/C) - Hàng chính hãng"
Microphone Stand 2-in-1 Mic and Smartphone Clip Holder Desktop Microphone Flexible Hose Support for Live Streaming
Micro thu âm cài áo BOYA BY-M3D Type-C Hàng chính hãng
Micro thu âm không dây cài áo YC-WM500X1 hàng chính hãng
Micro thu âm cài áo BOYA BY-DM1 cổng Lightning cho Iphone Ipad
Bộ Micro thu âm không dây cài áo 2 người YC-WM500X2 hàng chính hãng.
Micro cho máy ảnh máy quay Boya BY-WM8 Pro-K2 - Hàng chính hãng
Micro thu âm không dây cài áo iphone YC-WM500A1  hàng chính hãng
Micro thu âm cài áo Saramonic SR-WM4C Wireless VHF
Mic thu âm đôi cho điện thoại iphone cổng Lightning VM60 hàng chính hãng
Micro thu âm không dây cổng Type-C 2 người YC-WM500C2 hàng chính hãng
Micro thu âm không dây cổng Type-C YC-WM500C1 hàng chính hãng
Micro cho máy ảnh máy quay Boya BY-WM8 Pro-K1 - Hàng chính hãng
Mic thu âm đôi cho điện thoại máy ảnh VM50 - Hàng chính hãng
Micro thu âm  NTG4+
"Micro shotgun cho máy ảnh, máy quay Boya BY-BM3031 - Hàng chính hãng"
Micro Thu Âm Boya Super Cardioid Shotgun BY-BM2021 - Hàng Nhập Khẩu
Micro thu âm cho Smartphone BY- A7H
Micro thu âm Shotgun YC-VM400 Yichuang chính hãng.
"Micro shotgun cho máy ảnh, máy quay Boya BY-BM3030 - Hàng chính hãng"
Micro thu âm không dây cho iPhone 2 người YC-WM500A2z hàng chính hãng
Bộ Micro Không Dây UHF Cho Máy Ảnh Comica CVM-WM100 Plus - Hàng Chính Hãng
Micro thu âm cài áo BOYA BY-M1 Pro Hàng chính hãng
"Micro cho điện thoại, máy ảnh, máy quay Comica CVM-VM10II-R - Hàng chính hãng"
Phông giấy mỹ chụp ảnh studio màu xanh lá mã: 13
Bộ lọc gió cho mic chuyên nghiệp  BY-WS1000 - Hàng nhập khẩu
Micro thu âm BOYA BY-WM4 Pro K3 - Hàng chính hãng
