"Ổ cắm Điện Quang ECO ĐQ ESK 5WR 8ECO (8 Lỗ, dây dài 5m, màu trắng đỏ)"
Ổ cắm Điện Quang ĐQ ESK 2W.SM750SL (5 lỗ 3 chấu dây 2 mét màu Trắng Đỏ)
Ổ Cắm Điện 3D + 3S Dây 3m x 2 Lioa 3D3S32 - Đen
Ổ Cắm Điện Tích Hợp Sạc USB Xiaomi Mi Power Strip - Hàng Chính Hàng
Ổ Cắm Điện 4S LIOA 4S5W (Dây 5m)
Ổ Cắm Điện 4 Ổ Đa Năng Có Nắp Che Lioa 4D32N (2200W)
Ổ Cắm 5 Lỗ 3 Chấu Dây 5 Mét Điện Quang ĐQ ESK 5B.SM750SL - Đen Trắng Đỏ
Ổ Cắm Nối Dài Cổng USB Comet CES4223 - 3 Mét - Hàng Chính Hãng
Ổ Cắm Điện Nakagami 2 USB + Ổ Cắm Đa Năng -Dây 2m (Giao màu ngẫu nhiên)
Ổ Cắm Điện 3D + 3S Dây 5m x 2 Lioa 3D3S52 - Đen
Ổ CẮM CHUYỂN ĐỔI 3 CHẤU – KÈM CÔNG TẮC TOSHINO – CO-6S
Ổ Cắm Nối Dài Comet CESG2503 - Hàng Chính Hãng
Ổ Cắm Nối Dài Kèm Cổng USB Comet CES5303 - 3 Mét - Hàng Chính Hãng
Ổ Cắm Điện Đa Năng Bagi 3 Ổ Điện + 4 Cổng USB
Ổ Cắm Điện Quang ĐQ ESK 5W. SM740SL (5m)
Ổ CẮM CHUYỂN ĐỔI CÁC LOẠI CHÂN CẮM VÀ CHIA 2 Ổ KÈM CÔNG TẮC TẮT BẬT TW2
"Ổ cắm điện 10 lỗ đa năng (6 lỗ 2, 4 lỗ 3) Lioa 4D6S32"
Ổ cắm hẹn giờ lập trình điện tử AL-06
Ổ cắm Điện Quang ĐQ ESK 5W.SM750SL (5 lỗ 3 chấu dây 5 mét màu Trắng Đỏ)
"Ổ cắm Điện Quang ECO ĐQ ESK 2WR 6ECO (6 Lỗ, dây dài 2m, màu trắng đỏ)"
Ổ Điện Đa Năng Chống Giật 3 Cổng USB và 9 ổ cắm iCART
PHÍCH CẮM GẬP HÀN QUỐC CAO CẤP
Ổ cắm điện Nakagami 8 lỗ dây dài 2m
Công tắc hẹn giờ cơ công suất lớn 15A Timer 24H Camsco TB35-N
"Ổ cắm Điện Quang ECO ĐQ ESK 2BR 32 ECO (3 lỗ 2 chấu, dây dài 2m màu đen đỏ)"
"Ổ cắm hẹn giờ al06 bật tắt tự động 16 chương trình,công tắc hẹn giờ"
Ổ Cắm Điện Có Nắp Che 6 Lỗ 3 Chân Mpower MP-265S - 5 Mét
Đầu chuyển ổ cắm 3 chấu qua 2 chấu - Hàng nhập khẩu
"Ổ cắm Điện Quang ECO ĐQ ESK 5BR 42 ECO (4 lỗ 2 chấu , dây dài 5m màu đen đỏ)"
"Ổ cắm Điện Quang ECO ĐQ ESK 2BR 42 ECO (4 lỗ 2 chấu, dây dài 2m màu đen đỏ )"
Ổ cắm điện đa năng tích hợp cổng cắm usb và đèn ngủ (3 chấu)
Ổ Cắm Điện Đa Năng Thông Minh Chống Giật 6 Lỗ Kèm 3 Cổng USB Tiện Dụng (Xanh)
"Ổ cắm nối chia 3 ngả, chân dẹt LIOA ON3NCD"
"Ổ cắm Xoay 90° Điện Quang ĐQ ESK RT 6WR (6 lỗ, màu xanh trắng)"
"Phích cắm thông minh Điện Quang Apollo ĐQ SP1.1 01 Wifi (Kiểu 1 lỗ, sử dụng wifi)"
"Ổ cắm công suất lớn Điện Quang ĐQ ESKHP 3RW 5M (3 lỗ, màu đỏ trắng, dây dài 5m)"
Ổ Cắm Công Suất Cao LIOA S3TC (Dây 3m)
Ổ Cắm 8 Lỗ Dây 2 Mét Điện Quang ĐQ ESK 2BR 8ECO - Đen Đỏ
Set 10 Phích cắm công suất lớn cao cấp Điện Quang ĐQ EPR HP 2PN (Màu ngẫu nhiên)
Ổ cắm kéo dài phổ thông LiOA 4 ổ cắm (4TS3-2 4TS5-2)
Ổ cắm điện Wifi thông minh TP-Link Tapo P100
Combo 2 Bộ Chuyển Đổi Ổ Cắm 2 Chấu Thành 3 Chấu
Ổ Cắm 5 Lỗ 3 Chấu Dây 2 Mét Điện Quang ĐQ ESK 2B. SM750SL - Đen Trắng Đỏ
"Ổ Cắm Điện Loại Chuyển Đổi Đa Năng - Phích Cắm Tiêu Chuẩn US, EURO, UK, AUST - Có 2 Cổng USB (Dual USB) - Phù Hợp Cho Những Chuyến Công Tác Và Du Lịch Nước Ngoài"
Ổ Cắm Điện 4 Lỗ 3 Chấu 3m Philips SPN1248WB/74 (2500W)
Ổ Cắm Điện 4 Ổ Lioa 4SS2.5-2 (3300W)
Ổ Cắm Điện Allocacoc PowerCube Extended USB 1.5M - Hàng Chính Hãng
Ổ Cắm Điện 3S Dây 5m x 2 Lioa 3S5
Phích Cắm Chuyển Đổi 3 Chấu Sang 2 Chấu Milliken NL-3106
Phích Cắm Chuyển Đổi 3 Chấu Sang 2 Chấu
"Ổ cắm điện Pisen KY-44 (4USB, 4AC ) - Ổ cắm điện thông minh, đa năng_Hàng chính hãng"
Ổ Cắm Nối Dài Kèm Cổng USB Nối Dài Comet CES6703 - 3 Mét - Hàng Chính Hãng
"Ổ Cắm Điện Đa Năng Kèm Đèn Ngủ, Có Cổng Sạc Điện Thoại Màu Ngẫu Nhiên"
"Ổ cắm điện LIOA, 6 lỗ 6 công tắc, ~2000W, dây dài 3m, mã:6DOF32N"
Ổ cắm kéo dài đa năng kết hợp LiOA (4D6S32 4D6S52)
"Ổ cắm điện thông minh 6 USB sạc nhanh 3.4A, dây dài 2 mét TITAN CD01 - Hàng chính hãng"
"Ổ cắm Xoay 90° Điện Quang ĐQ ESK RT 6WR (6 lỗ, màu hồng trắng)"
Phích Cắm Chuyển Đa Chiều Điện Quang ĐQ EPC NK-803-K-O (Màu Cam)
Ổ Cắm Điện 6 Ổ Lioa 6SS2.5-2 (3300W)
Ổ Cắm Xiaomi Zmi Power Strip 6 Cổng 2 USB CX05 - Hàng Chính Hãng
"Ổ cắm Điện Quang ECO ĐQ ESK 5BR 32 ECO (3 lỗ 2 chấu, dây dài 5m màu đen đỏ )"
Ổ cắm điện đa năng Honjianda HJD-0448B
ổ cắm điện thông minh xiaomi hàng nhập khẩu
"Bảng điện nổi V2 Điện Quang ĐQ FEP 32W 02S (màu trắng, 3 lỗ 2 chấu, 2 công tắc)"
"Bảng điện nổi V3 Điện Quang ĐQ FEP 32W 03S (màu trắng, 3 lỗ 2 chấu, 3 công tắc)"
Ổ cắm Điện Quang ĐQ 001A-01 (6 lỗ 2 chấu dây 5 mét)
"Ổ cắm nối chia 3 ngả, chân tròn LIOA ON3NC5"
Ổ cắm Điện Quang ĐQ ESK 2W. SM740SL (4 lỗ 3 chấu dây 2 mét màu Trắng Đỏ)
PHÍCH  CẮM CHUYỂN ĐỔI 3 CHẤU SANG 2 CHẤU VÀ CHIA 2 Ổ TOSHINO PS18-A2  2000W - HÀNG CHÍNH HÃNG
Ổ Cắm Điện Thông Minh Titan T-CA11 (Đen) – Hàng Chính Hãng
Phích cắm chia 3 ổ cao cấp (Tải 2200W)
Ổ cắm Điện Quang ĐQ ESK 2W.106 (Kiểu UFO 6 lỗ 3 chấu dây 2m màu trắng)
"Ổ cắm công suất lớn Điện Quang ĐQ ESKHP 3RB 5M (3 lỗ, màu đỏ đen, dây dài 5m)"
Ổ cắm kéo dài đa năng LiOA - 2200W 4 ổ cắm 4 công tắc 3m dây 2 lõi-4DOF32N
Ổ cắm Điện Quang ĐQ 001A-02-2M (2 lỗ dây 2 mét)
Ổ cắm không dây thông minh Xiaomi Mi Smart Plug (Wifi) ZNCZ05CM - Hàng Chính Hãng
Ổ cắm điện đa năng âm tường tích hợp 2 cổng usb sạc điện thoại máy tính bảng có công tắc bật tắt
Ổ cắm đa năng du lịch Adapter
Ổ cắm Điện Quang ĐQ ESK 2B.SM750SL (5 lỗ 3 chấu dây 2 mét màu Đen Trắng Đỏ)
Phích cắm chuyển đổi ổ cắm 3 chấu – Toshino – PS18
Ổ Cắm Kéo Dài Đa Năng Kết Hợp 10 Ổ Lioa 4D6S52 (2200W)
Ổ cắm kéo dài đa năng LiOA 6 ổ cắm 6 công tắc (6DOF32N 6DOF32WN)
Ổ cắm điện gồm 3 ổ cắm 1 công tắc - dây nguồn dài 3m
Ổ cắm du lịch Điện Quang ĐQ ESK TV01
Ổ cắm điện đa năng Bagi 3 ổ điện 4 cổng USB - Hàng chính hãng
Ổ cắm kéo dài quay tay kiểu Rulo nhỏ LIOA QN20-2-15A 20m x 2 15A
Ổ Cắm Điện 4 Lỗ 3 Chấu 2 cổng USB Philips SPN6248WB/74 (2500W)
ĐẦU CHUYỂN 3 CHẤU SANG 2 CHẤU CHÂN DẸP
Ổ cắm Điện Quang ĐQ ESK 2B. SM740SL (4 lỗ 3 chấu dây 2 mét màu Đen Trắng Đỏ)
"Ổ cắm Công suất lớn Điện Quang ĐQ ESKHP 3RB 2M (3 lỗ, màu đỏ đen, dây dài 2m)"
Ổ Cắm Nối Dài Comet CES4433 Dây 3 Mét - Hàng Chính Hãng
03 Phích cắm điện chuyển tròn sang dẹp
Ổ Cắm Điện Quang ĐQ 002A-02 (3 Lỗ) dây 2m
Ổ cắm điện 6 phích cắm 3 cổng USB
"Ổ cắm Điện Quang ECO ĐQ ESK 5WR 5ECO 2A (5 lỗ, dài 5 mét , màu trắng đỏ , 2 cổng USB 2.0A)"
Ổ cắm điện thông minh 6 USB sạc nhanh 3.4A TITAN CD01 - Hàng Chính Hãng
Ổ Cắm Điện 4D + 6S Dây 3m x 2 Lioa 4D6S32 - Đen
"Ổ cắm Xoay 90° Điện Quang ĐQ ESK RT 6WR (6 lỗ, màu đỏ trắng)"
Ổ CẮM ĐIỆN ĐA NĂNG KIÊM ĐÈN NGỦ CÓ CỔNG USB SẠC ĐIỆN THOẠI
Ổ cắm điện đa năng Sopoka
Bổ ổ cắm chống nước ngoài trời IP66
Công tắc hẹn giờ kg316T công suất lớn 25A/220V 17 chương trình (ĐEN) timer hẹn giờ điện tử ổ cắm hẹn giờ
"Ổ cắm điện LIOA, 6 lỗ 6 công tắc, ~2000W, dây dài 3m màu trắng Model 6DOF32WN"
Bảng điện nổi 15A có 3 ổ cắm 2 công tắc LIOA B-CB15A2C
Ổ cắm điện kéo dài quay tay HONJIANDA loại 4 ổ  - HJD-083R-10A (Dây dài 8 mét)
ổ cắm điện LiOA kiểu đĩa bay 3 ổ cắm (DB52-10A DB10-2-10A)
Bộ 10 nút bịt ổ điện chống giật an toàn cho bé và gia đình bạn
Ổ Cắm Điện Đa Năng Lục Giác 5 Ổ Cắm Điện+ 2 Cổng USB siêu tiên lợi
"Ổ cắm hẹn giờ, hẹn giờ cơ"
"Ổ cắm nối chia 3 ngả, chân cắm tròn phi4 LIOA ON3NC4"
Ổ cắm xách tay LiOA XTD10-2-10A dây 10m x 2 10A (Cam)
Cáp nối dài 3m LIOA (trắng) 10A điện áp 220V C3-2-10A
Ổ cắm hẹn giờ AL06 10A/220V
Ổ cắm hẹn giờ cơ MK-958 hẹn giờ tắt sử dụng đơn giản công suất 10A/220V
Ổ Cắm Điện 4S Dây 3m x 2 Lioa 4S3
"Ổ Cắm Điện Thông Minh Hình Chú Mèo 6 Ổ Cắm 3 USB Dây Điện Dài 180cm Đa Tính Năng Chống Giật Điện Hàng Siêu Cao Cấp, Ổ Điện Chống Cháy Nổ Chịu Được Công Suất Cao"
Ổ cắm Điện Quang ĐQ 002A-02 (3 lỗ dây 5 mét)
" 	Bộ dụng cụ treo cố định ổ cắm điện trượt thẳng siêu tiện dụng an toàn cho bé, giá đỡ các vật dụng gia đình GD248-TreoOCD-Vi "
Ổ cắm điện NAKAGAMI 8 lỗ dây dài 3m
Ổ Cắm Điện 4 Lỗ 3 Chấu 3m Philips SPN1348WB/74 (2500W)
Ổ cắm điện LIOA 8 ổ cắm đa năng có nắp che 8D32N (Đen) 3 mét- Hàng chính hãng
Ổ CẮM CHUYỂN ĐỔI CÁC LOẠI CHÂN CẮM VÀ CHIA 3 Ổ TW3
Bộ đổi nguồn điện 220V sang 110V 80W
Rơ le an toàn cho phao điện SRF-111M
Ổ cắm LiOA 6 lỗ 3 chấu 6D52N dây dài 5m
Ổ cắm hẹn giờ điện tử (TXO-06)
Ổ cắm kéo dài LiOA - 1000W 4 ổ cắm 3m dây 2 lõi-4TS3-2
Phích cắm chân dẹp gấp
"Giá Treo Ổ Cắm Điện, Điều Khiển Điều Hòa Tiện Ích"
Ổ Cắm Điện Allocacoc PowerCube Extended 2 Sạc USB - Màu Ngẫu Nhiên (1.5m)
Ổ cắm hẹn giờ bật tắt luân phiên B-196B
Ổ cắm điện đa năng Honjianda HJD-0655B
Ổ cắm kéo dài đa năng LiOA 8 ổ cắm (8D33N 8D33WN)
"Ổ cắm Điện Quang ECO ĐQ ESK 2WR 8ECO (8 Lỗ, dây dài 2m, màu trắng đỏ)"
Timer hẹn giờ điện tử tắt mở thiết bị điện ETG-63A 8 chương trình
Ổ cắm điện tròn an toàn có cổng sạc USB 
Ổ Cắm Điện Honjianda Loại 5 Ổ Có 2 Cổng USB - HJD-0436B-2U (Dây Dài 3m)
Ổ cắm điện đa năng tròn - Hàng chính hãng
Ổ Cắm Kéo Dài Công Suất Lớn LIOA 6OFSSV2.5-2 (Dây 2m5)
Cáp nối dài 10m 10A Lioa C10-2-10A 
Ổ cắm điện du lịch đa năng
Sonoff Basic - Công tắc WiFi thông minh
Bổ ổ cắm chống nước ngoài trời có công tắc IP66
Combo 2 rắc chuyển 3 chạc sang 2 chấu
PHÍCH CẮM ĐIỆN THÔNG MINH 1 CHIA 5 
Ổ cắm Điện Quang ĐQ 001A-02 (2 lỗ dây 5 mét)
Ổ Cắm Chân Đa Năng Có Công Tắc Bật Tắt Nguồn MD-17
Ổ cắm điện hẹn giờ Kawasan KW-TGE2B
ổ cắm  sạc 3 cổng USB  nhỏ gọn siêu cute
Ổ Cắm Lioa 3 Ổ Đa Năng Kéo Dài DB10-2-10 (Cuộn 10m)
"Đầu nối đa năng chuyển đổi phích cắm 3 chấu sang 2 chấu cao cấp , tiện lợi , an toàn , dễ sử dụng"
Ổ Cắm Điện Allocacoc PowerCube Extended 2 Sạc USB - Xám (3m) - Hàng chính hãng
Ổ cắm chia 3 ngả đa năng MPE TA4 - Tích hợp 2 cổng USB sạc nhanh 2.4A
Ổ cắm LiOA 3 ổ công suất cao - 3 mét - 3 lẩu S3TC
Bộ 2 Công tắc hẹn giờ cơ công suất lớn 15A Timer 24H Camsco TB35-N
Ổ cắm Điện Quang ĐQ 003A-04 (6 lỗ 3 chấu dây 5 mét)
"Ổ cắm Điện Quang ECO ĐQ ESK 5BR 6ECO (6 Lỗ, dây dài 5m, màu đen đỏ)"
Ổ cắm điện âm tường tích hợp cổng sạc usb 5v LG-AC2P2U2S-02GP - Hàng Chính Hãng
Công tắc cảm biến ánh sáng AS-22
Ổ Cắm Điện Allocacoc PowerCube Extended - Đỏ (1.5m)
Công tắc hẹn giờ lùi TPE TM3F
"Ổ cắm hẹn giờ ĐQ ESK DT12 W 13 (Điều chỉnh điện tử, 1 lỗ - 3 chấu, trắng)"
Ổ Cắm Wifi Điều Khiển Từ Xa Hỗ Trợ Đo Công Suất Tiêu Thụ Điện 10A  S6
Ổ cắm kéo dài đa năng kết hợp LiOA - 2200W 6 ổ cắm 3m dây- 3D3S32
Ổ điện 3 Cổng Sạc Nhanh
Ổ Cắm 5 Lỗ 3 Chấu Dây 5 Mét Điện Quang ĐQ ESK 5W.SM750SL - Trắng Đỏ
"Hộp bảo vệ ổ cắm điện M2 kích thước 32*13,5*13cm "
Ổ cắm điện đa năng thông minh kèm 3 cổng sạc USB siêu nhanh và tiện dụng
"Ổ cắm nối đa năng , chân dẹt LIOA ONCD"
Combo 2 ổ cắm công suất lớn chịu tải 3 nồi lẩu S3TC
Ổ Cắm Đa Năng LIOA 10OFFICE 3 (Dây 3m)
Bình Lưu Điện Cửa Cuốn YH POWER -600kg Chuẩn ISO
Bộ chia ổ điện 2 cổng USB - Giao màu ngẫu nhiên
"Ổ cắm Điện Quang ECO ĐQ ESK 5BR 8ECO (8 Lỗ, dây dài 5m, màu đen đỏ)"
Ổ Cắm 4 Lỗ 3 Chấu Dây 2 Mét Điện Quang ĐQ ESK 2B. SM740SL (Giao màu ngẫu nhiên)
Ổ điện thông minh có 6 phích cắm 3 cổng USB (Giao Màu Ngẫu Nhiên)
Ổ cắm điện tích hợp sạc đa năng
Ổ Cắm 5 Lỗ 3 Chấu Dây 2 Mét Điện Quang ĐQ ESK 2W. SM750SL - Trắng Đỏ
Ổ Điện Cao Cấp Hình Chữ T Đa Năng Kiêm Đèn Ngủ Tiện Dụng Sử Dụng 2 Cổng Sạc USB Có Vỏ Bọc An Toàn
"Ổ cắm Điện Quang ECO ĐQ ESK 2BR 6ECO (6 Lỗ, dây dài 2m, màu đen đỏ)"
Thiết bị hẹn giờ lập trình giờ bật tắt điện công suất lớn
Ổ cắm điện âm tường có cổng USB LGtech  LG-F21-022 - Hàng Chính Hãng
Ổ cắm điện - Chống Giật - Chống Quá Tải - 04 lỗ cắm chuẩn Châu Âu
Ổ cắm điện Nakagami 8 lỗ dây dài 5m
Ổ cắm du lịch Noatek
Dây điện mềm 0.3mm cuộn 100 mét lõi đồng nhiều sợi
Ổ cắm điện HONJIANDA loại 5 ổ và 2 cổng USB - HJD-0326B-2U
Ổ Cắm Điện Thông Minh 3Cổng Cắm Điện Kèm 4 Cổng USB - Bagi PS-4U - Hàng Chính Hãng 
Cầu Đấu Chia Dây Điện Đôi 1 Ra 8 FC8
Ổ cắm điều khiển quạt V2 BOYIN B-198S
Đui đèn cảm ứng vi sóng kawasan KW-RS686B
Ổ cắm hẹn giờ KW-SG36
"Ổ cắm Điện Quang ECO ĐQ ESK 5WR 8ECO (8 Lỗ, dây dài 5m, màu trắng đỏ)"
Ổ cắm Điện Quang ĐQ ESK 2W.SM750SL (5 lỗ 3 chấu dây 2 mét màu Trắng Đỏ)
Ổ Cắm Điện 3D + 3S Dây 3m x 2 Lioa 3D3S32 - Đen
Ổ Cắm Điện Tích Hợp Sạc USB Xiaomi Mi Power Strip - Hàng Chính Hàng
Ổ Cắm Điện 4S LIOA 4S5W (Dây 5m)
Ổ Cắm Điện 4 Ổ Đa Năng Có Nắp Che Lioa 4D32N (2200W)
Ổ Cắm 5 Lỗ 3 Chấu Dây 5 Mét Điện Quang ĐQ ESK 5B.SM750SL - Đen Trắng Đỏ
Ổ Cắm Nối Dài Cổng USB Comet CES4223 - 3 Mét - Hàng Chính Hãng
Ổ Cắm Điện Nakagami 2 USB + Ổ Cắm Đa Năng -Dây 2m (Giao màu ngẫu nhiên)
Ổ Cắm Điện 3D + 3S Dây 5m x 2 Lioa 3D3S52 - Đen
Ổ CẮM CHUYỂN ĐỔI 3 CHẤU – KÈM CÔNG TẮC TOSHINO – CO-6S
Ổ Cắm Nối Dài Comet CESG2503 - Hàng Chính Hãng
Ổ Cắm Nối Dài Kèm Cổng USB Comet CES5303 - 3 Mét - Hàng Chính Hãng
Ổ Cắm Điện Đa Năng Bagi 3 Ổ Điện + 4 Cổng USB
Ổ Cắm Điện Quang ĐQ ESK 5W. SM740SL (5m)
Ổ CẮM CHUYỂN ĐỔI CÁC LOẠI CHÂN CẮM VÀ CHIA 2 Ổ KÈM CÔNG TẮC TẮT BẬT TW2
"Ổ cắm điện 10 lỗ đa năng (6 lỗ 2, 4 lỗ 3) Lioa 4D6S32"
Ổ cắm hẹn giờ lập trình điện tử AL-06
Ổ cắm Điện Quang ĐQ ESK 5W.SM750SL (5 lỗ 3 chấu dây 5 mét màu Trắng Đỏ)
"Ổ cắm Điện Quang ECO ĐQ ESK 2WR 6ECO (6 Lỗ, dây dài 2m, màu trắng đỏ)"
Ổ Điện Đa Năng Chống Giật 3 Cổng USB và 9 ổ cắm iCART
PHÍCH CẮM GẬP HÀN QUỐC CAO CẤP
Ổ cắm điện Nakagami 8 lỗ dây dài 2m
Công tắc hẹn giờ cơ công suất lớn 15A Timer 24H Camsco TB35-N
"Ổ cắm Điện Quang ECO ĐQ ESK 2BR 32 ECO (3 lỗ 2 chấu, dây dài 2m màu đen đỏ)"
"Ổ cắm hẹn giờ al06 bật tắt tự động 16 chương trình,công tắc hẹn giờ"
Ổ Cắm Điện Có Nắp Che 6 Lỗ 3 Chân Mpower MP-265S - 5 Mét
Đầu chuyển ổ cắm 3 chấu qua 2 chấu - Hàng nhập khẩu
"Ổ cắm Điện Quang ECO ĐQ ESK 5BR 42 ECO (4 lỗ 2 chấu , dây dài 5m màu đen đỏ)"
"Ổ cắm Điện Quang ECO ĐQ ESK 2BR 42 ECO (4 lỗ 2 chấu, dây dài 2m màu đen đỏ )"
Ổ cắm điện đa năng tích hợp cổng cắm usb và đèn ngủ (3 chấu)
Ổ Cắm Điện Đa Năng Thông Minh Chống Giật 6 Lỗ Kèm 3 Cổng USB Tiện Dụng (Xanh)
"Ổ cắm nối chia 3 ngả, chân dẹt LIOA ON3NCD"
"Ổ cắm Xoay 90° Điện Quang ĐQ ESK RT 6WR (6 lỗ, màu xanh trắng)"
"Phích cắm thông minh Điện Quang Apollo ĐQ SP1.1 01 Wifi (Kiểu 1 lỗ, sử dụng wifi)"
"Ổ cắm công suất lớn Điện Quang ĐQ ESKHP 3RW 5M (3 lỗ, màu đỏ trắng, dây dài 5m)"
Ổ Cắm Công Suất Cao LIOA S3TC (Dây 3m)
Ổ Cắm 8 Lỗ Dây 2 Mét Điện Quang ĐQ ESK 2BR 8ECO - Đen Đỏ
Set 10 Phích cắm công suất lớn cao cấp Điện Quang ĐQ EPR HP 2PN (Màu ngẫu nhiên)
Ổ cắm kéo dài phổ thông LiOA 4 ổ cắm (4TS3-2 4TS5-2)
Ổ cắm điện Wifi thông minh TP-Link Tapo P100
Combo 2 Bộ Chuyển Đổi Ổ Cắm 2 Chấu Thành 3 Chấu
Ổ Cắm 5 Lỗ 3 Chấu Dây 2 Mét Điện Quang ĐQ ESK 2B. SM750SL - Đen Trắng Đỏ
"Ổ Cắm Điện Loại Chuyển Đổi Đa Năng - Phích Cắm Tiêu Chuẩn US, EURO, UK, AUST - Có 2 Cổng USB (Dual USB) - Phù Hợp Cho Những Chuyến Công Tác Và Du Lịch Nước Ngoài"
Ổ Cắm Điện 4 Lỗ 3 Chấu 3m Philips SPN1248WB/74 (2500W)
Ổ Cắm Điện 4 Ổ Lioa 4SS2.5-2 (3300W)
Ổ Cắm Điện Allocacoc PowerCube Extended USB 1.5M - Hàng Chính Hãng
Ổ Cắm Điện 3S Dây 5m x 2 Lioa 3S5
Ổ Cắm 6 Ổ Đa Năng Lioa 6OFSSV2.5-2 (3300W)
Ổ cắm điều khiển từ xa công suất lớn HT-9501
"Ổ cắm điều khiển từ xa qua wifi BSD29 ( Bật tắt, hẹn giờ điện ở nhà dù bạn ở bất kì đâu ) - CÔNG SUẤT LỚN"
Ổ Cắm Điện Đa Năng Tích Hợp 3 Cổng USB Xiaomi - hàng chính hãng
Ổ Cắm Có Dây Panasonic WCHG2836 (3m)
Ổ cắm điện du lịch đa năng 2 ổ và 2 cổng sạc USB - Sopoka Q2U
Ổ cắm sạc USB 8 cổng YC-CDA6
Ổ Cắm Có Dây Panasonic WCHG28334 (3m)
Bảng điện nổi 15A có 3 ổ cắm 3 công tắc LIOA CB15A3C
"Đầu phích cắm tiêu chuẩn châu Âu, có cực nối đất LIOA PUK"
Ổ cắm điện thông minh kèm đèn led và 2 cổng sạc điện thoại GS0075
Bộ 12 Bịt Ổ Điện - Nội Địa Nhật Bản
Ổ cắm điện hình mèo loại lớn 6 ổ điện 3 cổng usb siêu kute - 1 ổ(giao mẫu ngẫu nhiên)
Ổ Cắm 6 Lỗ 3 USB Xiaomi Power Strip
"Ổ ĐIỆN 5 TẦNG 20 Ổ CẮM,3 CỔNG USB"
Ổ cắm kéo dài đa năng LiOA 6 ổ cắm 6 công tắc (6DOF33N 6DOF33WN)
"Ổ cắm Điện Quang ECO ĐQ ESK 5WR 6ECO (6 Lỗ, dây dài 5m, màu trắng đỏ)"
Phích cắm điện 3000w
Ổ cắm điện âm tường có cổng usb mã BS2P2U2S-02BP
Ổ cắm kéo dài phổ thông LiOA 6 ổ cắm 2 công tắc (6S3 6S5)
Ổ Cắm Wifi Thông Minh SONOFF S26 
Ổ cắm Belkin BV101000thCW
Ổ Cắm Điện Thông Minh Pisen PSCXB-01A (5AC) (Trắng) - Hàng Chính Hãng
DƯỠNG TÂM GIÀU CÓ DƯỠNG THÂN NGHÈO KHÓ - NGUYỄN ANH DŨNG
Ổ cắm kéo dài quay tay Rulo phổ thông LiOA (QT50-2-15A)
Phích Cắm Chuyển Đổi  3 chấu thành 2
Sonoff S20 - Phích cắm WiFi thông minh
Ổ Điện Có Cổng USB Đa Năng
Đầu phích cắm tiêu chuẩn châu Âu  LIOA EURF5
"Ổ cắm Điện Quang ECO ĐQ ESK 2WR 43ECO (4 Lỗ 3 chấu, dây dài 2m, màu trắng đỏ)"
Hộp bảo vệ chống thấm nước cho công tắc Sonoff
Ổ Cắm Điện HONJIANDA Loại 3 Ổ Và 2 Cổng USB - HJD-0644B-2U
Bộ Chuyển Đổi Điện Revolve TH-1010 220AC110AC 80w
Ổ Cắm Điện Có Nắp Che 5 Lỗ 2 Chân Mpower MP-153 - 3 Mét
"Ổ Cắm Điện Pisen KY-23(EP) (2 x AC, 3 x USB)"
"Hộp đựng ổ điện chống giật, hộp đựng ổ điện, chất liệu bằng nhựa cứng dày dặn chống giật. bảo vệ trẻ nhỏ"
Ổ Cắm Điện Thông Minh Tích Hợp 4 Cổng Sạc USB
Ổ cắm điện 02 USB Ucomen (Dây 3m)
"Phích cắm chia 3 ổ Cao cấp ominsu (Tải lớn, Chịu lực chống va đập)"
Ổ cắm điện chống giật 6 lỗ 3 cổng usb
Phích cắm chuyển đầu cho laptop lioa
Ổ cắm điều khiển từ xa 100M/10A/220V sóng RF 315 xuyên tường HT-6805WCX
"Ổ Cắm Kéo Dài Quay Tay, Cuộn Dây Kín Kiểu Xách Tay LIOA XTD 10-2-15A (Dây 10m)"
Đế âm tường đơn vuông nhựa cao cấp LG-DAV-001 - Hàng Chính Hãng
Ổ Cắm Đa Năng Có Cổng Sạc USB LIOA 6D32WNUSB (Dây 3m)
Combo 2 Hộp Tiết Kiệm Điện Gia Đình ELECTRICITY SAVING BOX
Bộ công tắc điều khiển từ xa 1KM bật tắt máy bơm nước máy rửa xe đông cơ công suất lớn 30A/220V có chức năng học lệnh HT-9220KB
Ổ Cắm Điện 6 Ổ Đa Năng Kết Hợp Có Nắp Che Lioa 3D3S32N (2200W)
Ổ cắm điện Huntkey SZM401 tiêu chuẩn Châu Âu 
Ổ cắm điện PowerCube Allocacoc
Ổ cắm kéo dài đa năng LiOA 8 ổ cắm (8D32N 8D52N 8D32WN 8D52WN)
Ổ Cắm Điện Đa Năng TM-BLB01 (Màu Ngẫu Nhiên)
Phích Cắm Chuyển Đổi 3 Chấu Sang 2 Chấu Tiện Dụng
"Ổ cắm điện hẹn giờ đếm ngược TW-935, 1-10 tiếng, Công tắc hẹn giờ điện tử"
Bộ 5 Ổ cắm nối đa năng chân cắm dẹp LIOA
Hộp tiết kiệm năng lượng điện thông minh cho gia đình ELECTRICITY SAVING BOX 
Ổ cắm điều khiển từ xa bằng remote TV và remote RF TF10v2
Dây Điện Mêm Chống Cháy 0.3mm cuộn 100m
Đế âm tường đôi  nhựa cao cấp cho Ổ cắm điện đôi đa năng LGTech  LG-DAD-001 - Hàng Chính Hãng
Bộ 02 Ổ Cắm Nối Dài An Toàn Comet CESG2405
Ổ cắm điện Honjianda HJD-0315B
Ổ cắm Điện Quang ĐQ ESK02 143L2 (4 lỗ 3 chấu dây 2 mét)
Ổ Cắm Điện 4D + 6S Dây 5m x 2 Lioa 4D6S52 - Đen
"Ổ Cắm Công Suất Lớn Điện Quang ĐQ ESKHP 3RB (3 Lỗ, Màu Đỏ Đen, Không Dây)"
Ổ cắm Điện Quang ĐQ ESK 2WR.UK986 (Kiểu UFO 6 lỗ 3 chấu dây 2 mét màu Trắng Đỏ)
Phích Cắm 3 Chấu Lioa 
Ổ Điện 2 Tầng Thông Minh  Đa Năng - 8 Ổ Cắm 3 Cổng USB
Ổ Cắm Điện Gongniu Đa Năng 8 Ổ 1 Công Tắc – Công Suất 10A/250/2500W – Trắng – Chính Hãng (V1080)
Ổ cắm xoay 90º Điện Quang ĐQ ESK RT 63 (6 lỗ 3 chấu)
Ổ Cắm Có Dây Panasonic WCHG28352 (3m)
Ổ CẮM ĐIỆN KHÔNG DÂY 2 LỖ HÀN QUỐC
Ổ Cắm Điện Xiaomi Tích Hợp 2 Cổng 2 USB - Hàng Nhập Khẩu
Đầu chuyển đổi đui xoáy từ E14 sang E27
Phích cắm điện cái
Ổ cắm điều khiển từ xa TPE TF2A 
Ổ cắm điện đa năng Honjianda HJD-0533B
Ổ Cắm 6 Lỗ 3 Chấu Dây 2 Mét Điện Quang ĐQ 003A-04-2M
"Phích cắm chuyển 3 chấu ĐQ NK 803 tiện lợi màu  xanh dương , trắng ( Hàng Chính Hãng )"
Ổ Cắm Nối Dài Comet CESG1403 - Đồng Đen - Hàng Chính Hãng
Ổ cắm điện tích hợp đèn ngủ và cổng sạc USB tiện dụng
"Ổ cắm Điện Quang ECO ĐQ ESK 5WR 43ECO (4 Lỗ 3 chấu, dây dài 5m, màu trắng đỏ)"
Ổ Cắm Đôi Chân Đa Năng Có Công Tắc Bật Tắt Nguồn MD-18
Ổ Cắm Điện 2D + 2S Dây 5m x 2 Lioa 2D2S52 - Đen
Ổ cắm điện đa năng tiện dụng
Ổ cắm thông minh Wifi thế hệ mới SP mini 3
Công tắc hồng ngoại điều khiển từ xa TPE IR2A
Ổ Cắm Điện Pisen 008-EP
Ổ CẮM KÉO DÀI LIOA 3 CHẤU 8 LỖ ĐA NĂNG DÂY DÀI 3M MODEL 8D32N
"Ổ cắm điều khiển từ xa wifi C1818 ( ĐỘ BỀN CAO, CHẤT LƯỢNG ĐẢM BẢO )"
ổ cắm điện LiOA kiểu đĩa bay 3 ổ cắm DB32-15A
Ổ cắm có bảo vệ quá tải bằng CB 4 ổ cắm 4 công tắc dây 3m LIOA -  4SOF3
Ổ cắm hẹn giờ cơ TW-260 (30 phút)
Công tắc hẹn giờ TPE TM3AV2 năm 2018
Ổ cắm điện 3 chấu đa năng có công tắc có đèn LED size EU LG-F21-065 - Hàng chính hãng   
Ổ cắm điện chuẩn châu âu 2 lỗ mặt vuông kèm đế âm tường | LG-F21-018 - Hàng Chính Hãng
Ổ điện thông minh có 6 phích cắm 3 cổng USB (Giao Màu Ngẫu Nhiên)
Bộ 5 Ổ cắm nối đa năng chân cắm tròn PHI5 Φ5 LIOA
Ổ Cắm Điện Đa Năng Có Đèn Ngủ Và Cổng Usb
Công tắc điều khiển từ xa 1 cổng kèm pin
Ổ cắm rời siêu chịu tải công suất 8000W
Đui đèn cảm ứng KAWASAN  KW-SS682
Ổ Cắm Lioa 3 Ổ Đa Năng Kéo Dài DB52-10A (Cuộn 5m)
Công tắc giật dây
"Ổ CẮM CAO SU – TOSHINO TRS-215 TẢI 3500W , DÂY DÀI 5M"
Trạm sạc thông minh LIOA 2 ổ cắm đa năng 5 ổ USB - 2D22N5USB
Ổ Cắm LIOA Kiểu Đĩa Bay Cuộn Dây Kín Dây 10 Mét 3 Ổ Đa Năng DB10-2-10A- Hãng chính hãng
Ổ Cắm 6 Lỗ 2 Chấu Dây 5 Mét Điện Quang ĐQ 001A-01
Bộ chia ổ điện 4 cổng có 2 cổng usb và đèn ngủ - BY9019 - Hồng - Onesize
Ổ cắm điện HONJIANDA loại 3 ổ và 2 cổng USB - HJD-0324B-2U
Ổ Cắm Điện Allocacoc PowerCube Original
Phích cắm âm chịu tải cao dùng công trường SA3000W
Ổ cắm điện Pisen PSCXB-03A (8AC ) - hàng chính hãng
Ổ Cắm Điện Nakagami 4 Lỗ (2m)
Ổ cắm điện đa năng 2 tầng
Combo 2 Phích Cắm Điện Đầu Đực
Ổ Cắm Điện Honjianda Loại 5 Ổ - HJD-0155R2 (Dây Dài 3m)
"Ổ cắm điện 4 lỗ đa năng (2 lỗ 2, 2 lỗ 3)  Lioa 2D2S32"
Cáp nối dài 2 lõi 10A  LiOA (C3-2-10A C5-2-10A C10-2-10A C15-2-10A )
COMBO 2 ĐẦU CHUYỂN ĐIỆN 3 CHÂN THÀNH 2 CHÂN
