"Bột Cắm Hoa ISRAEL (Combo 50 gói dưỡng hoa), Hiệu Longlife giữ hoa tươi lâu gấp 2 lần và 14 ngày không thay nước mới"
Nước cắm hoa lâu tàn Keep Flowering (1000ml)
 (COMBO 30 GÓI) GÓI DƯỠNG HOA TƯƠI LONGLIFE CỦA ISRAEL GIỮ HOA TƯƠI LÂU GẤP 2 LẦN VÀ 14 NGÀY KHÔNG THAY NƯỚC MỚI
Combo 03 Chai Nước cắm hoa lâu tàn Keep Flowering (1000ml/chai)
"Dưỡng Hoa Lâu tàn nhập khẩu Israel (Combo 50 gói), Hiêu Longlife"
"Dinh Dưỡng Giữ Hoa Hồng cắm bình Lâu Tàn - Food For Cut Flowers (Set 50 gói loại 5gr) giúp hoa luôn tươi mớ, cứng cáp gấp 2 lần và trong 14 ngày không thối nước hay cắt tỉa gốc hoa, nhập khẩu Israel"
"Hủ 1KG Bột Dinh Dưỡng Hoa Lâu Tàn dành cho Shop Hoa, Vựa Hoa hiệu Longlife SG nhập khẩu Israel, giúp bảo quản hoa cắm MUD tươi gấp 2 lần bình thường và Hạn chế thay hoa định kỳ"
Nước cắm hoa lâu tàn (Set 100 gói) dạng bột nhập khẩu Israel Food For CUT Flowers mỗi gói tạo ra 0.5L dung dịch xử lý hoa cắm bình
Nước cắm hoa tươi lâu công nghệ i on đồng HUMIK
Combo 20 Chai Nước cắm hoa lâu tàn Keep Flowering (1000ml/chai)
Combo 50 gói Nước cắm hoa lâu tàn dạng bột 5gr của Israel giúp hoa Hoàng Anh và hoa khác tươi lâu và hạn thay nước cho hoa
"Bột Cắm Hoa Lily Tươi Lâu, Hiệu Longlife nhập khẩu Isarel (Bộ 30 gói)"
Combo 5 Hộp DINH DƯỠNG HOA CẮT CÀNH (Food for Cut Flowers)(1 hộp 10 gói 5gr). Giúp hoa cắt cành tươi lâu và 14 ngày không thay nước mới. Giải pháp tối ưu theo công nghệ Israel
"Bột Dưỡng Hoa Hồng Lâu Tàn (Set 10 hộp 1 hộp 10 gói tiết kiệm) giúp hoa luôn tươi mới, cánh hoa hồng cứng cáp gấp 2 lần và trong 14 ngày không thối nước hay cắt tỉa gốc hoa (hiệu Longlife nhập khẩu Israel)"
"Bột cắm hoa cắt cành Longlife SG của Israel - Food For Cut Flower (Combo 3 hộp 1kg), giúp shop hoa bảo quản hoa tươi lâu và không thay nước, cắt tỉa gốc hay hạn chế thay hoa định kỳ theo tuần"
Combo 50 Bông Hoa Cẩm Tú Cầu Tươi Vĩnh Cữu
Bột Cắm Hoa Tươi Lâu Longlife Của Israel (Bộ 10 hộp – 100 gói)
Gói Cắm Hoa Tươi Lâu Gấp 2 Lần Và 14 Ngày Không Thay Nước Loại 5gr Longlife (Bộ 50 gói)
Bột Dưỡng Hoa Cắt Cành Longlife - Food for Cut Flowers - nhập khẩu ISRAEL (COMBO 100 gói tiết kiệm) giúp hoa tươi gấp 2 lần và 14 ngày không thay nước hay cắt tỉa lại gốc hoa
5 KG Bột Dưỡng Hoa Tươi Lâu Longlife SG ISRAEL
Nước cắm hoa ION đồng HUMIK 5 lít pha được hơn 500 lít nước.
"Dung Dịch Xử Lý Hoa TOG Galileo của ISRAEL (Chai 1 Lít) dùng bảo quản hoa cắt cành tươi lâu tại Nhà Vườn Trồng Hoa, Vựa Hoa và Chợ Sỉ Hoa. Tỷ lệ dung dịch 0.1% tức chai 1 Lít TOG pha được 1.000 Lít dung dịch xử lý hoa"
"Set 50 gói Bột Dung Dịch Dưỡng Hoa LILY Longlife Nhập khẩu Israel giúp hoa Lily tươi lâu gấp 2 lần, cánh hoa đậm màu và 14 ngày không thay nước cắm hoa (1 gói 5gr pha được 0.5 lít nước) "
Chăm sóc hoa lâu tàn bằng bột dưỡng cho hoa cắt cành nhập khẩu Israel (Set 50 gói) giữ hoa lâu tàn gấp 2 lần bình thường và 14 ngày không thay nước mới
cặp lọ hoa đá ngọc sepentine tự nhiên
Lọ hoa bầu điêu khắc 
"Shop Hoa Bảo Quản Hoa Cắm Lẵng, Hoa Cắm Xốp lâu tàn và hạn chế thay hoa định kỳ bằng Bột Dinh Dưỡng Hoa nhập khẩu Israel hiệu Longlife SG Của Israel (Thùng 5KG Bột Dưỡng Hoa Israel)"
NƯỚC CẮM HOA HUMIK CÔNG NGHỆ ION ĐỒNG COMBO THÙNG 12 CHAI  250ML
Dung Dịch Cắm Hoa Lan Vũ Nữ Lâu Tàn dạng bột của Israel (Combo 100 gói) giúp hoa lan nở đến nụ cuối cùng và hạn chế đen gốc hoa
Set 2kg Dung Dịch Xử Lý Hoa Lan Vũ Nữ Tươi Lâu Longlife SG Israel - Food For Cut Flower (1kg pha được 100L dung dịch) là dung dịch trong TIP Nhựa bảo quản Hoa Lan Vũ Nữ cắt cành tươi lâu
NƯỚC CẮM HOA HỒNG LÂU TÀN (1 LÍT TOG) nhập khẩu ISAREL dành cho Nhà Vườn Trồng Hoa Grower bảo quản hoa
NƯỚC CẮM HOA HUMIK CÔNG NGHỆ ION ĐÒNG HỘP 20 GÓI 10ML
