"Giấy ăn gấu trúc siêu dai, an toàn khi sử dụng, giấy ăn sợi tre an toàn không chất tẩy trắng (Thùng 30 gói)"
Bộ 20 gói giấy ăn than tre gấu trúc
Combo 100 túi lọc rác bồn rửa chén siêu tiện dụng - Mẫu ngẫu nhiên
giấy ăn gấu trúc Ycool khăn giấy tre 1 thùng 30 gói 300 tờ siêu dai mềm mại
Combo 200 Túi Lọc Rác Thái Dương Siêu Tiện dụng cho Bồn rửa Chén bát 
Túi lọc sữa đậu nành
Dụng cụ băm rau củ quả Lock&Lock Quick Chopper
"Giá Để Giẻ Rửa Bát, Nước Rửa Chén Đa Năng Inox 304"
Bộ 2 gói gồm 200 túi lọc rác bồn rửa thông minh có thể tái sử dụng
"Combo 4 Cây Cọ Silicon Cán Trong Quét Dầu, Bơ, Kem Trang Trí Bánh (ngẫu nhiên)"
Túi Đựng Hộp Cơm Giữ Nhiệt Đa Lớp Nhiều Hoa Văn
Combo Túi Lọc Rác cho bồn rửa chén bát
"LỒNG BÀN GIỮ NHIỆT DELISH GIỮ MÓN ĂN NÓNG HỔI, THƠM NGON"
"Máy Xay Tỏi Ớt Kéo Tay, Dụng Cụ Xay Nghiền Tỏi Ớt Mẫu Mới 2020"
 Đầu vòi rửa chén tăng áp nhựa mạ điện-Ba phương pháp thoát nước
Bộ 10 gói giấy ăn than tre gấu trúc
Túi Đựng Hộp Cơm Giữ Nhiệt- Túi Trữ Lạnh Cao Cấp Chống Thấm Nước Mhome MH2107
Vòi rửa chén tăng áp 3 chế độ nước
"Máy ép trái cây bằng tay FRU-227, Ép táo, lựu, bưởi, dưa, thơm Dụng cụ Ép cam chuyên dụng"
"DẬP TỎI DÂY RÚT,Máy xay tỏi ớt cầm tay Mini Food Chopper Tiện dụng"
"TỜ GIẤY NẾN ĐỤC LỖ DÙNG ĐỂ HẤP, NƯỚNG - size 23 cm ( tặng 1 món quà xinh )"
"Máy Xay Mini Sạc Điện Xay Hành, Tỏi, Rau Củ Dung Tích 250ml"
Bộ 2 Giấy Không Thấm Dầu / Giấy Nướng Bánh Goodbake GB30 (30cm x 5m)
"Túi Lọc Sữa Đậu Nành, Túi Lọc Sữa Hạt Cao Cấp, Túi Lọc Trà, Túi Lọc Gia Vị - Hàng Chính Hãng Amalife"
"Đầu vòi rửa chén , đầu vòi tăng áp lọc nước, Đầu vòi rửa chén tiết kiệm nước - tặng kèm Móc treo khăn"
ĐẦU VÒI RỬA CHÉN TIẾT KIỆM NƯỚC XOAY 360 ĐỘ
"Túi Đựng Hộp Cơm Giữ Nhiệt, Không Thấm Nước Delicious (23 x 15 x 21cm)"
"Dụng cụ nhồi xúc xích, lạp xưởng, dồi, mực nhồi bằng tay"
Lọ xay tiêu Inox 304 DandiHome cao cấp
Bộ 6 Nắp Đậy Silicon Đa Năng Nhiều Màu
Dụng cụ băm rau củ quả Lock&Lock Quick Chopper CKS308
Bộ 15 gói giấy ăn than tre gấu trúc
"Túi đựng hộp cơm giữ nhiệt/ Túi đựng đồ ăn trưa/ Túi chống toả nhiệt, dày dặn, có tay xách, phong cách Hàn Quốc thời trang, hiện đại Ver.6"
Túi giữ nhiệt văn phòng dây rút tiện dụng
Dụng cụ xay tỏi ớt thịt và thực phẩm nhà bếp E1920
Combo 100 Túi Lọc Trà Có Dây Rút
Kem Tẩy Rửa Xoong Nồi Đa Năng Hàn Quốc 500ml
"Đầu vòi tăng áp điều hướng 360 độ, 3 chế độ chảy Eurolife EL-TA01 (Trắng)"
Bộ 02 Cọ Quét Bột Silicon - Giao Màu Ngẫu Nhiên
Đầu Vòi rửa chén Tăng Áp công tắc đổi kiểu _ bông tăng áp rửa chén BTA4_Đầu vòi rửa bát tăng áp lực nước 2 chế độ phun_đầu tăng áp rửa chén bát nhựa ABS si inox cao cấp_ đầu vòi rửa chén tăng áp_ vòi rửa chén đa năng
Dụng cụ bóc vỏ tôm chuyên dụng 
Combo 200 túi lọc rác bồn rửa bát
Dụng Cụ Nhồi Xúc Xích Lạp Xưởng
Đầu vòi tăng áp 3 mức độ cho bồn rửa chén  
cuộn giấy than tre gấu trúc ( gồm 36 cuộn)
TÚI LỌC RÁC GIỮ RÁC BỒN RỬA CHÉN 
"Giá inox gắn vòi để búi rửa chén, xà phòng nhà bếp gọn gàng sạch sẽ"
Bộ 2 rổ lọc rác bồn rửa chén inox 304 cao cấp
Vòi nước rửa bát tăng áp xoay 360 độ 3 chế độ xả nước
"Dụng Cụ Đựng Nước Rửa Chén Và Miếng Bọt Biển Dạng Bơm, Xịt Đa Năng 2in1"
Túi đựng hộp cơm giữ nhiệt cao cấp KingZone
"Máy Xay Tỏi Ớt Kéo Tay, Dụng Cụ Xay Nghiền Tỏi Ớt"
"Dụng Cụ Xay Tỏi, Ớt ,Gia vị, Thực Phẩm Đa Năng Cầm Tay"
Thùng giấy ăn than tre 27 gói 
"Combo Chậu Rửa  Chén Đúc Inox  304 Kích Thước 1000x480 ,Vòi Rửa Chén,Rổ Đa Năng, Bình Xà Phòng"
"Tạp dề chống thấm nước, dầu mỡ phong cách hàn quốc dễ thương"
Túi đựng hộp cơm giữ nhiệt hình cá
"Tấm phủ tủ lạnh PEVA chống thấm, đặc biệt tấm phủ tủ lạnh có nhiều ngăn vô cùng tiện lợi để chứa đồ dùng cần thiết cho gia đình"
Cuộn khăn lau nhà bếp đa năng 50 miếng
"Túi Giữ Nhiệt Túi Đựng Hộp Cơm Chống Thấm Cao Cấp, Giữ Nhiệt Tốt, Nhỏ Gọn, Nhiều Màu Sắc"
Túi giữ nhiệt chấm bi cao cấp - Xanh
Móc Treo Cuộn Khăn Lau Nhà Bếp Đa Năng
Lọ dụng cụ xay muối tiêu inox 304 tiêu chuẩn 5 sao
Hộp đựng túi nilong 
Tấm chắn bếp tiện lợi
Chậu rửa chén Inox 201
Bộ 6 Dụng Cụ Ăn Cua Ghẹ Hải Sản Đa Chức Năng Cavara
Dụng cụ ép nước trái cây bằng hợp kim nhôm
"Khuôn , Dụng Cụ Làm Sushi Cơm Cuộn Tiện Lợi"
Máy xay tỏi ớt đa năng kéo tay NT9030B1
Cối Xay Tiêu Kiêm Đựng Tiêu Đa Năng Bằng Thủy Tinh Có Tay Cầm Vặn Tiện Lợi - Dụng Cụ Rắc Gia Vị Thông Minh (Nhiều Màu)
Túi đựng cơm thiết kế Hàn Quốc -  Lunch Bag | Có lớp bạc giữ nhiệt dễ vệ sinh
Máy Xay Thực Phẩm Tupperware Turbo Chopper (300ml) - Đỏ
"Túi Đựng Hộp Cơm Giữ Nhiệt Dáng Đứng, Size Lớn, Phong Cách Nhật Bản Ver.4"
"Dụng cụ thảo dược, gia vị hầm và lọc trà hình quả cầu bằng inox IN48 (Chọn kích thước)"
Dụng cụ xay tỏi ớt đa năng bằng tay
Set 80 tấm giấy thấm hút dầu mỡ các món ăn chiên/rán 25 x 27cm nhập khẩu từ Nhật Bản
"Dụng Cụ Dằm Thịt, Dụng Cụ làm Mềm Thịt"
Túi Đựng Hộp Cơm Giữ Nhiệt Đa Năng Họa Tiết Cá Và Sóng Biển Siêu Hot
Bộ 100 lưới lọc rác bồn rửa bát SRV8800
Lọ Xay Tiêu Elmich EL7156
"Combo Chậu Rửa  Chén Đúc Inox  304 Kích Thước 82x45 cm ,vòi rửa chén vuông nóng lạnh,bình xà phòng , rỗ đựng chén "
"Máy xay hành tỏi thiết kế cải tiến PHIÊN BẢN MỚI, dụng cụ xay hành tỏi có thể dùng xay thịt và nghiền cháo hiệu quả cao"
"Hộp Đựng Túi Nilong, Giấy Lau, Bông Tẩy Trang - Màu Trắng (Tặng Dây Silicon Nâng Nắp Bồn Cầu )"
Rế Bầu Gỗ Đức Thành – 09551 - Hàng Chính Hãng
Bộ 6 Nắp Silicon Đậy Thực Phẩm
Combo 2 hộp đựng đũa thìa cất gọn nội địa Nhật Bản
Vòi rửa bát lạnh Cao Cấp INOX SUS 304 cắm chậu + Kèm 1 dây cấp nước INOX 304
"Dụng cụ làm bếp đa năng, kẹp gắp đồ nóng như bít tết, cá rán, thịt nướng chuyên dụng tiện ích"
TẠP DỀ CHỐNG THẤM CÓ TÚI ĐỂ ĐIỆN THOẠI VÀ CHỖ LAU TAY TIỆN LỢI 
Tấm trải che phủ nóc tủ lạnh có túi bên
Kẹp gắp thức ăn inox 304 - 26cm 
Dụng Cụ Vắt Chanh Bằng Inox Cao Cấp - Không Gỉ - Nhỏ Gọn - Tiện Dụng (Màu Bạc) 
Dụng Cụ Gắp Đồ Nóng Thức Ăn
Set 100 túi lọc trà vải không dệt- sản phẩm có nhiều kích thước
"Giá treo túi rác gắn sau cánh cửa tủ bếp - Móc Inox treo túi rác, khăn bếp gắn sau cánh cửa tủ bếp - loại lớn có đệm cao su - HOBBY MTR30"
Giá Móc Kẹp Tủ Bếp Treo Dụng Cụ Nhà Bếp Đa Năng
Đầu Gắn Vòi Nước Rửa Chén Xoay 360 Độ Tiết Kiệm Nước XR581
Xe kéo đi chợ sieu nhẹ cao cấp 201
Hộp Kim Chỉ Đa Năng Cho Gia Đình
Hộp muối dưa cà Việt Nhật thông minh
Dụng Cụ Tỏi Ớt Bằng Tay Lock&Lock Quick Chopper CKS310
May xay tỏi ớt
GIỎ BỒN RỬA CHÉN CHUẨN INOX 304 MẪU MỚI
"Máy xay tỏi, xay thức ăn mini bằng pin qua cổng usb"
Túi Giữ Nhiệt Đựng Hộp Cơm - Túi Trữ Sữa Lạnh Cho Bé Tiện Lợi MHome TH0608
"Bộ 2 tạp dề nấu bếp, thiết kế đơn giản, có túi đựng điện thoại phía trước, kích thước freesize, chất liệu vải dù mỏng, không thấm nước"
"Lồng bàn đậy thức ăn thông minh GS115, 5 Tầng, chất liệu nhựa PP cao cấp"
Vòi rửa chén lạnh Eurolife EL-T014 (Trắng bạc)
Miếng Thép Đa Năng 11 Công Dụng Thẻ Phượt Đa Năng - Steel Credit Card Survival Tool (Màu Bạc)
"Túi Đựng Hộp Cơm Giữ Nhiệt Size Lớn, Kiểu Dáng Thời Trang Hiện Đại Ver.5"
Combo 2 Bánh Than Hoạt Tính Tự Khử Máy Hút Mùi Bếp - Hàng Chính Hãng
Hộp đựng muỗng đũa nhựa để bàn ăn có nắp đậy an toàn vệ sinh ( Giao màu ngẫu nhiên )- ANTH214
"Máy ép trái cây, ép cam bằng tay (Inox)"
 GIÁ KỆ ĐỰNG DỤNG CỤ RỬA CHÉN TRONG BỒN KÉO RÚT THÔNG MINH
Cây Treo Ly Thân Vuông Gỗ Đức Thành – 22041 - Hàng Chính Hãng
Combo 2 tấm chắn dầu mỡ
Combo 4 Dụng Cụ Cọ Rửa Ly Bình Sữa Loại Tốt (Giao Màu Ngẫu Nhiên)
"Túi Giữ Nhiệt Hình Cá Đựng Hộp Cơm (Nhỏ Gọn, Tiện Lợi)  (Màu Ngẫu Nhiên)"
Bộ vòi xịt tăng áp lực rửa chén HOBBY VSTADAY có dây nối dài và khớp nối xoay - 3 chế độ phun cực mạnh
Muôi (Muỗng) Đảo Cao Cấp Chịu Nhiệt Cực Tốt Nhật Bản
Vòi rửa chén lạnh Inox SUS 304 cần lò xo
Bộ 4 khuôn cơm tạo hình cho bé thương hiệu Kokubo Nhật Bản
Combo Bếp điện mini không kén nồi và đôi lót nồi silicon
Giá Để Giẻ Rửa Bát - Khay Để Giẻ Rửa Bát
Máy hàn miệng túi ny lông cầm tay nhỏ gọn - Hàng nội địa Nhật
Máy Ép Hoa Quả Trái Cây Bằng Tay Hợp Kim Nhôm Nguyên Khối Hàng Việt Nam
Đầu gắn vòi rửa chén tăng áp 2 chế độ cần lò xo xoay 360 độ
Khăn che tủ lạnh chống thấm giao họa tiết ngẫu nhiên
Xe kéo đi chợ cao cấp NiNDA X-800C
Combo 200 túi lọc rác bồn rửa bát - Túi lưới lọc rác giúp ngăn chặn tắc đường ống
Bộ vòi xịt nước rửa chén Inox 304 gắn vào bồn rửa chén có dây nối dây 120cm tới chai nước rửa chén lớn - HOBBY NRC2
"Giá Để Giẻ Rửa Bát, Nước Rửa Chén Đa Năng Inox 304 Có Khay Hứng Nước Và Thanh Phơi Khăn - Tặng Sét 5 Kẹp Miệng Túi"
Thùng 30 gói Giấy ăn gấu trúc Panda gói 300 tờ siêu dai hàng đẹp hai cây tre - Tặng 1 khăn lau đa năng sợi siêu thấm màu ngẫu nhiên
"Bộ khuôn làm sushi+ Tặng kèm dụng cụ làm sushi bằng gỗ- Bộ khuôn làm sushi kimbap, cơm cuộn, trứng cuộn "
Hộp đựng nước rửa chén ấn kèm miếng rửa bát - HDNR
Tấm chắn dầu mỡ cao cấp cho mọi loại bếp - Hàng Nội địa Nhật 
Đá lạnh vĩnh cửu inox 
Túi đựng hộp cơm giữ nhiệt lót bạc - TGN
"Giấy dán tường, dán bếp cách nhiệt - GDNB"
Túi giữ nhiệt đựng cơm văn phòng dày dặn
Combo 300 túi lọc rác bồn rửa bát
Ca Đánh Sữa Inox 350ml (Có Chia Vạch)
"Túi Đựng Hộp Cơm Giữ Nhiệt, Không Thấm Nước Ver.2 (23 x 20 x 14cm)"
"Túi Đựng Hộp Cơm Giữ Nhiệt Văn Phòng Dạng Hộp Màu Xanh Navy Có Dây Khóa Kéo Với Nhiều Ngăn Phụ Tặng Túi Muỗng Nĩa (Lunch Bags, Box)"
Combo 2 Lưới lọc rác bồn rửa chén 11.5cm - Inox dày không gỉ sét
Túi 100 Lưới Lọc Rác Bồn Rửa Chén Siêu Tiện Lợi Homepower Giúp Chặn Rác Thải Và Thoát Nước Dễ Dàng Tránh Bị Tắc Ống Nước
Lọ xay hạt tiêu cầm tay
"Máy Xay Tỏi Ớt Mini Sạc Điện, Lưỡi Dao Bằng Hợp Kim Cao Cấp"
HỘP ĐỰNG TÚI BÓNG RÚT TIỆN LỢI
Bếp điện mini đa năng pha trà cà phê nấu cháo công suất 500W
"Set 02 Cuộn Giấy Nến, Giấy Sáp, Giấy Lót Nướng Bánh, Lẩu Nướng, Hấp Bánh, Nướng Thực Ăn Chịu Nhiệt, Chống Dính, Không Thấm Dầu Tiện Dụng 30cm x 10m + Tặng Chổi Phếu Dầu Ăn"
"Dụng cụ bơm hút rượu, chất lỏng bóp tay tiện dụng"
Giá treo vòi đựng giẻ rửa bát bằng inox
"Dụng cụ ép tỏi, hành, nghiền tỏi, xay tỏi, hành "
Bịch 36 Cuốn Giấy Tre ăn Đa Năng Gấu Trúc
Nắp đậy dùng cho lò vi sóng nội địa Nhật Bản
Combo 6 tấm lót bàn ăn 30x45cm
Bộ 2 khay làm đá 8 viên và 12 viên nhập khẩu từ Nhật Bản
"Combo 3 nắp chặn chống tắc bồn rửa, cống bằng silicon - giao màu ngẫu nhiên"
Khay Đựng Đồ Đa Năng Chia 3 Ngăn Nhật Bản
"túi, bịch có 36 cuộn giấy ăn than tre gấu trúc hàng loại 1"
Túi đựng cơm  SIZE TO gữ nhiệt vải Oxford Size (size 26x15x35 cm) - Giao mẫu ngẫu nhiên
Dụng Cụ Ép Trái Cây Cầm Tay Inox Tiện Lợi
Bộ Chổi quét phết dầu silicon cán rời
Máy xay hành tỏi bằng tay tiện dụng - MXTM
Máy làm giá đỗ gieo mầm tự động bằng điện 3 tầng Connie A323B
Máy xay giò chả 2kg/mẻ cổng suất 900w ( tặng kèm tai nghe Hifi lõi kép siêu bass)
Dụng Cụ Khui Rượu Vang Đa Năng 16x5.5x3.5cm
Chổi phết gia vị bằng silicon nội địa Nhật Bản (giao màu ngẫu nhiên)
Vòi Nước Rửa Chén Inox 304 Cao Cấp 023
"Tạp dề, yếm nấu ăn học vẽ có lót tay, chống thấm nước cho bé"
Combo 3 Túi Giấy Thấm Dầu Tempura GTDD00004572 (20 Tờ/Túi)
Hộp Nhựa Đựng Muỗng Đũa An Toàn (giao màu ngẫu nhiên)
Vắt Cam Inox
"Băng dính nhôm dán kẽ hở nhà bếp, bồn rửa bát, bề mặt kim loại "
"Van nồi áp suất gas 1 tay cầm, 2 tay cầm"
Chậu rửa chén  Inox 304
"Mành Tre Làm Cơm Cuộn, Sushi, Kimbap + Tặng gói hồng trà sữa (Cafe) Maccaca siêu ngon"
Tấm Chắn Dầu Mỡ Cho Bếp Gas Panda  CB-01
Tạp Dề Vải Cotton Linen Phong Cách Hàn Quốc Tối Giản
"Đầu vòi rửa chén , đầu vòi tăng áp lọc nước, Đầu vòi rửa chén tiết kiệm nước - tặng kèm miếng rửa chén silicon"
"Combo chậu rửa chén bát inox hai hố cân 8245, vòi rửa bát inox rút dây 01, bộ xả chậu, bình xà phòng, rá inox đa năng"
Bộ 2 Vòi Rót Đa Năng
"Combo 3 túi lọc sữa đậu nành, sữa hạt đa năng size LỚN"
Thùng 30 gói Giấy ăn gấu trúc Panda gói 300 tờ siêu dai hàng đẹp hai cây tre - Tặng 4 Kẹp Nhựa cao cấp đa năng màu ngẫu nhiên
Bộ 3 Thảm Lót Cao Su Quầy Bar (45 x 30cm)
Đầu vòi hoa sen chậu rửa chén tăng áp_Đầu vòi rửa chén bát tăng áp lực nước 3 chế độ phun_ đầu tăng áp rửa chén bát nhựa ABS cao cấp_ đầu vòi rửa chén tăng áp
Rổ Ráo Nước - Rổ Lọc Rác Gắn Bồn Rửa Chén Đa Năng Hình Tam Giác
"Cối đá Non Nước đường kính 9,2 cm "
Đá Và Tim Bấc Cho Bật Lửa Zippo
"Búa đập thịt, tỏi, gừng, xả ... đa năng DandiHome cao cấp-Tiêu chuẩn quốc tế"
"Giấy ăn gấu trúc siêu dai, an toàn khi sử dụng, giấy ăn sợi tre an toàn không chất tẩy trắng (Thùng 30 gói)"
Bộ 20 gói giấy ăn than tre gấu trúc
Combo 100 túi lọc rác bồn rửa chén siêu tiện dụng - Mẫu ngẫu nhiên
giấy ăn gấu trúc Ycool khăn giấy tre 1 thùng 30 gói 300 tờ siêu dai mềm mại
Combo 200 Túi Lọc Rác Thái Dương Siêu Tiện dụng cho Bồn rửa Chén bát 
Túi lọc sữa đậu nành
Dụng cụ băm rau củ quả Lock&Lock Quick Chopper
"Giá Để Giẻ Rửa Bát, Nước Rửa Chén Đa Năng Inox 304"
Bộ 2 gói gồm 200 túi lọc rác bồn rửa thông minh có thể tái sử dụng
"Combo 4 Cây Cọ Silicon Cán Trong Quét Dầu, Bơ, Kem Trang Trí Bánh (ngẫu nhiên)"
Túi Đựng Hộp Cơm Giữ Nhiệt Đa Lớp Nhiều Hoa Văn
Combo Túi Lọc Rác cho bồn rửa chén bát
"LỒNG BÀN GIỮ NHIỆT DELISH GIỮ MÓN ĂN NÓNG HỔI, THƠM NGON"
"Máy Xay Tỏi Ớt Kéo Tay, Dụng Cụ Xay Nghiền Tỏi Ớt Mẫu Mới 2020"
 Đầu vòi rửa chén tăng áp nhựa mạ điện-Ba phương pháp thoát nước
Bộ 10 gói giấy ăn than tre gấu trúc
Túi Đựng Hộp Cơm Giữ Nhiệt- Túi Trữ Lạnh Cao Cấp Chống Thấm Nước Mhome MH2107
Vòi rửa chén tăng áp 3 chế độ nước
"Máy ép trái cây bằng tay FRU-227, Ép táo, lựu, bưởi, dưa, thơm Dụng cụ Ép cam chuyên dụng"
"DẬP TỎI DÂY RÚT,Máy xay tỏi ớt cầm tay Mini Food Chopper Tiện dụng"
"TỜ GIẤY NẾN ĐỤC LỖ DÙNG ĐỂ HẤP, NƯỚNG - size 23 cm ( tặng 1 món quà xinh )"
"Máy Xay Mini Sạc Điện Xay Hành, Tỏi, Rau Củ Dung Tích 250ml"
Bộ 2 Giấy Không Thấm Dầu / Giấy Nướng Bánh Goodbake GB30 (30cm x 5m)
"Túi Lọc Sữa Đậu Nành, Túi Lọc Sữa Hạt Cao Cấp, Túi Lọc Trà, Túi Lọc Gia Vị - Hàng Chính Hãng Amalife"
"Đầu vòi rửa chén , đầu vòi tăng áp lọc nước, Đầu vòi rửa chén tiết kiệm nước - tặng kèm Móc treo khăn"
ĐẦU VÒI RỬA CHÉN TIẾT KIỆM NƯỚC XOAY 360 ĐỘ
"Túi Đựng Hộp Cơm Giữ Nhiệt, Không Thấm Nước Delicious (23 x 15 x 21cm)"
"Dụng cụ nhồi xúc xích, lạp xưởng, dồi, mực nhồi bằng tay"
Lọ xay tiêu Inox 304 DandiHome cao cấp
Bộ 6 Nắp Đậy Silicon Đa Năng Nhiều Màu
Dụng cụ băm rau củ quả Lock&Lock Quick Chopper CKS308
Bộ 15 gói giấy ăn than tre gấu trúc
"Túi đựng hộp cơm giữ nhiệt/ Túi đựng đồ ăn trưa/ Túi chống toả nhiệt, dày dặn, có tay xách, phong cách Hàn Quốc thời trang, hiện đại Ver.6"
Túi giữ nhiệt văn phòng dây rút tiện dụng
Dụng cụ xay tỏi ớt thịt và thực phẩm nhà bếp E1920
Combo 100 Túi Lọc Trà Có Dây Rút
Kem Tẩy Rửa Xoong Nồi Đa Năng Hàn Quốc 500ml
"Đầu vòi tăng áp điều hướng 360 độ, 3 chế độ chảy Eurolife EL-TA01 (Trắng)"
Bộ 02 Cọ Quét Bột Silicon - Giao Màu Ngẫu Nhiên
Đầu Vòi rửa chén Tăng Áp công tắc đổi kiểu _ bông tăng áp rửa chén BTA4_Đầu vòi rửa bát tăng áp lực nước 2 chế độ phun_đầu tăng áp rửa chén bát nhựa ABS si inox cao cấp_ đầu vòi rửa chén tăng áp_ vòi rửa chén đa năng
Dụng cụ bóc vỏ tôm chuyên dụng 
Combo 200 túi lọc rác bồn rửa bát
Dụng Cụ Nhồi Xúc Xích Lạp Xưởng
Đầu vòi tăng áp 3 mức độ cho bồn rửa chén  
cuộn giấy than tre gấu trúc ( gồm 36 cuộn)
TÚI LỌC RÁC GIỮ RÁC BỒN RỬA CHÉN 
"Giá inox gắn vòi để búi rửa chén, xà phòng nhà bếp gọn gàng sạch sẽ"
Bộ 2 rổ lọc rác bồn rửa chén inox 304 cao cấp
"Giấy ăn gấu trúc siêu dai, an toàn khi sử dụng, giấy ăn sợi tre an toàn không chất tẩy trắng (Thùng 30 gói)"
Bộ 20 gói giấy ăn than tre gấu trúc
Combo 100 túi lọc rác bồn rửa chén siêu tiện dụng - Mẫu ngẫu nhiên
giấy ăn gấu trúc Ycool khăn giấy tre 1 thùng 30 gói 300 tờ siêu dai mềm mại
Combo 200 Túi Lọc Rác Thái Dương Siêu Tiện dụng cho Bồn rửa Chén bát 
Túi lọc sữa đậu nành
Dụng cụ băm rau củ quả Lock&Lock Quick Chopper
"Giá Để Giẻ Rửa Bát, Nước Rửa Chén Đa Năng Inox 304"
Bộ 2 gói gồm 200 túi lọc rác bồn rửa thông minh có thể tái sử dụng
"Combo 4 Cây Cọ Silicon Cán Trong Quét Dầu, Bơ, Kem Trang Trí Bánh (ngẫu nhiên)"
Túi Đựng Hộp Cơm Giữ Nhiệt Đa Lớp Nhiều Hoa Văn
Combo Túi Lọc Rác cho bồn rửa chén bát
"LỒNG BÀN GIỮ NHIỆT DELISH GIỮ MÓN ĂN NÓNG HỔI, THƠM NGON"
"Máy Xay Tỏi Ớt Kéo Tay, Dụng Cụ Xay Nghiền Tỏi Ớt Mẫu Mới 2020"
 Đầu vòi rửa chén tăng áp nhựa mạ điện-Ba phương pháp thoát nước
Bộ 10 gói giấy ăn than tre gấu trúc
Túi Đựng Hộp Cơm Giữ Nhiệt- Túi Trữ Lạnh Cao Cấp Chống Thấm Nước Mhome MH2107
Vòi rửa chén tăng áp 3 chế độ nước
"Máy ép trái cây bằng tay FRU-227, Ép táo, lựu, bưởi, dưa, thơm Dụng cụ Ép cam chuyên dụng"
"DẬP TỎI DÂY RÚT,Máy xay tỏi ớt cầm tay Mini Food Chopper Tiện dụng"
"TỜ GIẤY NẾN ĐỤC LỖ DÙNG ĐỂ HẤP, NƯỚNG - size 23 cm ( tặng 1 món quà xinh )"
"Máy Xay Mini Sạc Điện Xay Hành, Tỏi, Rau Củ Dung Tích 250ml"
Bộ 2 Giấy Không Thấm Dầu / Giấy Nướng Bánh Goodbake GB30 (30cm x 5m)
"Túi Lọc Sữa Đậu Nành, Túi Lọc Sữa Hạt Cao Cấp, Túi Lọc Trà, Túi Lọc Gia Vị - Hàng Chính Hãng Amalife"
"Đầu vòi rửa chén , đầu vòi tăng áp lọc nước, Đầu vòi rửa chén tiết kiệm nước - tặng kèm Móc treo khăn"
ĐẦU VÒI RỬA CHÉN TIẾT KIỆM NƯỚC XOAY 360 ĐỘ
"Túi Đựng Hộp Cơm Giữ Nhiệt, Không Thấm Nước Delicious (23 x 15 x 21cm)"
"Dụng cụ nhồi xúc xích, lạp xưởng, dồi, mực nhồi bằng tay"
Lọ xay tiêu Inox 304 DandiHome cao cấp
Bộ 6 Nắp Đậy Silicon Đa Năng Nhiều Màu
Dụng cụ băm rau củ quả Lock&Lock Quick Chopper CKS308
Bộ 15 gói giấy ăn than tre gấu trúc
"Túi đựng hộp cơm giữ nhiệt/ Túi đựng đồ ăn trưa/ Túi chống toả nhiệt, dày dặn, có tay xách, phong cách Hàn Quốc thời trang, hiện đại Ver.6"
Túi giữ nhiệt văn phòng dây rút tiện dụng
Dụng cụ xay tỏi ớt thịt và thực phẩm nhà bếp E1920
Combo 100 Túi Lọc Trà Có Dây Rút
Kem Tẩy Rửa Xoong Nồi Đa Năng Hàn Quốc 500ml
"Đầu vòi tăng áp điều hướng 360 độ, 3 chế độ chảy Eurolife EL-TA01 (Trắng)"
Bộ 02 Cọ Quét Bột Silicon - Giao Màu Ngẫu Nhiên
Đầu Vòi rửa chén Tăng Áp công tắc đổi kiểu _ bông tăng áp rửa chén BTA4_Đầu vòi rửa bát tăng áp lực nước 2 chế độ phun_đầu tăng áp rửa chén bát nhựa ABS si inox cao cấp_ đầu vòi rửa chén tăng áp_ vòi rửa chén đa năng
Dụng cụ bóc vỏ tôm chuyên dụng 
Combo 200 túi lọc rác bồn rửa bát
Dụng Cụ Nhồi Xúc Xích Lạp Xưởng
Đầu vòi tăng áp 3 mức độ cho bồn rửa chén  
cuộn giấy than tre gấu trúc ( gồm 36 cuộn)
TÚI LỌC RÁC GIỮ RÁC BỒN RỬA CHÉN 
"Giá inox gắn vòi để búi rửa chén, xà phòng nhà bếp gọn gàng sạch sẽ"
Bộ 2 rổ lọc rác bồn rửa chén inox 304 cao cấp
Combo 2 cuộn giấy bạc dán tường tặng kèm 3 khăn lau bếp
Kệ để nước rửa và lưới rửa bát Inox 304
Bình xịt nước rửa chén Inox SUS 304 250ml
Tấm phủ tủ lạnh tiện dụng
Vòi Rửa chén nóng lạnh đồng thau cao cấp_ vòi rửa bát nóng lạnh_Vòi rửa chén bát nóng lạnh 2 đường nước đồng thau Cao cấp
Nhiệt Kế Lò Nướng
Máy làm giá đỗ tự động BKCN1
Bộ 6 Khuôn Làm Kem
Vòi rửa chén nóng lạnh Eurolife EL-T005 (Trắng bạc)
Máy Xay Tỏi Ớt Bằng Tay SP JX-588 Cao Cấp - Dụng Cụ Xay Tỏi Và Gia Vị Tươi Bằng Tay
Chậu Rửa Chén 2 Hộc 8245B Inox 304
Máy xay thịt bằng tay inox
Bộ 3 Dụng Cụ Đựng Đồ Rửa Chén Thoát Nước Tiện Dụng
"Đèn khò ga, đầu khò ga mini tự động mồi Gas thông minh"
"Dụng Cụ Kẹp Cua, Ghẹ Tiện Dụng"
"Lọ xay tiêu thủy tinh, lưỡi sứ  - Màu ngẫu nhiên"
Cuộn khăn vải không dệt lau nhà bếp đa năng 50 miếng-màu ngẫu nhiên
Bao trùm bình nước fresh water
Nhôm Lá Mỏng / Giấy Bạc Nướng Goodfoil GF3075 8936009562121 (30cm x 75m)
Phễu silicon gấp gọn tiện dụng
ĐẦU VÒI RỬA CHÉN LỌC NƯỚC TĂNG ÁP 360 ĐỘ - giao màu ngẫu nhiên
Tấm Lót Bàn Ăn Cao Cấp 30x45cm
"Giá Treo Rổ Rá, Thau Chậu và Dụng Cụ Bếp Dán Tường Không Khoan Đục Kèm 4 Móc Treo Đồ Tiện Lợi"
"Túi Giữ Nhiệt Hình Hạc- Túi Đựng Hộp Cơm Văn Phòng Nhỏ Gọn, Dễ Thương Có Quai Xách Tiện Lợi MH1220"
Dụng cụ xay tiêu cầm tay
"hộp 200 ống hút giấy cao cấp _ Clean Paper Straw màu trắng kích thước 6mm x 197mm dùng cho cà phê, nước ép...."
"ỐNG ĐỰNG ĐŨA , KỆ ĐỂ ĐŨA 1 NGĂN INOX 304 CAO CẤP"
Dụng cụ lọc rác bồn rửa chén
"Ca lọc dầu ăn INOX 304 1,2l hàng cao cấp , có lưới lọc cặn tiện lợi dùng lọc nước trái cây , lọc đậu nành , lọc cua"
"Bộ 6 miếng bọc thực phẩm bằng silicone an toàn, chịu nhiệt tốt"
dụng cụ lọc gia vị bằng inox 
"Vòi rửa chén bát dây rút cao cấp inox 304 KAMA VNL23L - Vòi nóng lạnh inox 304 dùng cho mọi bồn rửa chén bát nhà bếp, dây rút tiện dụng, 2 chế độ nước - Hàng chính hãng"
"Dụng cụ dập hành tỏi , ép tỏi, nghiền tỏi cầm tay Garlic Press tiện dụng"
Lồng Bàn Vải Lưới Đậy Thực Phẩm Tiện Lợi
Combo 300 Túi Lọc Rác Siêu Tiện dụng cho Bồn rửa Chén bát
Nhiệt kế đo nhiệt độ thực phẩm TP101 (que đo nhiệt độ)
Túi đựng cơm tròn dây rút QSND 002 vải Linen hoạ tiết dễ thương (size 19x20 cm)
"Quai Vải Đựng Ly Clip Tumbler 540ml, Giúp mang theo bình giữ nhiệt dễ dàng, Treo trên xe máy dễ dàng, Kích thước Đáy Dưới 7cm, Đáy trên 10cm"
Combo 3 Túi Giấy Thấm Dầu Kokusai GTDD00004596 (20 Tờ/Túi)
