"Tấm Chăn Gió Điều Hòa, Máy Lạnh, Có Lỗ Nhỏ Tản Nhiệt Lạnh Đều Phòng Xoay 180 Độ"
Chân đế máy giặt tủ lạnh inox cao cấp tải trọng 1000kg - hàng nhập khẩu
Kệ chân đế máy giặt tủ lạnh inox cao cấp 55x77cm INOX dày 1mm
Chân Kê Đa Năng: Tủ Lạnh - Máy Giặt - Máy Sấy Chịu Lực 300kg
Chân đế giá đỡ tủ lạnh máy giặt có bánh xe
Chân kê tủ lạnh máy giặt đa năng 48cm đến 60cm INOX dày 1mm  Hàng Chính Hãng
Áo trùm vệ sinh máy lạnh RO _ vệ sinh máy lạnh tại nhà _ RO02
"Tấm chắn đổi hướng gió điều hòa,máy lạnh"
Điều khiển dùng cho quạt đứng và quạt treo tường Mitsubishi
Chân để máy giặt tủ lạnh inox đa năng hàng cao cấp
Chân đế máy giặt tủ lạnh inox lõi bê tông nặng 5kg chống rung lắc
"Tấm chắn đổi hướng gió điều hòa , máy lạnh DM-224"
Túi vệ sinh máy lạnh RO _ túi bảo dưỡng điều hòa RO _ áo trùm vệ sinh máy lạnh RO _ RO05
"Remote điều khiển máy lạnh đa năng, điều khiển máy lạnh, remote máy lạnh, máy điều hòa, remote điều khiển cho tất cả các loại máy lạnh+ Tặng kèm pin"
Tấm chắn gió máy điều hòa âm trần trong suốt 
"Tấm chắn đổi hướng gió điều hòa , máy lạnh D124"
Tấm chắn gió máy lạnh âm trần dành cho dân văn phòng
"Thanh chắn khe cửa chống thoát hơi máy lạnh, máy điều hòa"
"Remote Dùng Cho Máy Lạnh, Máy Điều Hòa DAIKIN FTKC25QVMV, FTKC35QVMV, FTKC50RVMV, ARC480A1"
Túi vệ sinh máy lạnh RO _ áo vệ sinh máy lạnh RO _ vệ sinh máy lạnh tại nhà _ RO03
"Remote Điều Khiển Dùng Cho Máy lạnh, Điều Hòa Panasonic e-ion A75C2817, A75C3298"
"Remote Điều Khiển Dành Cho Máy Lạnh, Điều Hòa Toshiba Inverter RAS-H10G2KCV, RAS- H10PKCVG"
Remote Điều Khiển Điều Hòa Đa Năng - Dễ Sử Dụng - Thích Hợp Với Tất Cả  Các Loại Máy Lạnh
"Remote Điều Khiển Cho Máy Lạnh, Điều Hòa Panasonic Inverter A75C3208, A75C3706, A75C3708 - Hàng nhập khẩu"
Chân kệ kê máy giặt - tủ lạnh hàng Việt Nam
Vỏ bọc bảo vệ máy giặt cửa trên - áo trùm máy giặt lồng đứng loại to dày đẹp Vegas12
"Vỏ bọc máy giặt, máy sấy chống mưa nắng chất liệu vải dù cao cấp"
Remote dùng cho điều hòa LG Inverter
Điều khiển Quạt cây Panasonic Model F-409KBVH - Hàng chính hãng 
Kệ chân đế máy giặt tủ lạnh inox 
Remote dùng cho điều hòa Panasonic 1 chiều
Điều khiển điều hòa đa năng 1000 in 1 Cho các loại điều hòa
"Remote Điều Khiển Cho Máy Lạnh, Máy Điều Hòa LG AKB74955602"
Tấm tản gió điều hòa
"Remote Điều Khiển Cho Máy Lạnh, Điều Hòa SHARP CRMC-A746JBEZ, CRMC-A791JBEZ"
"Kệ máy giặt, tủ lạnh thông minh,đa năng điều chỉnh được kích thước - Kệ chân tủ lạnh máy giặt - chân kê tủ lạnh đa năng"
"Remote Điều Khiển Máy Lạnh, Máy Điều Hòa LG AKB73756203, LG S09EN2"
"Combo 4 Cao su chống rung cục nóng điều hòa, máy lạnh"
Chân kệ kê máy giặt - tủ lạnh - Tặng khăn lau đa năng
Điều Khiển Dùng Cho Điều Hòa Mitsubishi
Điều Khiển Máy Lạnh DAIKIN ARC433A1 Home Leave - Hàng Chính Hãng
"Remote Điều Khiển Cho Máy Lạnh, Điều Hòa SHARP AH-X9UEW, AH-X12VEW, AH-X12STW, AH-X18VEW"
Điều khiển dùng cho điều hòa Panasonic Inverter 2 chiều
Tấm Chắn Điều Chỉnh Hướng Gió Cho Máy Lạnh Điều Hòa Cao Cấp 90x27cm
"Kệ kê tủ lạnh, chân máy giặt chống rung lắc kích thước thay đổi có bánh xe tiện lợi"
Vỏ Bọc Điều Hòa Chống Bụi
"Kê chân máy giặt, tủ lạnh, tủ sấy điều chỉnh được kích thước TXL9154"
"Remote Điều Khiển Cho Máy Lạnh, Điều Hòa DAIKIN FTKS, FTKS25, FTE25LV1V, FTE35LV1V, ARC433A87"
"Túi vệ sinh, bảo dưỡng điều hòa RO plus ROPLUS01"
"Túi bảo dưỡng điều hòa RO _ áo trùm vệ sinh máy lạnh RO _ vệ sinh máy lạnh tại nhà _ ống xả dài 2,5m _  RO04"
"Remote Đa Năng Điều Khiển Nhiều Model Máy Lạnh, Điều Hòa Panasonic (Kèm Pin Maxell)"
Thanh Magie Lọc Cặn Bình Nóng Lạnh
Điều khiển ( remote ) điều hòa đa năng 1000 in 1 nắp trượt cao cấp
"Remote Điều Khiển Cho Máy lạnh, Máy Điều Hòa Toshiba RAS-16SKV-E"
Áo trùm vệ sinh máy lạnh Q-535 1.5-3.0 HP
"Remote Điều Khiển Dành Cho Máy Lạnh, Máy Điều Hòa Mitsubishi RKX502A001"
Remote điều khiển dùng cho điều hòa Casper
"điều hướng gió dàn nóng, cục nóng máy lạnh, điều hoà 12000 (510x520mm)"
Điều Khiển Dùng Cho Điều Hòa Daikin Inverter
"Tấm chắn điều hướng gió  máy lạnh, điều hòa treo tường trong suốt cao cấp"
"Tấm kê chân máy giặt, tủ lạnh, máy sấy tùy chỉnh theo các kích cỡ khác nhau, 4 chân đế có thể điều chỉnh độ cao thấp"
Điều khiển điều hòa đa năng 1000 in 1
"Kệ kê tủ lạnh , chân máy giặt chống rung lắc  kich thước thay đổi"
"Remote Điều Khiển Dùng Cho Máy Lạnh, Điều Hòa DAIKIN FTNE25MV1V9, FTE35LV1V, ARC423A5, ARC423A6"
Điều khiển điều hòa panasonic CS 2 Chiều
Túi vệ sinh máy lạnh âm trần RO _ túi vệ sinh điều hòa âm trần _ áo vệ sinh điều hòa loại lớn _ AT02
Chân máy giặt đa năng
"Remote Điều Khiển Cho Máy Lạnh, Điều Hòa Panasonic A75C4137, A75C2913, CS-E9EKU - Hàng nhập khẩu"
Combo 03 Vỏ bọc điều hòa tránh khỏi bụi bẩn
 Điều khiển dùng cho quạt đứng và quạt treo tường
Túi vệ sinh điều hòa âm trần RO _ áo vệ sinh máy lạnh lớn _ túi trùm vệ sinh điều hòa công nghiệp _ AT01
Relay bảo vệ tủ lạnh cao cấp CHI-HU P.30A
Điều khiển từ xa dùng cho điều hòa SHARP A1
Chân Kê: Tủ Lạnh - Máy Giặt
Bình xịt vệ sinh điều hòa/máy lạnh & các loại quạt thông gió Hàn Quốc Sandokkaebi - 330ml
"Viên nén thông tắc máy lạnh 1,5 tấn - Pan Clear màu vàng - Xử lý rong rêu, cặn bẩn - Hộp 10 viên"
"Remote Điều Khiển Dùng Cho Máy Lạnh, Điều Hòa TCL TAC-12CSA/XA41 GYKQ-52"
Dây cấp máy giặt 3m
"Remote Điều Khiển Máy Lạnh, Máy Điều Hòa DAIKIN ARC423A Series, ARC433A2, ARC433A5"
"Remote Điều Khiển Dành Cho Máy Lạnh, Điều Hòa LG Inverter AKB73315601 (Kèm pin AAA) - Hàng nhập khẩu"
Áo trùm vệ sinh máy lạnh Q-532 1.0-1.5 Hp
Điều khiển điều hoà Panasonic Model CS-U12TKH-8-Hàng chính hãng
thiết bị bảo vệ tủ lạnh electron TH
"Remote Điều Khiển Cho Máy Lạnh, Điều Hòa SHARP AH-X12VEW, AH-X18VEW"
Điều Khiển Điều Hòa 1 Chiều Cho Panasonic
"Chân đế máy giặt, tủ lạnh đa năng điều chỉnh được kích thước"
Điều khiển dùng cho điều hòa LG 2 chiều ngắn
RƠ LE ÁP SUẤT MÁY NÉN KHÍ 4 LỖ TỰ ĐỘNG
Điều khiển dùng cho điều hòa Media
Kệ chân để lọc nước có thể tùy chỉnh kích thước từ 30cm-40cm GNG
"Bộ Đồng Hồ Nạp Gas Lạnh R410A,R32 AITCOOL HMG-2-R32-II - Hàng Nhập Khẩu"
"Bộ 2 Hộp Đá khô giữ lạnh sữa, Hộp đá dạng gel cho quạt điều hòa"
"Remote Điều Khiển Dùng Cho Máy Lạnh, Điều Hòa Panasonic Inverter CU/CS-S9RKH-8 (Kèm pin AAA Maxell) - Hàng nhập khẩu"
Set 4 Miếng Đệm Chống Rung Máy Giặt KM Japan
"Điều hướng gió dàn nóng, cục nóng máy lạnh, điều hoà 9000 (490 x 420mm)"
Điều Khiển Dùng Cho Điều Hòa LG
"Remote Điều Khiển Cho Máy Lạnh, Điều Hòa Panasonic Nanoe-G CS/CU-PU9UKH, N9UKH (Kèm Pin AAA Maxell)"
"Remote Điểu Khiển Cho Máy Lạnh, Máy Điều Hòa Reetech ZH/JT-03"
Bạt Bảo Dưỡng Điều Hòa Có Đuôi
"Remote Điều Khiển Dành Cho Máy lạnh Máy Điều Hòa Toshiba RAS-07GKSX, RAS-09GKSX, RAS-10UKPX3-T2, KT-TS1, WC-E1NE, WE-E1NE, WH-D9S"
"Remote Điều Khiển Cho Máy Lạnh, Máy Điều Hòa KELON 2 Chiều (Kèm Pin AAA Maxell)"
"Remote Điều Khiển Dành Cho Máy Lạnh, Điều Hòa DAIKIN Chức Năng Revolve"
	 ĐIỀU KHIỂN ĐIỀU HÒA CASPER - hàng chính hãng
Điều Khiển Dùng Cho Điều Hòa National
Gas lạnh PVCK R32 - bình nhỏ 3kg
"Kệ máy giặt, tủ lạnh thông minh điều chỉnh kích thước 3 chiều-Tấm kê chân máy giặt, tủ lạnh, máy sấy tùy chỉnh theo các kích cỡ khác nhau, 4 chân đế có thể điều chỉnh độ cao thấp+ Tặng hình dán ngẫu nhiên"
Điều khiển từ xa dành cho quạt cây panasonic 
Điều Khiển dùng cho Điều Hòa Sanyo
TẤM CHẮN ĐIỀU HÒA ÂM TRẦN 
"Kệ Tủ Lạnh , Máy Giặt (50cm - 70cm) "
"Remote Điều Khiển Cho Máy Lạnh, Điều Hòa Samsung DB93-14195A, DB93-14195G, DB93-14195F"
"Remote Điều Khiển Cho Máy Lạnh, Máy Điều Hòa Carrier (Kèm Pin AAA Maxell)"
"Viên Nén Xử Lý Rêu, Chất Bẩn Máy Lạnh - Clogg Away - Chính Hãng Mỹ - Sử Dụng Cho Hệ Thống Điều Hoà 5 Tấn"
Điều khiển điều hoà Panasonic Model CS-XU12UKH-8-Hàng chính hãng
"Remote Điều Khiển Cho Máy Lạnh, Điều Hòa ELECTROLUX ESM09CRF, TI07R, TI24R"
miếng chắn  điều chỉnh hướng gió điều hòa
Điều khiển dùng cho điều hòa Daikin 1 chiều đời cũ
Remote điều khiển dùng cho điều hòa GREE
"Remote Điều Khiển Cho Máy Lạnh, Điều Hòa MITSUBISHI E07140426, SLZ-A09RA, SLZ-A12RA (Kèm Pin AAA Maxell)"
Điều khiển dành cho điều hòa Samsung
"Remote Điều Khiển Cho Máy Lạnh, Máy Điều Hòa Không Khí National"
Điều khiển dùng cho điều hòa Nagakawa
"Remote Điều Khiển Máy Lạnh, Máy Điều Hòa Hitachi RAR-3U3"
"Cửa gió khuếch tán, miệng gió, vỉ gió KTA300 cho điều hòa âm trần"
"Remote Thay Thế Điều Khiển Cho Máy Lạnh, Máy Điều Hòa SANYO/AQUA (Kèm Pin AAA Maxell)"
Điều khiển chính hãng Điều hoà Panasonic Model CS-PU12UKH-8 - Hàng chính hãng
"Tấm Chắn Gió Điều Hòa - Tản Nhiệt Máy Lạnh - Thiết Kế Lỗ Nhỏ Tránh Gió Trực Tiếp Từ Điều Hòa - Xoay 180 độ - Chăm Sóc Sức Khỏe Gia Đình, nhựa pvc thân thiện môi trường"
"Remote Điều Khiển Dùng Cho Máy Lạnh, Máy Điều Hòa ELECTROLUX RG01/BGCEF (Kèm Pin AAA Maxell)"
Điều Khiển Dùng Cho Điều Hòa Panasonic Loại 10 Nút Nhấn
Van cấp nước đôi dành cho máy giặt toshiba
"Combo 5 Viên Đá khô CO2 DK250 250ml giữ lạnh sữa, đồ uống, đồ ăn. Chai đá khô, Hộp băng khô dạng gel cho quạt điều hòa, du lịch, phượt"
"Remote Điều Khiển Dùng Cho Máy Lạnh, Điều Hòa DAIKIN FTE25LV1V, FT25GV1G, FT35GV1G, ARC433A55"
Điều khiển điều hoà Panasonic Model CS-N9SKH-8- Hàng chính hãng
Điều khiển dùng cho quạt Vinawind và điện cơ
Điều khiển Dùng cho điều hòa Mitsubishi Heavy SRK13CRS-S5
Áo vệ sinh máy lạnh có ống xả thải chuyên nghiệp
"Remote Điều Khiển Cho Máy Lạnh, Máy Điều Hòa FUNIKI AKT-FK3"
Tụ điện máy điều hòa Mascotop CBB65
Tấm chắn điều chỉnh hướng gió cho máy lạnh
Điều khiển dùng cho quạt cây Panasonic
Remote điều khiển dùng cho điều hòa Sumikura
Điều khiển điều hòa âm trần Daikin
Áo bọc máy giặt cửa trên 7-8kg : siêu dày chống thấm nước 
Điều Khiển Dùng Cho Điều Hòa TOSHIBA
Điều khiển dùng cho điều hòa Funiki loại dài
Chân kệ kê máy giặt - tủ lạnh có thể thay đổi độ dài
Điều Khiển Điều Hòa Đa Năng Dùng Chung Cho Các Dòng Điều Hòa Hiện Nay K-1000ES
"Remote Điều Khiển Dùng Cho Máy Lạnh, Máy Điều Hòa FUNIKI SH-MMC2 (Kèm Pin AAA Maxell)"
"Vỏ bọc ĐIỀU HÒA chống thấm nước, chống bụi, côn trùng siêu tiện lợi - giao ngẫu nhiên"
Tấm Tản Nhiệt Cho Sò Nóng Lạnh Bằng Dung Dịch
Điều khiển dành cho điều hòa sanyo F1
"BẢO VỆ TỦ LẠNH, THIẾT BỊ LẠNH VỚI STANDA BẢO VỆ AN TOÀN TUYỆT ĐỐI "
Điều khiển dùng cho điều hòa Daikin 1 chiều
"Remote Điều Khiển Dùng Cho Máy Lạnh, Máy Điều Hòa ReeTech R51M/E"
Thiết bị bảo vệ tủ lạnh Robot - 10A hàng chính hãng
Van điện từ máy nén khí sạch - van điện từ máy nén khí không dầu giảm âm
"Combo vật tư ống đồng, simili quấn, dây điện máy lạnh, điều hòa 1HP 1.5HP 2HP 2.5HP Hàng chính hãng Tặng kèm đầy đủ phụ kiện"
"Kệ máy giặt, tủ lạnh thông minh điều chỉnh được kích thước"
"Remote Điều Khiển Cho Máy Lạnh, Điều Hòa DAIKIN FTV, FTN, FTN35JXV1V, FTV25AXV1, FTV60BXV1"
"Remote Điều Khiển Máy Lạnh, Máy Điều Hòa Sumikura"
Remote điều khiển đa năng - Dùng được cho tất cả các dòng máy lạnh 
Cuộn bông lọc bụi G3
"Remote Điều Khiển Dùng Cho Máy Lạnh LG 6711A90023B, Điều Hòa 6711A90031L"
Combo 3 lõi lọc số 1 PP 10in
Chuyển hướng gió dàn lạnh Airwing Slim
Bộ sản phẩm vệ sinh lồng máy giặt giúp tăng tuổi thọ máy giặt
TụCapacitor CBB65 40uF dành cho máy lạnh 
Miếng chắn gió điều hòa - chuyển hướng gió dàn lạnh Kaze Yoke - Hàng nhập khẩu
"Remote Điều Khiển Cho Máy Lạnh, Máy Điều Hòa TOSHIBA R51ME"
Cửa gió nan thẳng cổ 150x150
"Remote Điều Khiển Dành Cho  Máy lạnh, Máy Điều Hòa Toshiba WC-H01EE - Hàng Nhập Khẩu"
Điều khiển dùng cho điều hòa Samsung DB93
"Remote Điều Khiển Cho Máy Lạnh, Máy Điều Hòa Sumikura Turbo (Kèm pin AAA Maxell)"
ĐIỀU KHIỂN ĐIỀU HÒA DAIKIN INVERTER 2 chiều - hàng chính hãng
"Remote Điều Khiển Dùng Cho Máy Lạnh, Điều Hòa DAIKIN ARC433A7, ARC433A8"
Thiết bị đo nhiệt độ từ xa sửa chữa đa năng
"Remote Điều Khiển Cho Máy Lạnh, Máy Điều Hòa MIDEA MSMA3-10CRN1, MSMA3-18CRN1"
Điều khiển dùng cho điều hòa Sharp
TẤM CHẮN ĐIỀU HOÀ  HẠN CHẾ  GÓ CHO TRẺ NHỎ VÀ NGƯỜI GIÀ
"Remote Điều Khiển Cho Máy Lạnh, Máy Điều Hòa ALASKA (Kèm Pin AAA Maxell)"
Điều khiển điều hòa LG 05
Hạt công tắc chức năng chịu tải 20A có hình điều hòa
Điều khiển dùng cho điều hòa panasonic A75C2560 
"Lọc khung giấy Pre Filter G4, Kích thước 594 x 594 x 44mm"
Tụ điều hòa CBB65 25uF dành cho máy lạnh 
Tấm lọc bụi sơ cấp G1 dạng cuộn
Tấm bán dẫn làm lạnh siêu công nghệ
Điều khiển điều hoà Panasonic Model CS-XPU9WKH-8- Hàng chính hãng
Điều khiển Điều hoà Panasonic Model CS-PU12TKH-8- Hàng chính hãng
"Remote Điều Khiển Dành Cho Máy Lạnh, Điều Hòa Không Khí DAIKIN ARC433A46 Grade A"
Bộ Điều Khiển Nhiệt Độ Đóng Mở Điện STC-1000
Netism AC-15PRO air conditioning bracket outside frame stainless steel shelf thickening outdoor air conditioning bracket accessories 1P-1.5 horses to send expansion screws Haier Grex and other applications
"Remote Điều Khiển Cho Máy Lạnh, Máy Điều Hòa FUNIKI"
Điều khiển điều hoà Panasonic Model CS-PU9VKH-8- Hàng chính hãng
KẸP ỐNG ĐỒNG SIZE 10-42MM
Dây cấp máy giặt 1.5m
"Bộ 2 Đá khô CO2 DK250 giữ lạnh sữa, bia, rượu, Hộp băng khô dạng gel cho quạt điều hòa, du lịch, phượt"
Điều Khiển Điều Hòa 1 Chiều Đa Năng Dành Cho Điều Hòa Gree
"Remote Điều Khiển Cho Máy Lạnh, Máy Điều Hòa LG 6711A90032L, 6711A90091H, L8004R"
"Bộ 5 Đá khô CO2 DK400 giữ lạnh sữa, Hộp đá dạng gel cho quạt điều hòa"
Dây cấp máy giặt cửa ngang  1.5m
MÁY BƠM VỆ SINH ĐIỀU HÒA PCW-4S
"Remote Điều Khiển Dùng Cho Máy Lạnh, Máy Điều Hòa SHARP CRMC-A669JBEZ"
Giá treo ti vi xoay góc 42-63 inch
"Remote Điều Khiển Cho Máy Lạnh, Điều Hòa DAIKIN ARC433B1, ARC433B41, ARC433A49"
"Remote Điều Khiển Cho Máy Lạnh, Máy Điều Hòa SHARP CRMC-A876JBEZ"
Điều khiển chính hãng Điều hoà Panasonic Model CS-U12VKH-8
Combo 2 vỏ bọc điều hòa chống bụi - Tặng 1 lọ tinh dầu Quế
Màng nhựa chắn gió điều hòa ( giao màu ngẫu nhiên )
Thiết bị thông minh diều khiển máy điều hoà Ambi Climate
TẢN NHIỆT NƯỚC CHO SÒ NÓNG LẠNH XANH 40X40MM
"Remote Điều Khiển Cho Máy Lạnh, Máy Điều Hòa Sharp CRMC-A775JBEZ"
"Remote Điều Khiển Cho Máy Lạnh, Máy Điều Hòa Không Khí Sanyo SAP-K9AP"
Cuộn dây ống dẫn khí nén PU 8mm x 5mm màu xanh
Đầu chuyển đa năng 889/4/1 K dài 1/4'' x 50mm Wera 05052502001
"Tấm chắn đổi hướng gió điều hòa , máy lạnh D124  ( số lượng 2 tấm )"
Cuộn dây ống dẫn khí nén PU 8mm x 5mm x 100m trong suốt
"Remote Điều Khiển Dùng Cho Máy Lạnh Fujitsu Inverter AR-RAE2U, Điều Hòa AR-RY10"
Máy đo nhiệt độ từ xa bằng laser GM550
Điều Khiển Điều Hòa Đa Năng K-100ES
Điều khiển chính hãng Điều hoà Panasonic Model CS-N12WKH-8
 Điều khiển dùng cho điều hòa Panasonic CS 1 chiều
Điều khiển Quạt trần Panasonic Model F-60TDNTBARVV - Hàng chính hãng
SIMILI QUẤN ỐNG ĐỒNG MÁY LẠNH - 1 THÙNG
Trép RCF 450
Cuộn bông lọc bụi G4
"Remote Điều Khiển Dùng Cho Máy Lạnh, Máy Điều Hòa Reetech AUX009"
Điều khiển quạt trần Panasonic Model F-56MZGTBGAVH- Hàng chính hãng
Điều khiển chính hãng Điều hoà Panasonic Model CS-S9RKH-8
Loe ống Hàng chính hãng Retta RHS0418
"Remote Điều Khiển Cho Máy Lạnh, Điều Hòa LG 6711A20010N, 6711A2008K, 6711A20025M"
Điều khiển dành cho điều hòa samsung ARH 1362 
BƠM NƯỚC NGƯNG ĐIỀU HÒA PC-12B
Điều Khiển Dùng Cho Điều Hòa Panasonic Loại 15 Nút Nhấn
Điều khiển điều hòa Funiki
Máy nén lạnh xoắn ốc Zrd72kc Tfd 433
Timer thời gian thực (Timer 24H) 67DDT0
Gas lạnh PVCK R32 - bình 10KG
"Remote Điều Khiển Dùng Cho Máy Lạnh, Máy Điều Hòa MIDEA RG52A2/BGEF (Kèm Pin AAA Maxell)"
"Remote Điều Khiển Cho Máy Lạnh, Điều Hòa Không Khí National (Kèm Pin AAA Maxell)"
"Remote Điều Khiển Cho Máy Lạnh, Máy Điều Hòa FUJITSU AR-RCD1C"
"Cửa gió khuếch tán, miệng gió, vỉ gió KTA-450 cho điều hòa âm trần"
"Cửa gió khuếch tán, miệng gió, vỉ gió tròn D300 cho điều hòa âm trần"
"Cửa gió khuếch tán, miệng gió, vỉ gió tròn D600 cho điều hòa âm trần"
"Cửa gió khuếch tán, miệng gió, vỉ gió tròn D400 cho điều hòa âm trần "
Điều Khiển Dùng Cho Điều Hòa SAMSUNG
Timer On delay 12ODT4
Phụ kiện máy sưởi ấm kiêm sạc dự phòng N12 Tặng Đèn led USB nhiều màu
Điều khiển chính hãng Quạt cây Panasonic Model F-409KNBAKBV
CHUYỂN ĐỔI TÍN HIỆU   2SC3D11CC3  
Bộ lọc HEPA cho máy lọc không khí Lanaform Air Purifier LA120209 Nhập Khẩu Bỉ
Dụng cụ đo rò rỉ khí Gas Aitcool ALD-301 - Hàng nhập khẩu
Cuộn bông lọc bụi G1
Điều khiển điều hoà Panasonic Model CS-N12VKH-8- Hàng chính hãng
ĐÈN KHO LẠNH 20W TRẮNG/VÀNG
"Remote Điều Khiển Cho Máy Lạnh, Điều Hòa MIDEA Inverter MSAF-10CRDN8"
"Remote Điều Khiển Dành Cho Máy lạnh, Điều Hòa Toshiba RAS-07GKSX, RAS-10UKPX3-T2 (Kèm pin AAA Maxell)"
Điều Khiển Dùng Cho Điều Hòa Funiki
Cảm biến áp suất Huba Control 520 0-16bar  520.931S031301 - Hàng chính hãng
"Remote Điều Khiển Dùng Cho Máy Lạnh, Máy Điều Hòa TCL Royal 9000BTU"
Tấm bán dẫn làm lạnh
Cuộn dây ống dẫn khí nén PU 8mm x 5mm màu vàng
Tụ Capacitor CBB65 30uF dành cho máy lạnh 
Tụ Capacitor CBB65 35uF dành cho máy lạnh 
Cuộn giấy lọc cặn máy mài
Chân kê đa năng
Viên nén thông tắc máy lạnh BioFresh Pan Pills (Hộp 50 viên) - Hàng nhập khẩu
Điều khiển dành cho điều hòa samsung ARH 2201 
Điều khiển dành cho điều hòa Midea 01
BẢN LỀ CỬA KHO LẠNH CX-1132
Điều Khiển Dùng Cho Điều Hòa Fujitsu
Điều khiển dành cho điều hòa NAKAGAWA
VAN THÔNG ÁP
DÂY ĐẦU DÒ/DÂY DÒ CẢM BIẾN NHIỆT ĐỘ
"Tấm chắn đổi hướng gió điều hòa,máy lạnh"
Điều khiển dành cho điều hòa SUMIKURA S1
Điều khiển điều hòa Funiki (ghi) - Hàng Chính Hãng
BỆ DÀN NÓNG + ỐC VÍT - PSCSR-010001- Hàng nhập khẩu
Cảm biến áp suất Huba Control 520 0-250bar  520.943S031301 - Hàng chính hãng
"Remote Điều Khiển Cho Máy Lạnh, Điều Hòa Carrier RG56 Hiển Thị Độ F (Kèm Pin AAA Maxell)"
Viên nén thông tắc máy lạnh BioFresh CA90 (Hộp 7 viên) - Hàng nhập khẩu
Bộ mã hóa tự động E50S8-200-3-T-24
Cuộn dây ống dẫn khí nén PU 8mm x 5mm màu đỏ
Chuyển đổi RS232 - RS485/RS422 28B21A0
Điều khiển điều hoà Panasonic Model CS-N12UKH-8-Hàng chính hãng
Điều Khiển Điều Hòa Đa Năng Dùng Chung Cho Các Dòng Điều Hòa Hiện Nay K-1000ES
Tấm Tản Nhiệt Sò Bằng Dung Dịch 1 Sò Đầu Đẫn Dung Dịch Vuông Góc
Điều khiển dành cho điều hòa Elechtroluc A1
"Remote Điều Khiển Cho Máy Lạnh, Máy Điều Hòa SANYO RCS-AX1, RCS-7HS4E"
Ổ CẮM ĐIỆN 3 Ổ- 2 CHẤU TRÒN CÓ NẮP Nam Rack - Chính hãng
Cuộn bông lọc bụi G4
Signal Timer 20NDTT
Điều khiển điều hoà Panasonic Model CS-U9SKH-8-Hàng chính hãng
Bảo vệ điện áp (3 pha + N)   MAC04D0100  
Viên nén thông tắc máy lạnh BioFresh UT7B (Hộp 7 viên) - Hàng nhập khẩu
BỆ DÀN NÓNG 460MM - PSPCD-030001- Hàng nhập khẩu
Viên nén thông tắc máy lạnh BioFresh CT180 (Hộp 7 viên) - Hàng nhập khẩu
Viên nén thông tắc máy lạnh BioFresh UT3B (Hộp 7 viên) - Hàng nhập khẩu
Trunking Nhựa Fineduct Ống Mềm FA-80 - Hàng Nhập Khẩu
Tụ Capacitor 3 chân CBB65 25uF 
Cân gas điện tử AITCOOL CS-50N - Hàng Nhập Khẩu
"Ống lồng LM-TU342N (4.2mm, 100m/cuộn)"
"Remote Điều Khiển Dành Cho Máy Lạnh, Điều Hòa DAIKIN FTKC Series ARC480A1"
BỘ TAY KHÓA CỬA KHO LẠNH CX - 1178
Điều khiển chính hãng Điều hoà Panasonic Model CS-KC12NKH-8
