"Bộ 2 chiếc găng tay chơi game, bao tay chơi game, mobile chống trơn trượt mồ hôi tay thao tác dễ dàng - Hàng Nhập Khẩu"
Tay Bấm Gaming Logitech F310 - Hàng Chính Hãng
"Tay Cầm Chơi Game H5 Tích Hợp Nút Nhấn Hỗ Trợ Chơi PUBG, ROS, Freefire Có Quạt Tản Nhiệt - Không Pin"
Tay Cầm Chơi Game K21 Kiêm Giá Đỡ Điện Thoại Phiên Bản Mới
Tay Cầm Chơi Game Dualshock 4 CUH-ZCT2G - Hàng Chính Hãng
"Tay Cầm Chơi Game PC Đầu USB Có Rung, Joystick"
Combo tay cầm 5 trong 1 chơi game mobile Free Fire PUBG ROS làm mát máy 
Bộ 2 Nút Bấm Chơi Game Pubg
Tay Cầm Gamepad Không Dây Rapoo V600S - Hàng Chính Hãng
Tay Cầm Chơi Game Không Dây Cho PC / Xbox360 / Android TV / Smartphone/ Laptop 850M
Tay Cầm PlayStation PS4 Sony Dualshock 4 - Hàng Chính Hãng
"Tay cầm chơi game cho Fifa online 4 trên pc, laptop - U606"
Tay cầm chơi game xbox one s kèm cable usb cho windows - hàng nhập khẩu (Đen)
Bộ 2 bọc ngón tay cảm ứng chơi game mobile 2.0 siêu mỏng thoáng khí chống trượt ra mồ hôi và xây xước màn hình 
Tay cầm chơi game không dây 3 in  1 
Tay Cầm PlayStation PS4 Sony Dualshock 4 (Màu Xám Đen) - Hàng Chính Hãng
Tay Cầm PlayStation PS4 Sony Dualshock 4 (Màu Xanh Đen) - Hàng Chính Hãng
"Tay cầm chơi game W11+ Có Nút Bắn - Joystick di chuyển cho Điện Thoại chơi Pubg, Ros, Free Fire Controller"
"Tay cầm chơi game không dây cho android tivi, pc, laptop, android box - 850M"
Tay Cầm Chơi Game USB Nazar V44 - Hàng Nhập Khẩu (Màu ngẫu nhiên)
Tay Cầm  Sony Dualshock 4 CUH ZCT2G-Hàng Chính Hãng  màu đen 
Bộ 2 bọc ngón tay cảm ứng chơi game mobile thoáng khí chống trượt ra mồ hôi và xây xước màn hình
Tay cầm chơi game Gamesir T4w - Hàng nhập khẩu
Tay cầm điện thoại thông minh MEMO AK66 chơi game PUBG ROS Freefire mobile hỗ trợ 4 ngón tay
Tay Cầm Chơi Game Xbox 360
Tay Cầm PlayStation PS4 Sony Dualshock 4 (Màu Camo) - Hàng Chính Hãng
Găng Tay Chơi Game chống mồ hôi - Hàng nhập khẩu
"Tay cầm chơi game Bluetooth  cho Android, Window Terios X3 + Giá đỡ Điện Thoại "
Tay Cầm Chơi Game Điện Thoại Có Nút Bấm
Tay Cầm Chơi Game Không Dây Cho PC / Xbox360 / Android TV / Smartphone/ Laptop 850M - cổng OTG Type-C
Bộ 2 Tay Cầm Chơi Game Đôi Controller Cho PC 
Tay cầm chơi game gắn điện thoại
Tay Cầm Microsoft Xbox One S (Màu Trắng) - Hàng Nhập Khẩu
Tay Cầm Gamepad Có Dây Rapoo V600 - Hàng Chính Hãng
Game Ring Fit Adventure Nintendo Switch Cho máy Nintendo Switch-Hàng nhập khẩu
Tay Cầm Microsoft Xbox One S Kèm Usb (Màu Đen) - Hàng Nhập Khẩu
"Tay Cầm Chơi Game Microsoft XBox 360 Chơi PC, Laptop, XBox 360 - Hàng Nhập Khẩu"
"Handjoy M01 | Nút bắn chơi game đẳng cấp nhất thị trường nút bấm FPS FTMOBILE(Pubg, COD, Freefire)phiên bản mới-3977-Hàng nhập khẩu"
Nút bắn Pubg Freefire Blue Shark - Nút bấm Pubg Phụ kiện chơi Pubg Mobile CH-5 - hàng chính hãng
Bộ gamepad nút hỗ trợ chơi game PUBG Baseus Holder cho điện thoại máy tính bảng (Màu ngẫu nhiên) - Hàng chính hãng 
Nút game pubg CH-5 
Tay cầm chơi Game không dây Baseus Nintendo Switch Motion Sensing Vibrating Gamepad - Hàng Chính Hãng
Tay cầm chơi game đa chức năng có dây Fantech SHOOTER GP11 - Hàng chính hãng
Bộ 2 nút bấm chơi game PUBG Free Fire Thế hệ mới R11 cho smartphone
Tay Cầm Chơi Game Microsoft Xbox One S Wireless - Black - Hàng Chính Hãng
Tay Cầm Chơi Game Mobile Bluetooth 058
Bộ tay cầm 3in1 kèm nút di chuyển nút chơi game PUBG ROS Freefire W11+
"Bộ nút bắn Pubg mobile, ROF Garena nút hỗ trợ chơi game trên điện thoại - Mua 3 nút chơi game tặng 1 bộ nút PUBG"
Tay cầm game thương hiệu Baseus có quạt tản nhiệt hiệu ứng ánh sáng đẹp mắt kiêm sạc dự phòng 2000mAh cho smartphone - Hàng chính hãng
Kẹp tay cầm ps4 với điện thoại
"Tay Cầm Chơi Game Hỗ Trợ Game Pubg, Ros, Free Fire Controller [Phiên Bản 2019] "
Tay Cầm Chơi Game Không Dây GameSir T4 Pro Bộ Điều Khiển LED Nhiều Màu Tay Cầm Chơi Game Không Dây 5in1 Hỗ Trợ Switch/ PC/ Android/ iOS/ Macbook-4117-Hàng Nhập Khẩu
"Tay cầm chơi game Fifa online 4 trên pc, laptop -black"
Tay cầm game nút chơi game cho điện thoại chơi
"Máy chơi game điện tử tay cầm gamer kết nối tivi đa cổng HDMI và AV  800 game Hỗ trợ thẻ nhớ, lưu game "
Tay cầm chơi game PUBG mobile W10 tay gắn điện thoại kèm nút bắn
"Tay Cầm Chơi Game PUBG, ROS, FF/Liên Quân Mobile Tích Hợp Quạt Tản Nhiệt Kiêm Sac Dự Phòng"
Tay cầm chơi game H11 cho ipad máy tính bảng tay cầm chơi game 6 ngón pubg ros liên quân
Tay Cầm Chơi Game Cho Xbox 360
Bộ 2 nút bấm chơi Game Pubg D9 - Hàng nhập khẩu
Gamepad Không dây Bluetooth PlayStation cho máy tính - điện thoại - máy game Console PS/4 - hàng nhập khẩu
Tay cầm chơi game H10 sạc làm mát kép giá đỡ điện thoại điều khiển PUBG ROS liên quân
Tay cầm chơi game Gengame S3 New - Hàng Nhập Khẩu
Bộ 2 Tay Cầm Chơi Game Đôi Controller Cho PC - Hàng Nhập Khẩu
Bộ gamepad nút hỗ trợ chơi game PUBG Red Fish EH9 cho điện thoại máy tính bảng (Màu ngẫu nhiên) - Hàng nhập khẩu
"Nút bấm chơi game pubg cao cấp, độ nhậy cao, chất liệu thép không rỉ cơ siêu bền."
Tay cầm chơi game Bluetooth Terios X3 + Giá đỡ Điện Thoại (Thế Hệ Mới Nhất)
Tay cầm chơi game Flydigi Wee 2T - Hàng chính hãng
Tay Cầm Chơi Game Dành Cho Nintendo Switch >> 
Tay Bấm Game Không Dây Logitech F710 - Gaming - Hàng chính hãng
Tay Cầm PlayStation PS4 Sony Dualshock 4 (Màu Đỏ Camo) - Hàng Chính Hãng
Tay Cầm Chơi Game GameSir F4 Falcon/Plug And Play Chơi Game Di Động Cho IOS Và Android-Điều khiển cho PUBG Mobile Game-4015- Phiên Bản Mới 2020-Hàng Nhập Khẩu
"Combo Trọn Bộ Bàn Phím K15 + Bộ Chuyển Đổi D4 + Chuột chơi game PUBG Mobile cho Android, IOS, iPad như PC - Hàng Chính Hãng"
"Tay cầm chơi game một bên chơi PUBG, Liên quân dùng cho iPhone, iPad Aturos GS5 - Hàng chính hãng"
Bộ 02 gamepad nút hỗ trợ chơi game PUBG Hot WH6 hỗ trợ 6 ngón tay cùng lúc cho điện thoại máy tính bảng (Màu ngẫu nhiên) - Hàng nhập khẩu
"Tay cầm chơi game bluetooth cho Android, Window - kèm đế + usb không dây"
Tay cầm chơi game đẳng cấp game thủ cho smartphone JL01 (đen) – Hàng chính hãng
Tay Cầm Chơi Game Không Dây IPEGA PG-9128 Kết Nối Bluetooth Hỗ Trợ Android IOS PC TV - Hàng chính hãng
"Tay cầm chơi game PUBG có quạt tản nhiệt, pin 2000mAh - iPega PG-9123 - Hàng nhập khẩu"
"Tay cầm chơi game có dây cho Playstation 2, PS2 Slim - Hàng Nhập Khẩu"
Bộ 2 nút bắn chơi game PUBG Free fire Nút bấm hỗ trợ autotap 30 nhịp nhỏ gọn công nghệ cao ( Giao màu ngẫu nhiên )
Bộ 2 Nút Chơi Game Mẫu mới
Vô Lăng Logitech G29 Kèm Cần Số Rời - Hàng chính hãng
Combo bộ chuyển đổi Flydigi Q1 + Bàn phím K15 + Chuột chuyên Game G502 - Hàng Chính Hãng
Gamepad X360 USB cho máy tính
"Bộ 2 Nút Bấm Hỗ Trợ Chơi Game PUBG Mobile, Ros Mobile Siêu Mượt - NEW"
Tay Cầm Nintendo Switch Joy-Con Neon Red/Neon Blue - Hàng Nhập Khẩu
Tay cầm chơi game đơn rung V706
Tay Bấm Gaming Logitech F310 - Hàng Chính Hãng
"Tay Cầm Chơi Game PUBG,...Có Nút Bắn Và Quạt Tản Nhiệt Kèm Đèn Led H5"
"Tay Cầm Chơi Game Không Dây Ew-008 Thích hợp với các trò chơi giải trí như đá PES, game đua xe, đối kháọn bộ sản phẩm gầm 1 tay cầm game, 1 đầu nhận receiver, dây nối USB với PC, đĩa cài"
"Tay cầm chơi game bluetooth iPega 9077 (Android, IOS, Window) - Hàng chính hãng"
"Nút hỗ trợ bắn Cơ G-Point cho các game Pubg moblile, Rules of Survival, Free Fire Promax R11 - Hàng nhập khẩu"
Tay Cầm Chơi Game VINETTEAM K31 Kiêm Giá Đỡ Dành Cho Điện Thoại 4.7-6.5 Inch Phiên Bản Mới Của K21 Chơi PUBG- 4153- Hàng Chính Hãng
Tay Cầm Chơi Game Không Dây Cho PC / PS3 Lester (PXN) Smart 3
Tay Cầm Chơi Game - Có Rung - Cộng USB Cho Laptop PC
Tay Cầm PlayStation PS4 Sony Dualshock 4 (Đen) - Hàng Chính Hãng
Tay Cầm Chơi Game Xbox 360 - Trắng
Tay cầm chơi game cho FPT Play BOx 2019 - X3
Tay Cầm chơi GAME + Nút bấm kép chơi PUBG 5in 1 Thế Hệ Mới Nhất
"Tay cầm chơi game Battle AX- G5 cho điện thoại, iPad chơi PUBG, Liên quân, chơi trực tiếp, không band acc"
Tay Cầm chơi game cho Laptop và PC cổng USB - Hàng Nhập Khẩu
"Bàn phím cơ Handjoy K5 bộ chuyển đổi chơi PUBG và các game FPS trên Androi, iOS - Hàng Chính Hãng"
"Combo Tay Cầm Chơi Game Flydigi WASP 2 PRO + Găng tay Feelers 2 Chơi Game PUBG , ROS, Free Fire Và Các Game FPS, Chơi Game Trên IOS Và Androi Không Sợ Band Acc - Hàng Nhập Khẩu"
Bộ 02 Pin Và Đế Sạc cho Tay Cầm Xbox One - Xbox One X - Xbox One S
Tay cầm chơi game Pubg cho iPhone - iPega PG-9120 - Hàng Nhập Khẩu
Tay Cầm Chơi Game PUBG Liên Quân Free Fire Cao Cấp Dành Cho Điện Thoại Kèm Quạt Tản Nhiệt Và Pin Sạc Dự Phòng
Tay Cầm Chơi Game W10 Có Nút Chơi PUBG - Tặng tai nghe chuẩn.
Bộ 2 Nút Bấm Chơi Game Pubg Thế Hệ Mới K01
"Tay cầm chơi game bluetooth Terios T6 + usb không dây - chơi trên iOS, Android, PC, PS3 (Hàng nhập khẩu)"
"Nút chơi game Joystick Supernano iPhone, iPad, Smartphone (1 cặp)"
"Tay cầm chơi game Flydigi Stinger 2 phiên bản mới bấm cực nhanh, chơi game PUBG, ROS, Free Fire - Hàng Chính Hãng"
Tay cầm chơi game X3
Tay Cầm Chơi Game Không Dây Bluetooth Ipega PG-9156 cho điện thoại di động Adroid - Hàng nhập khẩu
Bộ 2 pin và đế sạc cho tay cầm xbox one controller - Hàng nhập khẩu
Tay cầm chơi game Ipega 9167-hàng nhập khẩu
Tay cầm chơi game liên quân có nút điều khiển 
Nút chơi Game Joystick
Dock sạc kiêm kệ đỡ cho tay cầm chơi game PS4 Slim và Pro - Hàng chính hãng
Tay cầm chơi game Gamesir T1 - Hàng Nhập Khẩu
Bộ gamepad nút hỗ trợ chơi game PUBG Baseus Red-Hot cho điện thoại máy tính bảng (Màu ngẫu nhiên) - Hàng chính hãng
Tay Chơi Game Điện Thoại Có Nút Bấm
"Tay cầm chơi game không dây cho máy tính, laptop, android tivi - GP X3"
Tay Cầm Sony Dualshock 4  (red)  - Hàng nhập khẩu
Tay Cầm Tản Nhiệt Điện Thoại Dành Cho Game Thủ Baseus 01 - Hàng chính hãng
Tay Cầm Chơi Game Marvo GT60(kd) PC+Mobile - Hàng Chính Hãng
COMBO Nút Chơi Game TRẮNG CM
"Tay cầm chơi game cho PC, Android, iPhone, iPad Bluetooth không dây Ipega PG-9118( chơi trực tiếp từ Appstore Ios) - Hàng Chính Hãng"
Tay cầm chơi game Ipega 9087S - Hàng Nhập Khẩu
Tay Cầm Điều Khiển Chơi Game Không Dây Ipega PG-9129 Bluetooth 3 Trong 1 Dành Cho Máy Tính Bảng Điện Thoại Android IOS Win7 8 10 PC -4159-Hàng Nhập Khẩu
Tay cầm chơi game V-706
Tay Cầm Chơi Game K21 Pro Cao Cấp Kiêm Giá Đỡ Điện Thoại Phiên Bản Mới - Hàng Chính Hãng Like Tech
Tay cầm chơi game iPega PG-9087 - Hàng Nhập Khẩu
Tay cầm chơi game 2 người cho máy SUP - Hàng nhập khẩu
Bộ 2 nút gamepad hỗ trợ chơi game PUBG Baseus Holder Shooting cho iPad máy tính bảng (Màu ngẫu nhiên) - Hàng chính hãng
Tay cầm chơi game tản nhiệt Baseus Magic Monster Games Dissipate - Hàng chính hãng
Tay cầm chơi game Ipega 9156-Hàng nhập khẩu
"Bộ 2 Nút Bấm Chơi Game PUBG VINETTEAM MK-1 Hỗ Trợ Chơi PUBG, ROS, Freefire Dành Cho Điện Thoại Androi Và IOS-4154- Hàng Chính Hãng"
"Bao Slicon Tay Cầm PS4 Mẫu Skull Comics Đen - Bọc Bảo Vệ Console Chống Va Đập, Tăng Độ Bám, Hạn Chế Mỏi Tay Khi Chơi Game Lâu"
Tay cầm Nintendo Switch Joy‑Con Neon Yellow - Hàng Nhập Khẩu
Tay cầm chơi game iPega PG-9076 - Kèm USB wifi chơi trên pc
Nút chơi game A9 cho smartphone Liên Quân ( giao màu ngẫu nhiên)
Gamesir G4S Tay Cầm Chơi Game Cho điện thoại Android PC Laptop - Hàng chính hãng 
Máy chơi game NES/SNES/GBC/GBA/SMC cầm tay X6 1000 games
Bao Silicon Tay cầm Chơi Game Microsoft Xbox 360 Chất Lượng Tốt ( giao màu ngẫu nhiên )
"Tay cầm chơi game Liên quân, Pubg, Rules, Free Fire , Fortnight trực tiếp từ Appstore cho iOs iPhone 6 đến iphone 8 Plus Promax FLYDIGY WASP - Hàng Chính Hãng"
Tay cầm chơi game Microsoft Xbox Controller - Hàng chính hãng
Tay bấm ps4 cao cấp cho pc /laptop kèm dây usb
Bộ gamepad nút hỗ trợ chơi game PUBG Super Turbo RH11 cho điện thoại máy tính bảng (Màu ngẫu nhiên) - Hàng nhập khẩu
Tay cầm chơi game GameSir T4 Pro - Tay cầm đa năng hỗ trợ cả PC và điện thoại - Hàng Nhập Khẩu
VINETTEAM Nút bấm PUBG hỗ trợ bắn 8 nhịp 1 giây cao cấp FX1 (Bộ gồm 1 cái)-4025-Hàng Nhập Khẩu
Tay Cầm Chơi Game Bluetooth GameSir G5 - Hàng Nhập Khẩu
Tay cầm Pro Wireless Controller cho máy Switch hàng cao cấp
"Tay cầm chơi game không dây bluetooth 3.0 IPEGA PG-9055 Cho IOS, Android, Window Hàng Nhập Khẩu"
Bộ chuyển đổi Flydigi Q1 - Hàng Chính Hãng
Tay Cầm Chơi Game Đơn Cho PC Vibration Joypad - Hàng Nhập Khẩu
"Bộ chuyển đổi game REZAR P30 dùng chuột và bàn phím cho điện thoại chơi game PUBG, Call of Duty kết nối 4 chế độ có dây và không dây"
Gamepad khônd dây wireless + OTG cho máy tính - Android - Smart TV
bao silicon tay bấm pro controller nintendo switch giao mầu ngẫu nhiên
"Tay Cầm Chơi Game Một Bên VINETTEAM G5 Cho Điện Thoại,IPad Chơi PUBG, Liên Quân, Chơi Trực Tiếp Game Từ Appstore/Chplay- 4017- Hàng Nhập Khẩu"
Nút Cơ Hỗ Trợ Bắn Baseus Grenade Handle G-Point - Hàng Chính Hãng
"Tay cầm chơi game PUBG, Rules Of Survival, Apex Legend kèm nút bắn Gpoint cơ kim loại Promax AK16 - Thiết kế 2 màu cho sự phá cách"
Gamepad Usb cho máy tính Black
Bộ nút bấm chơi game thế hệ mới K01
"TAY CẦM CHƠI GAME 4 IN 1 HỖ TRỢ CHƠI PUPG, FREE FIRE, LIÊN QUÂN"
Tay Cầm Chơi Game Kèm Giá Đỡ Điện Thoại
Tay cầm hỗ trợ chơi game 4in1 tặng kèm hai nút cảm ứng
Bộ 2 nút Hỗ Trợ Chơi Game PUBG Mobile Fortnite Baseus - hàng chính hãng
Tay Game Có Rung Chân Usb Cho Máy Tính Laptop PC
Tay Cầm Chơi Game Xbox 360 - Đen
Tay cầm chơi game Ipega 9083S - Hàng Nhập Khẩu
Tay cầm hỗ trợ chơi game trên điện thoại W11
"Tay Cầm K21 Thao Tác Cực Nhanh giúp Bạn Chiến Mọi Loại game như Liên quân Mobile, CrossFire, PUBG, Free Fire, Modern Combat - Hàng Nhập Khẩu"
"Nút bắn game, nút bấm chơi game FPS GameSir F5 Falcon mini/Auto Tap khủng, Hỗ trợ PUBG Mobile, Liên quân cực tốt - Hàng chính hãng"
Tay cầm chơi Game 1 tay Baseus GAMO GA05 Mobile Game One-Handed- Hàng chính hãng
Bộ tay cầm chơi game X3 kèm giá đỡ điện thoại X3
"TAY GAME BLUETOOTH PG-9017S (PG - 9017S)IOS 4.3 trở lên , Android 2.3 trở lên"
Tay Cầm Nintendo Switch Pro - Hàng Nhập Khẩu
"Tay Cầm Chơi Game Một Bên VINETTEAM MOBA ,Tay Cầm Chơi Game  PUBG Không Dây Một Tay Dành Cho IOS- 4090- Hàng Nhập Khẩu"
"Tay cầm chơi game, hỗ trợ chơi game liên quân, game pubg, game free fire có mút chống rung."
Tay cầm chơi game cho điện thoại W10 cao cấp
"Flydigi Wee 2T Phiên Bản Nâng cấp Tay cầm chơi game PUBG, Pes, Fifa, Liên quân cho iOS và Android ( GIAO NGẪU NHIÊN ) - Hàng Nhập Khẩu"
"Đế sạc đôi cho tay cầm chơi game PS4, Dock sạc 2 tay cầm "
 Tay Cầm Chơi Game Cho PS4 Không Dây - Hỗ Trợ Rung
Tay cầm không dây Gamesir X2 Type-C Mobile Gaming Controller chính hãng 
Gamepad Không dây Bluetooth TSW05 cho máy tính - điện thoại - máy game Console PS/4 - Switch
"Tay cầm chơi game bluetooth iPega 9021 (PC, Android, IOS, Windows) - Hàng chính hãng"
"Adapter Hub Gaming hiệu Baseus Gamo trang bị Blutooth 4.0 giúp kết nối bàn phím và chuột hỗ trợ chơi game hiệu cho Smartphone Android/ iPhone / iPad / PC iPhone iPad Samsung Xiaomi Huawei Oppo Vivo Nokia Sony LG (tốc độ kết nối cao, kết nối chuột và bàn phím, chơi game trải nghiệm tuyệt đỉnh) - Hàng nhập khẩu"
"Nút bấm chơi game Flydigi Stinger cực nhanh, chuẩn xác cho game PUBG, ROS, Free Fire"
Máy Chơi Game Cầm Tay Bluetooth BETOP
Tay cầm chơi game không dây cho Xbox 360 - có rung
Tay Cầm Gamepad Không Dây Rapoo V600S Xanh Đậm - Hàng Chính Hãng
Nút bấm PUBG hỗ trợ bắn 8 nhịp 1 giây cao cấp FX1 gồm 1 cái Tặng Găng Tay Cảm Ứng Chơi Game Điện Thoại Chống Mồ Hôi 
Tay cầm chơi game tích hợp quạt tản nhiệt Remax Proda Kroos PD-D03 - Hàng nhập khẩu
tay cầm chơi game PC đầu USB
"Tay cầm chơi game điện thoại kiêm giá đỡ smartphone nhiều kích thước hỗ trợ chống rung, chống trơn trượt."
"Tay cầm có nút bắn hỗ trợ chơi game cho điện thoại từ 4,5in - 7in"
"Nút bắn chơi game PUBG, Liên quân Flydigi Stinger - Hàng chính hãng"
"Bộ 2 nút bấm chơi game PUBG VINETTEAM X10, tay cầm chơi game dành cho điện thoại android/ios phiên bản 2020 -hàng nhập khẩu"
"Tay cầm chơi game không dây Somatosensory 6 trục cho iPhone, điện thoại Android Flydigi WASP 2 Pro chơi PUBG, Liên quân - Hàng chính hãng"
Tay Cầm Chơi Game Hỗ Trợ Game Pubg  Kiêm Quạt Tản Nhiệt SP+ 2000mAh
Tay cầm chơi game cho ĐT/PC/Laptop Gamesir G5 có phím cảm ứng điều hướng - Hàng Nhập Khẩu
Tay cầm chơi game không dây Flydigi Apex Octopus STEAM - Hàng chính hãng
Tay Cầm Hỗ Trợ Chơi Game Điện Thoại 5in 1
Tay Cầm Chơi Game Mobile Bluetooth 4.0
Tay Cầm Chơi Game Bluetooth Ipega PG-9055 Red Spider Hỗ Trợ PC Android Cao Cấp AZONE - Hàng Nhập Khẩu
Tay Cầm Hỗ Trợ Chơi Game Trên Điện Thoại
"Bao Slicon Tay Cầm PS4 Mẫu Skull Comics Trắng - Bọc Bảo Vệ Console Chống Va Đập, Tăng Độ Bám, Hạn Chế Mỏi Tay Khi Chơi Game Lâu"
Tay Cầm Sony Dualshock 4 Camo - Hàng nhập khẩu
"Tay Cầm Chơi Game Một Bên Cho Android Chơi Liên Quân, Pubg, Rule of Survival Mocute 058 - Hàng Chính Hãng"
Tay cầm chơi game một bên Flydigi WASP 2 cho iPad - Hàng Nhập Khẩu
Bộ 2 nút bấm chơi game dòng G9 cảm ứng nút thép đỏ trên điện thoại phù hợp với các tựa game mobille đang hot hiện nay 
"TAY CẦM GAME Baseus GA06 GAMO Refriger Cooling Radiator Mobile Phone Cooler For PUBG Mobile Game ,HÀNG NHẬP KHẨU"
Tay Cầm Chơi Game Memo AK-16 Tương Thích Với Hầu Hết Các Điện Thoại Smartphone - Hàng Chính Hãng
Bộ 2 nút chơi Game PUBG K01 - Hàng nhập khẩu
"Chuột Gaming siêu nhạy chuyên dụng cho game thủ hiệu Baseus Gamo GM01 (DPI khủng 6400, độ bền cao 5 triệu lần bấm, 9 phím điều hướng kèm theo, đèn led đổi màu 18 màu) - Hàng nhập khẩu"
Tay Cầm Chơi Game Không Dây Bluetooth Ipega PG-9077 cho điện thoại di động Adroid Hàng nhập khẩu
"Bộ 2 nút bấm chơi game PUBG VINETTEAM CH-2 BEE, tay cầm chơi game dành cho điện thoại android/ios-4109-hàng nhập khẩu "
"Máy chơi game cầm tay 4 nút kèm 2 tay cầm không dây FH - 007, tích hợp cổng HDMI siêu nét 8BIT HD (tặng kèm 1 băng 400 trò khác nhau) - Hàng nhập khẩu "
Bộ 2 tay cầm chơi game 4 nút cổng USB dành cho các máy chơi game 4 nút
Tay cầm chơi game đơn rung V909
Tay Cầm Chơi Game Rapoo V600s - Hàng chính hãng
Thiết Bị Chơi Game Sony Aim Controller Cho PlayStation Vr - Hàng Chính Hãng
Tay Cầm Dualshock 4 Model cuh-zct2g Kèm Dây Cable Usb -Hàng Chính Hãng
Nút Chơi Game Cầm 2 Bên Mobile Joystick
Nút chơi Game Muja mini
Tay Cầm Chơi Game Gamepad Hỗ Trợ Chơi Game Trên Điện Thoại Có Giá Đỡ (Trắng) - Hàng Nhập Khẩu 
"Tay cầm chơi game Bluetooth Ipega PG-9023S Hỗ Trợ Chơi Game Trên Thiết Bị Android, IOS - Hàng Nhập Khẩu"
Tay Cầm Chơi Game Có Dây U-928 Có Rung - Cổng Kết Nối USB
Tay cầm chơi game một bên Flydigi WASP 2 - Hàng Nhập Khẩu
"Tay cầm game Hoco Bluetooth không dây cho điện thoại , hỗ trợ nhiều loại Smartphone Android 3.0 trở lên - Hàng chính hãng"
Tay cầm chơi game Retro Mini 169 game - chạy được GBA GBC GB có thể chép thêm game qua khe thẻ (đen) hàng nhập khẩu
Tay cầm điện thoại thông minh MEMO AK66 chơi game PUBG ROS Freefire mobile hỗ trợ 4 ngón tay- HÀNG CHÍNH HÃNG
Gamesir G4S Tay Cầm Chơi Game Cho điện thoại Android PC Laptop - Hàng chính hãng
Tay Game VR Shinecon SC-B03 kết nối Bluetoth
Tay cầm chơi Game đơn rung Marvo GT 014 Đen - Hàng Chính Hãng
Đế sạc tay ps4 đa chức năng bảo vệ tay cầm ps4
"Tay cầm chơi game hỗ trợ game Pubg, Ros, Free Fire Controller AK-66"
Tay Cầm Chơi Game Mobile Bluetooth Mocute 059 Phiên bản cao cấp
Tay cầm Pro Wireless Controller cho máy Switch
Tay game EW 702
Thiết Bị Chơi Game Sony Move Motion Controller Cho PlayStation PS4 -Hàng nhập khẩu 
Tay chơi game DualShock 4/Xanh pha lê CUH-ZCT2G 19- Hàng Chính Hãng
HANDGRIP CHO JOY-CON NINTENDO SWITCH SET 2 CÁI
Tay cầm chơi game đa chức năng có dây Fantech SHOOTER GP11 viền màu xanh - Hàng chính hãng
"Tay chơi Bluetooth MOCUTE-059 Hỗ Trợ Chơi fifa, free fire,PUBG, ROS,Liên Quân Mobile Dành Cho Điện thoại Android ,iOS -Hàng Nhập Khẩu"
Tay Bấm Game VINYSON V706 - Tay Cầm Chơi Game Có Rung - Hàng Nhập Khẩu
Tay cầm game điện thoại có nút joystick
Tay cầm chơi game PUBG cao cấp có quạt tản nhiệt kiêm sạc dự phòng SP+
"Tay cầm chơi game bluetooth iPega 9076 (PS3, Android, IOS, Windows) - Hàng chính hãng"
Tay Game Đơn Vinyson U928 Có Rung- Hàng Chính Hãng
Tay cầm chơi game cho điện thoại W11 cao cấp - Tặng lọ tinh dầu sả treo dây
Nút game A9 ( nhẫn + nút viền đỏ )
Tay chơi game trên máy tính PC
Tay Cầm Chơi Game Bluetooth Ipega 9055 Red Spider - Đen - Hàng Chính Hãng
Tay Cầm  Sony Dualshock 4 CUH ZCT2 chính hãng  tặng kèm dây sạc và usb bluetooth 
Bộ Tay Cầm Chơi Game Hoco GM3 - hàng chính hãng
Tay Cầm Chơi Game Kèm Giá Đỡ Điện Thoại - Terios C8 - Hàng Nhập Khẩu
"Tay cầm chơi game một bên Bluetooth GameSir T6 cho Android, iOs iPhone chơi Liên quân, Pubg Mobile, Rule of Survival - Hàng Chính Hãng"
Tay cầm Nintendo Switch Pro Controller - hàng us - new seal -Hàng nhập khẩu
Tay Cầm chơi game cho Laptop và PC cổng USB - Hàng Nhập Khẩu
Dualshock 4 đen - usb 4.0
Bộ 2 nút bấm hỗ trợ chơi game PUBG dành cho iPad/máy tính bảng Baseus - Hàng chính hãng
Nút Bấm Hỗ Trợ Chơi Game PUBG - Mobile Rules of Survival - Pubg Mobile
Set Gamepad Black Shark 3.0 trái + Miếng gắn tay cầm + Bộ chuyển đổi phím RBG cho gamepad - Hàng Chính Hãng
"Bộ Nút Bấm Chơi Game Dành Cho Điện Thoại, LR Gaming Kích hoạt nút điều khiển chơi game PUBG - Hàng Nhập Khẩu"
"Nút bấm chơi game PUBG, ROS, Free Fire Thích Hợp Với Iphone Android, Lắp là chơi - Hàng Chính Hãng"
tay bấm ps3 cao cấp cho pc /laptop kèm dây usb giao mầu ngẫu nhiên tay game
"Tay cầm chơi game Flydigi Stinger 2 phiên bản mới bấm cực nhanh, chơi game PUBG, ROS, Free Fire Hỗ trợ iOS/Android  -Hàng Nhập Khẩu"
"Tay cầm chơi game không dây bluetooth 3.0 IPEGA PG-9089 Cho IOS, Android, Window Hàng Nhập Khẩu"
"Tay cầm chơi game,giá đỡ điện thoại,tay cầm điều khiển ama38"
Gamepad Không dây Bluetooth PS/4 camo cho máy tính - điện thoại - máy game Console PS/4
"Tay cầm chơi game Flydigi Wasp BT cho IOS và ANDROI chơi PUBG , ROS , liên quân mobile, game FPS khác - hàng nhập khẩu"
Tay cầm chơi game một bên FLydigi WASP 2 - Hàng chính hãng
Bộ gamepad nút chơi game PUBG Baseus cho điện thoại máy tính bảng (đính kèm chiếc xẻng PUBG làm móc chìa khóa) - Hàng chính hãng
"Bộ Tay cầm chơi game kèm nút bắn G Point các game Pubg mobile, Rules of Survival, Free Fire Promax W01 - Hàng chính hãng"
Nút chơi Game Muja mini dành cho IOS
Nút bấm game HandJoy M01 - 1 cặp Trái Phải - Hàng Nhập Khẩu
"Tay Game W11 đẳng cấp chơi Liên quân Mobile, CrossFire, PUBG, Rule of Survival, Free Fire, Modern Combat + Quà tặng đặc biệt"
Tay Cầm Chơi Game USB Nazar V33 - Hàng Nhập Khẩu (Màu ngẫu nhiên)
Dock Sạc Hai Tay Cầm Playstation 4  - Hàng Chính Hãng
Combo Tay cầm chơi game một bên Bluetooth GameSir T6 và GameSir Remapper A2 - Hàng chính hãng
"Tay cầm chơi game cho PC, Android, iPhone, iPad Bluetooth không dây Ipega PG-9118( chơi trực tiếp từ Appstore Ios) - Hàng Nhập Khẩu"
Tay Bấm Game Xb 360 Có Rung - Chân USB Cho Laptop PC
