"Tay Cầm Chơi Game Bluetooth iPega PG-9076 Dành Cho PS3, Android, Windows Cao Cấp AZONE - Hàng Nhập Khẩu"
Tay bấm chơi game Apple MFI Gamesir M2 Đỏ - Hàng chính hãng
núm bọc cần ps4 xbox360 xbox one họa tiết fifa21 set 2 cái giao mầu ngẫu nhiên
Tay Cầm Chơi Game Tản Nhiệt F3 + Tích Hợp Pin Sạc Dự Phòng 2000mAh
Tay Cầm Chơi Game Mobile Bluetooth Mocute 056 Phiên bản cao cấp - Hàng Nhập Khẩu
"Tay Cầm Chơi Game iPega PG-9089 Dành Cho Android, PC, TV, P3 Cao Cấp AZONE - Hàng Nhập Khẩu"
"Tay cầm chơi game cho iPhone, iPad Bluetooth không dây Ipega PG-9120( chơi trực tiếp từ Appstore Ios) - Hàng chính hãng"
Tay game không dây USB 850M 2.4Ghz
TAY CẦM THE LAST OF US 2 LIMITED EDITION-CHÍNH-CHÍNH HÃNG
Tay chơi game DualShock 4/Đỏ pha lê CUH-ZCT2G 18 - Hàng Chính Hãng
Bộ nút chơi game PUBG cho điện thoại chính hãng Baseus
Tay cầm chơi game iPega PG-9089 - Hàng Nhập Khẩu
Tay Cầm Chơi Game Bluetooth Ipega 9055 Red Spider - Đen - Hàng nhập khẩu
Bộ gamepad tản nhiệt hỗ trợ chơi game PUBG Baseus Fan - Hàng chính hãng
Tay Cầm Chơi Game Cho Smartphone Gamepad G1
Bọc Slicon Bảo Vệ Tay Cầm Chơi Game PS4 - Mẫu Trơn Có Gai Tăng Độ Bám Chống Trơn Trượt Và Mỏi Tay Khi Cầm Lâu
Bộ tay chơi game Hoco GM1 - Hàng Chính Hãng
Bộ tay cầm game hỗ trợ chơi PUBG Battleground support A5
Tay Cầm Chơi Game đôi Rung Marvo GT 007 Đen - Hàng Chính Hãng
"Bộ Tay Cầm Chơi Game Điện Thoại Bluetooth 4.0 MOCUTE 057 Dành Cho  Android, IOS -Hàng Nhập Khẩu"
Tay Cầm Chơi Game Pro Theatre 3.0 Kết Nối Bluetooth Hỗ Trợ Android
Tay Cầm Chơi Game Mocute 054 (Kèm Cáp Sạc) - Hàng Nhập Khẩu
Tay Cầm Điện Thoại Có Nút Di Chuyển (Chiến Game Mobile Siêu Kinh Điển) - Khóa 404 do không có loại hàng chính hãng - nhập khẩu
"Tay cầm chơi game PUBG, Rules Of Survival, Apex Legend kèm nút bắn Gpoint cơ kim loại Promax AK16 (Màu Xanh Đỏ) - Hàng chính hãng"
Tay Cầm Chơi Game Không Dây Bluetooth 3.0 Cho Smartphone Android/ TV Box MOCUTE-050- Hàng Nhập Khẩu
set 4 bọc chân gấu tay bấm tay cầm xbox360 giao mầu ngẫu nhiên 
TAY PRO CONTROLLER CHO MÁY WII TRÒ CHƠI WII TAY CẦM MẦU ĐEN Wii Classic Controller Pro - Black
Tay cầm chơi game không dây Gamesir T1S cho điện thoại thông minh Android IOS máy tính bảng máy tính - hàng nhập khẩu
Tay cầm chơi game bluetooth iPega PG-9076 - Kèm USB wifi - Hàng chính hãng
Tay cầm chơi game tản nhiệt Remax GS01 - Hàng chính hãng
Bộ 2 Nút Bấm Hỗ Trợ Chơi Game Trên Điện Thoại - Máy Tính Bảng
Đế chơi game PUBG - iPega PG-9117 - Hàng nhập khẩu
Bộ Tay cầm chơi game G1 tích hợp quạt làm mát và kiêm sạc dự phòng - Hàng nhập khẩu
"Tay cầm chơi game pubg mobile, hỗ trợ điện thoại nhiều kích thước, siêu nhẹ, có mút chống rung, chống trơn trượt."
Remote Bluetooth Cho Kính 3D Kiêm Tay Game Mocute 052 - Hàng Nhập Khẩu
BĂNG 4 NÚT 450IN1
"Bàn phím cơ Gaming Blue Swtich mini 35 phím dành cho game thủ hiệu Baseus Gamo G-01 (thiết kế nhỏ gọn, thao tác 1 tay dễ dàng, tuổi thọ cao, độ nhạy cực nhanh) - Hàng nhập khẩu"
Tay cầm hỗ trợ chơi Game PUBG Mobile Nút Bắn Gpoint Cơ Kim Loại AK16
Tay Cầm Playstations 4 Red Camouflage Limited Edition-Hàng nhập khẩu
Tay bấm chơi game Apple MFI Gamesir M2 màu Xanh Dương - Hàng chính hãng
Kẹp Game Cầm Tay Hỗ Trợ Cố Định Điện Thoại - Hàng Nhập Khẩu
Tay cầm chơi game vừa mọi loại điện thoại JL 01
Bộ Nút Game PUGB Mobile L7 Phiên Bản 2018  
túi đựng máy switch bóp đựng máy game switch bản classic giao mầu ngẫu nhiên
Bộ tay chơi game Hoco GM2 - Hàng Chính Hãng
Bộ tay chơi game Hoco GM2 - Hàng Chính Hãng
Ốp kính cường lực dành cho điện thoại iPhone 7/8 Plus - liên minh huyền thoại - lmht017
Combo Bộ tay chơi game Hoco GM2 + Tặng Kèm 01 Dây Đeo ĐT - Hàng Chính Hãng
BĂNG 4 NÚT 150 TRÒ KHÔNG LẶP LẠI
Ốp kính cường lực dành cho điện thoại Samsung Galaxy S9 - liên minh huyền thoại - lmht021 - hàng chất lượng cao
Ốp kính cường lực dành cho điện thoại iPhone 7/8 Plus - liên minh huyền thoại - lmht021
Ốp kính cường lực dành cho điện thoại Samsung Galaxy S9 - liên minh huyền thoại - lmht027 - hàng đẹp
TAY CẦM ĐÔI CÓ RUNG SENZE 702A - MÀU TRẮNG TRONG SUỐT - HÀNG CHÍNH HÃNG
tay bấm dualshock ps4 cao cấp kèm usb cable giao mầu ngẫu nhiên điều khiển ps4 giao mầu ngẫu nhiên
bộ phát bt jack 3.5mm Audio hỗ trợ chuẩn APTX Low Latency cho Nintendo Switch - Lite. PS4. PC Ugreen 324JS80188CM Bluetooth 5.0 hàng chính hãng
