"Thực phẩm bổ sung viên đốt mỡ giảm cân Hydroxycut Hardcore Elite của MuscleTech hỗ trợ giảm cân, giảm mỡ bụng mạnh mẽ cho người tập GYM và chơi thể thao"
"Combo Viên đốt mỡ LIPO 6 BLACK của Nutrex hộp 60 viên hỗ trợ đốt mỡ, giảm cân mạnh mẽ, tăng tỉnh táo tập trung cho người chơi thể thao & Bình Inox 739ml (mẫu ngẫu nhiên)"
"Thực phẩm bổ sung LIPO 6 BLACK của Nutrex hộp 60 viên hỗ trợ đốt mỡ, giảm cân mạnh mẽ, tăng tỉnh táo tập trung cho người tập GYM và chơi thể thao"
"Fat Burner NUTREX Lipo 6 Black Stim-Free - Đốt mỡ, Cắt nét & Không chứa chất kích thích"
QuadraLean Stimulant-Free Weight – Đốt Mỡ Tăng Tốc Độ Trao Đổi Chất và Không chất kích thích (90 viên)
Thực Phẩm Bổ Sung ANIMAL CUTS
Thực phẩm bổ sung Hydroxycut Hardcore Elite 110 viên
"Thực phẩm giảm cân Rule 1 Lean 5, 60 servings - 336g"
Whey Gold Standard 2Lbs (900G)
Dinh Dưỡng Hỗ Trợ Tang Suc Manh va Kiem Soat Can Nang BPI Sport CLA + Carnitine 50 Servings - Huong Waterlemon Ice
Thức uống giảm cân Bpi Sports Carnitine Orange - Chính Hãng
"Combo Thực phẩm bổ sung Hydroxycut Hardcore Elite của MuscleTech hộp 110 viên hỗ trợ đốt mỡ, giảm cân mạnh mẽ, tăng tỉnh táo tập trung & Áo thun thể thao (size L 68-80 kg)"
